[nightly] ==========================================
[nightly] SGL Nightly Benchmark Started
[nightly] ==========================================
[nightly] Command: scripts/perf_nightly.sh --model=deepseek --model-path=/data/models/deepseek-ai/DeepSeek-V3-0324 --mode=online --hardware=mi30x --teams-webhook-url=
[nightly] Start time: 2025-12-11 15:15:01 PST
[nightly] Machine: dell300x-pla-t12-38
[nightly] Working directory: /mnt/raid/michael/sglang-ci
[nightly] Script location: /mnt/raid/michael/sglang-ci/scripts/perf_nightly.sh
[nightly] Process ID: 1526594
[nightly] ==========================================

[nightly] Runtime Environment:
[nightly] User: amd | Groups: amd adm cdrom... | Docker: /usr/bin/docker
[nightly] Testing Docker daemon access...
[nightly] Docker daemon accessible - proceeding...
[nightly] WARN: --teams-webhook-url was provided without a value - notifications disabled
[nightly] Custom model path provided: /data/models/deepseek-ai/DeepSeek-V3-0324
[nightly] Hardware: mi30x, ROCM Version: rocm700
[nightly] Model: deepseek, Mode(s): online
[nightly] Created process lock: /tmp/perf_nightly_deepseek.lock
[nightly] GPU is busy. Attempting to stop running Docker containers...
[nightly] No running containers to stop.
[nightly] Waiting 15s for GPU to become idle...
[nightly] WARN: GPU may still be busy, but proceeding as requested.
[nightly] Searching for non-SRT images for deepseek for the last 1 days...
[nightly] Searching for non-SRT mi30x image (rocm700) in 'rocm/sgl-dev' for date 20251211...
[nightly] Found candidate tag for day -0: v0.5.6.post1-rocm700-mi30x-20251211
[nightly] Found local image: rocm/sgl-dev:v0.5.6.post1-rocm700-mi30x-20251211
[nightly] Successfully obtained image for date 20251211: rocm/sgl-dev:v0.5.6.post1-rocm700-mi30x-20251211
[nightly] Found 1 valid image(s) to run benchmarks on:
[nightly]   - rocm/sgl-dev:v0.5.6.post1-rocm700-mi30x-20251211

[nightly] ==========================================
[nightly] Starting benchmarks for image: rocm/sgl-dev:v0.5.6.post1-rocm700-mi30x-20251211
[nightly] ==========================================
[nightly] Checking GPU status before starting benchmarks for rocm/sgl-dev:v0.5.6.post1-rocm700-mi30x-20251211...
[nightly] GPU is busy. Attempting to stop running Docker containers...
[nightly] No running containers to stop.
[nightly] Waiting 15s for GPU to become idle...
[nightly] WARN: GPU may still be busy, but proceeding as requested.
[nightly] Checking benchmark completion in: /mnt/raid/michael/sglang-ci/online/DeepSeek-V3-0324/v0.5.6.post1-rocm700-mi30x-20251211_DeepSeek-V3-0324_FP8_online
[nightly] Found 0 completed benchmark runs
[nightly] INFO: Found 0/15 completed runs for rocm/sgl-dev:v0.5.6.post1-rocm700-mi30x-20251211 (online). Proceeding with benchmarks.
[nightly] Using Docker image: rocm/sgl-dev:v0.5.6.post1-rocm700-mi30x-20251211
[nightly] Container name: sgl-dev_v0.5.6.post1-rocm700-mi30x-20251211
[nightly] Reusing container sgl-dev_v0.5.6.post1-rocm700-mi30x-20251211
[nightly] === Starting benchmark execution ===
[nightly] === Starting nightly DEEPSEEK online benchmark ===
[nightly] Launching deepseek_perf_online_csv.sh inside sgl-dev_v0.5.6.post1-rocm700-mi30x-20251211
[nightly] Passing --model-name='DeepSeek-V3-0324' to DeepSeek benchmark
✅ Parameter validation passed
[online] Script started at: 2025-12-11 15:15:33 PST
Scanning existing logs to check if all benchmarks are already complete...
Checking GSM8K log status...
Missing: GSM8K log file (/mnt/raid/michael/sglang-ci/online/DeepSeek-V3-0324/v0.5.6.post1-rocm700-mi30x-20251211_DeepSeek-V3-0324_FP8_online/sglang_client_log_DeepSeek-V3-0324_gsm8k.log)
Checking serving benchmark logs...
Missing: Concurrency 128, Run 1
Missing: Concurrency 64, Run 1
Missing: Concurrency 16, Run 1
Missing: Concurrency 4, Run 1
Missing: Concurrency 1, Run 1
Scan complete: 5 total runs needed, 5 missing/incomplete
❌ Missing 5 serving benchmark runs.
❌ GSM8K benchmark is missing, empty, or incomplete.
Server startup required.
Clearing previous logs...
Starting SGLang server for online GSM8K benchmark...
[csv] Cleaning up stale aiter JIT lock files...
[csv] No stale aiter lock files found
[DEBUG] Using standard settings with environment variable: SGLANG_USE_AITER
Waiting for SGLang server (PID: 53) to start... (Max 15 minutes)
Server logs are being written to: /mnt/raid/michael/sglang-ci/online/DeepSeek-V3-0324/v0.5.6.post1-rocm700-mi30x-20251211_DeepSeek-V3-0324_FP8_online/sglang_server.log
...............................
SGLang server started successfully after 155 seconds.
=== Online GSM8K Benchmark: TP=8, Questions=2000, Parallel=2000, Shots=5 ===
[progress] Total benchmark runs to execute: 10 (GSM8K: 5, Serving: 5) - standard mode
[progress] [--------------------------------------------------] 0/10 (0%) 
Starting GSM8K Online Benchmark...
Running 5 test iterations...
Executing GSM8K test Run 1 ...
Downloading from https://raw.githubusercontent.com/openai/grade-school-math/master/grade_school_math/data/test.jsonl to /tmp/test.jsonl
/tmp/test.jsonl:   0%|          | 0.00/237k [00:00<?, ?B/s]/tmp/test.jsonl: 732kB [00:00, 22.2MB/s]                   
  0%|          | 0/1319 [00:00<?, ?it/s]  0%|          | 1/1319 [00:20<7:23:57, 20.21s/it]  0%|          | 2/1319 [00:21<3:13:59,  8.84s/it]  0%|          | 3/1319 [00:21<1:46:44,  4.87s/it]  0%|          | 4/1319 [00:22<1:11:49,  3.28s/it]  0%|          | 5/1319 [00:23<53:51,  2.46s/it]    1%|          | 9/1319 [00:23<18:04,  1.21it/s]  1%|          | 13/1319 [00:24<11:27,  1.90it/s]  1%|▏         | 17/1319 [00:26<12:35,  1.72it/s]  2%|▏         | 20/1319 [00:27<10:12,  2.12it/s]  2%|▏         | 28/1319 [00:30<08:32,  2.52it/s]  3%|▎         | 35/1319 [00:32<08:18,  2.58it/s]  3%|▎         | 42/1319 [00:33<06:15,  3.40it/s]  4%|▍         | 53/1319 [00:33<03:32,  5.96it/s]  5%|▍         | 61/1319 [00:34<02:53,  7.26it/s]  5%|▌         | 69/1319 [00:36<04:03,  5.13it/s]  6%|▌         | 76/1319 [00:37<03:26,  6.01it/s]  6%|▋         | 85/1319 [00:38<02:45,  7.44it/s]  7%|▋         | 91/1319 [00:38<02:37,  7.80it/s]  8%|▊         | 99/1319 [00:39<02:02,  9.99it/s]  8%|▊         | 103/1319 [00:39<01:57, 10.35it/s]  9%|▉         | 118/1319 [00:41<02:30,  8.00it/s] 10%|▉         | 129/1319 [00:42<02:02,  9.75it/s] 10%|█         | 135/1319 [00:43<02:02,  9.64it/s] 11%|█         | 140/1319 [00:43<02:12,  8.93it/s] 11%|█▏        | 150/1319 [00:44<01:50, 10.54it/s] 12%|█▏        | 156/1319 [00:45<01:54, 10.18it/s] 13%|█▎        | 168/1319 [00:45<01:32, 12.45it/s] 13%|█▎        | 173/1319 [00:46<01:43, 11.10it/s] 14%|█▍        | 182/1319 [00:49<02:59,  6.34it/s] 15%|█▍        | 196/1319 [00:49<02:04,  9.05it/s] 16%|█▌        | 211/1319 [00:50<01:33, 11.88it/s] 17%|█▋        | 220/1319 [00:50<01:19, 13.89it/s] 18%|█▊        | 233/1319 [00:51<01:19, 13.60it/s] 19%|█▉        | 254/1319 [00:54<01:42, 10.38it/s] 20%|█▉        | 263/1319 [00:54<01:28, 11.98it/s] 20%|██        | 270/1319 [00:54<01:20, 13.10it/s] 21%|██▏       | 282/1319 [00:55<01:02, 16.54it/s] 22%|██▏       | 294/1319 [00:55<00:51, 20.05it/s] 23%|██▎       | 301/1319 [00:56<01:00, 16.93it/s] 24%|██▎       | 311/1319 [00:56<00:50, 20.15it/s] 24%|██▍       | 320/1319 [00:56<00:40, 24.78it/s] 25%|██▍       | 327/1319 [00:56<00:35, 27.85it/s] 26%|██▌       | 344/1319 [00:56<00:22, 42.47it/s] 27%|██▋       | 352/1319 [00:57<00:21, 44.75it/s] 28%|██▊       | 363/1319 [00:57<00:18, 51.10it/s] 29%|██▉       | 380/1319 [00:57<00:14, 66.71it/s] 30%|██▉       | 393/1319 [00:57<00:12, 72.16it/s] 31%|███       | 407/1319 [00:57<00:11, 79.36it/s] 32%|███▏      | 416/1319 [00:57<00:12, 74.27it/s] 32%|███▏      | 425/1319 [00:59<00:53, 16.71it/s] 33%|███▎      | 438/1319 [00:59<00:39, 22.29it/s] 34%|███▍      | 449/1319 [01:00<00:31, 28.06it/s] 35%|███▍      | 460/1319 [01:00<00:25, 34.27it/s] 36%|███▌      | 474/1319 [01:00<00:19, 44.36it/s] 37%|███▋      | 482/1319 [01:00<00:17, 46.56it/s] 37%|███▋      | 490/1319 [01:00<00:17, 48.22it/s] 38%|███▊      | 497/1319 [01:00<00:17, 48.34it/s] 39%|███▊      | 510/1319 [01:00<00:13, 58.99it/s] 39%|███▉      | 520/1319 [01:01<00:12, 62.19it/s] 40%|████      | 528/1319 [01:01<00:13, 59.87it/s] 41%|████      | 537/1319 [01:01<00:12, 60.90it/s] 42%|████▏     | 549/1319 [01:01<00:11, 67.85it/s] 42%|████▏     | 557/1319 [01:01<00:11, 64.14it/s] 43%|████▎     | 569/1319 [01:01<00:11, 64.44it/s] 44%|████▎     | 577/1319 [01:01<00:10, 67.54it/s] 44%|████▍     | 584/1319 [01:03<00:53, 13.76it/s] 45%|████▍     | 591/1319 [01:03<00:43, 16.79it/s] 46%|████▌     | 608/1319 [01:03<00:25, 28.17it/s] 47%|████▋     | 618/1319 [01:04<00:20, 33.87it/s] 48%|████▊     | 630/1319 [01:04<00:16, 41.98it/s] 49%|████▊     | 643/1319 [01:04<00:13, 51.27it/s] 50%|████▉     | 655/1319 [01:04<00:11, 58.37it/s] 51%|█████     | 667/1319 [01:04<00:10, 64.95it/s] 51%|█████▏    | 676/1319 [01:04<00:10, 64.25it/s] 52%|█████▏    | 686/1319 [01:04<00:09, 66.38it/s] 53%|█████▎    | 694/1319 [01:05<00:09, 63.46it/s] 54%|█████▎    | 706/1319 [01:05<00:08, 70.10it/s] 54%|█████▍    | 714/1319 [01:05<00:09, 65.74it/s] 55%|█████▍    | 725/1319 [01:05<00:08, 69.32it/s] 56%|█████▌    | 738/1319 [01:05<00:07, 76.40it/s] 57%|█████▋    | 747/1319 [01:05<00:07, 72.41it/s] 58%|█████▊    | 759/1319 [01:05<00:07, 76.22it/s] 59%|█████▊    | 774/1319 [01:06<00:06, 85.75it/s] 60%|█████▉    | 785/1319 [01:06<00:06, 83.24it/s] 61%|██████    | 801/1319 [01:06<00:05, 93.16it/s] 63%|██████▎   | 825/1319 [01:06<00:04, 106.53it/s] 64%|██████▍   | 843/1319 [01:06<00:04, 106.62it/s] 65%|██████▍   | 854/1319 [01:06<00:04, 93.74it/s]  66%|██████▌   | 864/1319 [01:07<00:05, 84.28it/s] 66%|██████▋   | 876/1319 [01:07<00:05, 80.92it/s] 68%|██████▊   | 894/1319 [01:07<00:04, 90.54it/s] 69%|██████▉   | 913/1319 [01:07<00:04, 99.65it/s] 70%|███████   | 926/1319 [01:07<00:04, 94.62it/s] 72%|███████▏  | 944/1319 [01:07<00:03, 102.49it/s] 73%|███████▎  | 957/1319 [01:07<00:03, 97.62it/s]  74%|███████▍  | 978/1319 [01:08<00:03, 111.85it/s] 75%|███████▌  | 994/1319 [01:08<00:02, 112.24it/s] 76%|███████▋  | 1006/1319 [01:08<00:02, 104.94it/s] 77%|███████▋  | 1021/1319 [01:08<00:02, 103.45it/s] 78%|███████▊  | 1032/1319 [01:08<00:02, 100.04it/s] 79%|███████▉  | 1044/1319 [01:08<00:02, 97.35it/s]  80%|████████  | 1059/1319 [01:08<00:02, 102.76it/s] 81%|████████  | 1071/1319 [01:09<00:02, 101.72it/s] 82%|████████▏ | 1082/1319 [01:09<00:03, 76.09it/s]  83%|████████▎ | 1091/1319 [01:09<00:03, 75.39it/s] 84%|████████▍ | 1105/1319 [01:09<00:02, 86.11it/s] 85%|████████▍ | 1115/1319 [01:09<00:02, 85.25it/s] 85%|████████▌ | 1124/1319 [01:09<00:02, 72.97it/s] 86%|████████▋ | 1138/1319 [01:09<00:02, 85.64it/s] 87%|████████▋ | 1149/1319 [01:10<00:01, 88.51it/s] 88%|████████▊ | 1159/1319 [01:10<00:02, 70.28it/s] 89%|████████▊ | 1169/1319 [01:10<00:01, 75.32it/s] 89%|████████▉ | 1179/1319 [01:10<00:01, 79.58it/s] 90%|█████████ | 1188/1319 [01:10<00:01, 71.77it/s] 91%|█████████ | 1196/1319 [01:10<00:01, 72.85it/s] 91%|█████████▏| 1204/1319 [01:10<00:01, 66.04it/s] 92%|█████████▏| 1211/1319 [01:11<00:01, 66.97it/s] 92%|█████████▏| 1218/1319 [01:11<00:02, 44.83it/s] 93%|█████████▎| 1227/1319 [01:11<00:01, 49.58it/s] 93%|█████████▎| 1233/1319 [01:11<00:01, 47.48it/s] 94%|█████████▍| 1239/1319 [01:11<00:01, 42.28it/s] 94%|█████████▍| 1244/1319 [01:11<00:02, 37.38it/s] 95%|█████████▌| 1257/1319 [01:12<00:01, 52.46it/s] 96%|█████████▌| 1263/1319 [01:12<00:01, 46.87it/s] 96%|█████████▌| 1269/1319 [01:12<00:01, 43.50it/s] 97%|█████████▋| 1274/1319 [01:12<00:01, 39.55it/s] 97%|█████████▋| 1279/1319 [01:12<00:01, 39.97it/s] 97%|█████████▋| 1284/1319 [01:12<00:01, 32.67it/s] 98%|█████████▊| 1288/1319 [01:13<00:01, 29.28it/s] 98%|█████████▊| 1292/1319 [01:13<00:00, 29.12it/s] 98%|█████████▊| 1296/1319 [01:13<00:01, 21.66it/s] 98%|█████████▊| 1299/1319 [01:13<00:01, 16.49it/s] 99%|█████████▊| 1302/1319 [01:14<00:01, 16.85it/s] 99%|█████████▉| 1304/1319 [01:14<00:01, 13.26it/s] 99%|█████████▉| 1307/1319 [01:14<00:00, 15.30it/s] 99%|█████████▉| 1311/1319 [01:14<00:00, 17.35it/s]100%|█████████▉| 1313/1319 [01:15<00:00, 12.77it/s]100%|█████████▉| 1315/1319 [01:15<00:00, 13.78it/s]100%|█████████▉| 1317/1319 [01:15<00:00,  9.84it/s]100%|██████████| 1319/1319 [01:18<00:00,  2.23it/s]100%|██████████| 1319/1319 [01:18<00:00, 16.81it/s]
Accuracy: 0.937
Invalid: 0.000
Latency: 124.639 s
Output throughput: 1095.006 token/s
Run 1 completed in 131 seconds
Run 1: Accuracy: 0.937
  ✓ Run 1 included in average (accuracy: 0.937)
[progress] [=====---------------------------------------------] 1/10 (10%)  | GSM8K: Run 1

Checking server health before Run 2...
✅ Server is healthy
Executing GSM8K test Run 2 ...
  0%|          | 0/1319 [00:00<?, ?it/s]  0%|          | 1/1319 [00:07<2:51:35,  7.81s/it]  0%|          | 2/1319 [00:08<1:22:00,  3.74s/it]  0%|          | 3/1319 [00:08<45:57,  2.10s/it]    0%|          | 4/1319 [00:09<32:10,  1.47s/it]  0%|          | 5/1319 [00:10<28:35,  1.31s/it]  1%|          | 7/1319 [00:10<14:52,  1.47it/s]  1%|          | 12/1319 [00:11<06:44,  3.23it/s]  1%|          | 16/1319 [00:11<05:23,  4.03it/s]  2%|▏         | 22/1319 [00:12<04:10,  5.17it/s]  2%|▏         | 29/1319 [00:12<02:45,  7.81it/s]  3%|▎         | 36/1319 [00:13<02:03, 10.41it/s]  3%|▎         | 43/1319 [00:13<01:39, 12.85it/s]  3%|▎         | 46/1319 [00:13<01:45, 12.05it/s]  4%|▍         | 54/1319 [00:14<01:44, 12.11it/s]  5%|▌         | 66/1319 [00:14<01:15, 16.71it/s]  5%|▌         | 70/1319 [00:15<01:44, 11.99it/s]  6%|▌         | 77/1319 [00:15<01:28, 13.97it/s]  6%|▋         | 85/1319 [00:16<01:15, 16.41it/s]  7%|▋         | 94/1319 [00:16<01:03, 19.22it/s]  8%|▊         | 103/1319 [00:16<00:56, 21.49it/s]  8%|▊         | 110/1319 [00:17<00:56, 21.52it/s]  9%|▉         | 119/1319 [00:17<01:06, 18.05it/s] 10%|▉         | 129/1319 [00:18<01:11, 16.71it/s] 10%|█         | 137/1319 [00:18<01:05, 18.06it/s] 11%|█         | 145/1319 [00:19<00:59, 19.68it/s] 11%|█▏        | 151/1319 [00:19<01:00, 19.44it/s] 12%|█▏        | 158/1319 [00:19<00:57, 20.04it/s] 13%|█▎        | 167/1319 [00:20<00:51, 22.24it/s] 13%|█▎        | 172/1319 [00:20<00:56, 20.35it/s] 14%|█▎        | 180/1319 [00:20<00:52, 21.59it/s] 15%|█▍        | 193/1319 [00:21<00:41, 26.96it/s] 16%|█▌        | 210/1319 [00:22<00:56, 19.61it/s] 17%|█▋        | 218/1319 [00:22<00:53, 20.54it/s] 18%|█▊        | 232/1319 [00:23<00:52, 20.54it/s] 19%|█▉        | 250/1319 [00:23<00:47, 22.58it/s] 20%|█▉        | 262/1319 [00:24<00:41, 25.31it/s] 21%|██        | 273/1319 [00:24<00:38, 27.18it/s] 21%|██▏       | 282/1319 [00:24<00:38, 27.29it/s] 23%|██▎       | 297/1319 [00:25<00:40, 25.26it/s] 23%|██▎       | 305/1319 [00:25<00:39, 25.86it/s] 24%|██▎       | 312/1319 [00:26<00:35, 28.56it/s] 24%|██▍       | 321/1319 [00:26<00:29, 33.48it/s] 25%|██▍       | 329/1319 [00:26<00:26, 37.14it/s] 26%|██▌       | 338/1319 [00:26<00:23, 41.86it/s] 26%|██▋       | 347/1319 [00:26<00:21, 45.90it/s] 27%|██▋       | 360/1319 [00:26<00:17, 55.93it/s] 28%|██▊       | 372/1319 [00:26<00:15, 62.35it/s] 29%|██▉       | 385/1319 [00:27<00:13, 68.80it/s] 30%|███       | 400/1319 [00:27<00:11, 78.14it/s] 31%|███       | 409/1319 [00:27<00:12, 73.14it/s] 32%|███▏      | 417/1319 [00:27<00:13, 67.24it/s] 33%|███▎      | 431/1319 [00:27<00:11, 75.31it/s] 33%|███▎      | 441/1319 [00:27<00:11, 73.39it/s] 34%|███▍      | 449/1319 [00:27<00:13, 66.89it/s] 35%|███▌      | 468/1319 [00:28<00:09, 86.23it/s] 36%|███▌      | 477/1319 [00:28<00:10, 78.98it/s] 37%|███▋      | 485/1319 [00:28<00:11, 71.36it/s] 37%|███▋      | 493/1319 [00:28<00:12, 66.39it/s] 38%|███▊      | 500/1319 [00:28<00:13, 60.78it/s] 39%|███▊      | 509/1319 [00:28<00:13, 61.34it/s] 39%|███▉      | 516/1319 [00:29<00:14, 56.88it/s] 40%|███▉      | 526/1319 [00:29<00:13, 60.68it/s] 41%|████      | 535/1319 [00:29<00:12, 60.72it/s] 42%|████▏     | 549/1319 [00:29<00:10, 71.24it/s] 43%|████▎     | 561/1319 [00:29<00:10, 69.06it/s] 43%|████▎     | 568/1319 [00:29<00:11, 67.86it/s] 44%|████▎     | 577/1319 [00:29<00:11, 66.90it/s] 44%|████▍     | 584/1319 [00:30<00:12, 60.58it/s] 45%|████▍     | 591/1319 [00:30<00:12, 56.90it/s] 46%|████▌     | 603/1319 [00:30<00:11, 64.57it/s] 47%|████▋     | 618/1319 [00:30<00:09, 76.59it/s] 48%|████▊     | 630/1319 [00:30<00:08, 78.63it/s] 49%|████▊     | 640/1319 [00:30<00:09, 75.33it/s] 50%|████▉     | 657/1319 [00:30<00:07, 88.71it/s] 50%|█████     | 666/1319 [00:31<00:08, 80.66it/s] 51%|█████     | 675/1319 [00:31<00:08, 75.22it/s] 52%|█████▏    | 688/1319 [00:31<00:07, 80.06it/s] 53%|█████▎    | 698/1319 [00:31<00:08, 77.10it/s] 54%|█████▎    | 706/1319 [00:31<00:08, 70.11it/s] 55%|█████▍    | 720/1319 [00:31<00:07, 78.75it/s] 56%|█████▌    | 733/1319 [00:31<00:07, 82.38it/s] 56%|█████▋    | 745/1319 [00:32<00:06, 82.95it/s] 57%|█████▋    | 758/1319 [00:32<00:06, 85.46it/s] 59%|█████▊    | 772/1319 [00:32<00:06, 90.00it/s] 59%|█████▉    | 782/1319 [00:32<00:06, 83.80it/s] 60%|█████▉    | 791/1319 [00:32<00:06, 78.03it/s] 61%|██████    | 802/1319 [00:32<00:06, 78.29it/s] 62%|██████▏   | 820/1319 [00:32<00:04, 101.79it/s] 64%|██████▎   | 840/1319 [00:33<00:04, 108.12it/s] 65%|██████▍   | 852/1319 [00:33<00:04, 95.98it/s]  66%|██████▌   | 866/1319 [00:33<00:04, 92.71it/s] 67%|██████▋   | 881/1319 [00:33<00:04, 92.58it/s] 68%|██████▊   | 894/1319 [00:33<00:04, 89.29it/s] 70%|██████▉   | 918/1319 [00:33<00:03, 108.93it/s] 71%|███████   | 930/1319 [00:33<00:03, 99.39it/s]  72%|███████▏  | 945/1319 [00:34<00:03, 99.28it/s] 73%|███████▎  | 959/1319 [00:34<00:03, 97.81it/s] 74%|███████▎  | 971/1319 [00:34<00:03, 93.07it/s] 75%|███████▍  | 989/1319 [00:34<00:03, 102.98it/s] 76%|███████▌  | 1001/1319 [00:34<00:03, 97.35it/s] 77%|███████▋  | 1019/1319 [00:34<00:02, 105.24it/s] 78%|███████▊  | 1030/1319 [00:34<00:02, 100.62it/s] 79%|███████▉  | 1041/1319 [00:35<00:02, 95.95it/s]  80%|███████▉  | 1051/1319 [00:35<00:02, 90.50it/s] 81%|████████  | 1063/1319 [00:35<00:02, 91.69it/s] 81%|████████▏ | 1073/1319 [00:35<00:02, 87.91it/s] 82%|████████▏ | 1082/1319 [00:35<00:03, 72.75it/s] 83%|████████▎ | 1096/1319 [00:35<00:02, 84.38it/s] 84%|████████▍ | 1105/1319 [00:35<00:02, 81.61it/s] 84%|████████▍ | 1114/1319 [00:36<00:02, 79.51it/s] 85%|████████▌ | 1125/1319 [00:36<00:02, 84.21it/s] 86%|████████▌ | 1134/1319 [00:36<00:02, 81.61it/s] 87%|████████▋ | 1143/1319 [00:36<00:02, 81.25it/s] 87%|████████▋ | 1152/1319 [00:36<00:02, 80.93it/s] 88%|████████▊ | 1161/1319 [00:36<00:02, 70.87it/s] 89%|████████▊ | 1170/1319 [00:36<00:02, 73.58it/s] 89%|████████▉ | 1178/1319 [00:36<00:01, 73.74it/s] 90%|████████▉ | 1186/1319 [00:37<00:01, 74.02it/s] 91%|█████████ | 1194/1319 [00:37<00:01, 65.63it/s] 91%|█████████ | 1201/1319 [00:37<00:01, 66.27it/s] 92%|█████████▏| 1212/1319 [00:37<00:01, 68.60it/s] 92%|█████████▏| 1220/1319 [00:37<00:01, 63.97it/s] 93%|█████████▎| 1231/1319 [00:37<00:01, 61.65it/s] 94%|█████████▍| 1238/1319 [00:38<00:01, 45.18it/s] 94%|█████████▍| 1244/1319 [00:38<00:01, 41.44it/s] 95%|█████████▍| 1251/1319 [00:38<00:01, 43.68it/s] 95%|█████████▌| 1256/1319 [00:38<00:01, 41.88it/s] 96%|█████████▌| 1261/1319 [00:38<00:01, 37.73it/s] 96%|█████████▌| 1269/1319 [00:38<00:01, 40.60it/s] 97%|█████████▋| 1274/1319 [00:39<00:01, 34.93it/s] 97%|█████████▋| 1278/1319 [00:39<00:01, 34.46it/s] 98%|█████████▊| 1287/1319 [00:39<00:00, 41.45it/s] 98%|█████████▊| 1292/1319 [00:39<00:00, 30.88it/s] 98%|█████████▊| 1296/1319 [00:39<00:00, 30.36it/s] 99%|█████████▊| 1300/1319 [00:39<00:00, 28.55it/s] 99%|█████████▉| 1304/1319 [00:40<00:00, 18.67it/s] 99%|█████████▉| 1307/1319 [00:40<00:00, 18.90it/s] 99%|█████████▉| 1310/1319 [00:40<00:00, 17.07it/s]100%|█████████▉| 1313/1319 [00:40<00:00, 16.11it/s]100%|█████████▉| 1315/1319 [00:41<00:00, 10.12it/s]100%|█████████▉| 1317/1319 [00:41<00:00,  8.21it/s]100%|██████████| 1319/1319 [00:44<00:00,  2.42it/s]100%|██████████| 1319/1319 [00:44<00:00, 29.56it/s]
Accuracy: 0.936
Invalid: 0.000
Latency: 87.507 s
Output throughput: 1564.585 token/s
Run 2 completed in 93 seconds
Run 2: Accuracy: 0.936
  ✓ Run 2 included in average (accuracy: 0.936)
[progress] [==========----------------------------------------] 2/10 (20%)  | GSM8K: Run 2

Checking server health before Run 3...
✅ Server is healthy
Executing GSM8K test Run 3 ...
  0%|          | 0/1319 [00:00<?, ?it/s]  0%|          | 1/1319 [00:07<2:53:24,  7.89s/it]  0%|          | 2/1319 [00:08<1:24:51,  3.87s/it]  0%|          | 3/1319 [00:09<49:26,  2.25s/it]    0%|          | 4/1319 [00:10<38:51,  1.77s/it]  1%|          | 7/1319 [00:10<15:04,  1.45it/s]  1%|          | 11/1319 [00:10<07:24,  2.94it/s]  1%|          | 16/1319 [00:10<04:25,  4.90it/s]  2%|▏         | 20/1319 [00:11<04:07,  5.24it/s]  2%|▏         | 27/1319 [00:11<02:37,  8.18it/s]  2%|▏         | 31/1319 [00:12<02:22,  9.04it/s]  3%|▎         | 37/1319 [00:12<01:13, 17.54it/s]  3%|▎         | 37/1319 [00:12<01:13, 17.54it/s]  3%|▎         | 37/1319 [00:12<01:13, 17.54it/s]  3%|▎         | 37/1319 [00:12<01:13, 17.54it/s]  3%|▎         | 39/1319 [00:12<01:28, 14.44it/s]  3%|▎         | 41/1319 [00:12<01:45, 12.08it/s]  4%|▍         | 50/1319 [00:13<01:16, 16.62it/s]  5%|▍         | 60/1319 [00:13<00:51, 24.62it/s]  5%|▍         | 60/1319 [00:13<00:51, 24.62it/s]  5%|▍         | 63/1319 [00:13<01:26, 14.57it/s]  5%|▍         | 65/1319 [00:14<01:35, 13.20it/s]  5%|▌         | 70/1319 [00:14<01:30, 13.78it/s]  6%|▌         | 77/1319 [00:14<01:17, 15.93it/s]  6%|▌         | 82/1319 [00:15<01:18, 15.75it/s]  7%|▋         | 93/1319 [00:15<00:58, 20.96it/s]  8%|▊         | 101/1319 [00:15<00:55, 22.00it/s]  8%|▊         | 111/1319 [00:16<00:49, 24.50it/s]  9%|▉         | 123/1319 [00:16<00:55, 21.50it/s] 10%|▉         | 127/1319 [00:17<01:01, 19.24it/s] 10%|█         | 138/1319 [00:17<00:51, 22.98it/s] 11%|█         | 148/1319 [00:17<00:46, 25.14it/s] 12%|█▏        | 152/1319 [00:18<00:54, 21.53it/s] 12%|█▏        | 163/1319 [00:18<00:45, 25.13it/s] 13%|█▎        | 167/1319 [00:19<01:10, 16.38it/s] 13%|█▎        | 177/1319 [00:19<01:12, 15.85it/s] 14%|█▍        | 187/1319 [00:20<01:13, 15.49it/s] 16%|█▌        | 206/1319 [00:20<00:46, 24.10it/s] 16%|█▌        | 214/1319 [00:21<00:45, 24.16it/s] 17%|█▋        | 229/1319 [00:21<00:46, 23.44it/s] 19%|█▊        | 247/1319 [00:22<00:35, 30.31it/s] 20%|█▉        | 258/1319 [00:22<00:34, 31.05it/s] 20%|██        | 270/1319 [00:22<00:32, 32.48it/s] 22%|██▏       | 285/1319 [00:23<00:28, 36.02it/s] 22%|██▏       | 296/1319 [00:23<00:28, 35.45it/s] 23%|██▎       | 303/1319 [00:23<00:30, 32.78it/s] 24%|██▎       | 310/1319 [00:23<00:28, 35.01it/s] 24%|██▍       | 320/1319 [00:24<00:24, 40.95it/s] 25%|██▌       | 331/1319 [00:24<00:20, 47.83it/s] 26%|██▌       | 340/1319 [00:24<00:19, 50.72it/s] 26%|██▋       | 349/1319 [00:24<00:18, 52.79it/s] 28%|██▊       | 365/1319 [00:24<00:14, 67.38it/s] 28%|██▊       | 375/1319 [00:24<00:14, 67.07it/s] 29%|██▉       | 389/1319 [00:24<00:12, 75.20it/s] 30%|███       | 398/1319 [00:25<00:12, 70.91it/s] 31%|███       | 409/1319 [00:25<00:12, 71.87it/s] 32%|███▏      | 421/1319 [00:25<00:12, 74.41it/s] 33%|███▎      | 438/1319 [00:25<00:10, 87.03it/s] 34%|███▍      | 447/1319 [00:25<00:10, 79.32it/s] 35%|███▍      | 456/1319 [00:25<00:11, 73.32it/s] 36%|███▌      | 472/1319 [00:25<00:10, 84.56it/s] 36%|███▋      | 481/1319 [00:26<00:10, 77.70it/s] 37%|███▋      | 489/1319 [00:26<00:11, 70.62it/s] 38%|███▊      | 497/1319 [00:26<00:12, 65.61it/s] 38%|███▊      | 504/1319 [00:26<00:13, 60.24it/s] 39%|███▉      | 517/1319 [00:26<00:11, 69.36it/s] 40%|███▉      | 524/1319 [00:26<00:12, 62.67it/s] 40%|████      | 531/1319 [00:26<00:13, 58.16it/s] 41%|████      | 541/1319 [00:27<00:12, 61.58it/s] 42%|████▏     | 550/1319 [00:27<00:12, 61.83it/s] 42%|████▏     | 558/1319 [00:27<00:13, 54.98it/s] 43%|████▎     | 565/1319 [00:27<00:13, 57.14it/s] 44%|████▎     | 575/1319 [00:27<00:12, 61.31it/s] 44%|████▍     | 582/1319 [00:27<00:12, 56.93it/s] 45%|████▍     | 593/1319 [00:28<00:11, 63.08it/s] 45%|████▌     | 600/1319 [00:28<00:12, 58.22it/s] 47%|████▋     | 617/1319 [00:28<00:09, 76.58it/s] 47%|████▋     | 625/1319 [00:28<00:09, 70.02it/s] 48%|████▊     | 637/1319 [00:28<00:09, 73.87it/s] 49%|████▉     | 652/1319 [00:28<00:07, 83.40it/s] 50%|█████     | 663/1319 [00:28<00:08, 81.39it/s] 51%|█████     | 675/1319 [00:29<00:07, 82.89it/s] 52%|█████▏    | 684/1319 [00:29<00:08, 76.87it/s] 52%|█████▏    | 692/1319 [00:29<00:08, 70.83it/s] 53%|█████▎    | 700/1319 [00:29<00:09, 66.46it/s] 54%|█████▎    | 707/1319 [00:29<00:10, 60.74it/s] 55%|█████▍    | 722/1319 [00:29<00:08, 74.19it/s] 56%|█████▌    | 736/1319 [00:29<00:07, 81.32it/s] 57%|█████▋    | 751/1319 [00:30<00:06, 89.02it/s] 58%|█████▊    | 763/1319 [00:30<00:06, 87.89it/s] 59%|█████▊    | 772/1319 [00:30<00:06, 79.95it/s] 60%|█████▉    | 786/1319 [00:30<00:06, 86.06it/s] 60%|██████    | 796/1319 [00:30<00:06, 81.46it/s] 61%|██████    | 807/1319 [00:30<00:06, 80.61it/s] 63%|██████▎   | 826/1319 [00:30<00:04, 105.71it/s] 64%|██████▍   | 843/1319 [00:30<00:04, 103.38it/s] 65%|██████▍   | 857/1319 [00:31<00:04, 97.24it/s]  66%|██████▌   | 870/1319 [00:31<00:04, 90.74it/s] 68%|██████▊   | 893/1319 [00:31<00:04, 106.30it/s] 69%|██████▉   | 907/1319 [00:31<00:04, 100.65it/s] 70%|███████   | 924/1319 [00:31<00:03, 102.77it/s] 71%|███████▏  | 941/1319 [00:31<00:03, 105.44it/s] 73%|███████▎  | 958/1319 [00:32<00:03, 108.42it/s] 74%|███████▍  | 975/1319 [00:32<00:03, 110.37it/s] 75%|███████▍  | 987/1319 [00:32<00:03, 101.99it/s] 76%|███████▌  | 999/1319 [00:32<00:03, 97.19it/s]  77%|███████▋  | 1013/1319 [00:32<00:03, 98.00it/s] 78%|███████▊  | 1023/1319 [00:32<00:03, 91.00it/s] 78%|███████▊  | 1035/1319 [00:32<00:03, 90.87it/s] 79%|███████▉  | 1048/1319 [00:33<00:02, 92.81it/s] 80%|████████  | 1058/1319 [00:33<00:02, 88.04it/s] 81%|████████  | 1070/1319 [00:33<00:02, 90.32it/s] 82%|████████▏ | 1080/1319 [00:33<00:02, 86.99it/s] 83%|████████▎ | 1089/1319 [00:33<00:02, 83.21it/s] 83%|████████▎ | 1098/1319 [00:33<00:02, 80.40it/s] 84%|████████▍ | 1110/1319 [00:33<00:02, 85.70it/s] 85%|████████▍ | 1120/1319 [00:33<00:02, 85.64it/s] 86%|████████▌ | 1129/1319 [00:34<00:02, 82.95it/s] 86%|████████▋ | 1138/1319 [00:34<00:02, 81.03it/s] 87%|████████▋ | 1148/1319 [00:34<00:02, 83.89it/s] 88%|████████▊ | 1157/1319 [00:34<00:02, 57.77it/s] 88%|████████▊ | 1166/1319 [00:34<00:02, 63.05it/s] 89%|████████▉ | 1174/1319 [00:34<00:02, 65.72it/s] 90%|████████▉ | 1182/1319 [00:34<00:02, 59.98it/s] 90%|█████████ | 1189/1319 [00:35<00:02, 49.46it/s] 91%|█████████ | 1200/1319 [00:35<00:01, 61.87it/s] 92%|█████████▏| 1208/1319 [00:35<00:01, 65.44it/s] 92%|█████████▏| 1219/1319 [00:35<00:01, 68.48it/s] 93%|█████████▎| 1227/1319 [00:35<00:01, 63.79it/s] 94%|█████████▎| 1234/1319 [00:35<00:01, 49.08it/s] 94%|█████████▍| 1240/1319 [00:36<00:01, 43.84it/s] 94%|█████████▍| 1246/1319 [00:36<00:01, 43.71it/s] 95%|█████████▌| 1254/1319 [00:36<00:01, 43.93it/s] 95%|█████████▌| 1259/1319 [00:36<00:01, 38.82it/s] 96%|█████████▌| 1266/1319 [00:36<00:01, 42.70it/s] 96%|█████████▋| 1271/1319 [00:36<00:01, 41.78it/s] 97%|█████████▋| 1276/1319 [00:37<00:01, 32.92it/s] 97%|█████████▋| 1280/1319 [00:37<00:01, 30.61it/s] 97%|█████████▋| 1284/1319 [00:37<00:01, 21.67it/s] 98%|█████████▊| 1289/1319 [00:37<00:01, 25.64it/s] 98%|█████████▊| 1293/1319 [00:37<00:01, 24.72it/s] 98%|█████████▊| 1296/1319 [00:38<00:00, 23.84it/s] 98%|█████████▊| 1299/1319 [00:38<00:00, 24.97it/s] 99%|█████████▊| 1302/1319 [00:38<00:00, 22.80it/s] 99%|█████████▉| 1305/1319 [00:38<00:00, 18.56it/s] 99%|█████████▉| 1308/1319 [00:38<00:00, 18.91it/s] 99%|█████████▉| 1311/1319 [00:38<00:00, 20.51it/s]100%|█████████▉| 1314/1319 [00:38<00:00, 18.95it/s]100%|█████████▉| 1317/1319 [00:39<00:00,  8.90it/s]100%|██████████| 1319/1319 [00:42<00:00,  2.36it/s]100%|██████████| 1319/1319 [00:42<00:00, 30.75it/s]
Accuracy: 0.934
Invalid: 0.000
Latency: 43.098 s
Output throughput: 3182.590 token/s
Run 3 completed in 49 seconds
Run 3: Accuracy: 0.934
  ✓ Run 3 included in average (accuracy: 0.934)
[progress] [===============-----------------------------------] 3/10 (30%)  | GSM8K: Run 3

Checking server health before Run 4...
✅ Server is healthy
Executing GSM8K test Run 4 ...
  0%|          | 0/1319 [00:00<?, ?it/s]  0%|          | 1/1319 [00:07<2:44:56,  7.51s/it]  0%|          | 2/1319 [00:08<1:19:26,  3.62s/it]  0%|          | 3/1319 [00:08<44:35,  2.03s/it]    0%|          | 4/1319 [00:09<33:46,  1.54s/it]  0%|          | 5/1319 [00:10<27:31,  1.26s/it]  1%|          | 8/1319 [00:10<11:26,  1.91it/s]  1%|          | 12/1319 [00:10<05:50,  3.73it/s]  1%|          | 16/1319 [00:10<04:03,  5.36it/s]  1%|▏         | 19/1319 [00:11<03:30,  6.17it/s]  2%|▏         | 27/1319 [00:11<02:03, 10.49it/s]  2%|▏         | 30/1319 [00:12<02:40,  8.03it/s]  3%|▎         | 40/1319 [00:12<01:37, 13.07it/s]  3%|▎         | 42/1319 [00:12<01:52, 11.40it/s]  4%|▍         | 51/1319 [00:13<01:21, 15.55it/s]  5%|▍         | 61/1319 [00:13<01:07, 18.57it/s]  5%|▌         | 66/1319 [00:13<01:07, 18.56it/s]  5%|▌         | 72/1319 [00:14<01:07, 18.52it/s]  6%|▌         | 82/1319 [00:14<00:56, 22.07it/s]  7%|▋         | 89/1319 [00:14<00:56, 21.88it/s]  7%|▋         | 98/1319 [00:15<00:51, 23.60it/s]  8%|▊         | 105/1319 [00:15<00:52, 22.93it/s]  9%|▊         | 115/1319 [00:15<00:47, 25.21it/s] 10%|▉         | 128/1319 [00:16<00:52, 22.53it/s] 10%|█         | 137/1319 [00:16<00:52, 22.44it/s] 11%|█         | 141/1319 [00:17<00:59, 19.89it/s] 11%|█▏        | 149/1319 [00:17<00:55, 21.15it/s] 12%|█▏        | 156/1319 [00:17<00:54, 21.22it/s] 13%|█▎        | 169/1319 [00:18<00:43, 26.54it/s] 13%|█▎        | 175/1319 [00:18<00:47, 24.17it/s] 14%|█▍        | 185/1319 [00:18<00:43, 26.06it/s] 15%|█▍        | 196/1319 [00:19<00:52, 21.55it/s] 16%|█▌        | 211/1319 [00:19<00:40, 27.52it/s] 17%|█▋        | 220/1319 [00:20<00:40, 27.46it/s] 18%|█▊        | 236/1319 [00:20<00:32, 33.28it/s] 19%|█▉        | 249/1319 [00:20<00:30, 35.13it/s] 20%|█▉        | 260/1319 [00:20<00:30, 34.73it/s] 21%|██        | 272/1319 [00:21<00:29, 35.38it/s] 21%|██▏       | 283/1319 [00:21<00:29, 34.88it/s] 22%|██▏       | 294/1319 [00:21<00:29, 34.55it/s] 23%|██▎       | 303/1319 [00:22<00:31, 32.53it/s] 24%|██▍       | 314/1319 [00:22<00:29, 34.33it/s] 25%|██▍       | 324/1319 [00:22<00:25, 39.79it/s] 25%|██▌       | 334/1319 [00:22<00:21, 45.08it/s] 26%|██▋       | 347/1319 [00:23<00:17, 54.47it/s] 27%|██▋       | 356/1319 [00:23<00:17, 55.71it/s] 28%|██▊       | 370/1319 [00:23<00:14, 65.87it/s] 29%|██▊       | 378/1319 [00:23<00:15, 62.59it/s] 29%|██▉       | 388/1319 [00:23<00:14, 64.01it/s] 30%|███       | 399/1319 [00:23<00:13, 67.38it/s] 31%|███       | 406/1319 [00:23<00:14, 61.55it/s] 31%|███▏      | 414/1319 [00:24<00:15, 59.19it/s] 33%|███▎      | 429/1319 [00:24<00:12, 72.15it/s] 33%|███▎      | 437/1319 [00:24<00:13, 67.06it/s] 34%|███▎      | 445/1319 [00:24<00:13, 62.89it/s] 35%|███▌      | 462/1319 [00:24<00:10, 79.18it/s] 36%|███▌      | 471/1319 [00:24<00:11, 73.99it/s] 36%|███▋      | 480/1319 [00:24<00:11, 70.20it/s] 37%|███▋      | 490/1319 [00:25<00:11, 69.94it/s] 38%|███▊      | 498/1319 [00:25<00:12, 65.35it/s] 39%|███▊      | 508/1319 [00:25<00:12, 66.76it/s] 39%|███▉      | 515/1319 [00:25<00:13, 60.74it/s] 40%|███▉      | 522/1319 [00:25<00:13, 57.11it/s] 40%|████      | 530/1319 [00:25<00:14, 56.22it/s] 41%|████      | 543/1319 [00:25<00:11, 66.24it/s] 42%|████▏     | 555/1319 [00:26<00:11, 65.74it/s] 43%|████▎     | 566/1319 [00:26<00:10, 73.86it/s] 44%|████▍     | 578/1319 [00:26<00:09, 77.07it/s] 44%|████▍     | 586/1319 [00:26<00:10, 69.89it/s] 45%|████▌     | 600/1319 [00:26<00:09, 77.93it/s] 47%|████▋     | 616/1319 [00:26<00:07, 88.17it/s] 48%|████▊     | 628/1319 [00:26<00:07, 86.71it/s] 48%|████▊     | 638/1319 [00:27<00:08, 81.41it/s] 49%|████▉     | 650/1319 [00:27<00:08, 82.23it/s] 50%|█████     | 663/1319 [00:27<00:07, 85.46it/s] 51%|█████     | 672/1319 [00:27<00:08, 78.60it/s] 52%|█████▏    | 684/1319 [00:27<00:07, 80.34it/s] 53%|█████▎    | 694/1319 [00:27<00:08, 77.72it/s] 53%|█████▎    | 702/1319 [00:27<00:08, 71.07it/s] 54%|█████▍    | 710/1319 [00:28<00:09, 66.33it/s] 54%|█████▍    | 718/1319 [00:28<00:09, 63.08it/s] 55%|█████▌    | 732/1319 [00:28<00:07, 73.96it/s] 56%|█████▋    | 743/1319 [00:28<00:07, 74.80it/s] 57%|█████▋    | 757/1319 [00:28<00:06, 81.98it/s] 58%|█████▊    | 771/1319 [00:28<00:06, 87.61it/s] 59%|█████▉    | 780/1319 [00:28<00:06, 79.93it/s] 60%|██████    | 795/1319 [00:29<00:05, 87.99it/s] 61%|██████    | 807/1319 [00:29<00:05, 87.65it/s] 63%|██████▎   | 831/1319 [00:29<00:04, 103.25it/s] 64%|██████▍   | 844/1319 [00:29<00:05, 94.67it/s]  65%|██████▌   | 861/1319 [00:29<00:04, 96.39it/s] 66%|██████▌   | 873/1319 [00:29<00:05, 89.08it/s] 68%|██████▊   | 891/1319 [00:30<00:04, 96.09it/s] 68%|██████▊   | 902/1319 [00:30<00:04, 87.44it/s] 70%|██████▉   | 923/1319 [00:30<00:03, 101.42it/s] 71%|███████▏  | 940/1319 [00:30<00:03, 104.00it/s] 72%|███████▏  | 952/1319 [00:30<00:03, 97.25it/s]  74%|███████▎  | 971/1319 [00:30<00:03, 106.61it/s] 74%|███████▍  | 982/1319 [00:30<00:03, 97.66it/s]  75%|███████▌  | 993/1319 [00:31<00:03, 91.41it/s] 76%|███████▋  | 1008/1319 [00:31<00:03, 95.76it/s] 77%|███████▋  | 1019/1319 [00:31<00:03, 92.11it/s] 78%|███████▊  | 1029/1319 [00:31<00:03, 86.29it/s] 79%|███████▉  | 1043/1319 [00:31<00:02, 92.28it/s] 80%|███████▉  | 1053/1319 [00:31<00:03, 87.52it/s] 81%|████████  | 1062/1319 [00:31<00:03, 82.51it/s] 81%|████████  | 1071/1319 [00:32<00:03, 79.16it/s] 82%|████████▏ | 1079/1319 [00:32<00:03, 74.33it/s] 83%|████████▎ | 1091/1319 [00:32<00:02, 81.76it/s] 83%|████████▎ | 1100/1319 [00:32<00:02, 79.37it/s] 84%|████████▍ | 1108/1319 [00:32<00:02, 74.64it/s] 85%|████████▌ | 1123/1319 [00:32<00:02, 90.23it/s] 86%|████████▌ | 1133/1319 [00:32<00:02, 88.24it/s] 87%|████████▋ | 1142/1319 [00:32<00:02, 75.28it/s] 87%|████████▋ | 1150/1319 [00:33<00:02, 65.11it/s] 88%|████████▊ | 1157/1319 [00:33<00:02, 64.09it/s] 88%|████████▊ | 1167/1319 [00:33<00:02, 71.17it/s] 89%|████████▉ | 1175/1319 [00:33<00:02, 71.57it/s] 90%|████████▉ | 1183/1319 [00:33<00:01, 71.96it/s] 90%|█████████ | 1191/1319 [00:33<00:01, 73.05it/s] 91%|█████████ | 1199/1319 [00:33<00:01, 65.28it/s] 92%|█████████▏| 1208/1319 [00:33<00:01, 71.11it/s] 92%|█████████▏| 1218/1319 [00:34<00:01, 69.78it/s] 93%|█████████▎| 1227/1319 [00:34<00:01, 60.33it/s] 94%|█████████▎| 1234/1319 [00:34<00:01, 51.80it/s] 94%|█████████▍| 1240/1319 [00:34<00:01, 45.11it/s] 94%|█████████▍| 1245/1319 [00:34<00:01, 42.59it/s] 95%|█████████▍| 1253/1319 [00:34<00:01, 46.97it/s] 95%|█████████▌| 1258/1319 [00:35<00:01, 44.23it/s] 96%|█████████▌| 1263/1319 [00:35<00:01, 39.00it/s] 96%|█████████▌| 1269/1319 [00:35<00:01, 41.06it/s] 97%|█████████▋| 1274/1319 [00:35<00:01, 40.72it/s] 97%|█████████▋| 1279/1319 [00:35<00:01, 37.26it/s] 97%|█████████▋| 1285/1319 [00:35<00:01, 28.81it/s] 98%|█████████▊| 1290/1319 [00:36<00:00, 31.86it/s] 98%|█████████▊| 1294/1319 [00:36<00:00, 30.83it/s] 98%|█████████▊| 1298/1319 [00:36<00:00, 25.51it/s] 99%|█████████▊| 1302/1319 [00:36<00:00, 23.85it/s] 99%|█████████▉| 1305/1319 [00:36<00:00, 19.57it/s] 99%|█████████▉| 1308/1319 [00:37<00:00, 16.01it/s] 99%|█████████▉| 1310/1319 [00:37<00:00, 14.95it/s] 99%|█████████▉| 1312/1319 [00:37<00:00, 15.50it/s]100%|█████████▉| 1315/1319 [00:37<00:00, 10.63it/s]100%|█████████▉| 1317/1319 [00:38<00:00,  6.72it/s]100%|██████████| 1319/1319 [00:43<00:00,  1.52it/s]100%|██████████| 1319/1319 [00:43<00:00, 30.59it/s]
Accuracy: 0.939
Invalid: 0.000
Latency: 43.314 s
Output throughput: 3167.639 token/s
Run 4 completed in 49 seconds
Run 4: Accuracy: 0.939
  ✓ Run 4 included in average (accuracy: 0.939)
[progress] [====================------------------------------] 4/10 (40%)  | GSM8K: Run 4

Checking server health before Run 5...
✅ Server is healthy
Executing GSM8K test Run 5 ...
  0%|          | 0/1319 [00:00<?, ?it/s]  0%|          | 1/1319 [00:07<2:52:57,  7.87s/it]  0%|          | 2/1319 [00:08<1:22:42,  3.77s/it]  0%|          | 3/1319 [00:08<46:21,  2.11s/it]    0%|          | 4/1319 [00:09<32:28,  1.48s/it]  0%|          | 5/1319 [00:10<28:52,  1.32s/it]  1%|          | 8/1319 [00:10<11:57,  1.83it/s]  1%|          | 12/1319 [00:10<06:04,  3.58it/s]  1%|          | 16/1319 [00:11<05:00,  4.34it/s]  1%|▏         | 19/1319 [00:11<04:09,  5.21it/s]  2%|▏         | 29/1319 [00:12<02:03, 10.45it/s]  3%|▎         | 33/1319 [00:12<01:58, 10.89it/s]  3%|▎         | 38/1319 [00:12<01:46, 12.04it/s]  3%|▎         | 41/1319 [00:13<01:53, 11.30it/s]  4%|▍         | 52/1319 [00:13<01:12, 17.44it/s]  4%|▍         | 59/1319 [00:13<01:11, 17.58it/s]  5%|▍         | 64/1319 [00:14<01:10, 17.89it/s]  5%|▌         | 70/1319 [00:14<01:09, 18.07it/s]  6%|▌         | 76/1319 [00:14<00:54, 22.82it/s]  6%|▌         | 78/1319 [00:14<00:54, 22.82it/s]  6%|▌         | 78/1319 [00:14<00:54, 22.82it/s]  6%|▌         | 81/1319 [00:14<01:05, 18.79it/s]  7%|▋         | 86/1319 [00:14<01:15, 16.43it/s]  7%|▋         | 86/1319 [00:14<01:15, 16.43it/s]  7%|▋         | 88/1319 [00:15<02:01, 10.13it/s]  8%|▊         | 99/1319 [00:15<01:16, 15.98it/s]  8%|▊         | 106/1319 [00:16<01:09, 17.41it/s]  9%|▉         | 116/1319 [00:16<00:57, 21.08it/s]  9%|▉         | 123/1319 [00:16<00:56, 21.23it/s] 10%|▉         | 131/1319 [00:16<00:53, 22.23it/s] 10%|█         | 137/1319 [00:17<00:55, 21.11it/s] 11%|█         | 144/1319 [00:17<00:55, 21.22it/s] 12%|█▏        | 154/1319 [00:17<00:48, 24.04it/s] 12%|█▏        | 164/1319 [00:18<00:44, 26.09it/s] 13%|█▎        | 169/1319 [00:18<00:50, 22.92it/s] 14%|█▎        | 179/1319 [00:18<00:45, 25.32it/s] 14%|█▍        | 187/1319 [00:19<00:45, 25.00it/s] 16%|█▌        | 205/1319 [00:19<00:32, 34.18it/s] 16%|█▌        | 214/1319 [00:19<00:34, 32.09it/s] 17%|█▋        | 228/1319 [00:20<00:30, 35.32it/s] 18%|█▊        | 244/1319 [00:20<00:27, 39.52it/s] 19%|█▉        | 252/1319 [00:20<00:30, 35.01it/s] 20%|█▉        | 261/1319 [00:21<00:32, 32.68it/s] 21%|██        | 278/1319 [00:21<00:35, 29.34it/s] 22%|██▏       | 292/1319 [00:22<00:31, 32.68it/s] 23%|██▎       | 301/1319 [00:22<00:32, 31.47it/s] 23%|██▎       | 308/1319 [00:22<00:33, 29.88it/s] 24%|██▍       | 319/1319 [00:22<00:27, 36.77it/s] 25%|██▍       | 328/1319 [00:23<00:24, 41.01it/s] 26%|██▌       | 343/1319 [00:23<00:18, 53.86it/s] 27%|██▋       | 350/1319 [00:23<00:18, 51.83it/s] 28%|██▊       | 367/1319 [00:23<00:14, 67.84it/s] 29%|██▊       | 376/1319 [00:23<00:14, 65.75it/s] 29%|██▉       | 389/1319 [00:23<00:12, 72.00it/s] 30%|███       | 400/1319 [00:23<00:12, 73.31it/s] 31%|███       | 408/1319 [00:24<00:13, 67.60it/s] 32%|███▏      | 417/1319 [00:24<00:13, 65.55it/s] 33%|███▎      | 431/1319 [00:24<00:11, 74.58it/s] 34%|███▎      | 442/1319 [00:24<00:11, 75.28it/s] 34%|███▍      | 450/1319 [00:24<00:12, 68.21it/s] 36%|███▌      | 469/1319 [00:24<00:09, 87.27it/s] 36%|███▋      | 480/1319 [00:25<00:09, 84.11it/s] 37%|███▋      | 489/1319 [00:25<00:10, 77.27it/s] 38%|███▊      | 500/1319 [00:25<00:10, 76.90it/s] 39%|███▊      | 510/1319 [00:25<00:10, 75.02it/s] 39%|███▉      | 518/1319 [00:25<00:11, 68.81it/s] 40%|███▉      | 525/1319 [00:25<00:12, 62.30it/s] 41%|████      | 538/1319 [00:25<00:10, 71.08it/s] 42%|████▏     | 548/1319 [00:26<00:10, 70.27it/s] 42%|████▏     | 559/1319 [00:26<00:10, 71.97it/s] 43%|████▎     | 572/1319 [00:26<00:10, 71.86it/s] 44%|████▍     | 584/1319 [00:26<00:09, 81.05it/s] 45%|████▍     | 593/1319 [00:26<00:09, 75.96it/s] 46%|████▌     | 601/1319 [00:26<00:10, 69.04it/s] 46%|████▌     | 610/1319 [00:26<00:10, 67.61it/s] 47%|████▋     | 621/1319 [00:27<00:09, 70.35it/s] 48%|████▊     | 634/1319 [00:27<00:08, 76.93it/s] 49%|████▊     | 643/1319 [00:27<00:09, 72.82it/s] 49%|████▉     | 651/1319 [00:27<00:09, 67.44it/s] 51%|█████     | 668/1319 [00:27<00:07, 84.03it/s] 51%|█████▏    | 677/1319 [00:27<00:08, 77.69it/s] 52%|█████▏    | 691/1319 [00:27<00:07, 85.00it/s] 53%|█████▎    | 700/1319 [00:28<00:07, 78.80it/s] 54%|█████▎    | 708/1319 [00:28<00:08, 72.07it/s] 54%|█████▍    | 716/1319 [00:28<00:08, 67.07it/s] 55%|█████▍    | 725/1319 [00:28<00:08, 66.44it/s] 56%|█████▌    | 735/1319 [00:28<00:08, 67.36it/s] 57%|█████▋    | 751/1319 [00:28<00:06, 81.31it/s] 58%|█████▊    | 768/1319 [00:28<00:05, 93.42it/s] 59%|█████▉    | 781/1319 [00:29<00:05, 93.54it/s] 60%|█████▉    | 791/1319 [00:29<00:06, 86.91it/s] 61%|██████    | 800/1319 [00:29<00:06, 80.07it/s] 62%|██████▏   | 821/1319 [00:29<00:04, 110.07it/s] 64%|██████▎   | 839/1319 [00:29<00:04, 108.39it/s] 65%|██████▍   | 854/1319 [00:29<00:04, 102.05it/s] 66%|██████▌   | 867/1319 [00:29<00:04, 94.30it/s]  67%|██████▋   | 882/1319 [00:30<00:04, 93.81it/s] 68%|██████▊   | 892/1319 [00:30<00:05, 83.98it/s] 68%|██████▊   | 903/1319 [00:30<00:05, 79.37it/s] 70%|██████▉   | 919/1319 [00:30<00:04, 86.05it/s] 71%|███████   | 935/1319 [00:30<00:04, 90.80it/s] 72%|███████▏  | 950/1319 [00:30<00:03, 93.41it/s] 73%|███████▎  | 965/1319 [00:30<00:03, 95.63it/s] 74%|███████▍  | 977/1319 [00:31<00:03, 91.77it/s] 75%|███████▌  | 991/1319 [00:31<00:03, 92.88it/s] 77%|███████▋  | 1014/1319 [00:31<00:02, 113.17it/s] 78%|███████▊  | 1033/1319 [00:31<00:02, 122.52it/s] 79%|███████▉  | 1046/1319 [00:31<00:02, 114.30it/s] 80%|████████  | 1058/1319 [00:31<00:02, 94.96it/s]  81%|████████  | 1068/1319 [00:32<00:02, 90.21it/s] 82%|████████▏ | 1078/1319 [00:32<00:02, 87.63it/s] 82%|████████▏ | 1087/1319 [00:32<00:02, 83.30it/s] 83%|████████▎ | 1096/1319 [00:32<00:02, 80.52it/s] 84%|████████▍ | 1105/1319 [00:32<00:02, 78.72it/s] 84%|████████▍ | 1114/1319 [00:32<00:02, 78.01it/s] 85%|████████▌ | 1122/1319 [00:32<00:02, 74.36it/s] 86%|████████▌ | 1135/1319 [00:32<00:02, 85.52it/s] 87%|████████▋ | 1145/1319 [00:32<00:02, 86.28it/s] 88%|████████▊ | 1156/1319 [00:33<00:01, 89.79it/s] 88%|████████▊ | 1166/1319 [00:33<00:01, 78.25it/s] 89%|████████▉ | 1175/1319 [00:33<00:01, 79.10it/s] 90%|████████▉ | 1184/1319 [00:33<00:02, 57.34it/s] 90%|█████████ | 1191/1319 [00:33<00:02, 59.22it/s] 91%|█████████ | 1198/1319 [00:33<00:02, 54.55it/s] 91%|█████████▏| 1204/1319 [00:33<00:02, 55.28it/s] 92%|█████████▏| 1213/1319 [00:34<00:01, 56.73it/s] 92%|█████████▏| 1220/1319 [00:34<00:01, 53.93it/s] 93%|█████████▎| 1230/1319 [00:34<00:01, 58.61it/s] 94%|█████████▎| 1236/1319 [00:34<00:01, 44.63it/s] 94%|█████████▍| 1243/1319 [00:34<00:01, 45.96it/s] 95%|█████████▍| 1251/1319 [00:34<00:01, 49.18it/s] 95%|█████████▌| 1257/1319 [00:35<00:01, 47.72it/s] 96%|█████████▌| 1262/1319 [00:35<00:01, 41.37it/s] 96%|█████████▌| 1267/1319 [00:35<00:01, 34.61it/s] 96%|█████████▋| 1271/1319 [00:35<00:01, 31.31it/s] 97%|█████████▋| 1275/1319 [00:35<00:01, 29.13it/s] 97%|█████████▋| 1280/1319 [00:35<00:01, 31.90it/s] 97%|█████████▋| 1284/1319 [00:36<00:01, 24.48it/s] 98%|█████████▊| 1287/1319 [00:36<00:01, 24.74it/s] 98%|█████████▊| 1291/1319 [00:36<00:01, 27.32it/s] 98%|█████████▊| 1295/1319 [00:36<00:00, 27.43it/s] 98%|█████████▊| 1298/1319 [00:36<00:00, 24.21it/s] 99%|█████████▊| 1301/1319 [00:36<00:00, 20.87it/s] 99%|█████████▉| 1304/1319 [00:37<00:00, 17.14it/s] 99%|█████████▉| 1306/1319 [00:37<00:00, 16.13it/s] 99%|█████████▉| 1310/1319 [00:37<00:00, 18.14it/s] 99%|█████████▉| 1312/1319 [00:37<00:00, 18.11it/s]100%|█████████▉| 1314/1319 [00:38<00:00, 11.70it/s]100%|█████████▉| 1316/1319 [00:38<00:00,  8.20it/s]100%|█████████▉| 1318/1319 [00:38<00:00,  6.82it/s]100%|██████████| 1319/1319 [00:41<00:00,  1.71it/s]100%|██████████| 1319/1319 [00:41<00:00, 31.48it/s]
Accuracy: 0.934
Invalid: 0.000
Latency: 42.100 s
Output throughput: 3242.449 token/s
Run 5 completed in 48 seconds
Run 5: Accuracy: 0.934
  ✓ Run 5 included in average (accuracy: 0.934)
[progress] [=========================-------------------------] 5/10 (50%)  | GSM8K: Run 5
GSM8K test completed in 370 seconds
Total runs: 5, Valid runs: 5, Excluded runs: 0
Average Accuracy over 5 valid runs: 0.936
Average accuracy meets threshold (0.93).
✅ GSM8K benchmark completed successfully.
GSM8K log saved to /mnt/raid/michael/sglang-ci/online/DeepSeek-V3-0324/v0.5.6.post1-rocm700-mi30x-20251211_DeepSeek-V3-0324_FP8_online/sglang_client_log_DeepSeek-V3-0324_gsm8k.log
Server log saved to /mnt/raid/michael/sglang-ci/online/DeepSeek-V3-0324/v0.5.6.post1-rocm700-mi30x-20251211_DeepSeek-V3-0324_FP8_online/sglang_server.log
Starting serving benchmark tests with different concurrency levels...
[online] Structured CSV initialized at /mnt/raid/michael/sglang-ci/online/DeepSeek-V3-0324/v0.5.6.post1-rocm700-mi30x-20251211_DeepSeek-V3-0324_FP8_online/v0.5.6.post1-rocm700-mi30x-20251211_DeepSeek-V3-0324_FP8_serving.csv
Processing concurrency 128 with 1 runs...
Running serving benchmark with concurrency 128 (Run 1) - 500 prompts...
Concurrency 128, Run 1 completed: 500 requests, (tok/s): tok/s output throughput, 157077.14ms E2E latency (629s)
[progress] [==============================--------------------] 6/10 (60%)  | Serving: C128 R1
✅ Best results for concurrency 128: E2E=157077.14ms, TTFT=18859.63ms, ITL=148.79ms, Output=(tok/s): tok/s
[online] Updating CSV for concurrency 128: E2E=157077.14ms, TTFT=18859.63ms, ITL=148.79ms, Output=(tok/s): tok/s
[online] CSV updated with results for concurrency 128
Sleeping 3 seconds before next concurrency level...
Processing concurrency 64 with 1 runs...
Running serving benchmark with concurrency 64 (Run 1) - 500 prompts...
Concurrency 64, Run 1 completed: 500 requests, (tok/s): tok/s output throughput, 117805.28ms E2E latency (900s)
[progress] [===================================---------------] 7/10 (70%)  | Serving: C64 R1
✅ Best results for concurrency 64: E2E=117805.28ms, TTFT=9768.10ms, ITL=122.65ms, Output=(tok/s): tok/s
[online] Updating CSV for concurrency 64: E2E=117805.28ms, TTFT=9768.10ms, ITL=122.65ms, Output=(tok/s): tok/s
[online] CSV updated with results for concurrency 64
Sleeping 3 seconds before next concurrency level...
Processing concurrency 16 with 1 runs...
Running serving benchmark with concurrency 16 (Run 1) - 128 prompts...
Concurrency 16, Run 1 completed: 128 requests, (tok/s): tok/s output throughput, 67090.28ms E2E latency (484s)
[progress] [========================================----------] 8/10 (80%)  | Serving: C16 R1
✅ Best results for concurrency 16: E2E=67090.28ms, TTFT=2458.02ms, ITL=96.87ms, Output=(tok/s): tok/s
[online] Updating CSV for concurrency 16: E2E=67090.28ms, TTFT=2458.02ms, ITL=96.87ms, Output=(tok/s): tok/s
[online] CSV updated with results for concurrency 16
Sleeping 3 seconds before next concurrency level...
Processing concurrency 4 with 1 runs...
Running serving benchmark with concurrency 4 (Run 1) - 128 prompts...
Concurrency 4, Run 1 completed: 128 requests, (tok/s): tok/s output throughput, 21511.56ms E2E latency (702s)
[progress] [=============================================-----] 9/10 (90%)  | Serving: C4 R1
✅ Best results for concurrency 4: E2E=21511.56ms, TTFT=371.28ms, ITL=26.44ms, Output=(tok/s): tok/s
[online] Updating CSV for concurrency 4: E2E=21511.56ms, TTFT=371.28ms, ITL=26.44ms, Output=(tok/s): tok/s
[online] CSV updated with results for concurrency 4
Sleeping 3 seconds before next concurrency level...
Processing concurrency 1 with 1 runs...
Running serving benchmark with concurrency 1 (Run 1) - 128 prompts...
Concurrency 1, Run 1 completed: 128 requests, (tok/s): tok/s output throughput, 20001.46ms E2E latency (2575s)
[progress] [==================================================] 10/10 (100%) ✅ Complete!
 | Serving: C1 R1
✅ Best results for concurrency 1: E2E=20001.46ms, TTFT=201.38ms, ITL=24.80ms, Output=(tok/s): tok/s
[online] Updating CSV for concurrency 1: E2E=20001.46ms, TTFT=201.38ms, ITL=24.80ms, Output=(tok/s): tok/s
[online] CSV updated with results for concurrency 1
✅ Serving benchmark completed successfully in 5312 seconds (standard mode).
Structured serving benchmark results written to /mnt/raid/michael/sglang-ci/online/DeepSeek-V3-0324/v0.5.6.post1-rocm700-mi30x-20251211_DeepSeek-V3-0324_FP8_online/v0.5.6.post1-rocm700-mi30x-20251211_DeepSeek-V3-0324_FP8_serving.csv
Individual concurrency logs saved to /mnt/raid/michael/sglang-ci/online/DeepSeek-V3-0324/v0.5.6.post1-rocm700-mi30x-20251211_DeepSeek-V3-0324_FP8_online/sglang_serving_benchmark_concurrency_*_run*.log
GSM8K accuracy results written to /mnt/raid/michael/sglang-ci/online/DeepSeek-V3-0324/v0.5.6.post1-rocm700-mi30x-20251211_DeepSeek-V3-0324_FP8_online/sglang_client_log_DeepSeek-V3-0324_gsm8k.log
Shutting down SGLang server...
Server shutdown completed in 0 seconds

==========================================
SCRIPT EXECUTION SUMMARY
==========================================
Script completed at: 2025-12-11 16:52:50 PST
Total execution time: 5837 seconds (97 minutes)
Output directory: /mnt/raid/michael/sglang-ci/online/DeepSeek-V3-0324/v0.5.6.post1-rocm700-mi30x-20251211_DeepSeek-V3-0324_FP8_online
Serving CSV: /mnt/raid/michael/sglang-ci/online/DeepSeek-V3-0324/v0.5.6.post1-rocm700-mi30x-20251211_DeepSeek-V3-0324_FP8_online/v0.5.6.post1-rocm700-mi30x-20251211_DeepSeek-V3-0324_FP8_serving.csv
Timing log: /mnt/raid/michael/sglang-ci/online/DeepSeek-V3-0324/v0.5.6.post1-rocm700-mi30x-20251211_DeepSeek-V3-0324_FP8_online/timing_summary_20251211_151533.log
===========================================
Cleaning up...
Killing background SGLang server (PID: 53)...
Server process 53 not found or already terminated.
[nightly] === Online benchmark dispatched for DEEPSEEK; check logs in sgl-dev_v0.5.6.post1-rocm700-mi30x-20251211 ===
[nightly] === Starting post-processing (CSV processing, plot generation, Teams notifications) ===
[nightly] Processing online CSV data and generating plots... Logs will be saved to /mnt/raid/michael/sglang-ci/online/DeepSeek-V3-0324/v0.5.6.post1-rocm700-mi30x-20251211_DeepSeek-V3-0324_FP8_online/process_and_generate_online_plots.log
[nightly] Using plot date from image tag: 20251211
[nightly] Teams notifications skipped - --teams-webhook-url not provided
[nightly] === Online post-processing completed for DEEPSEEK ===
[nightly] ==========================================
[nightly] Completed benchmarks for image: rocm/sgl-dev:v0.5.6.post1-rocm700-mi30x-20251211
[nightly] Stopping container sgl-dev_v0.5.6.post1-rocm700-mi30x-20251211 to release resources...
[nightly] ==========================================
[nightly] ==========================================
[nightly] All benchmarks completed for 1 image(s)
[nightly] ==========================================
[nightly] Cleaning up process lock...
