[nightly] ==========================================
[nightly] SGL Nightly Benchmark Started
[nightly] ==========================================
[nightly] Command: scripts/perf_nightly.sh --model=deepseek --model-path=/data/models/deepseek-ai/DeepSeek-V3-0324 --mode=online --hardware=mi30x --check-dp-attention --teams-webhook-url=
[nightly] Start time: 2025-12-07 10:30:01 PST
[nightly] Machine: dell300x-pla-t12-38
[nightly] Working directory: /mnt/raid/michael/sglang-ci
[nightly] Script location: /mnt/raid/michael/sglang-ci/scripts/perf_nightly.sh
[nightly] Process ID: 404622
[nightly] ==========================================

[nightly] Runtime Environment:
[nightly] User: amd | Groups: amd adm cdrom... | Docker: /usr/bin/docker
[nightly] Testing Docker daemon access...
[nightly] Docker daemon accessible - proceeding...
[nightly] WARN: --teams-webhook-url was provided without a value - notifications disabled
[nightly] DP attention mode enabled via command line
[nightly] Custom model path provided: /data/models/deepseek-ai/DeepSeek-V3-0324
[nightly] Hardware: mi30x, ROCM Version: rocm700
[nightly] Model: deepseek, Mode(s): online
[nightly] Created process lock: /tmp/perf_nightly_deepseek.lock
[nightly] GPU is busy. Attempting to stop running Docker containers...
[nightly] No running containers to stop.
[nightly] Waiting 15s for GPU to become idle...
[nightly] WARN: GPU may still be busy, but proceeding as requested.
[nightly] Searching for non-SRT images for deepseek for the last 1 days...
[nightly] Searching for non-SRT mi30x image (rocm700) in 'rocm/sgl-dev' for date 20251207...
[nightly] Found candidate tag for day -0: v0.5.6-rocm700-mi30x-20251207
[nightly] Found local image: rocm/sgl-dev:v0.5.6-rocm700-mi30x-20251207
[nightly] Successfully obtained image for date 20251207: rocm/sgl-dev:v0.5.6-rocm700-mi30x-20251207
[nightly] Found 1 valid image(s) to run benchmarks on:
[nightly]   - rocm/sgl-dev:v0.5.6-rocm700-mi30x-20251207

[nightly] ==========================================
[nightly] Starting benchmarks for image: rocm/sgl-dev:v0.5.6-rocm700-mi30x-20251207
[nightly] ==========================================
[nightly] Checking GPU status before starting benchmarks for rocm/sgl-dev:v0.5.6-rocm700-mi30x-20251207...
[nightly] GPU is busy. Attempting to stop running Docker containers...
[nightly] No running containers to stop.
[nightly] Waiting 15s for GPU to become idle...
[nightly] WARN: GPU may still be busy, but proceeding as requested.
[nightly] INFO: Found 0/15 completed runs for rocm/sgl-dev:v0.5.6-rocm700-mi30x-20251207 (online). Proceeding with benchmarks.
[nightly] Using Docker image: rocm/sgl-dev:v0.5.6-rocm700-mi30x-20251207
[nightly] Container name: sgl-dev_v0.5.6-rocm700-mi30x-20251207
[nightly] Reusing container sgl-dev_v0.5.6-rocm700-mi30x-20251207
[nightly] === Starting benchmark execution ===
[nightly] === Starting nightly DEEPSEEK online benchmark ===
[nightly] Launching deepseek_perf_online_csv.sh inside sgl-dev_v0.5.6-rocm700-mi30x-20251207
[nightly] Passing --model-name='DeepSeek-V3-0324' to DeepSeek benchmark
[nightly] Adding --check-dp-attention flag for DeepSeek online benchmark
✅ Parameter validation passed
[online] Script started at: 2025-12-07 10:30:32 PST
Scanning existing logs to check if all benchmarks are already complete...
Checking GSM8K log status...
Missing: GSM8K log file (/mnt/raid/michael/sglang-ci/online/DeepSeek-V3-0324/v0.5.6-rocm700-mi30x-20251207_DeepSeek-V3-0324_FP8_online_dp_attention/sglang_client_log_DeepSeek-V3-0324_gsm8k.log)
DP attention mode - skipping serving benchmark log checks (GSM8K only)
Scan complete: 0 total runs needed, 0 missing/incomplete
❌ GSM8K benchmark is missing, empty, or incomplete.
Server startup required.
Clearing previous logs...
Starting SGLang server for online GSM8K benchmark...
[csv] Cleaning up stale aiter JIT lock files...
[csv] No stale aiter lock files found
[DEBUG] Using Data Parallel attention settings with SGLANG_USE_AITER=1
[DEBUG] Enabling SGLANG_USE_ROCM700A for ROCm 700 image
Waiting for SGLang server (PID: 45) to start... (Max 15 minutes)
Server logs are being written to: /mnt/raid/michael/sglang-ci/online/DeepSeek-V3-0324/v0.5.6-rocm700-mi30x-20251207_DeepSeek-V3-0324_FP8_online_dp_attention/sglang_server.log
......................................
SGLang server started successfully after 191 seconds.
=== Online GSM8K Benchmark: TP=8, Questions=2000, Parallel=2000, Shots=5 ===
[progress] Total benchmark runs to execute: 5 (GSM8K only - DP attention mode)
[progress] [--------------------------------------------------] 0/5 (0%) 
Starting GSM8K Online Benchmark...
Running 5 test iterations...
Executing GSM8K test Run 1 ...
Downloading from https://raw.githubusercontent.com/openai/grade-school-math/master/grade_school_math/data/test.jsonl to /tmp/test.jsonl
/tmp/test.jsonl:   0%|          | 0.00/237k [00:00<?, ?B/s]/tmp/test.jsonl: 732kB [00:00, 23.4MB/s]                   
  0%|          | 0/1319 [00:00<?, ?it/s]  0%|          | 1/1319 [00:18<6:44:39, 18.42s/it]  0%|          | 3/1319 [00:18<1:49:07,  4.98s/it]  0%|          | 4/1319 [00:19<1:12:20,  3.30s/it]  0%|          | 5/1319 [00:19<51:18,  2.34s/it]    1%|          | 7/1319 [00:19<27:03,  1.24s/it]  1%|▏         | 17/1319 [00:19<06:13,  3.48it/s]  2%|▏         | 21/1319 [00:19<04:31,  4.78it/s]  2%|▏         | 25/1319 [00:20<03:21,  6.42it/s]  3%|▎         | 35/1319 [00:20<01:44, 12.26it/s]  3%|▎         | 44/1319 [00:20<01:09, 18.24it/s]  4%|▍         | 52/1319 [00:20<00:53, 23.82it/s]  5%|▍         | 61/1319 [00:20<00:40, 30.79it/s]  6%|▌         | 73/1319 [00:20<00:30, 41.39it/s]  7%|▋         | 87/1319 [00:20<00:23, 52.25it/s]  7%|▋         | 95/1319 [00:21<00:22, 55.27it/s]  8%|▊         | 103/1319 [00:21<00:21, 55.64it/s]  9%|▊         | 113/1319 [00:21<00:20, 59.83it/s]  9%|▉         | 123/1319 [00:21<00:18, 62.96it/s] 10%|█         | 138/1319 [00:21<00:15, 75.35it/s] 11%|█         | 147/1319 [00:21<00:16, 71.95it/s] 12%|█▏        | 155/1319 [00:21<00:17, 67.69it/s] 13%|█▎        | 165/1319 [00:21<00:16, 71.96it/s] 13%|█▎        | 173/1319 [00:22<00:16, 70.33it/s] 14%|█▎        | 181/1319 [00:22<00:16, 69.25it/s] 15%|█▍        | 192/1319 [00:22<00:14, 75.75it/s] 16%|█▌        | 208/1319 [00:22<00:12, 92.46it/s] 17%|█▋        | 225/1319 [00:22<00:10, 106.97it/s] 18%|█▊        | 238/1319 [00:22<00:10, 107.33it/s] 19%|█▉        | 253/1319 [00:22<00:09, 113.56it/s] 20%|██        | 265/1319 [00:22<00:09, 110.02it/s] 21%|██▏       | 281/1319 [00:23<00:08, 118.14it/s] 22%|██▏       | 293/1319 [00:23<00:09, 113.58it/s] 23%|██▎       | 308/1319 [00:23<00:08, 118.06it/s] 25%|██▍       | 325/1319 [00:23<00:08, 123.40it/s] 26%|██▌       | 345/1319 [00:23<00:07, 134.24it/s] 27%|██▋       | 362/1319 [00:23<00:07, 134.18it/s] 29%|██▊       | 379/1319 [00:23<00:06, 138.00it/s] 30%|██▉       | 393/1319 [00:23<00:06, 133.10it/s] 31%|███       | 407/1319 [00:23<00:07, 129.30it/s] 32%|███▏      | 420/1319 [00:24<00:07, 124.98it/s] 33%|███▎      | 433/1319 [00:24<00:07, 122.07it/s] 34%|███▍      | 446/1319 [00:24<00:07, 121.13it/s] 35%|███▍      | 459/1319 [00:24<00:07, 119.88it/s] 36%|███▌      | 471/1319 [00:24<00:07, 115.82it/s] 37%|███▋      | 483/1319 [00:24<00:07, 114.02it/s] 38%|███▊      | 495/1319 [00:24<00:07, 112.83it/s] 38%|███▊      | 507/1319 [00:24<00:07, 109.59it/s] 39%|███▉      | 521/1319 [00:24<00:06, 116.55it/s] 41%|████      | 535/1319 [00:25<00:06, 119.37it/s] 42%|████▏     | 548/1319 [00:25<00:06, 117.07it/s] 43%|████▎     | 563/1319 [00:25<00:06, 121.12it/s] 44%|████▍     | 583/1319 [00:25<00:05, 136.89it/s] 45%|████▌     | 597/1319 [00:25<00:05, 136.28it/s] 46%|████▋     | 611/1319 [00:25<00:05, 136.58it/s] 47%|████▋     | 625/1319 [00:25<00:05, 135.78it/s] 48%|████▊     | 639/1319 [00:25<00:05, 134.56it/s] 50%|████▉     | 653/1319 [00:25<00:04, 134.44it/s] 51%|█████     | 667/1319 [00:26<00:04, 134.47it/s] 52%|█████▏    | 681/1319 [00:26<00:04, 134.49it/s] 53%|█████▎    | 695/1319 [00:26<00:06, 103.82it/s] 54%|█████▍    | 710/1319 [00:26<00:05, 112.95it/s] 55%|█████▍    | 723/1319 [00:26<00:05, 114.59it/s] 56%|█████▌    | 736/1319 [00:26<00:05, 109.39it/s] 57%|█████▋    | 756/1319 [00:26<00:05, 108.07it/s] 58%|█████▊    | 768/1319 [00:27<00:05, 108.41it/s] 59%|█████▉    | 783/1319 [00:27<00:04, 116.61it/s] 60%|██████    | 795/1319 [00:27<00:04, 115.09it/s] 61%|██████    | 807/1319 [00:27<00:04, 114.29it/s] 62%|██████▏   | 823/1319 [00:27<00:04, 100.71it/s] 64%|██████▍   | 841/1319 [00:27<00:04, 119.21it/s] 65%|██████▍   | 854/1319 [00:27<00:03, 121.89it/s] 66%|██████▌   | 868/1319 [00:27<00:03, 126.49it/s] 67%|██████▋   | 885/1319 [00:28<00:03, 111.91it/s] 69%|██████▊   | 906/1319 [00:28<00:03, 111.14it/s] 71%|███████   | 932/1319 [00:28<00:03, 120.55it/s] 72%|███████▏  | 954/1319 [00:28<00:03, 120.55it/s] 74%|███████▎  | 971/1319 [00:28<00:03, 111.94it/s] 75%|███████▌  | 990/1319 [00:28<00:02, 111.08it/s] 77%|███████▋  | 1011/1319 [00:29<00:02, 115.59it/s] 78%|███████▊  | 1025/1319 [00:29<00:02, 106.38it/s] 79%|███████▉  | 1042/1319 [00:29<00:02, 105.18it/s] 80%|███████▉  | 1053/1319 [00:29<00:02, 93.76it/s]  81%|████████  | 1065/1319 [00:29<00:02, 87.32it/s] 82%|████████▏ | 1077/1319 [00:29<00:02, 82.98it/s] 82%|████████▏ | 1088/1319 [00:30<00:02, 78.16it/s] 83%|████████▎ | 1099/1319 [00:30<00:02, 74.83it/s] 84%|████████▍ | 1110/1319 [00:30<00:02, 74.09it/s] 85%|████████▍ | 1118/1319 [00:30<00:02, 67.94it/s] 86%|████████▌ | 1128/1319 [00:30<00:02, 67.19it/s] 86%|████████▌ | 1137/1319 [00:30<00:02, 65.13it/s] 87%|████████▋ | 1144/1319 [00:31<00:02, 59.64it/s] 87%|████████▋ | 1154/1319 [00:31<00:02, 61.73it/s] 88%|████████▊ | 1163/1319 [00:31<00:02, 61.25it/s] 89%|████████▉ | 1175/1319 [00:31<00:02, 67.06it/s] 90%|████████▉ | 1183/1319 [00:31<00:02, 63.67it/s] 90%|█████████ | 1192/1319 [00:31<00:01, 63.51it/s] 91%|█████████ | 1199/1319 [00:31<00:02, 59.23it/s] 92%|█████████▏| 1207/1319 [00:32<00:01, 58.47it/s] 92%|█████████▏| 1213/1319 [00:32<00:01, 53.84it/s] 92%|█████████▏| 1220/1319 [00:32<00:01, 52.74it/s] 93%|█████████▎| 1226/1319 [00:32<00:01, 49.84it/s] 93%|█████████▎| 1232/1319 [00:32<00:01, 48.04it/s] 94%|█████████▍| 1237/1319 [00:32<00:01, 44.55it/s] 94%|█████████▍| 1242/1319 [00:33<00:02, 32.75it/s] 94%|█████████▍| 1246/1319 [00:33<00:02, 26.05it/s] 95%|█████████▍| 1250/1319 [00:33<00:02, 24.45it/s] 95%|█████████▌| 1255/1319 [00:33<00:02, 24.90it/s] 95%|█████████▌| 1258/1319 [00:33<00:03, 20.24it/s] 96%|█████████▌| 1261/1319 [00:34<00:02, 20.99it/s] 96%|█████████▌| 1265/1319 [00:34<00:02, 23.58it/s] 96%|█████████▌| 1268/1319 [00:34<00:02, 23.83it/s] 96%|█████████▋| 1271/1319 [00:34<00:01, 24.12it/s] 97%|█████████▋| 1279/1319 [00:34<00:01, 35.53it/s] 97%|█████████▋| 1283/1319 [00:34<00:01, 23.13it/s] 98%|█████████▊| 1287/1319 [00:35<00:01, 23.23it/s] 98%|█████████▊| 1290/1319 [00:35<00:01, 19.81it/s] 98%|█████████▊| 1293/1319 [00:35<00:01, 17.71it/s] 98%|█████████▊| 1296/1319 [00:35<00:01, 19.39it/s] 98%|█████████▊| 1299/1319 [00:35<00:01, 16.13it/s] 99%|█████████▊| 1301/1319 [00:36<00:01,  9.47it/s] 99%|█████████▉| 1303/1319 [00:36<00:01, 10.66it/s] 99%|█████████▉| 1305/1319 [00:36<00:01,  8.67it/s] 99%|█████████▉| 1309/1319 [00:37<00:00, 10.61it/s] 99%|█████████▉| 1311/1319 [00:37<00:00,  9.34it/s]100%|█████████▉| 1313/1319 [00:37<00:00,  7.12it/s]100%|█████████▉| 1314/1319 [00:38<00:00,  5.62it/s]100%|█████████▉| 1315/1319 [00:38<00:00,  5.27it/s]100%|█████████▉| 1317/1319 [00:39<00:00,  4.23it/s]100%|██████████| 1319/1319 [00:40<00:00,  3.21it/s]100%|██████████| 1319/1319 [00:40<00:00, 32.81it/s]
Accuracy: 0.930
Invalid: 0.000
Latency: 94.756 s
Output throughput: 1412.982 token/s
Run 1 completed in 100 seconds
Run 1: Accuracy: 0.930
  ✓ Run 1 included in average (accuracy: 0.930)
[progress] [==========----------------------------------------] 1/5 (20%)  | GSM8K: Run 1

Checking server health before Run 2...
✅ Server is healthy
Executing GSM8K test Run 2 ...
  0%|          | 0/1319 [00:00<?, ?it/s]  0%|          | 1/1319 [00:12<4:31:28, 12.36s/it]  0%|          | 2/1319 [00:12<1:53:26,  5.17s/it]  0%|          | 3/1319 [00:12<1:04:19,  2.93s/it]  0%|          | 4/1319 [00:13<41:15,  1.88s/it]    0%|          | 5/1319 [00:13<29:34,  1.35s/it]  1%|          | 7/1319 [00:13<15:18,  1.43it/s]  1%|▏         | 17/1319 [00:13<03:30,  6.17it/s]  2%|▏         | 21/1319 [00:13<02:38,  8.17it/s]  2%|▏         | 25/1319 [00:13<02:03, 10.49it/s]  3%|▎         | 33/1319 [00:14<01:15, 17.03it/s]  3%|▎         | 40/1319 [00:14<00:56, 22.61it/s]  4%|▍         | 50/1319 [00:14<00:39, 32.18it/s]  4%|▍         | 58/1319 [00:14<00:33, 37.83it/s]  5%|▌         | 70/1319 [00:14<00:25, 48.98it/s]  6%|▋         | 84/1319 [00:14<00:21, 57.07it/s]  7%|▋         | 98/1319 [00:14<00:16, 72.98it/s]  8%|▊         | 107/1319 [00:15<00:17, 70.22it/s]  9%|▉         | 116/1319 [00:15<00:17, 68.37it/s]  9%|▉         | 124/1319 [00:15<00:18, 65.07it/s] 10%|█         | 137/1319 [00:15<00:16, 72.97it/s] 11%|█         | 145/1319 [00:15<00:17, 68.00it/s] 12%|█▏        | 153/1319 [00:15<00:18, 64.61it/s] 12%|█▏        | 163/1319 [00:15<00:17, 66.62it/s] 13%|█▎        | 170/1319 [00:16<00:17, 64.45it/s] 14%|█▎        | 180/1319 [00:16<00:16, 69.65it/s] 14%|█▍        | 191/1319 [00:16<00:14, 75.84it/s] 15%|█▌        | 202/1319 [00:16<00:13, 80.38it/s] 16%|█▋        | 217/1319 [00:16<00:11, 93.10it/s] 17%|█▋        | 229/1319 [00:16<00:11, 95.83it/s] 18%|█▊        | 244/1319 [00:16<00:10, 105.34it/s] 19%|█▉        | 256/1319 [00:16<00:10, 104.56it/s] 21%|██        | 273/1319 [00:17<00:08, 116.51it/s] 22%|██▏       | 286/1319 [00:17<00:09, 114.74it/s] 23%|██▎       | 302/1319 [00:17<00:08, 121.27it/s] 25%|██▍       | 324/1319 [00:17<00:07, 141.07it/s] 26%|██▌       | 339/1319 [00:17<00:07, 134.21it/s] 27%|██▋       | 357/1319 [00:17<00:07, 137.04it/s] 28%|██▊       | 371/1319 [00:17<00:07, 129.23it/s] 29%|██▉       | 384/1319 [00:17<00:07, 124.57it/s] 30%|███       | 397/1319 [00:17<00:07, 121.14it/s] 31%|███▏      | 413/1319 [00:18<00:07, 126.41it/s] 32%|███▏      | 426/1319 [00:18<00:07, 122.35it/s] 33%|███▎      | 440/1319 [00:18<00:07, 122.03it/s] 34%|███▍      | 453/1319 [00:18<00:07, 118.81it/s] 35%|███▌      | 465/1319 [00:18<00:07, 114.81it/s] 36%|███▌      | 477/1319 [00:18<00:07, 112.74it/s] 37%|███▋      | 490/1319 [00:18<00:07, 114.26it/s] 38%|███▊      | 502/1319 [00:18<00:07, 111.45it/s] 39%|███▉      | 516/1319 [00:18<00:06, 117.04it/s] 40%|████      | 532/1319 [00:19<00:06, 125.38it/s] 41%|████▏     | 545/1319 [00:19<00:06, 122.97it/s] 43%|████▎     | 561/1319 [00:19<00:05, 129.68it/s] 44%|████▎     | 575/1319 [00:19<00:05, 129.01it/s] 45%|████▍     | 588/1319 [00:19<00:05, 125.04it/s] 46%|████▌     | 607/1319 [00:19<00:05, 139.99it/s] 47%|████▋     | 622/1319 [00:19<00:05, 138.02it/s] 48%|████▊     | 636/1319 [00:19<00:05, 132.99it/s] 49%|████▉     | 650/1319 [00:20<00:05, 129.31it/s] 50%|█████     | 663/1319 [00:20<00:06, 96.85it/s]  51%|█████     | 674/1319 [00:20<00:06, 99.07it/s] 52%|█████▏    | 685/1319 [00:20<00:06, 100.79it/s] 53%|█████▎    | 700/1319 [00:20<00:05, 112.73it/s] 54%|█████▍    | 715/1319 [00:20<00:04, 121.35it/s] 55%|█████▌    | 728/1319 [00:20<00:05, 113.94it/s] 56%|█████▋    | 745/1319 [00:20<00:05, 105.95it/s] 57%|█████▋    | 757/1319 [00:21<00:05, 106.68it/s] 58%|█████▊    | 770/1319 [00:21<00:04, 110.95it/s] 59%|█████▉    | 783/1319 [00:21<00:04, 113.02it/s] 60%|██████    | 796/1319 [00:21<00:04, 114.62it/s] 61%|██████▏   | 808/1319 [00:21<00:04, 112.69it/s] 62%|██████▏   | 820/1319 [00:21<00:04, 111.62it/s] 63%|██████▎   | 832/1319 [00:21<00:04, 111.41it/s] 64%|██████▍   | 844/1319 [00:21<00:04, 111.28it/s] 65%|██████▍   | 857/1319 [00:21<00:03, 116.28it/s] 66%|██████▋   | 876/1319 [00:22<00:04, 107.54it/s] 67%|██████▋   | 888/1319 [00:22<00:03, 110.50it/s] 68%|██████▊   | 902/1319 [00:22<00:03, 117.91it/s] 70%|███████   | 924/1319 [00:22<00:02, 145.21it/s] 71%|███████▏  | 940/1319 [00:22<00:03, 118.36it/s] 72%|███████▏  | 954/1319 [00:22<00:03, 100.71it/s] 73%|███████▎  | 966/1319 [00:22<00:03, 104.81it/s] 74%|███████▍  | 978/1319 [00:23<00:03, 89.81it/s]  75%|███████▌  | 991/1319 [00:23<00:03, 83.36it/s] 76%|███████▋  | 1009/1319 [00:23<00:03, 87.98it/s] 78%|███████▊  | 1027/1319 [00:23<00:03, 90.97it/s] 79%|███████▊  | 1038/1319 [00:23<00:03, 81.20it/s] 79%|███████▉  | 1048/1319 [00:24<00:03, 72.96it/s] 81%|████████  | 1064/1319 [00:24<00:03, 78.24it/s] 82%|████████▏ | 1080/1319 [00:24<00:02, 83.29it/s] 83%|████████▎ | 1091/1319 [00:24<00:02, 78.35it/s] 84%|████████▍ | 1105/1319 [00:24<00:02, 79.90it/s] 85%|████████▍ | 1116/1319 [00:24<00:02, 75.85it/s] 85%|████████▌ | 1124/1319 [00:25<00:02, 67.69it/s] 86%|████████▌ | 1132/1319 [00:25<00:03, 61.94it/s] 87%|████████▋ | 1143/1319 [00:25<00:02, 63.28it/s] 87%|████████▋ | 1151/1319 [00:25<00:02, 60.25it/s] 88%|████████▊ | 1158/1319 [00:25<00:02, 56.21it/s] 89%|████████▊ | 1170/1319 [00:25<00:02, 63.16it/s] 89%|████████▉ | 1177/1319 [00:25<00:02, 58.45it/s] 90%|█████████ | 1189/1319 [00:26<00:01, 65.10it/s] 91%|█████████ | 1196/1319 [00:26<00:02, 60.02it/s] 91%|█████████ | 1202/1319 [00:26<00:02, 54.77it/s] 92%|█████████▏| 1208/1319 [00:26<00:02, 44.65it/s] 92%|█████████▏| 1213/1319 [00:26<00:02, 42.07it/s] 92%|█████████▏| 1218/1319 [00:26<00:02, 40.37it/s] 93%|█████████▎| 1226/1319 [00:27<00:02, 45.14it/s] 93%|█████████▎| 1231/1319 [00:27<00:02, 42.51it/s] 94%|█████████▍| 1240/1319 [00:27<00:01, 49.06it/s] 94%|█████████▍| 1246/1319 [00:27<00:01, 47.83it/s] 95%|█████████▍| 1251/1319 [00:27<00:01, 35.19it/s] 95%|█████████▌| 1255/1319 [00:28<00:02, 25.20it/s] 95%|█████████▌| 1259/1319 [00:28<00:02, 21.98it/s] 96%|█████████▌| 1262/1319 [00:28<00:02, 22.25it/s] 96%|█████████▌| 1265/1319 [00:28<00:03, 17.05it/s] 96%|█████████▋| 1270/1319 [00:28<00:02, 21.17it/s] 97%|█████████▋| 1273/1319 [00:28<00:02, 21.97it/s] 97%|█████████▋| 1276/1319 [00:29<00:02, 20.33it/s] 97%|█████████▋| 1279/1319 [00:29<00:01, 21.34it/s] 97%|█████████▋| 1282/1319 [00:29<00:02, 16.31it/s] 97%|█████████▋| 1284/1319 [00:29<00:02, 16.40it/s] 98%|█████████▊| 1290/1319 [00:29<00:01, 24.09it/s] 98%|█████████▊| 1293/1319 [00:30<00:01, 15.58it/s] 98%|█████████▊| 1296/1319 [00:30<00:01, 14.92it/s] 98%|█████████▊| 1298/1319 [00:30<00:01, 14.24it/s] 99%|█████████▊| 1300/1319 [00:30<00:01, 12.62it/s] 99%|█████████▊| 1302/1319 [00:31<00:02,  8.04it/s] 99%|█████████▉| 1304/1319 [00:31<00:01,  8.37it/s] 99%|█████████▉| 1306/1319 [00:31<00:01,  8.67it/s] 99%|█████████▉| 1308/1319 [00:32<00:01,  8.39it/s] 99%|█████████▉| 1310/1319 [00:32<00:00, 10.01it/s] 99%|█████████▉| 1312/1319 [00:33<00:01,  4.32it/s]100%|█████████▉| 1313/1319 [00:33<00:01,  4.11it/s]100%|█████████▉| 1315/1319 [00:33<00:00,  4.73it/s]100%|█████████▉| 1318/1319 [00:37<00:00,  1.76it/s]100%|██████████| 1319/1319 [00:40<00:00,  1.04s/it]100%|██████████| 1319/1319 [00:40<00:00, 32.53it/s]
Accuracy: 0.933
Invalid: 0.000
Latency: 41.499 s
Output throughput: 3261.739 token/s
Run 2 completed in 48 seconds
Run 2: Accuracy: 0.933
  ✓ Run 2 included in average (accuracy: 0.933)
[progress] [====================------------------------------] 2/5 (40%)  | GSM8K: Run 2

Checking server health before Run 3...
✅ Server is healthy
Executing GSM8K test Run 3 ...
  0%|          | 0/1319 [00:00<?, ?it/s]  0%|          | 1/1319 [00:10<4:01:36, 11.00s/it]  0%|          | 3/1319 [00:11<1:03:38,  2.90s/it]  0%|          | 5/1319 [00:11<33:56,  1.55s/it]    0%|          | 6/1319 [00:12<27:13,  1.24s/it]  1%|          | 9/1319 [00:12<13:09,  1.66it/s]  1%|▏         | 19/1319 [00:12<03:53,  5.57it/s]  2%|▏         | 24/1319 [00:12<02:45,  7.82it/s]  2%|▏         | 28/1319 [00:12<02:11,  9.83it/s]  3%|▎         | 36/1319 [00:12<01:22, 15.60it/s]  3%|▎         | 43/1319 [00:12<01:01, 20.75it/s]  4%|▍         | 52/1319 [00:13<00:44, 28.48it/s]  4%|▍         | 58/1319 [00:13<00:40, 31.52it/s]  5%|▍         | 65/1319 [00:13<00:34, 35.92it/s]  6%|▌         | 78/1319 [00:13<00:26, 47.11it/s]  7%|▋         | 89/1319 [00:13<00:20, 58.99it/s]  7%|▋         | 97/1319 [00:13<00:20, 58.40it/s]  8%|▊         | 104/1319 [00:13<00:21, 55.85it/s]  9%|▉         | 116/1319 [00:14<00:18, 64.13it/s] 10%|▉         | 131/1319 [00:14<00:15, 76.32it/s] 11%|█         | 140/1319 [00:14<00:16, 72.27it/s] 11%|█         | 148/1319 [00:14<00:17, 67.63it/s] 12%|█▏        | 160/1319 [00:14<00:15, 76.42it/s] 13%|█▎        | 170/1319 [00:14<00:14, 78.31it/s] 14%|█▎        | 179/1319 [00:14<00:14, 76.92it/s] 14%|█▍        | 188/1319 [00:14<00:14, 76.42it/s] 15%|█▌        | 200/1319 [00:15<00:13, 82.99it/s] 16%|█▌        | 214/1319 [00:15<00:11, 92.61it/s] 17%|█▋        | 226/1319 [00:15<00:11, 94.86it/s] 18%|█▊        | 236/1319 [00:15<00:11, 91.16it/s] 19%|█▊        | 246/1319 [00:15<00:12, 88.96it/s] 20%|█▉        | 261/1319 [00:15<00:10, 100.42it/s] 21%|██        | 272/1319 [00:15<00:10, 98.55it/s]  22%|██▏       | 289/1319 [00:15<00:09, 112.29it/s] 23%|██▎       | 308/1319 [00:15<00:07, 127.00it/s] 24%|██▍       | 321/1319 [00:16<00:08, 119.22it/s] 26%|██▌       | 338/1319 [00:16<00:07, 124.03it/s] 27%|██▋       | 354/1319 [00:16<00:07, 124.82it/s] 28%|██▊       | 369/1319 [00:16<00:07, 122.81it/s] 29%|██▉       | 382/1319 [00:16<00:08, 116.79it/s] 30%|███       | 399/1319 [00:16<00:07, 122.13it/s] 31%|███       | 412/1319 [00:16<00:07, 119.60it/s] 32%|███▏      | 424/1319 [00:16<00:07, 114.63it/s] 33%|███▎      | 438/1319 [00:17<00:07, 117.20it/s] 35%|███▍      | 460/1319 [00:17<00:06, 138.81it/s] 36%|███▌      | 475/1319 [00:17<00:06, 137.47it/s] 37%|███▋      | 490/1319 [00:17<00:06, 136.39it/s] 38%|███▊      | 504/1319 [00:17<00:10, 80.19it/s]  39%|███▊      | 511/1319 [00:17<00:12, 62.68it/s] 42%|████▏     | 559/1319 [00:17<00:06, 109.44it/s] 44%|████▍     | 579/1319 [00:18<00:06, 120.48it/s] 45%|████▌     | 594/1319 [00:18<00:05, 121.29it/s] 46%|████▌     | 609/1319 [00:18<00:05, 123.60it/s] 47%|████▋     | 624/1319 [00:18<00:05, 128.13it/s] 48%|████▊     | 638/1319 [00:18<00:05, 128.97it/s] 49%|████▉     | 652/1319 [00:18<00:05, 130.07it/s] 50%|█████     | 666/1319 [00:18<00:04, 130.98it/s] 52%|█████▏    | 680/1319 [00:18<00:04, 131.49it/s] 53%|█████▎    | 694/1319 [00:19<00:06, 103.86it/s] 54%|█████▍    | 709/1319 [00:19<00:05, 113.55it/s] 55%|█████▍    | 722/1319 [00:19<00:05, 115.27it/s] 56%|█████▌    | 735/1319 [00:19<00:05, 108.93it/s] 57%|█████▋    | 751/1319 [00:19<00:05, 100.21it/s] 58%|█████▊    | 762/1319 [00:19<00:05, 100.47it/s] 59%|█████▉    | 775/1319 [00:19<00:05, 106.22it/s] 60%|█████▉    | 787/1319 [00:19<00:04, 106.71it/s] 61%|██████    | 798/1319 [00:20<00:04, 105.41it/s] 61%|██████▏   | 809/1319 [00:20<00:04, 104.61it/s] 62%|██████▏   | 820/1319 [00:20<00:04, 103.61it/s] 63%|██████▎   | 832/1319 [00:20<00:04, 106.43it/s] 64%|██████▍   | 843/1319 [00:20<00:04, 105.46it/s] 65%|██████▌   | 859/1319 [00:20<00:03, 120.80it/s] 66%|██████▋   | 875/1319 [00:20<00:03, 131.88it/s] 68%|██████▊   | 893/1319 [00:20<00:03, 114.88it/s] 69%|██████▊   | 906/1319 [00:20<00:03, 118.48it/s] 70%|███████   | 929/1319 [00:21<00:03, 120.32it/s] 72%|███████▏  | 947/1319 [00:21<00:03, 111.85it/s] 73%|███████▎  | 962/1319 [00:21<00:03, 102.04it/s] 74%|███████▍  | 978/1319 [00:21<00:03, 97.50it/s]  76%|███████▌  | 996/1319 [00:21<00:03, 98.09it/s] 77%|███████▋  | 1013/1319 [00:22<00:03, 97.98it/s] 78%|███████▊  | 1023/1319 [00:22<00:03, 86.91it/s] 79%|███████▉  | 1039/1319 [00:22<00:03, 89.90it/s] 80%|███████▉  | 1053/1319 [00:22<00:03, 88.32it/s] 81%|████████  | 1065/1319 [00:22<00:03, 83.62it/s] 81%|████████▏ | 1074/1319 [00:22<00:03, 74.75it/s] 82%|████████▏ | 1082/1319 [00:23<00:03, 67.14it/s] 83%|████████▎ | 1093/1319 [00:23<00:03, 66.99it/s] 84%|████████▍ | 1106/1319 [00:23<00:03, 70.77it/s] 85%|████████▍ | 1115/1319 [00:23<00:03, 66.00it/s] 85%|████████▌ | 1122/1319 [00:23<00:03, 59.05it/s] 86%|████████▌ | 1131/1319 [00:23<00:03, 58.42it/s] 86%|████████▌ | 1137/1319 [00:24<00:03, 52.97it/s] 87%|████████▋ | 1145/1319 [00:24<00:03, 52.94it/s] 88%|████████▊ | 1164/1319 [00:24<00:02, 74.21it/s] 89%|████████▉ | 1173/1319 [00:24<00:02, 70.02it/s] 90%|████████▉ | 1181/1319 [00:24<00:02, 64.99it/s] 90%|█████████ | 1188/1319 [00:24<00:02, 59.62it/s] 91%|█████████ | 1196/1319 [00:24<00:02, 58.33it/s] 91%|█████████ | 1203/1319 [00:25<00:02, 55.36it/s] 92%|█████████▏| 1209/1319 [00:25<00:02, 44.93it/s] 92%|█████████▏| 1214/1319 [00:25<00:02, 42.48it/s] 92%|█████████▏| 1219/1319 [00:25<00:02, 40.63it/s] 93%|█████████▎| 1224/1319 [00:25<00:02, 34.50it/s] 94%|█████████▎| 1234/1319 [00:25<00:01, 44.63it/s] 94%|█████████▍| 1239/1319 [00:26<00:01, 42.79it/s] 94%|█████████▍| 1244/1319 [00:26<00:02, 32.63it/s] 95%|█████████▍| 1248/1319 [00:26<00:02, 23.96it/s] 95%|█████████▍| 1252/1319 [00:26<00:02, 25.55it/s] 95%|█████████▌| 1256/1319 [00:26<00:02, 24.37it/s] 95%|█████████▌| 1259/1319 [00:27<00:02, 24.35it/s] 96%|█████████▌| 1263/1319 [00:27<00:02, 26.26it/s] 96%|█████████▌| 1266/1319 [00:27<00:02, 25.79it/s] 96%|█████████▋| 1270/1319 [00:27<00:01, 27.67it/s] 97%|█████████▋| 1275/1319 [00:27<00:01, 27.92it/s] 97%|█████████▋| 1279/1319 [00:27<00:01, 29.60it/s] 97%|█████████▋| 1284/1319 [00:27<00:01, 33.26it/s] 98%|█████████▊| 1288/1319 [00:27<00:01, 29.78it/s] 98%|█████████▊| 1292/1319 [00:28<00:01, 24.87it/s] 98%|█████████▊| 1295/1319 [00:28<00:01, 20.67it/s] 98%|█████████▊| 1299/1319 [00:28<00:01, 19.75it/s] 99%|█████████▊| 1302/1319 [00:28<00:01, 16.40it/s] 99%|█████████▉| 1304/1319 [00:29<00:01, 13.41it/s] 99%|█████████▉| 1307/1319 [00:29<00:01,  9.29it/s] 99%|█████████▉| 1309/1319 [00:29<00:00, 10.48it/s] 99%|█████████▉| 1311/1319 [00:30<00:00, 11.02it/s]100%|█████████▉| 1313/1319 [00:30<00:00, 10.82it/s]100%|█████████▉| 1315/1319 [00:30<00:00, 10.70it/s]100%|█████████▉| 1317/1319 [00:31<00:00,  5.01it/s]100%|█████████▉| 1318/1319 [00:31<00:00,  4.17it/s]100%|██████████| 1319/1319 [00:31<00:00, 41.36it/s]
Accuracy: 0.931
Invalid: 0.000
Latency: 32.043 s
Output throughput: 4220.339 token/s
Run 3 completed in 37 seconds
Run 3: Accuracy: 0.931
  ✓ Run 3 included in average (accuracy: 0.931)
[progress] [==============================--------------------] 3/5 (60%)  | GSM8K: Run 3

Checking server health before Run 4...
✅ Server is healthy
Executing GSM8K test Run 4 ...
  0%|          | 0/1319 [00:00<?, ?it/s]  0%|          | 1/1319 [00:10<3:56:31, 10.77s/it]  0%|          | 2/1319 [00:10<1:39:04,  4.51s/it]  0%|          | 3/1319 [00:11<59:15,  2.70s/it]    0%|          | 5/1319 [00:11<27:21,  1.25s/it]  0%|          | 6/1319 [00:11<20:19,  1.08it/s]  1%|          | 9/1319 [00:11<09:37,  2.27it/s]  1%|▏         | 17/1319 [00:12<03:19,  6.51it/s]  2%|▏         | 21/1319 [00:12<02:28,  8.73it/s]  2%|▏         | 28/1319 [00:12<01:32, 13.92it/s]  3%|▎         | 34/1319 [00:12<01:09, 18.40it/s]  3%|▎         | 40/1319 [00:12<00:55, 22.89it/s]  4%|▎         | 49/1319 [00:12<00:40, 31.54it/s]  4%|▍         | 59/1319 [00:12<00:30, 40.82it/s]  5%|▌         | 69/1319 [00:13<00:25, 48.63it/s]  6%|▋         | 83/1319 [00:13<00:21, 57.88it/s]  7%|▋         | 92/1319 [00:13<00:19, 63.11it/s]  8%|▊         | 101/1319 [00:13<00:19, 63.07it/s]  9%|▊         | 113/1319 [00:13<00:17, 69.04it/s] 10%|▉         | 127/1319 [00:13<00:15, 77.54it/s] 11%|█         | 140/1319 [00:13<00:14, 81.48it/s] 11%|█▏        | 149/1319 [00:14<00:15, 75.90it/s] 12%|█▏        | 157/1319 [00:14<00:15, 73.34it/s] 13%|█▎        | 165/1319 [00:14<00:16, 71.25it/s] 13%|█▎        | 178/1319 [00:14<00:14, 81.18it/s] 14%|█▍        | 191/1319 [00:14<00:12, 88.39it/s] 16%|█▌        | 205/1319 [00:14<00:11, 96.13it/s] 16%|█▋        | 216/1319 [00:14<00:11, 94.40it/s] 17%|█▋        | 228/1319 [00:14<00:11, 96.20it/s] 18%|█▊        | 238/1319 [00:15<00:11, 92.71it/s] 19%|█▉        | 250/1319 [00:15<00:11, 95.07it/s] 20%|█▉        | 262/1319 [00:15<00:10, 96.83it/s] 21%|██        | 275/1319 [00:15<00:10, 100.58it/s] 22%|██▏       | 287/1319 [00:15<00:10, 100.74it/s] 23%|██▎       | 302/1319 [00:15<00:09, 108.24it/s] 24%|██▍       | 322/1319 [00:15<00:08, 123.28it/s] 26%|██▌       | 339/1319 [00:15<00:07, 126.56it/s] 27%|██▋       | 357/1319 [00:16<00:07, 131.05it/s] 28%|██▊       | 371/1319 [00:16<00:07, 124.31it/s] 29%|██▉       | 384/1319 [00:16<00:07, 117.57it/s] 30%|███       | 399/1319 [00:16<00:07, 118.19it/s] 32%|███▏      | 420/1319 [00:16<00:06, 136.56it/s] 33%|███▎      | 436/1319 [00:16<00:06, 137.30it/s] 34%|███▍      | 453/1319 [00:16<00:06, 140.38it/s] 35%|███▌      | 468/1319 [00:16<00:06, 138.06it/s] 37%|███▋      | 482/1319 [00:16<00:06, 133.70it/s] 38%|███▊      | 496/1319 [00:17<00:06, 131.67it/s] 39%|███▊      | 510/1319 [00:17<00:06, 130.86it/s] 40%|███▉      | 524/1319 [00:17<00:06, 129.06it/s] 41%|████      | 537/1319 [00:17<00:06, 126.36it/s] 42%|████▏     | 550/1319 [00:17<00:06, 123.50it/s] 43%|████▎     | 563/1319 [00:17<00:06, 120.51it/s] 44%|████▎     | 576/1319 [00:17<00:06, 119.08it/s] 45%|████▍     | 588/1319 [00:17<00:06, 115.05it/s] 45%|████▌     | 600/1319 [00:17<00:06, 112.13it/s] 47%|████▋     | 616/1319 [00:18<00:05, 120.65it/s] 48%|████▊     | 629/1319 [00:18<00:05, 118.29it/s] 49%|████▊     | 641/1319 [00:18<00:05, 114.88it/s] 50%|████▉     | 653/1319 [00:18<00:05, 115.06it/s] 50%|█████     | 666/1319 [00:18<00:05, 118.51it/s] 51%|█████▏    | 678/1319 [00:18<00:05, 117.60it/s] 52%|█████▏    | 690/1319 [00:18<00:05, 115.85it/s] 53%|█████▎    | 702/1319 [00:18<00:05, 114.54it/s] 54%|█████▍    | 715/1319 [00:18<00:05, 117.42it/s] 55%|█████▌    | 727/1319 [00:19<00:05, 115.87it/s] 56%|█████▌    | 739/1319 [00:19<00:05, 109.36it/s] 57%|█████▋    | 755/1319 [00:19<00:05, 98.13it/s]  58%|█████▊    | 766/1319 [00:19<00:05, 99.46it/s] 59%|█████▉    | 784/1319 [00:19<00:04, 117.67it/s] 60%|██████    | 797/1319 [00:19<00:04, 117.95it/s] 61%|██████▏   | 810/1319 [00:19<00:04, 119.35it/s] 62%|██████▏   | 823/1319 [00:19<00:04, 119.68it/s] 63%|██████▎   | 836/1319 [00:20<00:04, 120.04it/s] 64%|██████▍   | 849/1319 [00:20<00:04, 96.33it/s]  66%|██████▌   | 865/1319 [00:20<00:04, 111.47it/s] 67%|██████▋   | 883/1319 [00:20<00:03, 128.84it/s] 68%|██████▊   | 898/1319 [00:20<00:03, 108.05it/s] 70%|██████▉   | 917/1319 [00:20<00:03, 127.21it/s] 71%|███████▏  | 940/1319 [00:20<00:03, 125.63it/s] 73%|███████▎  | 960/1319 [00:21<00:03, 118.20it/s] 74%|███████▍  | 973/1319 [00:21<00:03, 101.36it/s] 75%|███████▌  | 991/1319 [00:21<00:03, 99.75it/s]  76%|███████▋  | 1009/1319 [00:21<00:03, 99.36it/s] 77%|███████▋  | 1021/1319 [00:21<00:03, 89.10it/s] 79%|███████▊  | 1037/1319 [00:22<00:03, 88.75it/s] 80%|███████▉  | 1051/1319 [00:22<00:03, 86.21it/s] 80%|████████  | 1061/1319 [00:22<00:03, 78.76it/s] 81%|████████▏ | 1074/1319 [00:22<00:03, 78.60it/s] 82%|████████▏ | 1087/1319 [00:22<00:02, 78.51it/s] 83%|████████▎ | 1101/1319 [00:22<00:02, 80.21it/s] 85%|████████▍ | 1117/1319 [00:23<00:02, 85.02it/s] 85%|████████▌ | 1126/1319 [00:23<00:02, 75.33it/s] 86%|████████▌ | 1134/1319 [00:23<00:03, 58.89it/s] 87%|████████▋ | 1141/1319 [00:23<00:03, 54.44it/s] 87%|████████▋ | 1147/1319 [00:23<00:03, 48.87it/s] 87%|████████▋ | 1153/1319 [00:23<00:03, 45.96it/s] 88%|████████▊ | 1164/1319 [00:24<00:02, 52.67it/s] 89%|████████▉ | 1177/1319 [00:24<00:02, 61.99it/s] 90%|████████▉ | 1186/1319 [00:24<00:02, 61.54it/s] 91%|█████████ | 1196/1319 [00:24<00:01, 63.31it/s] 91%|█████████ | 1203/1319 [00:24<00:01, 58.53it/s] 92%|█████████▏| 1209/1319 [00:24<00:02, 46.72it/s] 92%|█████████▏| 1214/1319 [00:25<00:02, 38.77it/s] 93%|█████████▎| 1223/1319 [00:25<00:02, 44.97it/s] 93%|█████████▎| 1228/1319 [00:25<00:02, 33.83it/s] 94%|█████████▎| 1235/1319 [00:25<00:02, 37.51it/s] 94%|█████████▍| 1240/1319 [00:25<00:02, 37.06it/s] 94%|█████████▍| 1245/1319 [00:25<00:02, 36.89it/s] 95%|█████████▍| 1249/1319 [00:26<00:02, 30.92it/s] 95%|█████████▍| 1253/1319 [00:26<00:02, 27.50it/s] 95%|█████████▌| 1256/1319 [00:26<00:02, 26.45it/s] 96%|█████████▌| 1260/1319 [00:26<00:02, 27.63it/s] 96%|█████████▌| 1263/1319 [00:26<00:02, 23.47it/s] 96%|█████████▌| 1266/1319 [00:26<00:02, 20.90it/s] 96%|█████████▌| 1269/1319 [00:27<00:02, 21.57it/s] 96%|█████████▋| 1272/1319 [00:27<00:02, 22.01it/s] 97%|█████████▋| 1276/1319 [00:27<00:01, 24.75it/s] 97%|█████████▋| 1279/1319 [00:27<00:02, 19.29it/s] 97%|█████████▋| 1283/1319 [00:27<00:01, 22.44it/s] 97%|█████████▋| 1286/1319 [00:27<00:01, 20.60it/s] 98%|█████████▊| 1289/1319 [00:28<00:01, 19.55it/s] 98%|█████████▊| 1292/1319 [00:28<00:01, 18.94it/s] 98%|█████████▊| 1294/1319 [00:28<00:01, 16.79it/s] 98%|█████████▊| 1296/1319 [00:28<00:01, 15.31it/s] 98%|█████████▊| 1299/1319 [00:28<00:01, 14.63it/s] 99%|█████████▊| 1301/1319 [00:29<00:01,  9.51it/s] 99%|█████████▉| 1303/1319 [00:29<00:01, 10.12it/s] 99%|█████████▉| 1305/1319 [00:29<00:01,  8.76it/s] 99%|█████████▉| 1307/1319 [00:29<00:01, 10.33it/s] 99%|█████████▉| 1309/1319 [00:30<00:00, 10.97it/s] 99%|█████████▉| 1311/1319 [00:30<00:00,  9.84it/s]100%|█████████▉| 1313/1319 [00:30<00:00,  6.88it/s]100%|█████████▉| 1314/1319 [00:31<00:01,  3.88it/s]100%|█████████▉| 1316/1319 [00:31<00:00,  5.07it/s]100%|█████████▉| 1317/1319 [00:31<00:00,  4.88it/s]100%|█████████▉| 1318/1319 [00:32<00:00,  2.76it/s]100%|██████████| 1319/1319 [00:39<00:00,  1.88s/it]100%|██████████| 1319/1319 [00:39<00:00, 33.18it/s]
Accuracy: 0.928
Invalid: 0.000
Latency: 39.902 s
Output throughput: 3360.746 token/s
Run 4 completed in 46 seconds
Run 4: Accuracy: 0.928
  ✓ Run 4 included in average (accuracy: 0.928)
[progress] [========================================----------] 4/5 (80%)  | GSM8K: Run 4

Checking server health before Run 5...
✅ Server is healthy
Executing GSM8K test Run 5 ...
  0%|          | 0/1319 [00:00<?, ?it/s]  0%|          | 1/1319 [00:08<3:17:18,  8.98s/it]  0%|          | 2/1319 [00:10<1:35:12,  4.34s/it]  0%|          | 3/1319 [00:10<54:25,  2.48s/it]    0%|          | 4/1319 [00:10<35:15,  1.61s/it]  0%|          | 5/1319 [00:10<23:36,  1.08s/it]  1%|          | 7/1319 [00:10<12:21,  1.77it/s]  1%|          | 16/1319 [00:11<03:07,  6.93it/s]  2%|▏         | 20/1319 [00:11<02:20,  9.24it/s]  2%|▏         | 25/1319 [00:11<01:41, 12.77it/s]  3%|▎         | 35/1319 [00:11<00:57, 22.17it/s]  3%|▎         | 44/1319 [00:11<00:42, 30.13it/s]  4%|▍         | 53/1319 [00:11<00:33, 37.55it/s]  5%|▍         | 60/1319 [00:11<00:30, 40.73it/s]  5%|▌         | 71/1319 [00:11<00:24, 50.60it/s]  7%|▋         | 86/1319 [00:12<00:19, 62.14it/s]  7%|▋         | 94/1319 [00:12<00:28, 43.26it/s]  9%|▉         | 122/1319 [00:12<00:16, 72.87it/s] 10%|█         | 138/1319 [00:12<00:14, 81.88it/s] 11%|█         | 148/1319 [00:12<00:14, 81.78it/s] 12%|█▏        | 158/1319 [00:13<00:14, 81.73it/s] 13%|█▎        | 167/1319 [00:13<00:14, 79.98it/s] 13%|█▎        | 176/1319 [00:13<00:14, 78.42it/s] 14%|█▍        | 185/1319 [00:13<00:14, 77.21it/s] 15%|█▍        | 195/1319 [00:13<00:14, 78.83it/s] 16%|█▌        | 207/1319 [00:13<00:13, 85.13it/s] 17%|█▋        | 219/1319 [00:13<00:12, 89.80it/s] 18%|█▊        | 231/1319 [00:13<00:11, 93.03it/s] 19%|█▊        | 246/1319 [00:14<00:10, 102.68it/s] 20%|█▉        | 262/1319 [00:14<00:09, 112.17it/s] 21%|██        | 274/1319 [00:14<00:09, 108.93it/s] 22%|██▏       | 285/1319 [00:14<00:09, 104.12it/s] 23%|██▎       | 297/1319 [00:14<00:10, 101.00it/s] 24%|██▍       | 317/1319 [00:14<00:08, 118.27it/s] 25%|██▌       | 335/1319 [00:14<00:07, 125.41it/s] 27%|██▋       | 354/1319 [00:14<00:07, 132.51it/s] 28%|██▊       | 370/1319 [00:15<00:07, 130.65it/s] 30%|██▉       | 390/1319 [00:15<00:06, 142.24it/s] 31%|███       | 405/1319 [00:15<00:06, 137.87it/s] 32%|███▏      | 419/1319 [00:15<00:06, 132.99it/s] 33%|███▎      | 433/1319 [00:15<00:06, 129.01it/s] 34%|███▍      | 446/1319 [00:15<00:07, 123.95it/s] 35%|███▍      | 459/1319 [00:15<00:07, 120.22it/s] 36%|███▌      | 472/1319 [00:15<00:07, 118.44it/s] 37%|███▋      | 484/1319 [00:15<00:07, 115.52it/s] 38%|███▊      | 496/1319 [00:16<00:07, 113.18it/s] 39%|███▊      | 508/1319 [00:16<00:07, 111.35it/s] 39%|███▉      | 520/1319 [00:16<00:07, 111.18it/s] 40%|████      | 532/1319 [00:16<00:07, 110.06it/s] 41%|████      | 543/1319 [00:16<00:07, 105.75it/s] 42%|████▏     | 554/1319 [00:16<00:07, 104.24it/s] 43%|████▎     | 567/1319 [00:16<00:06, 107.77it/s] 44%|████▍     | 579/1319 [00:16<00:06, 107.72it/s] 45%|████▍     | 593/1319 [00:16<00:06, 111.51it/s] 46%|████▌     | 607/1319 [00:17<00:06, 114.39it/s] 47%|████▋     | 619/1319 [00:17<00:06, 111.03it/s] 48%|████▊     | 634/1319 [00:17<00:05, 116.95it/s] 49%|████▉     | 646/1319 [00:17<00:05, 116.47it/s] 50%|████▉     | 658/1319 [00:17<00:05, 115.65it/s] 51%|█████     | 670/1319 [00:17<00:05, 115.39it/s] 52%|█████▏    | 682/1319 [00:17<00:05, 115.76it/s] 53%|█████▎    | 697/1319 [00:17<00:05, 123.88it/s] 54%|█████▍    | 710/1319 [00:17<00:04, 123.36it/s] 55%|█████▍    | 723/1319 [00:18<00:05, 115.01it/s] 57%|█████▋    | 746/1319 [00:18<00:04, 117.38it/s] 57%|█████▋    | 758/1319 [00:18<00:04, 115.15it/s] 58%|█████▊    | 771/1319 [00:18<00:04, 117.22it/s] 59%|█████▉    | 783/1319 [00:18<00:04, 114.58it/s] 60%|██████    | 795/1319 [00:18<00:04, 112.96it/s] 61%|██████    | 807/1319 [00:18<00:05, 87.75it/s]  62%|██████▏   | 820/1319 [00:18<00:05, 95.76it/s] 63%|██████▎   | 832/1319 [00:19<00:04, 99.70it/s] 65%|██████▍   | 852/1319 [00:19<00:03, 124.88it/s] 66%|██████▌   | 869/1319 [00:19<00:03, 136.77it/s] 67%|██████▋   | 884/1319 [00:19<00:03, 139.48it/s] 68%|██████▊   | 901/1319 [00:19<00:03, 117.48it/s] 70%|██████▉   | 919/1319 [00:19<00:03, 132.48it/s] 71%|███████   | 936/1319 [00:19<00:03, 115.56it/s] 72%|███████▏  | 949/1319 [00:20<00:03, 99.38it/s]  74%|███████▎  | 971/1319 [00:20<00:03, 105.99it/s] 75%|███████▌  | 993/1319 [00:20<00:02, 110.50it/s] 76%|███████▌  | 1005/1319 [00:20<00:03, 98.98it/s] 77%|███████▋  | 1019/1319 [00:20<00:03, 94.47it/s] 78%|███████▊  | 1030/1319 [00:20<00:03, 85.95it/s] 79%|███████▉  | 1042/1319 [00:21<00:03, 81.85it/s] 80%|███████▉  | 1054/1319 [00:21<00:03, 78.92it/s] 81%|████████  | 1064/1319 [00:21<00:03, 73.18it/s] 82%|████████▏ | 1080/1319 [00:21<00:02, 80.02it/s] 83%|████████▎ | 1098/1319 [00:21<00:02, 88.49it/s] 84%|████████▍ | 1109/1319 [00:21<00:02, 81.83it/s] 85%|████████▍ | 1118/1319 [00:22<00:03, 63.97it/s] 85%|████████▌ | 1125/1319 [00:22<00:03, 58.21it/s] 86%|████████▌ | 1132/1319 [00:22<00:03, 54.35it/s] 86%|████████▋ | 1138/1319 [00:22<00:03, 50.28it/s] 87%|████████▋ | 1150/1319 [00:22<00:02, 58.18it/s] 88%|████████▊ | 1162/1319 [00:22<00:02, 64.10it/s] 89%|████████▊ | 1169/1319 [00:23<00:02, 58.81it/s] 89%|████████▉ | 1177/1319 [00:23<00:02, 57.30it/s] 90%|████████▉ | 1184/1319 [00:23<00:02, 54.27it/s] 90%|█████████ | 1193/1319 [00:23<00:02, 56.15it/s] 91%|█████████ | 1199/1319 [00:23<00:02, 52.04it/s] 92%|█████████▏| 1208/1319 [00:23<00:02, 55.27it/s] 92%|█████████▏| 1214/1319 [00:24<00:02, 44.90it/s] 93%|█████████▎| 1221/1319 [00:24<00:02, 46.21it/s] 93%|█████████▎| 1226/1319 [00:24<00:02, 38.12it/s] 93%|█████████▎| 1231/1319 [00:24<00:02, 37.53it/s] 94%|█████████▎| 1236/1319 [00:24<00:02, 37.13it/s] 94%|█████████▍| 1240/1319 [00:24<00:02, 34.84it/s] 94%|█████████▍| 1246/1319 [00:24<00:01, 37.76it/s] 95%|█████████▍| 1252/1319 [00:25<00:01, 35.27it/s] 95%|█████████▌| 1256/1319 [00:25<00:01, 34.22it/s] 96%|█████████▌| 1260/1319 [00:25<00:01, 29.53it/s] 96%|█████████▌| 1264/1319 [00:25<00:01, 30.34it/s] 96%|█████████▋| 1270/1319 [00:25<00:01, 31.17it/s] 97%|█████████▋| 1274/1319 [00:25<00:01, 28.13it/s] 97%|█████████▋| 1277/1319 [00:26<00:01, 27.35it/s] 97%|█████████▋| 1280/1319 [00:26<00:02, 19.40it/s] 97%|█████████▋| 1283/1319 [00:26<00:01, 20.62it/s] 98%|█████████▊| 1287/1319 [00:26<00:01, 21.47it/s] 98%|█████████▊| 1292/1319 [00:26<00:01, 23.81it/s] 98%|█████████▊| 1295/1319 [00:27<00:01, 15.79it/s] 98%|█████████▊| 1298/1319 [00:27<00:01, 17.64it/s] 99%|█████████▊| 1301/1319 [00:27<00:01, 14.08it/s] 99%|█████████▉| 1303/1319 [00:27<00:01, 11.85it/s] 99%|█████████▉| 1305/1319 [00:28<00:01, 11.92it/s] 99%|█████████▉| 1307/1319 [00:28<00:01, 10.37it/s] 99%|█████████▉| 1309/1319 [00:28<00:01,  8.32it/s] 99%|█████████▉| 1311/1319 [00:29<00:01,  6.40it/s] 99%|█████████▉| 1312/1319 [00:30<00:01,  3.83it/s]100%|█████████▉| 1313/1319 [00:30<00:01,  4.33it/s]100%|█████████▉| 1315/1319 [00:30<00:00,  5.67it/s]100%|█████████▉| 1317/1319 [00:30<00:00,  5.53it/s]100%|█████████▉| 1318/1319 [00:30<00:00,  5.06it/s]100%|██████████| 1319/1319 [00:40<00:00,  2.24s/it]100%|██████████| 1319/1319 [00:40<00:00, 32.42it/s]
Accuracy: 0.934
Invalid: 0.000
Latency: 40.833 s
Output throughput: 3316.984 token/s
Run 5 completed in 46 seconds
Run 5: Accuracy: 0.934
  ✓ Run 5 included in average (accuracy: 0.934)
[progress] [==================================================] 5/5 (100%) ✅ Complete!
 | GSM8K: Run 5
GSM8K test completed in 277 seconds
Total runs: 5, Valid runs: 5, Excluded runs: 0
Average Accuracy over 5 valid runs: 0.931
Average accuracy meets threshold (0.93).
✅ GSM8K benchmark completed successfully.
GSM8K log saved to /mnt/raid/michael/sglang-ci/online/DeepSeek-V3-0324/v0.5.6-rocm700-mi30x-20251207_DeepSeek-V3-0324_FP8_online_dp_attention/sglang_client_log_DeepSeek-V3-0324_gsm8k.log
Server log saved to /mnt/raid/michael/sglang-ci/online/DeepSeek-V3-0324/v0.5.6-rocm700-mi30x-20251207_DeepSeek-V3-0324_FP8_online_dp_attention/sglang_server.log
✅ DP attention mode enabled - skipping serving benchmarks (GSM8K only mode)
Proceeding to cleanup...
✅ GSM8K benchmark completed in DP attention mode (serving benchmarks skipped).
GSM8K accuracy results written to /mnt/raid/michael/sglang-ci/online/DeepSeek-V3-0324/v0.5.6-rocm700-mi30x-20251207_DeepSeek-V3-0324_FP8_online_dp_attention/sglang_client_log_DeepSeek-V3-0324_gsm8k.log
Shutting down SGLang server...
Server shutdown completed in 0 seconds

==========================================
SCRIPT EXECUTION SUMMARY
==========================================
Script completed at: 2025-12-07 10:38:21 PST
Total execution time: 469 seconds (7 minutes)
Output directory: /mnt/raid/michael/sglang-ci/online/DeepSeek-V3-0324/v0.5.6-rocm700-mi30x-20251207_DeepSeek-V3-0324_FP8_online_dp_attention
Serving CSV: /mnt/raid/michael/sglang-ci/online/DeepSeek-V3-0324/v0.5.6-rocm700-mi30x-20251207_DeepSeek-V3-0324_FP8_online_dp_attention/v0.5.6-rocm700-mi30x-20251207_DeepSeek-V3-0324_FP8_serving_dp_attention.csv
Timing log: /mnt/raid/michael/sglang-ci/online/DeepSeek-V3-0324/v0.5.6-rocm700-mi30x-20251207_DeepSeek-V3-0324_FP8_online_dp_attention/timing_summary_20251207_103032.log
===========================================
Cleaning up...
Killing background SGLang server (PID: 45)...
Server process 45 not found or already terminated.
[nightly] === Online benchmark dispatched for DEEPSEEK; check logs in sgl-dev_v0.5.6-rocm700-mi30x-20251207 ===
[nightly] === Starting post-processing (CSV processing, plot generation, Teams notifications) ===
[nightly] Processing online CSV data and generating plots... Logs will be saved to /mnt/raid/michael/sglang-ci/online/DeepSeek-V3-0324/v0.5.6-rocm700-mi30x-20251207_DeepSeek-V3-0324_FP8_online/process_and_generate_online_plots.log
[nightly] Using plot date from image tag: 20251207
[nightly] Teams notifications skipped - --teams-webhook-url not provided
[nightly] === Online post-processing completed for DEEPSEEK ===
[nightly] ==========================================
[nightly] Completed benchmarks for image: rocm/sgl-dev:v0.5.6-rocm700-mi30x-20251207
[nightly] Stopping container sgl-dev_v0.5.6-rocm700-mi30x-20251207 to release resources...
[nightly] ==========================================
[nightly] ==========================================
[nightly] All benchmarks completed for 1 image(s)
[nightly] ==========================================
[nightly] Cleaning up process lock...
