[nightly] ==========================================
[nightly] SGL Nightly Benchmark Started
[nightly] ==========================================
[nightly] Command: scripts/perf_nightly.sh --model=deepseek --model-path=/data/models/deepseek-ai/DeepSeek-V3-0324 --mode=online --hardware=mi30x --teams-webhook-url=
[nightly] Start time: 2025-12-08 15:15:01 PST
[nightly] Machine: dell300x-pla-t12-38
[nightly] Working directory: /mnt/raid/michael/sglang-ci
[nightly] Script location: /mnt/raid/michael/sglang-ci/scripts/perf_nightly.sh
[nightly] Process ID: 585205
[nightly] ==========================================

[nightly] Runtime Environment:
[nightly] User: amd | Groups: amd adm cdrom... | Docker: /usr/bin/docker
[nightly] Testing Docker daemon access...
[nightly] Docker daemon accessible - proceeding...
[nightly] WARN: --teams-webhook-url was provided without a value - notifications disabled
[nightly] Custom model path provided: /data/models/deepseek-ai/DeepSeek-V3-0324
[nightly] Hardware: mi30x, ROCM Version: rocm700
[nightly] Model: deepseek, Mode(s): online
[nightly] Created process lock: /tmp/perf_nightly_deepseek.lock
[nightly] GPU is busy. Attempting to stop running Docker containers...
[nightly] No running containers to stop.
[nightly] Waiting 15s for GPU to become idle...
[nightly] WARN: GPU may still be busy, but proceeding as requested.
[nightly] Searching for non-SRT images for deepseek for the last 1 days...
[nightly] Searching for non-SRT mi30x image (rocm700) in 'rocm/sgl-dev' for date 20251208...
[nightly] Found candidate tag for day -0: v0.5.6-rocm700-mi30x-20251208
[nightly] Found local image: rocm/sgl-dev:v0.5.6-rocm700-mi30x-20251208
[nightly] Successfully obtained image for date 20251208: rocm/sgl-dev:v0.5.6-rocm700-mi30x-20251208
[nightly] Found 1 valid image(s) to run benchmarks on:
[nightly]   - rocm/sgl-dev:v0.5.6-rocm700-mi30x-20251208

[nightly] ==========================================
[nightly] Starting benchmarks for image: rocm/sgl-dev:v0.5.6-rocm700-mi30x-20251208
[nightly] ==========================================
[nightly] Checking GPU status before starting benchmarks for rocm/sgl-dev:v0.5.6-rocm700-mi30x-20251208...
[nightly] GPU is busy. Attempting to stop running Docker containers...
[nightly] No running containers to stop.
[nightly] Waiting 15s for GPU to become idle...
[nightly] WARN: GPU may still be busy, but proceeding as requested.
[nightly] INFO: Found 0/15 completed runs for rocm/sgl-dev:v0.5.6-rocm700-mi30x-20251208 (online). Proceeding with benchmarks.
[nightly] Using Docker image: rocm/sgl-dev:v0.5.6-rocm700-mi30x-20251208
[nightly] Container name: sgl-dev_v0.5.6-rocm700-mi30x-20251208
[nightly] Reusing container sgl-dev_v0.5.6-rocm700-mi30x-20251208
[nightly] === Starting benchmark execution ===
[nightly] === Starting nightly DEEPSEEK online benchmark ===
[nightly] Launching deepseek_perf_online_csv.sh inside sgl-dev_v0.5.6-rocm700-mi30x-20251208
[nightly] Passing --model-name='DeepSeek-V3-0324' to DeepSeek benchmark
✅ Parameter validation passed
[online] Script started at: 2025-12-08 15:15:32 PST
Scanning existing logs to check if all benchmarks are already complete...
Checking GSM8K log status...
Missing: GSM8K log file (/mnt/raid/michael/sglang-ci/online/DeepSeek-V3-0324/v0.5.6-rocm700-mi30x-20251208_DeepSeek-V3-0324_FP8_online/sglang_client_log_DeepSeek-V3-0324_gsm8k.log)
Checking serving benchmark logs...
Missing: Concurrency 128, Run 1
Missing: Concurrency 64, Run 1
Missing: Concurrency 16, Run 1
Missing: Concurrency 4, Run 1
Missing: Concurrency 1, Run 1
Scan complete: 5 total runs needed, 5 missing/incomplete
❌ Missing 5 serving benchmark runs.
❌ GSM8K benchmark is missing, empty, or incomplete.
Server startup required.
Clearing previous logs...
Starting SGLang server for online GSM8K benchmark...
[csv] Cleaning up stale aiter JIT lock files...
[csv] No stale aiter lock files found
[DEBUG] Using standard settings with environment variable: SGLANG_USE_AITER
Waiting for SGLang server (PID: 50) to start... (Max 15 minutes)
Server logs are being written to: /mnt/raid/michael/sglang-ci/online/DeepSeek-V3-0324/v0.5.6-rocm700-mi30x-20251208_DeepSeek-V3-0324_FP8_online/sglang_server.log
..................................
SGLang server started successfully after 171 seconds.
=== Online GSM8K Benchmark: TP=8, Questions=2000, Parallel=2000, Shots=5 ===
[progress] Total benchmark runs to execute: 10 (GSM8K: 5, Serving: 5) - standard mode
[progress] [--------------------------------------------------] 0/10 (0%) 
Starting GSM8K Online Benchmark...
Running 5 test iterations...
Executing GSM8K test Run 1 ...
Downloading from https://raw.githubusercontent.com/openai/grade-school-math/master/grade_school_math/data/test.jsonl to /tmp/test.jsonl
/tmp/test.jsonl:   0%|          | 0.00/237k [00:00<?, ?B/s]/tmp/test.jsonl: 732kB [00:00, 20.4MB/s]                   
  0%|          | 0/1319 [00:00<?, ?it/s]  0%|          | 1/1319 [00:22<8:17:25, 22.64s/it]  0%|          | 2/1319 [00:23<3:35:46,  9.83s/it]  0%|          | 3/1319 [00:24<2:02:57,  5.61s/it]  0%|          | 4/1319 [00:24<1:21:49,  3.73s/it]  0%|          | 6/1319 [00:25<39:39,  1.81s/it]    1%|          | 11/1319 [00:25<16:00,  1.36it/s]  1%|          | 14/1319 [00:28<17:13,  1.26it/s]  1%|▏         | 19/1319 [00:31<14:36,  1.48it/s]  2%|▏         | 28/1319 [00:32<07:33,  2.85it/s]  3%|▎         | 33/1319 [00:32<05:39,  3.79it/s]  3%|▎         | 37/1319 [00:33<05:36,  3.81it/s]  3%|▎         | 41/1319 [00:33<04:32,  4.70it/s]  4%|▍         | 54/1319 [00:34<02:38,  7.98it/s]  5%|▍         | 64/1319 [00:35<02:14,  9.34it/s]  5%|▌         | 70/1319 [00:35<01:57, 10.62it/s]  6%|▌         | 78/1319 [00:35<01:34, 13.11it/s]  7%|▋         | 88/1319 [00:38<02:55,  7.00it/s]  7%|▋         | 95/1319 [00:39<02:41,  7.58it/s]  8%|▊         | 102/1319 [00:39<02:11,  9.22it/s]  8%|▊         | 110/1319 [00:39<01:44, 11.57it/s]  9%|▉         | 119/1319 [00:40<01:22, 14.49it/s] 10%|▉         | 130/1319 [00:40<01:22, 14.35it/s] 10%|█         | 135/1319 [00:41<01:20, 14.68it/s] 11%|█         | 146/1319 [00:41<01:15, 15.54it/s] 12%|█▏        | 156/1319 [00:42<01:01, 18.80it/s] 12%|█▏        | 162/1319 [00:42<01:01, 18.96it/s] 13%|█▎        | 177/1319 [00:43<01:08, 16.64it/s] 14%|█▍        | 186/1319 [00:43<00:59, 18.93it/s] 15%|█▍        | 196/1319 [00:46<02:10,  8.62it/s] 15%|█▌        | 202/1319 [00:47<02:07,  8.75it/s] 16%|█▋        | 216/1319 [00:47<01:38, 11.24it/s] 17%|█▋        | 221/1319 [00:48<01:32, 11.85it/s] 18%|█▊        | 236/1319 [00:50<02:02,  8.83it/s] 19%|█▉        | 252/1319 [00:51<01:32, 11.60it/s] 20%|█▉        | 263/1319 [00:51<01:13, 14.29it/s] 21%|██        | 277/1319 [00:51<00:56, 18.57it/s] 22%|██▏       | 294/1319 [00:52<00:50, 20.21it/s] 23%|██▎       | 302/1319 [00:53<00:56, 18.01it/s] 24%|██▎       | 312/1319 [00:53<00:48, 20.75it/s] 24%|██▍       | 319/1319 [00:53<00:44, 22.29it/s] 25%|██▍       | 327/1319 [00:53<00:40, 24.68it/s] 26%|██▌       | 337/1319 [00:53<00:34, 28.58it/s] 27%|██▋       | 350/1319 [00:54<00:27, 35.13it/s] 27%|██▋       | 358/1319 [00:54<00:27, 35.13it/s] 28%|██▊       | 374/1319 [00:54<00:21, 44.49it/s] 29%|██▉       | 384/1319 [00:54<00:21, 44.41it/s] 30%|██▉       | 395/1319 [00:55<00:20, 45.78it/s] 31%|███       | 406/1319 [00:55<00:19, 47.04it/s] 31%|███▏      | 413/1319 [00:55<00:21, 42.46it/s] 32%|███▏      | 419/1319 [00:55<00:23, 37.74it/s] 33%|███▎      | 433/1319 [00:56<00:20, 42.68it/s] 34%|███▍      | 447/1319 [00:56<00:19, 45.81it/s] 35%|███▍      | 456/1319 [00:58<00:59, 14.50it/s] 36%|███▌      | 470/1319 [00:58<00:42, 19.97it/s] 36%|███▌      | 476/1319 [00:58<00:40, 20.86it/s] 37%|███▋      | 489/1319 [00:58<00:30, 27.25it/s] 38%|███▊      | 495/1319 [00:59<00:30, 27.18it/s] 38%|███▊      | 504/1319 [00:59<00:27, 30.13it/s] 39%|███▉      | 517/1319 [00:59<00:21, 36.98it/s] 40%|███▉      | 523/1319 [00:59<00:23, 34.53it/s] 40%|████      | 533/1319 [00:59<00:21, 37.30it/s] 41%|████      | 543/1319 [01:00<00:19, 39.45it/s] 42%|████▏     | 555/1319 [01:00<00:17, 43.36it/s] 43%|████▎     | 565/1319 [01:00<00:17, 42.04it/s] 43%|████▎     | 573/1319 [01:00<00:17, 42.30it/s] 44%|████▍     | 581/1319 [01:01<00:18, 40.73it/s] 45%|████▍     | 588/1319 [01:01<00:19, 37.84it/s] 46%|████▌     | 608/1319 [01:01<00:13, 53.82it/s] 47%|████▋     | 623/1319 [01:01<00:12, 57.80it/s] 48%|████▊     | 633/1319 [01:01<00:12, 54.25it/s] 49%|████▉     | 644/1319 [01:02<00:12, 52.68it/s] 50%|█████     | 660/1319 [01:02<00:11, 59.17it/s] 51%|█████     | 670/1319 [01:02<00:11, 55.16it/s] 51%|█████▏    | 677/1319 [01:02<00:13, 48.12it/s] 52%|█████▏    | 691/1319 [01:03<00:11, 52.64it/s] 54%|█████▎    | 707/1319 [01:03<00:10, 58.91it/s] 55%|█████▍    | 719/1319 [01:03<00:10, 57.63it/s] 55%|█████▌    | 729/1319 [01:03<00:10, 54.15it/s] 56%|█████▌    | 737/1319 [01:03<00:11, 48.81it/s] 57%|█████▋    | 748/1319 [01:04<00:11, 49.23it/s] 58%|█████▊    | 761/1319 [01:04<00:10, 52.27it/s] 59%|█████▉    | 778/1319 [01:04<00:08, 60.45it/s] 60%|█████▉    | 785/1319 [01:04<00:10, 51.88it/s] 60%|██████    | 795/1319 [01:04<00:10, 50.22it/s] 61%|██████    | 806/1319 [01:05<00:10, 50.13it/s] 63%|██████▎   | 833/1319 [01:05<00:06, 78.18it/s] 64%|██████▍   | 847/1319 [01:05<00:05, 81.89it/s] 65%|██████▍   | 857/1319 [01:05<00:05, 78.30it/s] 66%|██████▌   | 869/1319 [01:05<00:05, 78.16it/s] 67%|██████▋   | 879/1319 [01:05<00:05, 76.13it/s] 68%|██████▊   | 892/1319 [01:06<00:05, 82.46it/s] 68%|██████▊   | 903/1319 [01:06<00:05, 81.26it/s] 70%|███████   | 925/1319 [01:06<00:03, 104.04it/s] 72%|███████▏  | 950/1319 [01:06<00:02, 129.08it/s] 73%|███████▎  | 965/1319 [01:06<00:02, 122.86it/s] 74%|███████▍  | 979/1319 [01:06<00:02, 118.39it/s] 75%|███████▌  | 993/1319 [01:06<00:02, 117.32it/s] 76%|███████▋  | 1007/1319 [01:07<00:02, 115.68it/s] 77%|███████▋  | 1020/1319 [01:07<00:02, 109.21it/s] 78%|███████▊  | 1031/1319 [01:07<00:02, 108.08it/s] 79%|███████▉  | 1042/1319 [01:07<00:02, 104.40it/s] 80%|███████▉  | 1053/1319 [01:07<00:02, 102.47it/s] 81%|████████  | 1068/1319 [01:07<00:02, 110.44it/s] 82%|████████▏ | 1080/1319 [01:07<00:02, 108.45it/s] 83%|████████▎ | 1091/1319 [01:07<00:02, 106.48it/s] 84%|████████▎ | 1102/1319 [01:07<00:02, 90.20it/s]  85%|████████▍ | 1115/1319 [01:08<00:02, 98.40it/s] 85%|████████▌ | 1126/1319 [01:08<00:01, 97.77it/s] 86%|████████▌ | 1137/1319 [01:08<00:01, 99.85it/s] 87%|████████▋ | 1148/1319 [01:08<00:01, 87.81it/s] 88%|████████▊ | 1159/1319 [01:08<00:01, 92.63it/s] 89%|████████▊ | 1169/1319 [01:08<00:01, 82.26it/s] 89%|████████▉ | 1178/1319 [01:08<00:01, 75.30it/s] 90%|█████████ | 1189/1319 [01:09<00:01, 75.31it/s] 91%|█████████ | 1197/1319 [01:09<00:01, 68.80it/s] 92%|█████████▏| 1208/1319 [01:09<00:01, 71.81it/s] 92%|█████████▏| 1216/1319 [01:09<00:01, 67.07it/s] 93%|█████████▎| 1223/1319 [01:09<00:01, 61.99it/s] 93%|█████████▎| 1230/1319 [01:09<00:01, 58.72it/s] 94%|█████████▍| 1237/1319 [01:09<00:01, 57.28it/s] 94%|█████████▍| 1244/1319 [01:10<00:01, 55.85it/s] 95%|█████████▍| 1250/1319 [01:10<00:01, 52.79it/s] 95%|█████████▌| 1256/1319 [01:10<00:01, 46.79it/s] 96%|█████████▌| 1261/1319 [01:10<00:01, 44.95it/s] 96%|█████████▌| 1268/1319 [01:10<00:01, 48.14it/s] 97%|█████████▋| 1275/1319 [01:10<00:01, 43.10it/s] 97%|█████████▋| 1282/1319 [01:10<00:00, 47.49it/s] 98%|█████████▊| 1287/1319 [01:11<00:00, 34.70it/s] 98%|█████████▊| 1292/1319 [01:11<00:00, 27.77it/s] 98%|█████████▊| 1296/1319 [01:11<00:00, 26.62it/s] 99%|█████████▊| 1300/1319 [01:11<00:00, 23.61it/s] 99%|█████████▉| 1303/1319 [01:12<00:00, 21.32it/s] 99%|█████████▉| 1306/1319 [01:12<00:00, 19.07it/s] 99%|█████████▉| 1309/1319 [01:12<00:00, 17.68it/s] 99%|█████████▉| 1311/1319 [01:12<00:00, 14.85it/s]100%|█████████▉| 1315/1319 [01:12<00:00, 17.32it/s]100%|█████████▉| 1317/1319 [01:13<00:00, 14.97it/s]100%|██████████| 1319/1319 [01:13<00:00,  6.94it/s]100%|██████████| 1319/1319 [01:13<00:00, 17.85it/s]
Accuracy: 0.936
Invalid: 0.000
Latency: 117.178 s
Output throughput: 1155.186 token/s
Run 1 completed in 123 seconds
Run 1: Accuracy: 0.936
  ✓ Run 1 included in average (accuracy: 0.936)
[progress] [=====---------------------------------------------] 1/10 (10%)  | GSM8K: Run 1

Checking server health before Run 2...
✅ Server is healthy
Executing GSM8K test Run 2 ...
  0%|          | 0/1319 [00:00<?, ?it/s]  0%|          | 1/1319 [00:07<2:42:41,  7.41s/it]  0%|          | 2/1319 [00:08<1:18:11,  3.56s/it]  0%|          | 3/1319 [00:08<43:53,  2.00s/it]    0%|          | 4/1319 [00:08<30:35,  1.40s/it]  0%|          | 5/1319 [00:09<27:27,  1.25s/it]  0%|          | 6/1319 [00:10<19:12,  1.14it/s]  1%|          | 13/1319 [00:10<04:44,  4.59it/s]  1%|▏         | 17/1319 [00:10<03:31,  6.14it/s]  2%|▏         | 21/1319 [00:10<02:51,  7.58it/s]  2%|▏         | 29/1319 [00:11<02:17,  9.38it/s]  3%|▎         | 34/1319 [00:12<02:25,  8.80it/s]  3%|▎         | 38/1319 [00:12<02:13,  9.62it/s]  3%|▎         | 41/1319 [00:13<02:51,  7.46it/s]  4%|▍         | 53/1319 [00:13<01:38, 12.91it/s]  5%|▌         | 66/1319 [00:14<01:37, 12.85it/s]  6%|▌         | 80/1319 [00:15<01:18, 15.87it/s]  7%|▋         | 89/1319 [00:15<01:07, 18.22it/s]  7%|▋         | 96/1319 [00:15<01:03, 19.23it/s]  8%|▊         | 102/1319 [00:16<01:02, 19.42it/s]  8%|▊         | 106/1319 [00:16<01:07, 17.96it/s]  9%|▊         | 114/1319 [00:16<00:59, 20.13it/s] 10%|▉         | 127/1319 [00:16<00:45, 26.27it/s] 10%|█         | 135/1319 [00:17<00:59, 20.03it/s] 11%|█         | 146/1319 [00:17<00:49, 23.77it/s] 12%|█▏        | 154/1319 [00:18<00:47, 24.47it/s] 12%|█▏        | 160/1319 [00:18<00:49, 23.27it/s] 13%|█▎        | 174/1319 [00:19<00:50, 22.53it/s] 14%|█▎        | 181/1319 [00:19<01:03, 17.98it/s] 14%|█▍        | 190/1319 [00:20<00:55, 20.39it/s] 15%|█▍        | 197/1319 [00:20<01:07, 16.68it/s] 16%|█▌        | 210/1319 [00:21<01:01, 17.98it/s] 16%|█▋        | 216/1319 [00:21<01:00, 18.23it/s] 17%|█▋        | 230/1319 [00:21<00:44, 24.24it/s] 19%|█▉        | 248/1319 [00:22<00:43, 24.48it/s] 20%|█▉        | 260/1319 [00:23<00:38, 27.50it/s] 21%|██        | 275/1319 [00:23<00:40, 25.82it/s] 22%|██▏       | 290/1319 [00:23<00:33, 30.66it/s] 23%|██▎       | 300/1319 [00:24<00:32, 31.25it/s] 24%|██▎       | 311/1319 [00:24<00:30, 33.24it/s] 24%|██▍       | 319/1319 [00:24<00:27, 36.51it/s] 25%|██▍       | 327/1319 [00:24<00:25, 39.56it/s] 26%|██▌       | 343/1319 [00:25<00:20, 48.39it/s] 27%|██▋       | 351/1319 [00:25<00:21, 44.75it/s] 27%|██▋       | 359/1319 [00:25<00:22, 42.08it/s] 28%|██▊       | 370/1319 [00:25<00:21, 43.99it/s] 29%|██▉       | 385/1319 [00:25<00:18, 50.97it/s] 30%|██▉       | 393/1319 [00:26<00:19, 46.33it/s] 31%|███       | 404/1319 [00:26<00:19, 47.31it/s] 31%|███       | 411/1319 [00:26<00:21, 42.57it/s] 32%|███▏      | 417/1319 [00:26<00:23, 37.64it/s] 33%|███▎      | 432/1319 [00:27<00:19, 46.44it/s] 34%|███▍      | 446/1319 [00:27<00:16, 51.41it/s] 34%|███▍      | 455/1319 [00:27<00:18, 47.93it/s] 36%|███▌      | 470/1319 [00:27<00:14, 60.32it/s] 36%|███▋      | 479/1319 [00:27<00:15, 54.06it/s] 37%|███▋      | 486/1319 [00:28<00:17, 46.47it/s] 38%|███▊      | 499/1319 [00:28<00:16, 50.33it/s] 38%|███▊      | 507/1319 [00:28<00:17, 45.72it/s] 39%|███▉      | 520/1319 [00:28<00:16, 49.83it/s] 40%|████      | 528/1319 [00:29<00:17, 45.46it/s] 41%|████      | 539/1319 [00:29<00:16, 46.64it/s] 42%|████▏     | 553/1319 [00:29<00:14, 51.55it/s] 43%|████▎     | 566/1319 [00:29<00:13, 53.85it/s] 44%|████▎     | 576/1319 [00:29<00:15, 48.77it/s] 44%|████▍     | 584/1319 [00:31<00:50, 14.41it/s] 45%|████▌     | 595/1319 [00:32<00:39, 18.49it/s] 46%|████▌     | 601/1319 [00:32<00:38, 18.66it/s] 47%|████▋     | 617/1319 [00:32<00:25, 27.42it/s] 48%|████▊     | 627/1319 [00:32<00:22, 30.63it/s] 49%|████▉     | 644/1319 [00:32<00:16, 40.38it/s] 50%|████▉     | 656/1319 [00:33<00:15, 43.69it/s] 50%|█████     | 664/1319 [00:33<00:15, 42.08it/s] 51%|█████     | 671/1319 [00:33<00:16, 39.29it/s] 52%|█████▏    | 681/1319 [00:33<00:15, 40.86it/s] 53%|█████▎    | 697/1319 [00:34<00:12, 49.81it/s] 54%|█████▍    | 709/1319 [00:34<00:11, 51.02it/s] 55%|█████▍    | 720/1319 [00:34<00:11, 50.72it/s] 55%|█████▌    | 729/1319 [00:34<00:10, 53.69it/s] 56%|█████▌    | 735/1319 [00:34<00:12, 45.15it/s] 57%|█████▋    | 749/1319 [00:35<00:11, 51.20it/s] 57%|█████▋    | 756/1319 [00:35<00:12, 45.29it/s] 58%|█████▊    | 769/1319 [00:35<00:11, 49.78it/s] 59%|█████▉    | 777/1319 [00:35<00:11, 45.54it/s] 60%|█████▉    | 790/1319 [00:35<00:10, 49.88it/s] 61%|██████    | 800/1319 [00:36<00:10, 48.72it/s] 62%|██████▏   | 822/1319 [00:36<00:07, 69.00it/s] 63%|██████▎   | 837/1319 [00:36<00:06, 75.53it/s] 65%|██████▍   | 851/1319 [00:36<00:05, 80.48it/s] 66%|██████▌   | 867/1319 [00:36<00:05, 87.20it/s] 67%|██████▋   | 879/1319 [00:36<00:05, 86.74it/s] 68%|██████▊   | 892/1319 [00:37<00:04, 90.04it/s] 69%|██████▉   | 911/1319 [00:37<00:03, 103.64it/s] 70%|███████   | 928/1319 [00:37<00:03, 110.73it/s] 72%|███████▏  | 951/1319 [00:37<00:02, 128.80it/s] 73%|███████▎  | 965/1319 [00:37<00:02, 120.46it/s] 74%|███████▍  | 978/1319 [00:37<00:02, 114.60it/s] 75%|███████▌  | 990/1319 [00:37<00:03, 109.24it/s] 77%|███████▋  | 1011/1319 [00:38<00:02, 126.03it/s] 78%|███████▊  | 1024/1319 [00:38<00:02, 118.47it/s] 79%|███████▊  | 1036/1319 [00:38<00:02, 117.51it/s] 79%|███████▉  | 1048/1319 [00:38<00:02, 114.62it/s] 80%|████████  | 1060/1319 [00:38<00:02, 111.06it/s] 82%|████████▏ | 1076/1319 [00:38<00:02, 119.38it/s] 82%|████████▏ | 1088/1319 [00:38<00:02, 113.97it/s] 83%|████████▎ | 1100/1319 [00:38<00:02, 87.28it/s]  84%|████████▍ | 1111/1319 [00:39<00:02, 90.81it/s] 85%|████████▍ | 1121/1319 [00:39<00:02, 90.95it/s] 86%|████████▌ | 1131/1319 [00:39<00:02, 92.04it/s] 87%|████████▋ | 1141/1319 [00:39<00:01, 92.48it/s] 87%|████████▋ | 1151/1319 [00:39<00:02, 80.54it/s] 88%|████████▊ | 1161/1319 [00:39<00:01, 85.31it/s] 89%|████████▊ | 1170/1319 [00:39<00:01, 75.02it/s] 89%|████████▉ | 1178/1319 [00:39<00:02, 68.12it/s] 90%|████████▉ | 1187/1319 [00:40<00:01, 66.33it/s] 91%|█████████ | 1196/1319 [00:40<00:01, 64.91it/s] 91%|█████████ | 1203/1319 [00:40<00:01, 59.89it/s] 92%|█████████▏| 1212/1319 [00:40<00:01, 61.47it/s] 92%|█████████▏| 1219/1319 [00:40<00:01, 52.56it/s] 93%|█████████▎| 1229/1319 [00:40<00:01, 58.03it/s] 94%|█████████▎| 1236/1319 [00:40<00:01, 56.83it/s] 95%|█████████▍| 1247/1319 [00:41<00:01, 64.08it/s] 95%|█████████▌| 1254/1319 [00:41<00:01, 61.63it/s] 96%|█████████▌| 1261/1319 [00:41<00:01, 54.69it/s] 96%|█████████▌| 1267/1319 [00:41<00:01, 41.79it/s] 97%|█████████▋| 1273/1319 [00:41<00:01, 43.76it/s] 97%|█████████▋| 1278/1319 [00:41<00:00, 43.49it/s] 97%|█████████▋| 1283/1319 [00:42<00:01, 27.48it/s] 98%|█████████▊| 1287/1319 [00:42<00:01, 22.20it/s] 98%|█████████▊| 1290/1319 [00:42<00:01, 23.15it/s] 98%|█████████▊| 1296/1319 [00:42<00:00, 28.04it/s] 99%|█████████▊| 1300/1319 [00:42<00:00, 28.68it/s] 99%|█████████▉| 1304/1319 [00:43<00:00, 21.28it/s] 99%|█████████▉| 1307/1319 [00:43<00:00, 18.33it/s] 99%|█████████▉| 1310/1319 [00:43<00:00, 16.72it/s] 99%|█████████▉| 1312/1319 [00:44<00:00, 11.59it/s]100%|█████████▉| 1314/1319 [00:44<00:00, 11.76it/s]100%|█████████▉| 1316/1319 [00:44<00:00,  8.79it/s]100%|█████████▉| 1318/1319 [00:45<00:00,  7.02it/s]100%|██████████| 1319/1319 [00:45<00:00, 29.18it/s]
Accuracy: 0.929
Invalid: 0.000
Latency: 84.037 s
Output throughput: 1615.328 token/s
Run 2 completed in 89 seconds
Run 2: Accuracy: 0.929
  ✓ Run 2 included in average (accuracy: 0.929)
[progress] [==========----------------------------------------] 2/10 (20%)  | GSM8K: Run 2

Checking server health before Run 3...
✅ Server is healthy
Executing GSM8K test Run 3 ...
  0%|          | 0/1319 [00:00<?, ?it/s]  0%|          | 1/1319 [00:07<2:44:12,  7.48s/it]  0%|          | 2/1319 [00:08<1:18:46,  3.59s/it]  0%|          | 3/1319 [00:08<44:12,  2.02s/it]    0%|          | 4/1319 [00:08<30:45,  1.40s/it]  0%|          | 5/1319 [00:09<27:32,  1.26s/it]  0%|          | 6/1319 [00:10<19:14,  1.14it/s]  1%|          | 10/1319 [00:10<07:07,  3.06it/s]  1%|          | 16/1319 [00:10<04:18,  5.04it/s]  2%|▏         | 22/1319 [00:11<02:50,  7.62it/s]  2%|▏         | 31/1319 [00:11<01:46, 12.07it/s]  3%|▎         | 36/1319 [00:11<01:38, 13.08it/s]  3%|▎         | 40/1319 [00:12<01:37, 13.17it/s]  3%|▎         | 42/1319 [00:12<01:51, 11.45it/s]  4%|▍         | 53/1319 [00:12<01:09, 18.19it/s]  5%|▍         | 63/1319 [00:13<00:59, 21.09it/s]  5%|▌         | 68/1319 [00:13<01:00, 20.75it/s]  6%|▌         | 75/1319 [00:13<00:58, 21.45it/s]  6%|▋         | 84/1319 [00:14<01:08, 17.95it/s]  7%|▋         | 89/1319 [00:14<01:12, 17.01it/s]  7%|▋         | 89/1319 [00:14<01:12, 17.01it/s]  7%|▋         | 92/1319 [00:14<01:18, 15.60it/s]  8%|▊         | 102/1319 [00:14<01:02, 19.40it/s]  8%|▊         | 108/1319 [00:15<01:02, 19.51it/s]  9%|▉         | 116/1319 [00:15<00:56, 21.23it/s]  9%|▉         | 125/1319 [00:15<00:50, 23.48it/s] 10%|█         | 134/1319 [00:16<00:46, 25.23it/s] 11%|█         | 143/1319 [00:16<00:44, 26.49it/s] 11%|█▏        | 151/1319 [00:16<00:44, 26.45it/s] 12%|█▏        | 159/1319 [00:17<00:43, 26.40it/s] 13%|█▎        | 170/1319 [00:17<00:39, 29.31it/s] 14%|█▎        | 181/1319 [00:17<00:48, 23.50it/s] 14%|█▍        | 188/1319 [00:17<00:53, 21.20it/s] 14%|█▍        | 189/1319 [00:17<00:53, 21.20it/s] 14%|█▍        | 189/1319 [00:17<00:53, 21.20it/s] 15%|█▍        | 192/1319 [00:18<00:58, 19.12it/s] 15%|█▌        | 202/1319 [00:18<00:50, 22.02it/s] 16%|█▌        | 213/1319 [00:18<00:43, 25.36it/s] 16%|█▋        | 217/1319 [00:19<00:49, 22.27it/s] 17%|█▋        | 229/1319 [00:19<00:52, 20.68it/s] 18%|█▊        | 243/1319 [00:20<00:51, 21.01it/s] 20%|█▉        | 260/1319 [00:21<00:46, 22.93it/s] 21%|██        | 271/1319 [00:21<00:41, 25.43it/s] 21%|██▏       | 282/1319 [00:21<00:37, 27.73it/s] 22%|██▏       | 294/1319 [00:22<00:33, 30.50it/s] 23%|██▎       | 303/1319 [00:22<00:33, 30.34it/s] 24%|██▎       | 311/1319 [00:22<00:33, 29.99it/s] 24%|██▍       | 318/1319 [00:22<00:33, 30.25it/s] 25%|██▍       | 328/1319 [00:23<00:29, 33.53it/s] 26%|██▌       | 342/1319 [00:23<00:23, 41.03it/s] 27%|██▋       | 352/1319 [00:23<00:23, 41.69it/s] 28%|██▊       | 366/1319 [00:23<00:20, 47.49it/s] 29%|██▊       | 378/1319 [00:23<00:19, 49.26it/s] 29%|██▉       | 387/1319 [00:24<00:20, 46.52it/s] 30%|███       | 398/1319 [00:24<00:19, 47.46it/s] 31%|███       | 404/1319 [00:24<00:19, 46.23it/s] 31%|███       | 412/1319 [00:24<00:21, 42.51it/s] 32%|███▏      | 426/1319 [00:25<00:18, 48.56it/s] 33%|███▎      | 441/1319 [00:25<00:16, 54.35it/s] 34%|███▍      | 454/1319 [00:25<00:15, 55.35it/s] 35%|███▌      | 468/1319 [00:25<00:14, 57.91it/s] 36%|███▌      | 475/1319 [00:25<00:16, 49.66it/s] 37%|███▋      | 486/1319 [00:26<00:15, 55.29it/s] 38%|███▊      | 500/1319 [00:26<00:14, 58.21it/s] 39%|███▊      | 511/1319 [00:26<00:14, 55.30it/s] 39%|███▉      | 520/1319 [00:26<00:14, 56.97it/s] 40%|████      | 531/1319 [00:26<00:14, 54.92it/s] 41%|████      | 537/1319 [00:27<00:17, 45.59it/s] 42%|████▏     | 551/1319 [00:27<00:15, 51.19it/s] 43%|████▎     | 562/1319 [00:27<00:14, 50.97it/s] 43%|████▎     | 568/1319 [00:27<00:18, 41.06it/s] 44%|████▍     | 581/1319 [00:27<00:13, 54.99it/s] 45%|████▍     | 589/1319 [00:28<00:14, 48.69it/s] 45%|████▌     | 595/1319 [00:28<00:15, 46.89it/s] 46%|████▌     | 610/1319 [00:28<00:13, 54.10it/s] 47%|████▋     | 622/1319 [00:28<00:12, 54.51it/s] 48%|████▊     | 632/1319 [00:28<00:13, 51.70it/s] 49%|████▉     | 644/1319 [00:29<00:11, 59.09it/s] 50%|████▉     | 657/1319 [00:29<00:11, 58.97it/s] 51%|█████     | 675/1319 [00:29<00:09, 67.13it/s] 52%|█████▏    | 683/1319 [00:29<00:11, 57.04it/s] 53%|█████▎    | 695/1319 [00:29<00:10, 56.79it/s] 53%|█████▎    | 701/1319 [00:30<00:13, 47.28it/s] 54%|█████▍    | 710/1319 [00:30<00:13, 45.45it/s] 55%|█████▍    | 720/1319 [00:30<00:11, 51.40it/s] 55%|█████▌    | 726/1319 [00:30<00:13, 43.13it/s] 56%|█████▌    | 738/1319 [00:30<00:12, 46.99it/s] 57%|█████▋    | 750/1319 [00:31<00:11, 49.48it/s] 58%|█████▊    | 762/1319 [00:31<00:10, 51.28it/s] 59%|█████▉    | 777/1319 [00:31<00:08, 64.04it/s] 60%|█████▉    | 786/1319 [00:31<00:09, 56.67it/s] 60%|██████    | 795/1319 [00:31<00:08, 58.40it/s] 63%|██████▎   | 825/1319 [00:32<00:05, 91.59it/s] 64%|██████▍   | 845/1319 [00:32<00:04, 103.22it/s] 65%|██████▍   | 856/1319 [00:32<00:04, 94.48it/s]  66%|██████▌   | 872/1319 [00:32<00:04, 97.64it/s] 67%|██████▋   | 888/1319 [00:32<00:04, 104.50it/s] 68%|██████▊   | 899/1319 [00:32<00:04, 97.21it/s]  70%|███████   | 925/1319 [00:32<00:03, 123.44it/s] 71%|███████▏  | 941/1319 [00:33<00:03, 122.76it/s] 73%|███████▎  | 959/1319 [00:33<00:02, 125.14it/s] 74%|███████▎  | 972/1319 [00:33<00:03, 115.56it/s] 75%|███████▍  | 984/1319 [00:33<00:03, 110.49it/s] 76%|███████▌  | 999/1319 [00:33<00:02, 113.56it/s] 77%|███████▋  | 1013/1319 [00:33<00:02, 112.27it/s] 78%|███████▊  | 1026/1319 [00:33<00:02, 108.26it/s] 79%|███████▉  | 1042/1319 [00:33<00:02, 119.71it/s] 80%|███████▉  | 1055/1319 [00:34<00:02, 117.94it/s] 81%|████████  | 1067/1319 [00:34<00:02, 98.22it/s]  82%|████████▏ | 1078/1319 [00:34<00:02, 97.39it/s] 83%|████████▎ | 1089/1319 [00:34<00:02, 86.06it/s] 83%|████████▎ | 1099/1319 [00:34<00:02, 86.31it/s] 84%|████████▍ | 1108/1319 [00:34<00:02, 85.32it/s] 85%|████████▍ | 1117/1319 [00:34<00:02, 74.17it/s] 85%|████████▌ | 1127/1319 [00:34<00:02, 79.01it/s] 86%|████████▌ | 1136/1319 [00:35<00:02, 79.75it/s] 87%|████████▋ | 1145/1319 [00:35<00:02, 80.77it/s] 87%|████████▋ | 1154/1319 [00:35<00:02, 71.99it/s] 88%|████████▊ | 1162/1319 [00:35<00:02, 73.36it/s] 89%|████████▊ | 1170/1319 [00:35<00:02, 64.83it/s] 90%|████████▉ | 1183/1319 [00:35<00:01, 72.44it/s] 90%|█████████ | 1191/1319 [00:35<00:01, 66.43it/s] 91%|█████████ | 1201/1319 [00:36<00:01, 67.21it/s] 92%|█████████▏| 1212/1319 [00:36<00:01, 70.20it/s] 93%|█████████▎| 1222/1319 [00:36<00:01, 70.40it/s] 93%|█████████▎| 1230/1319 [00:36<00:01, 66.72it/s] 94%|█████████▍| 1237/1319 [00:36<00:01, 57.12it/s] 95%|█████████▍| 1248/1319 [00:36<00:01, 64.04it/s] 95%|█████████▌| 1255/1319 [00:37<00:01, 48.37it/s] 96%|█████████▌| 1261/1319 [00:37<00:01, 48.05it/s] 96%|█████████▌| 1267/1319 [00:37<00:01, 47.97it/s] 97%|█████████▋| 1273/1319 [00:37<00:01, 44.71it/s] 97%|█████████▋| 1279/1319 [00:37<00:00, 46.44it/s] 97%|█████████▋| 1284/1319 [00:37<00:01, 28.58it/s] 98%|█████████▊| 1288/1319 [00:38<00:01, 26.76it/s] 98%|█████████▊| 1292/1319 [00:38<00:01, 18.78it/s] 98%|█████████▊| 1297/1319 [00:38<00:00, 22.07it/s] 99%|█████████▊| 1300/1319 [00:38<00:00, 20.19it/s] 99%|█████████▉| 1303/1319 [00:39<00:00, 18.05it/s] 99%|█████████▉| 1306/1319 [00:39<00:00, 16.20it/s] 99%|█████████▉| 1309/1319 [00:39<00:00, 17.89it/s] 99%|█████████▉| 1312/1319 [00:39<00:00, 18.67it/s]100%|█████████▉| 1315/1319 [00:39<00:00, 17.11it/s]100%|█████████▉| 1317/1319 [00:40<00:00,  9.26it/s]100%|██████████| 1319/1319 [00:41<00:00,  6.62it/s]100%|██████████| 1319/1319 [00:41<00:00, 32.12it/s]
Accuracy: 0.932
Invalid: 0.000
Latency: 41.240 s
Output throughput: 3298.242 token/s
Run 3 completed in 46 seconds
Run 3: Accuracy: 0.932
  ✓ Run 3 included in average (accuracy: 0.932)
[progress] [===============-----------------------------------] 3/10 (30%)  | GSM8K: Run 3

Checking server health before Run 4...
✅ Server is healthy
Executing GSM8K test Run 4 ...
  0%|          | 0/1319 [00:00<?, ?it/s]  0%|          | 1/1319 [00:06<2:31:12,  6.88s/it]  0%|          | 2/1319 [00:07<1:11:28,  3.26s/it]  0%|          | 3/1319 [00:08<47:25,  2.16s/it]    0%|          | 4/1319 [00:09<33:40,  1.54s/it]  0%|          | 5/1319 [00:09<28:20,  1.29s/it]  1%|          | 7/1319 [00:10<14:43,  1.48it/s]  1%|          | 11/1319 [00:10<06:32,  3.33it/s]  1%|          | 15/1319 [00:10<04:16,  5.08it/s]  1%|▏         | 19/1319 [00:10<03:13,  6.71it/s]  2%|▏         | 28/1319 [00:11<01:48, 11.87it/s]  2%|▏         | 32/1319 [00:11<01:45, 12.21it/s]  3%|▎         | 35/1319 [00:11<01:50, 11.63it/s]  3%|▎         | 41/1319 [00:12<01:32, 13.78it/s]  4%|▍         | 57/1319 [00:12<01:07, 18.81it/s]  5%|▌         | 67/1319 [00:13<01:14, 16.91it/s]  5%|▌         | 71/1319 [00:13<01:14, 16.75it/s]  6%|▌         | 79/1319 [00:14<01:21, 15.14it/s]  7%|▋         | 86/1319 [00:14<01:13, 16.75it/s]  7%|▋         | 96/1319 [00:14<00:59, 20.47it/s]  8%|▊         | 104/1319 [00:15<00:55, 21.93it/s]  8%|▊         | 111/1319 [00:15<00:54, 22.23it/s]  9%|▉         | 119/1319 [00:15<00:51, 23.29it/s] 10%|▉         | 131/1319 [00:16<00:55, 21.23it/s] 10%|█         | 138/1319 [00:16<00:54, 21.68it/s] 11%|█         | 145/1319 [00:17<00:53, 22.04it/s] 12%|█▏        | 156/1319 [00:17<00:45, 25.82it/s] 13%|█▎        | 165/1319 [00:17<00:43, 26.79it/s] 13%|█▎        | 178/1319 [00:18<00:47, 23.95it/s] 14%|█▍        | 182/1319 [00:18<00:53, 21.25it/s] 15%|█▍        | 194/1319 [00:18<00:43, 25.86it/s] 16%|█▌        | 207/1319 [00:19<00:36, 30.28it/s] 17%|█▋        | 221/1319 [00:19<00:41, 26.64it/s] 18%|█▊        | 231/1319 [00:20<00:40, 26.89it/s] 19%|█▊        | 245/1319 [00:20<00:34, 31.43it/s] 20%|█▉        | 262/1319 [00:20<00:28, 37.74it/s] 21%|██        | 274/1319 [00:21<00:27, 38.21it/s] 21%|██▏       | 282/1319 [00:21<00:29, 34.80it/s] 22%|██▏       | 296/1319 [00:21<00:26, 38.01it/s] 23%|██▎       | 308/1319 [00:21<00:25, 39.33it/s] 24%|██▍       | 318/1319 [00:22<00:22, 44.37it/s] 25%|██▍       | 324/1319 [00:22<00:25, 39.49it/s] 25%|██▌       | 334/1319 [00:22<00:24, 40.79it/s] 26%|██▌       | 344/1319 [00:22<00:23, 41.74it/s] 27%|██▋       | 357/1319 [00:23<00:20, 46.32it/s] 28%|██▊       | 366/1319 [00:23<00:19, 49.41it/s] 29%|██▉       | 381/1319 [00:23<00:17, 55.00it/s] 30%|██▉       | 392/1319 [00:23<00:17, 53.37it/s] 30%|███       | 399/1319 [00:23<00:19, 46.61it/s] 31%|███       | 406/1319 [00:24<00:19, 46.80it/s] 31%|███       | 412/1319 [00:24<00:19, 45.43it/s] 32%|███▏      | 421/1319 [00:24<00:20, 43.48it/s] 33%|███▎      | 435/1319 [00:24<00:17, 49.67it/s] 34%|███▍      | 448/1319 [00:24<00:16, 52.62it/s] 35%|███▍      | 457/1319 [00:25<00:17, 48.53it/s] 36%|███▌      | 473/1319 [00:25<00:15, 56.35it/s] 36%|███▋      | 479/1319 [00:25<00:17, 46.81it/s] 37%|███▋      | 486/1319 [00:25<00:17, 47.26it/s] 38%|███▊      | 496/1319 [00:25<00:17, 46.51it/s] 39%|███▊      | 509/1319 [00:26<00:16, 50.48it/s] 39%|███▉      | 518/1319 [00:26<00:16, 47.61it/s] 40%|███▉      | 526/1319 [00:26<00:18, 43.94it/s] 40%|████      | 532/1319 [00:27<00:35, 22.27it/s] 41%|████▏     | 547/1319 [00:27<00:24, 31.29it/s] 43%|████▎     | 561/1319 [00:27<00:19, 38.49it/s] 43%|████▎     | 568/1319 [00:27<00:19, 38.26it/s] 44%|████▎     | 576/1319 [00:28<00:17, 43.63it/s] 44%|████▍     | 586/1319 [00:28<00:16, 44.09it/s] 45%|████▌     | 594/1319 [00:28<00:17, 41.12it/s] 46%|████▌     | 610/1319 [00:28<00:12, 56.51it/s] 47%|████▋     | 620/1319 [00:28<00:13, 52.68it/s] 48%|████▊     | 634/1319 [00:29<00:12, 55.79it/s] 49%|████▉     | 648/1319 [00:29<00:11, 58.26it/s] 50%|████▉     | 657/1319 [00:29<00:11, 59.08it/s] 51%|█████     | 672/1319 [00:29<00:10, 62.48it/s] 51%|█████▏    | 679/1319 [00:29<00:12, 52.39it/s] 52%|█████▏    | 691/1319 [00:30<00:10, 59.53it/s] 53%|█████▎    | 704/1319 [00:30<00:10, 59.72it/s] 54%|█████▍    | 711/1319 [00:30<00:10, 57.31it/s] 54%|█████▍    | 718/1319 [00:30<00:12, 48.55it/s] 55%|█████▌    | 728/1319 [00:33<00:53, 11.01it/s] 56%|█████▌    | 740/1319 [00:33<00:37, 15.30it/s] 57%|█████▋    | 753/1319 [00:33<00:27, 20.67it/s] 58%|█████▊    | 768/1319 [00:33<00:19, 27.82it/s] 59%|█████▉    | 783/1319 [00:33<00:15, 34.94it/s] 60%|██████    | 794/1319 [00:34<00:13, 38.04it/s] 61%|██████    | 805/1319 [00:34<00:12, 40.80it/s] 63%|██████▎   | 827/1319 [00:34<00:08, 58.41it/s] 64%|██████▎   | 839/1319 [00:34<00:07, 62.48it/s] 65%|██████▍   | 854/1319 [00:34<00:06, 70.92it/s] 66%|██████▌   | 871/1319 [00:34<00:05, 81.14it/s] 67%|██████▋   | 883/1319 [00:35<00:05, 81.66it/s] 68%|██████▊   | 903/1319 [00:35<00:04, 98.45it/s] 70%|██████▉   | 921/1319 [00:35<00:03, 107.91it/s] 71%|███████   | 933/1319 [00:35<00:03, 103.46it/s] 72%|███████▏  | 955/1319 [00:35<00:03, 121.20it/s] 74%|███████▎  | 972/1319 [00:35<00:02, 121.34it/s] 75%|███████▍  | 986/1319 [00:35<00:02, 119.49it/s] 76%|███████▌  | 999/1319 [00:36<00:02, 114.96it/s] 77%|███████▋  | 1011/1319 [00:36<00:02, 108.29it/s] 78%|███████▊  | 1029/1319 [00:36<00:02, 117.82it/s] 79%|███████▉  | 1041/1319 [00:36<00:02, 116.17it/s] 80%|███████▉  | 1053/1319 [00:36<00:02, 113.69it/s] 81%|████████  | 1065/1319 [00:36<00:02, 108.74it/s] 82%|████████▏ | 1079/1319 [00:36<00:02, 113.03it/s] 83%|████████▎ | 1092/1319 [00:36<00:01, 113.91it/s] 84%|████████▎ | 1104/1319 [00:37<00:02, 97.97it/s]  85%|████████▍ | 1115/1319 [00:37<00:02, 86.87it/s] 85%|████████▌ | 1125/1319 [00:37<00:02, 87.86it/s] 86%|████████▌ | 1135/1319 [00:37<00:02, 89.54it/s] 87%|████████▋ | 1145/1319 [00:37<00:02, 70.82it/s] 87%|████████▋ | 1154/1319 [00:37<00:02, 74.66it/s] 88%|████████▊ | 1163/1319 [00:37<00:02, 77.13it/s] 89%|████████▉ | 1172/1319 [00:37<00:01, 80.08it/s] 90%|████████▉ | 1181/1319 [00:38<00:01, 82.61it/s] 90%|█████████ | 1192/1319 [00:38<00:01, 80.26it/s] 91%|█████████ | 1201/1319 [00:38<00:01, 66.57it/s] 92%|█████████▏| 1209/1319 [00:38<00:01, 63.34it/s] 92%|█████████▏| 1218/1319 [00:38<00:01, 63.46it/s] 93%|█████████▎| 1229/1319 [00:38<00:01, 68.29it/s] 94%|█████████▍| 1237/1319 [00:38<00:01, 65.57it/s] 94%|█████████▍| 1244/1319 [00:39<00:01, 51.77it/s] 95%|█████████▍| 1251/1319 [00:39<00:01, 52.12it/s] 95%|█████████▌| 1257/1319 [00:39<00:01, 40.18it/s] 96%|█████████▌| 1265/1319 [00:39<00:01, 45.45it/s] 96%|█████████▋| 1271/1319 [00:39<00:01, 46.19it/s] 97%|█████████▋| 1277/1319 [00:40<00:01, 31.67it/s] 97%|█████████▋| 1282/1319 [00:40<00:01, 33.77it/s] 98%|█████████▊| 1287/1319 [00:40<00:01, 28.19it/s] 98%|█████████▊| 1291/1319 [00:40<00:01, 26.78it/s] 98%|█████████▊| 1295/1319 [00:40<00:00, 27.30it/s] 98%|█████████▊| 1299/1319 [00:41<00:00, 25.08it/s] 99%|█████████▉| 1303/1319 [00:41<00:00, 26.34it/s] 99%|█████████▉| 1306/1319 [00:41<00:00, 24.44it/s] 99%|█████████▉| 1309/1319 [00:41<00:00, 15.68it/s] 99%|█████████▉| 1312/1319 [00:42<00:00, 13.49it/s]100%|█████████▉| 1314/1319 [00:42<00:00, 10.65it/s]100%|█████████▉| 1316/1319 [00:42<00:00,  8.25it/s]100%|█████████▉| 1318/1319 [00:43<00:00,  5.74it/s]100%|██████████| 1319/1319 [00:44<00:00,  3.46it/s]100%|██████████| 1319/1319 [00:44<00:00, 29.65it/s]
Accuracy: 0.938
Invalid: 0.000
Latency: 44.662 s
Output throughput: 3030.419 token/s
Run 4 completed in 50 seconds
Run 4: Accuracy: 0.938
  ✓ Run 4 included in average (accuracy: 0.938)
[progress] [====================------------------------------] 4/10 (40%)  | GSM8K: Run 4

Checking server health before Run 5...
✅ Server is healthy
Executing GSM8K test Run 5 ...
  0%|          | 0/1319 [00:00<?, ?it/s]  0%|          | 1/1319 [00:07<2:45:29,  7.53s/it]  0%|          | 2/1319 [00:08<1:19:21,  3.62s/it]  0%|          | 3/1319 [00:08<48:58,  2.23s/it]    0%|          | 4/1319 [00:09<37:10,  1.70s/it]  0%|          | 5/1319 [00:09<22:31,  1.03s/it]  0%|          | 6/1319 [00:10<17:12,  1.27it/s]  1%|          | 11/1319 [00:10<06:16,  3.47it/s]  1%|          | 16/1319 [00:10<03:51,  5.64it/s]  2%|▏         | 21/1319 [00:10<02:48,  7.71it/s]  2%|▏         | 30/1319 [00:11<01:43, 12.44it/s]  3%|▎         | 34/1319 [00:11<01:41, 12.61it/s]  3%|▎         | 39/1319 [00:11<01:34, 13.61it/s]  3%|▎         | 42/1319 [00:12<01:41, 12.57it/s]  4%|▍         | 55/1319 [00:12<01:00, 20.85it/s]  5%|▌         | 67/1319 [00:12<01:04, 19.27it/s]  6%|▌         | 78/1319 [00:12<00:47, 26.16it/s]  6%|▌         | 79/1319 [00:12<00:47, 26.16it/s]  6%|▌         | 80/1319 [00:12<00:47, 26.16it/s]  6%|▌         | 80/1319 [00:12<00:47, 26.16it/s]  6%|▌         | 80/1319 [00:12<00:47, 26.16it/s]  6%|▌         | 80/1319 [00:12<00:47, 26.16it/s]  6%|▌         | 80/1319 [00:12<00:47, 26.16it/s]  6%|▌         | 80/1319 [00:12<00:47, 26.16it/s]  6%|▋         | 83/1319 [00:13<00:50, 24.38it/s]  7%|▋         | 91/1319 [00:13<00:49, 24.76it/s]  8%|▊         | 99/1319 [00:13<00:48, 25.03it/s]  8%|▊         | 108/1319 [00:14<00:46, 26.11it/s]  9%|▊         | 114/1319 [00:14<00:49, 24.44it/s]  9%|▉         | 121/1319 [00:14<00:49, 24.03it/s] 10%|█         | 133/1319 [00:15<00:42, 28.18it/s] 11%|█         | 143/1319 [00:15<00:39, 29.54it/s] 11%|█         | 146/1319 [00:16<01:05, 17.99it/s] 12%|█▏        | 158/1319 [00:16<00:50, 23.16it/s] 12%|█▏        | 164/1319 [00:16<00:51, 22.24it/s] 13%|█▎        | 175/1319 [00:16<00:44, 25.88it/s] 14%|█▍        | 185/1319 [00:17<00:40, 27.78it/s] 15%|█▍        | 194/1319 [00:17<00:54, 20.67it/s] 15%|█▌        | 201/1319 [00:18<00:53, 20.92it/s] 16%|█▌        | 213/1319 [00:18<00:43, 25.49it/s] 17%|█▋        | 220/1319 [00:18<00:44, 24.81it/s] 18%|█▊        | 233/1319 [00:19<00:36, 29.52it/s] 19%|█▉        | 251/1319 [00:19<00:28, 37.73it/s] 20%|██        | 265/1319 [00:19<00:26, 40.06it/s] 21%|██        | 275/1319 [00:20<00:27, 37.85it/s] 22%|██▏       | 289/1319 [00:20<00:25, 40.23it/s] 23%|██▎       | 298/1319 [00:20<00:27, 37.04it/s] 23%|██▎       | 307/1319 [00:20<00:28, 35.52it/s] 24%|██▍       | 321/1319 [00:21<00:23, 41.88it/s] 25%|██▌       | 330/1319 [00:21<00:23, 41.31it/s] 26%|██▌       | 343/1319 [00:21<00:19, 50.57it/s] 27%|██▋       | 351/1319 [00:21<00:18, 51.20it/s] 28%|██▊       | 363/1319 [00:21<00:18, 51.74it/s] 28%|██▊       | 375/1319 [00:22<00:18, 52.26it/s] 29%|██▉       | 386/1319 [00:22<00:18, 51.19it/s] 30%|███       | 397/1319 [00:22<00:18, 50.62it/s] 31%|███       | 406/1319 [00:22<00:17, 53.00it/s] 31%|███▏      | 415/1319 [00:23<00:18, 48.71it/s] 32%|███▏      | 422/1319 [00:23<00:20, 42.99it/s] 33%|███▎      | 436/1319 [00:23<00:18, 49.03it/s] 34%|███▎      | 445/1319 [00:23<00:18, 46.25it/s] 34%|███▍      | 455/1319 [00:23<00:16, 50.96it/s] 36%|███▌      | 476/1319 [00:23<00:11, 73.82it/s] 37%|███▋      | 485/1319 [00:24<00:13, 62.22it/s] 37%|███▋      | 492/1319 [00:24<00:15, 51.80it/s] 38%|███▊      | 500/1319 [00:24<00:15, 52.57it/s] 39%|███▉      | 512/1319 [00:24<00:15, 52.97it/s] 40%|███▉      | 522/1319 [00:25<00:15, 50.46it/s] 40%|████      | 529/1319 [00:25<00:17, 44.24it/s] 41%|████      | 538/1319 [00:25<00:18, 42.90it/s] 42%|████▏     | 553/1319 [00:25<00:13, 56.59it/s] 43%|████▎     | 567/1319 [00:25<00:12, 58.96it/s] 44%|████▎     | 574/1319 [00:26<00:14, 52.84it/s] 44%|████▍     | 580/1319 [00:26<00:15, 46.62it/s] 45%|████▍     | 590/1319 [00:26<00:15, 46.30it/s] 45%|████▌     | 595/1319 [00:26<00:16, 43.33it/s] 46%|████▋     | 613/1319 [00:26<00:12, 56.25it/s] 47%|████▋     | 626/1319 [00:27<00:12, 56.95it/s] 49%|████▊     | 642/1319 [00:27<00:10, 61.97it/s] 50%|████▉     | 653/1319 [00:27<00:11, 58.19it/s] 50%|█████     | 661/1319 [00:27<00:12, 51.37it/s] 51%|█████     | 672/1319 [00:27<00:11, 57.41it/s] 52%|█████▏    | 681/1319 [00:27<00:10, 58.64it/s] 52%|█████▏    | 692/1319 [00:28<00:11, 55.37it/s] 53%|█████▎    | 705/1319 [00:28<00:10, 56.81it/s] 54%|█████▍    | 717/1319 [00:28<00:10, 55.99it/s] 55%|█████▍    | 725/1319 [00:28<00:11, 49.90it/s] 56%|█████▌    | 735/1319 [00:28<00:10, 54.47it/s] 57%|█████▋    | 747/1319 [00:29<00:10, 54.75it/s] 57%|█████▋    | 753/1319 [00:29<00:11, 51.43it/s] 58%|█████▊    | 771/1319 [00:29<00:08, 62.26it/s] 59%|█████▉    | 780/1319 [00:29<00:09, 55.30it/s] 60%|█████▉    | 789/1319 [00:30<00:10, 50.70it/s] 61%|██████    | 799/1319 [00:30<00:10, 49.13it/s] 63%|██████▎   | 829/1319 [00:30<00:06, 81.36it/s] 64%|██████▍   | 841/1319 [00:30<00:05, 80.49it/s] 65%|██████▍   | 852/1319 [00:30<00:05, 78.66it/s] 65%|██████▌   | 861/1319 [00:30<00:06, 72.86it/s] 67%|██████▋   | 878/1319 [00:31<00:05, 83.39it/s] 68%|██████▊   | 895/1319 [00:31<00:04, 94.45it/s] 70%|██████▉   | 920/1319 [00:31<00:03, 119.33it/s] 71%|███████   | 933/1319 [00:31<00:03, 114.56it/s] 72%|███████▏  | 950/1319 [00:31<00:03, 117.51it/s] 73%|███████▎  | 962/1319 [00:31<00:03, 107.22it/s] 74%|███████▍  | 981/1319 [00:31<00:02, 118.77it/s] 75%|███████▌  | 994/1319 [00:31<00:02, 113.85it/s] 77%|███████▋  | 1011/1319 [00:32<00:02, 119.34it/s] 78%|███████▊  | 1024/1319 [00:32<00:02, 113.60it/s] 79%|███████▊  | 1036/1319 [00:32<00:02, 113.40it/s] 79%|███████▉  | 1048/1319 [00:32<00:02, 111.35it/s] 80%|████████  | 1060/1319 [00:32<00:02, 108.49it/s] 81%|████████  | 1071/1319 [00:32<00:02, 103.42it/s] 82%|████████▏ | 1085/1319 [00:32<00:02, 110.07it/s] 83%|████████▎ | 1097/1319 [00:33<00:02, 83.46it/s]  84%|████████▍ | 1109/1319 [00:33<00:02, 90.38it/s] 85%|████████▍ | 1119/1319 [00:33<00:02, 89.98it/s] 86%|████████▌ | 1129/1319 [00:33<00:02, 90.24it/s] 86%|████████▋ | 1139/1319 [00:33<00:01, 91.23it/s] 87%|████████▋ | 1149/1319 [00:33<00:01, 91.85it/s] 88%|████████▊ | 1159/1319 [00:33<00:01, 93.00it/s] 89%|████████▊ | 1169/1319 [00:33<00:01, 81.88it/s] 89%|████████▉ | 1178/1319 [00:33<00:01, 83.51it/s] 90%|████████▉ | 1187/1319 [00:34<00:01, 75.59it/s] 91%|█████████ | 1200/1319 [00:34<00:01, 80.35it/s] 92%|█████████▏| 1209/1319 [00:34<00:01, 67.89it/s] 92%|█████████▏| 1217/1319 [00:34<00:01, 64.07it/s] 93%|█████████▎| 1229/1319 [00:34<00:01, 71.65it/s] 94%|█████████▍| 1240/1319 [00:34<00:01, 74.00it/s] 95%|█████████▍| 1248/1319 [00:34<00:01, 64.32it/s] 95%|█████████▌| 1255/1319 [00:35<00:01, 56.40it/s] 96%|█████████▌| 1261/1319 [00:35<00:01, 46.03it/s] 96%|█████████▌| 1267/1319 [00:35<00:01, 46.35it/s] 96%|█████████▋| 1272/1319 [00:35<00:01, 38.33it/s] 97%|█████████▋| 1277/1319 [00:35<00:01, 36.26it/s] 97%|█████████▋| 1281/1319 [00:36<00:01, 26.13it/s] 97%|█████████▋| 1285/1319 [00:36<00:01, 22.08it/s] 98%|█████████▊| 1289/1319 [00:36<00:01, 20.98it/s] 98%|█████████▊| 1292/1319 [00:36<00:01, 22.13it/s] 98%|█████████▊| 1295/1319 [00:37<00:01, 17.83it/s] 98%|█████████▊| 1298/1319 [00:37<00:01, 17.05it/s] 99%|█████████▉| 1303/1319 [00:37<00:00, 19.42it/s] 99%|█████████▉| 1306/1319 [00:37<00:00, 16.32it/s] 99%|█████████▉| 1310/1319 [00:37<00:00, 18.76it/s]100%|█████████▉| 1313/1319 [00:38<00:00, 10.82it/s]100%|█████████▉| 1315/1319 [00:38<00:00,  9.25it/s]100%|█████████▉| 1317/1319 [00:39<00:00,  7.27it/s]100%|██████████| 1319/1319 [00:43<00:00,  1.66it/s]100%|██████████| 1319/1319 [00:43<00:00, 30.29it/s]
Accuracy: 0.936
Invalid: 0.000
Latency: 43.735 s
Output throughput: 3101.351 token/s
Run 5 completed in 49 seconds
Run 5: Accuracy: 0.936
  ✓ Run 5 included in average (accuracy: 0.936)
[progress] [=========================-------------------------] 5/10 (50%)  | GSM8K: Run 5
GSM8K test completed in 357 seconds
Total runs: 5, Valid runs: 5, Excluded runs: 0
Average Accuracy over 5 valid runs: 0.934
Average accuracy meets threshold (0.93).
✅ GSM8K benchmark completed successfully.
GSM8K log saved to /mnt/raid/michael/sglang-ci/online/DeepSeek-V3-0324/v0.5.6-rocm700-mi30x-20251208_DeepSeek-V3-0324_FP8_online/sglang_client_log_DeepSeek-V3-0324_gsm8k.log
Server log saved to /mnt/raid/michael/sglang-ci/online/DeepSeek-V3-0324/v0.5.6-rocm700-mi30x-20251208_DeepSeek-V3-0324_FP8_online/sglang_server.log
Starting serving benchmark tests with different concurrency levels...
[online] Structured CSV initialized at /mnt/raid/michael/sglang-ci/online/DeepSeek-V3-0324/v0.5.6-rocm700-mi30x-20251208_DeepSeek-V3-0324_FP8_online/v0.5.6-rocm700-mi30x-20251208_DeepSeek-V3-0324_FP8_serving.csv
Processing concurrency 128 with 1 runs...
Running serving benchmark with concurrency 128 (Run 1) - 500 prompts...
Concurrency 128, Run 1 completed: 500 requests, (tok/s): tok/s output throughput, 135957.39ms E2E latency (544s)
[progress] [==============================--------------------] 6/10 (60%)  | Serving: C128 R1
✅ Best results for concurrency 128: E2E=135957.39ms, TTFT=19575.79ms, ITL=120.77ms, Output=(tok/s): tok/s
[online] Updating CSV for concurrency 128: E2E=135957.39ms, TTFT=19575.79ms, ITL=120.77ms, Output=(tok/s): tok/s
[online] CSV updated with results for concurrency 128
Sleeping 3 seconds before next concurrency level...
Processing concurrency 64 with 1 runs...
Running serving benchmark with concurrency 64 (Run 1) - 500 prompts...
Concurrency 64, Run 1 completed: 500 requests, (tok/s): tok/s output throughput, 106574.88ms E2E latency (826s)
[progress] [===================================---------------] 7/10 (70%)  | Serving: C64 R1
✅ Best results for concurrency 64: E2E=106574.88ms, TTFT=9892.68ms, ITL=108.80ms, Output=(tok/s): tok/s
[online] Updating CSV for concurrency 64: E2E=106574.88ms, TTFT=9892.68ms, ITL=108.80ms, Output=(tok/s): tok/s
[online] CSV updated with results for concurrency 64
Sleeping 3 seconds before next concurrency level...
Processing concurrency 16 with 1 runs...
Running serving benchmark with concurrency 16 (Run 1) - 128 prompts...
Concurrency 16, Run 1 completed: 128 requests, (tok/s): tok/s output throughput, 79726.97ms E2E latency (502s)
[progress] [========================================----------] 8/10 (80%)  | Serving: C16 R1
✅ Best results for concurrency 16: E2E=79726.97ms, TTFT=2519.01ms, ITL=94.78ms, Output=(tok/s): tok/s
[online] Updating CSV for concurrency 16: E2E=79726.97ms, TTFT=2519.01ms, ITL=94.78ms, Output=(tok/s): tok/s
[online] CSV updated with results for concurrency 16
Sleeping 3 seconds before next concurrency level...
Processing concurrency 4 with 1 runs...
Running serving benchmark with concurrency 4 (Run 1) - 128 prompts...
Concurrency 4, Run 1 completed: 128 requests, (tok/s): tok/s output throughput, 21126.08ms E2E latency (689s)
[progress] [=============================================-----] 9/10 (90%)  | Serving: C4 R1
✅ Best results for concurrency 4: E2E=21126.08ms, TTFT=334.43ms, ITL=26.02ms, Output=(tok/s): tok/s
[online] Updating CSV for concurrency 4: E2E=21126.08ms, TTFT=334.43ms, ITL=26.02ms, Output=(tok/s): tok/s
[online] CSV updated with results for concurrency 4
Sleeping 3 seconds before next concurrency level...
Processing concurrency 1 with 1 runs...
Running serving benchmark with concurrency 1 (Run 1) - 128 prompts...
Concurrency 1, Run 1 completed: 128 requests, (tok/s): tok/s output throughput, 19636.73ms E2E latency (2527s)
[progress] [==================================================] 10/10 (100%) ✅ Complete!
 | Serving: C1 R1
✅ Best results for concurrency 1: E2E=19636.73ms, TTFT=181.71ms, ITL=24.35ms, Output=(tok/s): tok/s
[online] Updating CSV for concurrency 1: E2E=19636.73ms, TTFT=181.71ms, ITL=24.35ms, Output=(tok/s): tok/s
[online] CSV updated with results for concurrency 1
✅ Serving benchmark completed successfully in 5111 seconds (standard mode).
Structured serving benchmark results written to /mnt/raid/michael/sglang-ci/online/DeepSeek-V3-0324/v0.5.6-rocm700-mi30x-20251208_DeepSeek-V3-0324_FP8_online/v0.5.6-rocm700-mi30x-20251208_DeepSeek-V3-0324_FP8_serving.csv
Individual concurrency logs saved to /mnt/raid/michael/sglang-ci/online/DeepSeek-V3-0324/v0.5.6-rocm700-mi30x-20251208_DeepSeek-V3-0324_FP8_online/sglang_serving_benchmark_concurrency_*_run*.log
GSM8K accuracy results written to /mnt/raid/michael/sglang-ci/online/DeepSeek-V3-0324/v0.5.6-rocm700-mi30x-20251208_DeepSeek-V3-0324_FP8_online/sglang_client_log_DeepSeek-V3-0324_gsm8k.log
Shutting down SGLang server...
Server shutdown completed in 0 seconds

==========================================
SCRIPT EXECUTION SUMMARY
==========================================
Script completed at: 2025-12-08 16:49:31 PST
Total execution time: 5639 seconds (93 minutes)
Output directory: /mnt/raid/michael/sglang-ci/online/DeepSeek-V3-0324/v0.5.6-rocm700-mi30x-20251208_DeepSeek-V3-0324_FP8_online
Serving CSV: /mnt/raid/michael/sglang-ci/online/DeepSeek-V3-0324/v0.5.6-rocm700-mi30x-20251208_DeepSeek-V3-0324_FP8_online/v0.5.6-rocm700-mi30x-20251208_DeepSeek-V3-0324_FP8_serving.csv
Timing log: /mnt/raid/michael/sglang-ci/online/DeepSeek-V3-0324/v0.5.6-rocm700-mi30x-20251208_DeepSeek-V3-0324_FP8_online/timing_summary_20251208_151532.log
===========================================
Cleaning up...
Killing background SGLang server (PID: 50)...
Server process 50 not found or already terminated.
[nightly] === Online benchmark dispatched for DEEPSEEK; check logs in sgl-dev_v0.5.6-rocm700-mi30x-20251208 ===
[nightly] === Starting post-processing (CSV processing, plot generation, Teams notifications) ===
[nightly] Processing online CSV data and generating plots... Logs will be saved to /mnt/raid/michael/sglang-ci/online/DeepSeek-V3-0324/v0.5.6-rocm700-mi30x-20251208_DeepSeek-V3-0324_FP8_online/process_and_generate_online_plots.log
[nightly] Using plot date from image tag: 20251208
[nightly] Teams notifications skipped - --teams-webhook-url not provided
[nightly] === Online post-processing completed for DEEPSEEK ===
[nightly] ==========================================
[nightly] Completed benchmarks for image: rocm/sgl-dev:v0.5.6-rocm700-mi30x-20251208
[nightly] Stopping container sgl-dev_v0.5.6-rocm700-mi30x-20251208 to release resources...
[nightly] ==========================================
[nightly] ==========================================
[nightly] All benchmarks completed for 1 image(s)
[nightly] ==========================================
[nightly] Cleaning up process lock...
