[nightly] ==========================================
[nightly] SGL Nightly Benchmark Started
[nightly] ==========================================
[nightly] Command: scripts/perf_nightly.sh --model=deepseek --model-path=/data2/models/amd-DeepSeek-R1-MXFP4-Preview --model-name=DeepSeek-R1-MXFP4-Preview --mode=online --hardware=mi35x
[nightly] Start time: 2025-11-01 17:10:01 PDT
[nightly] Machine: smci355-ccs-aus-m15-21.cs-aus.dcgpu
[nightly] Working directory: /mnt/raid/michael/sglang-ci
[nightly] Script location: /mnt/raid/michael/sglang-ci/scripts/perf_nightly.sh
[nightly] Process ID: 2640143
[nightly] ==========================================

[nightly] Runtime Environment:
[nightly] User: root | Groups: root video render... | Docker: /usr/bin/docker
[nightly] Testing Docker daemon access...
[nightly] Docker daemon accessible - proceeding...
[nightly] INFO: Ignoring Teams webhook URL from environment (require --teams-webhook-url)
[nightly] Custom model path provided: /data2/models/amd-DeepSeek-R1-MXFP4-Preview
[nightly] Hardware: mi35x, ROCM Version: rocm700
[nightly] Custom model name provided: DeepSeek-R1-MXFP4-Preview
[nightly] Model: deepseek, Mode(s): online
[nightly] Created process lock: /tmp/perf_nightly_deepseek.lock
[nightly] GPU is busy. Attempting to stop running Docker containers...
[nightly] Stopping running containers: efc0f69c0f68
2e7bc920a0b0
[nightly] Waiting 15s for GPU to become idle...
[nightly] WARN: GPU may still be busy, but proceeding as requested.
[nightly] Searching for non-SRT images for deepseek for the last 1 days...
[nightly] Searching for non-SRT mi35x image in 'rocm/sgl-dev' for date 20251101...
[nightly] Found candidate tag for day -0: v0.5.4.post2-rocm700-mi35x-20251101
[nightly] Found local image: rocm/sgl-dev:v0.5.4.post2-rocm700-mi35x-20251101
[nightly] Successfully obtained image for date 20251101: rocm/sgl-dev:v0.5.4.post2-rocm700-mi35x-20251101
[nightly] Found 1 valid image(s) to run benchmarks on:
[nightly]   - rocm/sgl-dev:v0.5.4.post2-rocm700-mi35x-20251101

[nightly] ==========================================
[nightly] Starting benchmarks for image: rocm/sgl-dev:v0.5.4.post2-rocm700-mi35x-20251101
[nightly] ==========================================
[nightly] Checking GPU status before starting benchmarks for rocm/sgl-dev:v0.5.4.post2-rocm700-mi35x-20251101...
[nightly] GPU is busy. Attempting to stop running Docker containers...
[nightly] Stopping running containers: 47bbaf603dbf
[nightly] Waiting 15s for GPU to become idle...
[nightly] WARN: GPU may still be busy, but proceeding as requested.
[nightly] Checking benchmark completion in: /mnt/raid/michael/sglang-ci/online/DeepSeek-R1-MXFP4-Preview/v0.5.4.post2-rocm700-mi35x-20251101_DeepSeek-R1-MXFP4-Preview_FP8_online
[nightly] Found 0 completed benchmark runs
[nightly] INFO: Found 0/15 completed runs for rocm/sgl-dev:v0.5.4.post2-rocm700-mi35x-20251101 (online). Proceeding with benchmarks.
[nightly] Using Docker image: rocm/sgl-dev:v0.5.4.post2-rocm700-mi35x-20251101
[nightly] Container name: sgl-dev_v0.5.4.post2-rocm700-mi35x-20251101
[nightly] Reusing container sgl-dev_v0.5.4.post2-rocm700-mi35x-20251101
[nightly] === Starting benchmark execution ===
[nightly] === Starting nightly DEEPSEEK online benchmark ===
[nightly] Launching deepseek_perf_online_csv.sh inside sgl-dev_v0.5.4.post2-rocm700-mi35x-20251101
[nightly] Passing --model-name='DeepSeek-R1-MXFP4-Preview' to DeepSeek benchmark
✅ Parameter validation passed
[online] Script started at: 2025-11-01 17:10:43 PDT
Scanning existing logs to check if all benchmarks are already complete...
Checking GSM8K log status...
Missing: GSM8K log file (/mnt/raid/michael/sglang-ci/online/DeepSeek-R1-MXFP4-Preview/v0.5.4.post2-rocm700-mi35x-20251101_DeepSeek-R1-MXFP4-Preview_FP8_online/sglang_client_log_DeepSeek-R1-MXFP4-Preview_gsm8k.log)
Checking serving benchmark logs...
Missing: Concurrency 128, Run 1
Missing: Concurrency 64, Run 1
Missing: Concurrency 16, Run 1
Missing: Concurrency 4, Run 1
Missing: Concurrency 1, Run 1
Scan complete: 5 total runs needed, 5 missing/incomplete
❌ Missing 5 serving benchmark runs.
❌ GSM8K benchmark is missing, empty, or incomplete.
Server startup required.
Clearing previous logs...
Starting SGLang server for online GSM8K benchmark...
[DEBUG] Using standard settings with environment variable: SGLANG_USE_AITER
Waiting for SGLang server (PID: 47) to start... (Max 15 minutes)
Server logs are being written to: /mnt/raid/michael/sglang-ci/online/DeepSeek-R1-MXFP4-Preview/v0.5.4.post2-rocm700-mi35x-20251101_DeepSeek-R1-MXFP4-Preview_FP8_online/sglang_server.log
................
SGLang server started successfully after 81 seconds.
=== Online GSM8K Benchmark: TP=8, Questions=2000, Parallel=2000, Shots=5 ===
[progress] Total benchmark runs to execute: 10 (GSM8K: 5, Serving: 5) - standard mode
[progress] [--------------------------------------------------] 0/10 (0%) 
Starting GSM8K Online Benchmark...
Running 5 test iterations...
Executing GSM8K test Run 1 ...
  0%|          | 0/1319 [00:00<?, ?it/s]  0%|          | 1/1319 [00:12<4:24:26, 12.04s/it]  1%|          | 8/1319 [00:12<24:28,  1.12s/it]    1%|          | 14/1319 [00:12<11:54,  1.83it/s]  1%|          | 15/1319 [00:12<06:37,  3.28it/s]  2%|▏         | 25/1319 [00:12<05:13,  4.12it/s]  2%|▏         | 28/1319 [00:12<04:22,  4.92it/s]  2%|▏         | 30/1319 [00:12<02:30,  8.55it/s]  3%|▎         | 36/1319 [00:12<02:30,  8.55it/s]  3%|▎         | 39/1319 [00:13<02:14,  9.48it/s]  4%|▎         | 49/1319 [00:13<01:23, 15.22it/s]  5%|▍         | 64/1319 [00:13<00:59, 21.24it/s]  5%|▌         | 70/1319 [00:14<00:59, 20.83it/s]  6%|▌         | 77/1319 [00:14<00:35, 35.21it/s]  6%|▌         | 77/1319 [00:14<00:35, 35.21it/s]  6%|▌         | 77/1319 [00:14<00:35, 35.21it/s]  6%|▌         | 77/1319 [00:14<00:35, 35.21it/s]  6%|▌         | 77/1319 [00:14<00:35, 35.21it/s]  6%|▌         | 77/1319 [00:14<00:35, 35.21it/s]  6%|▌         | 77/1319 [00:14<00:35, 35.21it/s]  6%|▌         | 81/1319 [00:14<00:47, 26.19it/s]  7%|▋         | 87/1319 [00:14<00:57, 21.47it/s]  7%|▋         | 88/1319 [00:14<00:57, 21.47it/s]  7%|▋         | 88/1319 [00:14<00:57, 21.47it/s]  7%|▋         | 88/1319 [00:14<00:57, 21.47it/s]  7%|▋         | 88/1319 [00:14<00:57, 21.47it/s]  7%|▋         | 88/1319 [00:14<00:57, 21.47it/s]  7%|▋         | 91/1319 [00:14<01:08, 17.98it/s]  8%|▊         | 99/1319 [00:14<01:15, 16.15it/s]  8%|▊         | 99/1319 [00:14<01:15, 16.15it/s]  8%|▊         | 99/1319 [00:14<01:15, 16.15it/s]  8%|▊         | 102/1319 [00:15<01:09, 17.62it/s]  8%|▊         | 106/1319 [00:15<01:26, 13.94it/s]  9%|▉         | 119/1319 [00:15<00:54, 22.18it/s]  9%|▉         | 122/1319 [00:15<00:29, 40.79it/s]  9%|▉         | 122/1319 [00:15<00:29, 40.79it/s]  9%|▉         | 122/1319 [00:15<00:29, 40.79it/s] 10%|▉         | 127/1319 [00:16<00:39, 30.26it/s] 10%|█         | 134/1319 [00:16<00:42, 28.18it/s] 11%|█         | 144/1319 [00:16<00:24, 47.91it/s] 11%|█         | 145/1319 [00:16<00:24, 47.91it/s] 11%|█         | 145/1319 [00:16<00:24, 47.91it/s] 11%|█         | 145/1319 [00:16<00:24, 47.91it/s] 11%|█         | 145/1319 [00:16<00:24, 47.91it/s] 11%|█         | 145/1319 [00:16<00:24, 47.91it/s] 11%|█         | 145/1319 [00:16<00:24, 47.91it/s] 11%|█         | 145/1319 [00:16<00:24, 47.91it/s] 11%|█         | 145/1319 [00:16<00:24, 47.91it/s] 11%|█         | 145/1319 [00:16<00:24, 47.91it/s] 11%|█▏        | 150/1319 [00:16<00:27, 43.00it/s] 12%|█▏        | 155/1319 [00:16<00:30, 38.62it/s] 12%|█▏        | 160/1319 [00:16<00:31, 36.81it/s] 12%|█▏        | 160/1319 [00:16<00:31, 36.81it/s] 12%|█▏        | 160/1319 [00:16<00:31, 36.81it/s] 12%|█▏        | 164/1319 [00:17<00:41, 28.12it/s] 13%|█▎        | 171/1319 [00:17<00:43, 26.32it/s] 13%|█▎        | 177/1319 [00:17<00:41, 27.26it/s] 14%|█▍        | 183/1319 [00:17<00:41, 27.26it/s] 14%|█▍        | 187/1319 [00:17<00:52, 21.72it/s] 15%|█▍        | 195/1319 [00:18<00:48, 23.38it/s] 16%|█▌        | 205/1319 [00:18<00:37, 29.77it/s] 16%|█▋        | 217/1319 [00:18<00:32, 33.55it/s] 17%|█▋        | 227/1319 [00:18<00:30, 36.08it/s] 18%|█▊        | 237/1319 [00:19<00:30, 35.60it/s] 18%|█▊        | 244/1319 [00:19<00:30, 34.88it/s] 19%|█▉        | 249/1319 [00:19<00:30, 35.54it/s] 20%|█▉        | 258/1319 [00:19<00:33, 31.86it/s] 21%|██        | 271/1319 [00:19<00:15, 66.55it/s] 21%|██        | 271/1319 [00:19<00:15, 66.55it/s] 21%|██        | 271/1319 [00:19<00:15, 66.55it/s] 21%|██        | 272/1319 [00:19<00:15, 66.55it/s] 21%|██        | 272/1319 [00:19<00:15, 66.55it/s] 21%|██        | 272/1319 [00:19<00:15, 66.55it/s] 21%|██        | 272/1319 [00:19<00:15, 66.55it/s] 21%|██        | 272/1319 [00:19<00:15, 66.55it/s] 21%|██        | 272/1319 [00:19<00:15, 66.55it/s] 21%|██        | 272/1319 [00:19<00:15, 66.55it/s] 21%|██        | 272/1319 [00:19<00:15, 66.55it/s] 21%|██        | 279/1319 [00:19<00:18, 56.99it/s] 21%|██▏       | 281/1319 [00:19<00:20, 51.89it/s] 22%|██▏       | 288/1319 [00:20<00:26, 39.52it/s] 23%|██▎       | 307/1319 [00:20<00:13, 73.31it/s] 23%|██▎       | 308/1319 [00:20<00:13, 73.31it/s] 23%|██▎       | 308/1319 [00:20<00:13, 73.31it/s] 23%|██▎       | 308/1319 [00:20<00:13, 73.31it/s] 23%|██▎       | 308/1319 [00:20<00:13, 73.31it/s] 23%|██▎       | 308/1319 [00:20<00:13, 73.31it/s] 23%|██▎       | 308/1319 [00:20<00:13, 73.31it/s] 23%|██▎       | 308/1319 [00:20<00:13, 73.31it/s] 23%|██▎       | 308/1319 [00:20<00:13, 73.31it/s] 23%|██▎       | 308/1319 [00:20<00:13, 73.31it/s] 23%|██▎       | 308/1319 [00:20<00:13, 73.31it/s] 23%|██▎       | 308/1319 [00:20<00:13, 73.31it/s] 23%|██▎       | 308/1319 [00:20<00:13, 73.31it/s] 23%|██▎       | 308/1319 [00:20<00:13, 73.31it/s] 23%|██▎       | 308/1319 [00:20<00:13, 73.31it/s] 23%|██▎       | 308/1319 [00:20<00:13, 73.31it/s] 23%|██▎       | 308/1319 [00:20<00:13, 73.31it/s] 23%|██▎       | 308/1319 [00:20<00:13, 73.31it/s] 24%|██▍       | 316/1319 [00:20<00:17, 58.45it/s] 25%|██▍       | 327/1319 [00:20<00:17, 57.52it/s] 26%|██▌       | 344/1319 [00:21<00:24, 39.78it/s] 27%|██▋       | 354/1319 [00:21<00:24, 39.33it/s] 28%|██▊       | 367/1319 [00:21<00:21, 44.17it/s] 28%|██▊       | 375/1319 [00:21<00:11, 79.05it/s] 29%|██▊       | 376/1319 [00:21<00:11, 79.05it/s] 29%|██▊       | 376/1319 [00:21<00:11, 79.05it/s] 29%|██▊       | 376/1319 [00:21<00:11, 79.05it/s] 29%|██▊       | 376/1319 [00:21<00:11, 79.05it/s] 29%|██▊       | 376/1319 [00:21<00:11, 79.05it/s] 29%|██▉       | 385/1319 [00:21<00:13, 69.14it/s] 30%|██▉       | 395/1319 [00:21<00:14, 63.36it/s] 30%|███       | 402/1319 [00:22<00:14, 64.42it/s] 31%|███       | 409/1319 [00:22<00:16, 54.67it/s] 32%|███▏      | 424/1319 [00:22<00:09, 97.04it/s] 32%|███▏      | 424/1319 [00:22<00:09, 97.04it/s] 32%|███▏      | 424/1319 [00:22<00:09, 97.04it/s] 32%|███▏      | 424/1319 [00:22<00:09, 97.04it/s] 32%|███▏      | 424/1319 [00:22<00:09, 97.04it/s] 32%|███▏      | 424/1319 [00:22<00:09, 97.04it/s] 32%|███▏      | 424/1319 [00:22<00:09, 97.04it/s] 32%|███▏      | 424/1319 [00:22<00:09, 97.04it/s] 32%|███▏      | 424/1319 [00:22<00:09, 97.04it/s] 32%|███▏      | 424/1319 [00:22<00:09, 97.04it/s] 32%|███▏      | 424/1319 [00:22<00:09, 97.04it/s] 32%|███▏      | 424/1319 [00:22<00:09, 97.04it/s] 32%|███▏      | 424/1319 [00:22<00:09, 97.04it/s] 32%|███▏      | 424/1319 [00:22<00:09, 97.04it/s] 32%|███▏      | 424/1319 [00:22<00:09, 97.04it/s] 33%|███▎      | 434/1319 [00:22<00:09, 94.69it/s] 34%|███▎      | 444/1319 [00:22<00:10, 80.41it/s] 34%|███▍      | 453/1319 [00:22<00:12, 69.55it/s] 35%|███▍      | 461/1319 [00:22<00:12, 70.16it/s] 35%|███▌      | 464/1319 [00:22<00:10, 82.63it/s] 35%|███▌      | 466/1319 [00:22<00:10, 82.63it/s] 35%|███▌      | 466/1319 [00:22<00:10, 82.63it/s] 36%|███▌      | 475/1319 [00:23<00:14, 57.40it/s] 37%|███▋      | 486/1319 [00:23<00:15, 55.04it/s] 39%|███▉      | 513/1319 [00:23<00:11, 69.87it/s] 39%|███▉      | 515/1319 [00:23<00:09, 85.89it/s] 40%|███▉      | 522/1319 [00:23<00:09, 85.89it/s] 40%|████      | 531/1319 [00:23<00:10, 75.78it/s] 41%|████      | 539/1319 [00:24<00:12, 64.71it/s] 42%|████▏     | 557/1319 [00:24<00:09, 82.54it/s] 43%|████▎     | 571/1319 [00:24<00:10, 70.34it/s] 44%|████▍     | 580/1319 [00:24<00:10, 73.12it/s] 45%|████▍     | 588/1319 [00:24<00:06, 118.37it/s] 45%|████▍     | 589/1319 [00:24<00:06, 118.37it/s] 45%|████▍     | 589/1319 [00:24<00:06, 118.37it/s] 45%|████▍     | 589/1319 [00:24<00:06, 118.37it/s] 45%|████▍     | 589/1319 [00:24<00:06, 118.37it/s] 45%|████▍     | 589/1319 [00:24<00:06, 118.37it/s] 46%|████▌     | 602/1319 [00:24<00:07, 91.75it/s]  46%|████▋     | 613/1319 [00:24<00:08, 80.41it/s] 47%|████▋     | 623/1319 [00:25<00:08, 84.07it/s] 48%|████▊     | 633/1319 [00:25<00:09, 70.68it/s] 49%|████▊     | 641/1319 [00:25<00:11, 60.99it/s] 50%|████▉     | 655/1319 [00:25<00:10, 61.38it/s] 50%|█████     | 662/1319 [00:25<00:11, 55.01it/s] 51%|█████     | 672/1319 [00:25<00:10, 59.07it/s] 51%|█████     | 672/1319 [00:25<00:10, 59.07it/s] 51%|█████     | 672/1319 [00:25<00:10, 59.07it/s] 51%|█████     | 672/1319 [00:25<00:10, 59.07it/s] 51%|█████     | 672/1319 [00:25<00:10, 59.07it/s] 52%|█████▏    | 684/1319 [00:26<00:12, 49.67it/s] 53%|█████▎    | 696/1319 [00:26<00:21, 29.01it/s] 53%|█████▎    | 702/1319 [00:27<00:26, 23.27it/s] 54%|█████▍    | 717/1319 [00:27<00:20, 29.06it/s] 55%|█████▍    | 725/1319 [00:27<00:17, 33.41it/s] 56%|█████▋    | 744/1319 [00:27<00:15, 37.87it/s] 57%|█████▋    | 750/1319 [00:27<00:10, 55.32it/s] 57%|█████▋    | 750/1319 [00:27<00:10, 55.32it/s] 57%|█████▋    | 750/1319 [00:27<00:10, 55.32it/s] 57%|█████▋    | 750/1319 [00:27<00:10, 55.32it/s] 57%|█████▋    | 750/1319 [00:27<00:10, 55.32it/s] 57%|█████▋    | 750/1319 [00:27<00:10, 55.32it/s] 57%|█████▋    | 756/1319 [00:28<00:11, 49.79it/s] 58%|█████▊    | 767/1319 [00:28<00:10, 51.99it/s] 59%|█████▉    | 776/1319 [00:28<00:09, 54.95it/s] 60%|█████▉    | 786/1319 [00:28<00:07, 71.48it/s] 60%|█████▉    | 787/1319 [00:28<00:07, 71.48it/s] 60%|█████▉    | 787/1319 [00:28<00:07, 71.48it/s] 61%|██████    | 798/1319 [00:28<00:09, 57.17it/s] 61%|██████    | 805/1319 [00:28<00:10, 50.06it/s] 63%|██████▎   | 836/1319 [00:28<00:05, 86.94it/s] 64%|██████▍   | 846/1319 [00:28<00:01, 239.81it/s] 64%|██████▍   | 846/1319 [00:28<00:01, 239.81it/s] 64%|██████▍   | 846/1319 [00:28<00:01, 239.81it/s] 64%|██████▍   | 846/1319 [00:28<00:01, 239.81it/s] 64%|██████▍   | 846/1319 [00:28<00:01, 239.81it/s] 64%|██████▍   | 846/1319 [00:28<00:01, 239.81it/s] 64%|██████▍   | 846/1319 [00:28<00:01, 239.81it/s] 64%|██████▍   | 846/1319 [00:28<00:01, 239.81it/s] 64%|██████▍   | 846/1319 [00:28<00:01, 239.81it/s] 66%|██████▌   | 871/1319 [00:29<00:02, 221.15it/s] 68%|██████▊   | 903/1319 [00:29<00:01, 227.23it/s] 70%|███████   | 926/1319 [00:29<00:01, 208.79it/s] 73%|███████▎  | 958/1319 [00:29<00:01, 219.32it/s] 73%|███████▎  | 963/1319 [00:29<00:01, 247.33it/s] 73%|███████▎  | 963/1319 [00:29<00:01, 247.33it/s] 73%|███████▎  | 963/1319 [00:29<00:01, 247.33it/s] 75%|███████▍  | 988/1319 [00:29<00:01, 230.88it/s] 75%|███████▌  | 991/1319 [00:29<00:01, 216.06it/s] 75%|███████▌  | 991/1319 [00:29<00:01, 216.06it/s] 75%|███████▌  | 991/1319 [00:29<00:01, 216.06it/s] 77%|███████▋  | 1013/1319 [00:29<00:01, 185.94it/s] 79%|███████▊  | 1037/1319 [00:29<00:01, 189.30it/s] 80%|████████  | 1057/1319 [00:30<00:01, 168.23it/s] 82%|████████▏ | 1081/1319 [00:30<00:01, 175.63it/s] 82%|████████▏ | 1084/1319 [00:30<00:01, 199.15it/s] 82%|████████▏ | 1085/1319 [00:30<00:01, 199.15it/s] 82%|████████▏ | 1085/1319 [00:30<00:01, 199.15it/s] 84%|████████▍ | 1106/1319 [00:30<00:01, 177.06it/s] 85%|████████▌ | 1127/1319 [00:30<00:01, 177.29it/s] 87%|████████▋ | 1147/1319 [00:30<00:00, 178.21it/s] 88%|████████▊ | 1166/1319 [00:30<00:00, 176.57it/s] 90%|████████▉ | 1184/1319 [00:30<00:00, 155.76it/s] 91%|█████████ | 1200/1319 [00:31<00:00, 134.68it/s] 92%|█████████▏| 1217/1319 [00:31<00:00, 141.26it/s] 93%|█████████▎| 1232/1319 [00:31<00:00, 128.17it/s] 93%|█████████▎| 1233/1319 [00:31<00:00, 121.69it/s] 94%|█████████▍| 1246/1319 [00:31<00:00, 101.58it/s] 95%|█████████▌| 1257/1319 [00:31<00:00, 94.25it/s]  96%|█████████▌| 1267/1319 [00:31<00:00, 87.93it/s] 97%|█████████▋| 1277/1319 [00:32<00:00, 66.73it/s] 97%|█████████▋| 1286/1319 [00:32<00:00, 60.20it/s] 98%|█████████▊| 1293/1319 [00:32<00:00, 50.87it/s] 98%|█████████▊| 1299/1319 [00:32<00:00, 51.18it/s] 99%|█████████▉| 1305/1319 [00:33<00:00, 26.10it/s] 99%|█████████▉| 1310/1319 [00:35<00:01,  7.53it/s]100%|█████████▉| 1313/1319 [00:35<00:00,  8.44it/s]100%|██████████| 1319/1319 [00:36<00:00,  8.99it/s]100%|██████████| 1319/1319 [00:36<00:00, 36.33it/s]
Accuracy: 0.943
Invalid: 0.000
Latency: 36.854 s
Output throughput: 3532.862 token/s
Run 1 completed in 42 seconds
Run 1: Accuracy: 0.943
[progress] [=====---------------------------------------------] 1/10 (10%)  | GSM8K: Run 1
Executing GSM8K test Run 2 ...
  0%|          | 0/1319 [00:00<?, ?it/s]  0%|          | 1/1319 [00:05<1:58:36,  5.40s/it]  0%|          | 2/1319 [00:06<58:10,  2.65s/it]    0%|          | 5/1319 [00:06<17:00,  1.29it/s]  1%|          | 13/1319 [00:06<04:46,  4.57it/s]  1%|▏         | 18/1319 [00:06<00:37, 34.85it/s]  2%|▏         | 20/1319 [00:06<00:37, 34.85it/s]  2%|▏         | 20/1319 [00:06<00:37, 34.85it/s]  2%|▏         | 20/1319 [00:06<00:37, 34.85it/s]  2%|▏         | 29/1319 [00:06<00:42, 30.27it/s]  3%|▎         | 43/1319 [00:06<00:32, 39.33it/s]  4%|▎         | 49/1319 [00:06<00:17, 72.26it/s]  4%|▎         | 49/1319 [00:06<00:17, 72.26it/s]  4%|▎         | 49/1319 [00:06<00:17, 72.26it/s]  4%|▎         | 49/1319 [00:06<00:17, 72.26it/s]  4%|▍         | 58/1319 [00:07<00:25, 49.09it/s]  5%|▍         | 65/1319 [00:07<00:28, 43.97it/s]  5%|▌         | 66/1319 [00:07<00:30, 41.26it/s]  5%|▌         | 71/1319 [00:07<00:32, 37.91it/s]  6%|▌         | 76/1319 [00:07<00:35, 35.14it/s]  6%|▋         | 85/1319 [00:08<00:34, 35.55it/s]  7%|▋         | 89/1319 [00:08<00:53, 22.94it/s]  7%|▋         | 94/1319 [00:08<01:15, 16.22it/s]  7%|▋         | 96/1319 [00:08<01:15, 16.22it/s]  7%|▋         | 96/1319 [00:08<01:15, 16.22it/s]  7%|▋         | 96/1319 [00:08<01:15, 16.22it/s] 10%|▉         | 131/1319 [00:08<00:28, 41.52it/s] 11%|█         | 141/1319 [00:09<00:27, 43.51it/s] 12%|█▏        | 156/1319 [00:09<00:16, 69.82it/s] 12%|█▏        | 156/1319 [00:09<00:16, 69.82it/s] 12%|█▏        | 157/1319 [00:09<00:16, 69.82it/s] 12%|█▏        | 157/1319 [00:09<00:16, 69.82it/s] 12%|█▏        | 157/1319 [00:09<00:16, 69.82it/s] 12%|█▏        | 157/1319 [00:09<00:16, 69.82it/s] 13%|█▎        | 165/1319 [00:09<00:19, 60.17it/s] 13%|█▎        | 172/1319 [00:09<00:21, 53.99it/s] 13%|█▎        | 176/1319 [00:09<00:21, 53.59it/s] 14%|█▎        | 179/1319 [00:09<00:21, 53.59it/s] 14%|█▎        | 180/1319 [00:09<00:21, 53.59it/s] 14%|█▎        | 180/1319 [00:09<00:21, 53.59it/s] 14%|█▍        | 186/1319 [00:09<00:24, 46.95it/s] 14%|█▍        | 191/1319 [00:09<00:27, 40.99it/s] 15%|█▌        | 200/1319 [00:09<00:26, 42.04it/s] 15%|█▌        | 202/1319 [00:09<00:26, 42.04it/s] 15%|█▌        | 202/1319 [00:09<00:26, 42.04it/s] 15%|█▌        | 202/1319 [00:09<00:26, 42.04it/s] 16%|█▌        | 207/1319 [00:10<00:29, 37.59it/s] 16%|█▌        | 213/1319 [00:10<00:22, 49.48it/s] 16%|█▌        | 213/1319 [00:10<00:22, 49.48it/s] 16%|█▌        | 213/1319 [00:10<00:22, 49.48it/s] 16%|█▌        | 213/1319 [00:10<00:22, 49.48it/s] 16%|█▌        | 213/1319 [00:10<00:22, 49.48it/s] 16%|█▌        | 213/1319 [00:10<00:22, 49.48it/s] 17%|█▋        | 218/1319 [00:10<00:25, 42.42it/s] 17%|█▋        | 223/1319 [00:10<00:29, 36.91it/s] 18%|█▊        | 231/1319 [00:10<00:28, 38.71it/s] 18%|█▊        | 239/1319 [00:10<00:17, 63.40it/s] 18%|█▊        | 239/1319 [00:10<00:17, 63.40it/s] 18%|█▊        | 243/1319 [00:10<00:16, 63.40it/s] 18%|█▊        | 243/1319 [00:10<00:16, 63.40it/s] 18%|█▊        | 243/1319 [00:10<00:16, 63.40it/s] 18%|█▊        | 243/1319 [00:10<00:16, 63.40it/s] 19%|█▉        | 250/1319 [00:10<00:19, 55.51it/s] 19%|█▉        | 256/1319 [00:11<00:28, 37.06it/s] 20%|█▉        | 260/1319 [00:11<00:41, 25.76it/s] 20%|██        | 269/1319 [00:11<00:40, 25.76it/s] 21%|██        | 272/1319 [00:11<00:40, 25.76it/s] 21%|██        | 272/1319 [00:11<00:40, 25.76it/s] 21%|██        | 275/1319 [00:11<01:02, 16.77it/s] 21%|██        | 280/1319 [00:12<01:00, 17.25it/s] 22%|██▏       | 294/1319 [00:12<00:37, 27.39it/s] 23%|██▎       | 306/1319 [00:12<00:29, 34.45it/s] 24%|██▍       | 319/1319 [00:12<00:17, 56.22it/s] 24%|██▍       | 319/1319 [00:12<00:17, 56.22it/s] 24%|██▍       | 319/1319 [00:12<00:17, 56.22it/s] 25%|██▍       | 326/1319 [00:12<00:19, 51.29it/s] 25%|██▌       | 332/1319 [00:12<00:17, 55.87it/s] 25%|██▌       | 332/1319 [00:12<00:17, 55.87it/s] 25%|██▌       | 332/1319 [00:12<00:17, 55.87it/s] 25%|██▌       | 332/1319 [00:12<00:17, 55.87it/s] 25%|██▌       | 332/1319 [00:12<00:17, 55.87it/s] 26%|██▌       | 338/1319 [00:12<00:20, 47.68it/s] 26%|██▌       | 345/1319 [00:12<00:19, 51.02it/s] 28%|██▊       | 368/1319 [00:13<00:15, 61.81it/s] 28%|██▊       | 373/1319 [00:13<00:11, 84.39it/s] 29%|██▉       | 381/1319 [00:13<00:11, 84.39it/s] 29%|██▉       | 381/1319 [00:13<00:11, 84.39it/s] 29%|██▉       | 381/1319 [00:13<00:11, 84.39it/s] 29%|██▉       | 381/1319 [00:13<00:11, 84.39it/s] 30%|██▉       | 390/1319 [00:13<00:12, 76.09it/s] 30%|██▉       | 395/1319 [00:13<00:14, 65.73it/s] 30%|██▉       | 395/1319 [00:13<00:14, 65.73it/s] 30%|██▉       | 395/1319 [00:13<00:14, 65.73it/s] 30%|███       | 402/1319 [00:13<00:16, 56.81it/s] 31%|███       | 408/1319 [00:13<00:16, 56.65it/s] 31%|███▏      | 414/1319 [00:13<00:11, 81.38it/s] 31%|███▏      | 415/1319 [00:13<00:11, 81.38it/s] 31%|███▏      | 415/1319 [00:13<00:11, 81.38it/s] 31%|███▏      | 415/1319 [00:13<00:11, 81.38it/s] 31%|███▏      | 415/1319 [00:13<00:11, 81.38it/s] 32%|███▏      | 424/1319 [00:13<00:13, 68.42it/s] 33%|███▎      | 432/1319 [00:14<00:15, 56.04it/s] 33%|███▎      | 436/1319 [00:14<00:17, 49.99it/s] 33%|███▎      | 436/1319 [00:14<00:17, 49.99it/s] 33%|███▎      | 436/1319 [00:14<00:17, 49.99it/s] 34%|███▎      | 442/1319 [00:14<00:20, 42.90it/s] 34%|███▍      | 447/1319 [00:14<00:21, 39.65it/s] 34%|███▍      | 447/1319 [00:14<00:21, 39.65it/s] 34%|███▍      | 447/1319 [00:14<00:21, 39.65it/s] 35%|███▍      | 461/1319 [00:14<00:17, 48.75it/s] 37%|███▋      | 482/1319 [00:14<00:14, 56.91it/s] 38%|███▊      | 496/1319 [00:14<00:07, 108.60it/s] 38%|███▊      | 496/1319 [00:14<00:07, 108.60it/s] 38%|███▊      | 496/1319 [00:14<00:07, 108.60it/s] 38%|███▊      | 496/1319 [00:14<00:07, 108.60it/s] 38%|███▊      | 496/1319 [00:14<00:07, 108.60it/s] 38%|███▊      | 496/1319 [00:14<00:07, 108.60it/s] 38%|███▊      | 496/1319 [00:14<00:07, 108.60it/s] 38%|███▊      | 496/1319 [00:14<00:07, 108.60it/s] 38%|███▊      | 496/1319 [00:14<00:07, 108.60it/s] 38%|███▊      | 496/1319 [00:14<00:07, 108.60it/s] 38%|███▊      | 496/1319 [00:14<00:07, 108.60it/s] 38%|███▊      | 496/1319 [00:14<00:07, 108.60it/s] 38%|███▊      | 496/1319 [00:14<00:07, 108.60it/s] 38%|███▊      | 496/1319 [00:14<00:07, 108.60it/s] 38%|███▊      | 507/1319 [00:15<00:08, 98.20it/s]  39%|███▉      | 518/1319 [00:15<00:07, 101.32it/s] 39%|███▉      | 518/1319 [00:15<00:07, 101.32it/s] 39%|███▉      | 518/1319 [00:15<00:07, 101.32it/s] 39%|███▉      | 518/1319 [00:15<00:07, 101.32it/s] 39%|███▉      | 518/1319 [00:15<00:07, 101.32it/s] 39%|███▉      | 518/1319 [00:15<00:07, 101.32it/s] 39%|███▉      | 518/1319 [00:15<00:07, 101.32it/s] 39%|███▉      | 518/1319 [00:15<00:07, 101.32it/s] 39%|███▉      | 518/1319 [00:15<00:07, 101.32it/s] 39%|███▉      | 518/1319 [00:15<00:07, 101.32it/s] 40%|████      | 529/1319 [00:15<00:07, 100.30it/s] 41%|████▏     | 545/1319 [00:15<00:08, 94.14it/s]  42%|████▏     | 556/1319 [00:15<00:07, 103.24it/s] 42%|████▏     | 556/1319 [00:15<00:07, 103.24it/s] 42%|████▏     | 557/1319 [00:15<00:07, 103.24it/s] 42%|████▏     | 557/1319 [00:15<00:07, 103.24it/s] 42%|████▏     | 557/1319 [00:15<00:07, 103.24it/s] 42%|████▏     | 557/1319 [00:15<00:07, 103.24it/s] 43%|████▎     | 571/1319 [00:15<00:07, 96.21it/s]  44%|████▍     | 581/1319 [00:15<00:06, 116.08it/s] 44%|████▍     | 581/1319 [00:15<00:06, 116.08it/s] 44%|████▍     | 581/1319 [00:15<00:06, 116.08it/s] 44%|████▍     | 581/1319 [00:15<00:06, 116.08it/s] 44%|████▍     | 581/1319 [00:15<00:06, 116.08it/s] 44%|████▍     | 581/1319 [00:15<00:06, 116.08it/s] 44%|████▍     | 581/1319 [00:15<00:06, 116.08it/s] 44%|████▍     | 581/1319 [00:15<00:06, 116.08it/s] 44%|████▍     | 581/1319 [00:15<00:06, 116.08it/s] 45%|████▍     | 593/1319 [00:15<00:08, 82.81it/s]  46%|████▌     | 602/1319 [00:15<00:11, 61.18it/s] 46%|████▌     | 602/1319 [00:15<00:11, 61.18it/s] 46%|████▌     | 602/1319 [00:15<00:11, 61.18it/s] 46%|████▌     | 602/1319 [00:15<00:11, 61.18it/s] 46%|████▌     | 602/1319 [00:15<00:11, 61.18it/s] 46%|████▌     | 602/1319 [00:15<00:11, 61.18it/s] 46%|████▌     | 602/1319 [00:15<00:11, 61.18it/s] 46%|████▌     | 602/1319 [00:15<00:11, 61.18it/s] 46%|████▌     | 602/1319 [00:15<00:11, 61.18it/s] 46%|████▌     | 610/1319 [00:16<00:12, 57.67it/s] 48%|████▊     | 628/1319 [00:16<00:10, 66.93it/s] 48%|████▊     | 636/1319 [00:17<00:21, 31.32it/s] 49%|████▉     | 648/1319 [00:17<00:45, 14.63it/s] 49%|████▉     | 650/1319 [00:17<00:45, 14.63it/s] 49%|████▉     | 650/1319 [00:17<00:45, 14.63it/s] 49%|████▉     | 650/1319 [00:17<00:45, 14.63it/s] 50%|████▉     | 653/1319 [00:17<00:46, 14.31it/s] 50%|█████     | 660/1319 [00:17<00:40, 16.39it/s] 51%|█████     | 672/1319 [00:17<00:15, 40.47it/s] 51%|█████     | 672/1319 [00:17<00:15, 40.47it/s] 51%|█████     | 672/1319 [00:17<00:15, 40.47it/s] 51%|█████     | 672/1319 [00:17<00:15, 40.47it/s] 51%|█████     | 672/1319 [00:17<00:15, 40.47it/s] 51%|█████     | 672/1319 [00:17<00:15, 40.47it/s] 52%|█████▏    | 685/1319 [00:17<00:14, 43.47it/s] 52%|█████▏    | 692/1319 [00:17<00:10, 61.40it/s] 52%|█████▏    | 692/1319 [00:17<00:10, 61.40it/s] 53%|█████▎    | 694/1319 [00:17<00:10, 61.40it/s] 53%|█████▎    | 694/1319 [00:17<00:10, 61.40it/s] 53%|█████▎    | 694/1319 [00:17<00:10, 61.40it/s] 53%|█████▎    | 701/1319 [00:18<00:11, 54.27it/s] 54%|█████▎    | 707/1319 [00:18<00:11, 54.71it/s] 54%|█████▍    | 714/1319 [00:18<00:07, 81.30it/s] 54%|█████▍    | 714/1319 [00:18<00:07, 81.30it/s] 54%|█████▍    | 714/1319 [00:18<00:07, 81.30it/s] 54%|█████▍    | 714/1319 [00:18<00:07, 81.30it/s] 54%|█████▍    | 714/1319 [00:18<00:07, 81.30it/s] 55%|█████▍    | 723/1319 [00:18<00:09, 64.52it/s] 55%|█████▌    | 731/1319 [00:18<00:10, 55.07it/s] 56%|█████▌    | 741/1319 [00:18<00:10, 53.79it/s] 57%|█████▋    | 750/1319 [00:19<00:11, 49.71it/s] 57%|█████▋    | 753/1319 [00:19<00:11, 48.63it/s] 58%|█████▊    | 768/1319 [00:19<00:09, 57.32it/s] 59%|█████▉    | 779/1319 [00:19<00:09, 57.69it/s] 60%|█████▉    | 788/1319 [00:19<00:08, 63.39it/s] 61%|██████    | 800/1319 [00:19<00:02, 180.13it/s] 61%|██████    | 800/1319 [00:19<00:02, 180.13it/s] 61%|██████    | 800/1319 [00:19<00:02, 180.13it/s] 61%|██████    | 800/1319 [00:19<00:02, 180.13it/s] 61%|██████    | 800/1319 [00:19<00:02, 180.13it/s] 61%|██████    | 800/1319 [00:19<00:02, 180.13it/s] 61%|██████    | 800/1319 [00:19<00:02, 180.13it/s] 61%|██████    | 800/1319 [00:19<00:02, 180.13it/s] 61%|██████    | 800/1319 [00:19<00:02, 180.13it/s] 61%|██████    | 800/1319 [00:19<00:02, 180.13it/s] 61%|██████    | 800/1319 [00:19<00:02, 180.13it/s] 61%|██████    | 800/1319 [00:19<00:02, 180.13it/s] 62%|██████▏   | 819/1319 [00:19<00:03, 161.27it/s] 64%|██████▍   | 848/1319 [00:19<00:02, 179.26it/s] 65%|██████▍   | 854/1319 [00:19<00:01, 232.51it/s] 65%|██████▍   | 854/1319 [00:19<00:01, 232.51it/s] 65%|██████▍   | 854/1319 [00:19<00:01, 232.51it/s] 65%|██████▍   | 854/1319 [00:19<00:01, 232.51it/s] 65%|██████▍   | 854/1319 [00:19<00:01, 232.51it/s] 67%|██████▋   | 878/1319 [00:19<00:02, 210.50it/s] 68%|██████▊   | 900/1319 [00:20<00:02, 199.66it/s] 70%|███████   | 924/1319 [00:20<00:02, 193.34it/s] 72%|███████▏  | 951/1319 [00:20<00:01, 196.30it/s] 72%|███████▏  | 956/1319 [00:20<00:01, 224.42it/s] 73%|███████▎  | 960/1319 [00:20<00:01, 224.42it/s] 73%|███████▎  | 960/1319 [00:20<00:01, 224.42it/s] 73%|███████▎  | 960/1319 [00:20<00:01, 224.42it/s] 73%|███████▎  | 960/1319 [00:20<00:01, 224.42it/s] 75%|███████▍  | 983/1319 [00:20<00:01, 210.61it/s] 76%|███████▌  | 1005/1319 [00:20<00:01, 199.72it/s] 78%|███████▊  | 1034/1319 [00:20<00:01, 212.26it/s] 80%|████████  | 1056/1319 [00:20<00:01, 187.88it/s] 82%|████████▏ | 1076/1319 [00:20<00:01, 188.07it/s] 83%|████████▎ | 1096/1319 [00:21<00:01, 176.84it/s] 85%|████████▍ | 1115/1319 [00:21<00:01, 177.34it/s] 86%|████████▋ | 1139/1319 [00:21<00:00, 187.64it/s] 88%|████████▊ | 1158/1319 [00:21<00:00, 181.62it/s] 89%|████████▉ | 1177/1319 [00:21<00:00, 170.50it/s] 91%|█████████ | 1195/1319 [00:21<00:00, 159.32it/s] 92%|█████████▏| 1218/1319 [00:21<00:00, 175.51it/s] 94%|█████████▎| 1236/1319 [00:21<00:00, 155.84it/s] 94%|█████████▍| 1237/1319 [00:21<00:00, 145.92it/s] 95%|█████████▍| 1253/1319 [00:22<00:00, 122.03it/s] 96%|█████████▌| 1267/1319 [00:22<00:00, 107.05it/s] 97%|█████████▋| 1279/1319 [00:22<00:00, 82.48it/s]  98%|█████████▊| 1289/1319 [00:22<00:00, 71.69it/s] 98%|█████████▊| 1298/1319 [00:22<00:00, 66.22it/s] 99%|█████████▉| 1306/1319 [00:23<00:00, 48.06it/s] 99%|█████████▉| 1312/1319 [00:23<00:00, 32.59it/s]100%|█████████▉| 1317/1319 [00:26<00:00,  9.16it/s]100%|██████████| 1319/1319 [00:26<00:00, 50.60it/s]
Accuracy: 0.942
Invalid: 0.000
Latency: 26.268 s
Output throughput: 4819.915 token/s
Run 2 completed in 30 seconds
Run 2: Accuracy: 0.942
[progress] [==========----------------------------------------] 2/10 (20%)  | GSM8K: Run 2
Executing GSM8K test Run 3 ...
  0%|          | 0/1319 [00:00<?, ?it/s]  0%|          | 1/1319 [00:05<2:05:05,  5.69s/it]  0%|          | 3/1319 [00:05<34:01,  1.55s/it]    1%|          | 7/1319 [00:06<11:34,  1.89it/s]  1%|          | 10/1319 [00:06<07:15,  3.01it/s]  1%|▏         | 19/1319 [00:06<02:51,  7.59it/s]  2%|▏         | 24/1319 [00:06<02:09,  9.97it/s]  2%|▏         | 29/1319 [00:06<00:46, 27.87it/s]  2%|▏         | 30/1319 [00:06<00:46, 27.87it/s]  2%|▏         | 30/1319 [00:06<00:46, 27.87it/s]  2%|▏         | 30/1319 [00:06<00:46, 27.87it/s]  3%|▎         | 34/1319 [00:06<00:49, 26.03it/s]  4%|▎         | 49/1319 [00:07<00:31, 39.77it/s]  4%|▍         | 57/1319 [00:07<00:15, 80.58it/s]  5%|▍         | 60/1319 [00:07<00:15, 80.58it/s]  5%|▍         | 60/1319 [00:07<00:15, 80.58it/s]  5%|▍         | 60/1319 [00:07<00:15, 80.58it/s]  5%|▌         | 69/1319 [00:07<00:22, 55.04it/s]  6%|▌         | 81/1319 [00:07<00:32, 38.62it/s]  6%|▌         | 81/1319 [00:07<00:32, 38.62it/s]  7%|▋         | 86/1319 [00:07<00:34, 36.20it/s]  7%|▋         | 95/1319 [00:08<00:52, 23.50it/s] 10%|█         | 135/1319 [00:08<00:27, 43.31it/s] 11%|█         | 139/1319 [00:08<00:20, 56.68it/s] 11%|█▏        | 149/1319 [00:09<00:22, 51.61it/s] 11%|█▏        | 150/1319 [00:09<00:24, 47.69it/s] 12%|█▏        | 155/1319 [00:09<00:26, 43.70it/s] 12%|█▏        | 159/1319 [00:09<00:30, 38.66it/s] 13%|█▎        | 166/1319 [00:09<00:24, 47.43it/s] 13%|█▎        | 166/1319 [00:09<00:24, 47.43it/s] 13%|█▎        | 166/1319 [00:09<00:24, 47.43it/s] 13%|█▎        | 166/1319 [00:09<00:24, 47.43it/s] 13%|█▎        | 166/1319 [00:09<00:24, 47.43it/s] 13%|█▎        | 166/1319 [00:09<00:24, 47.43it/s] 13%|█▎        | 166/1319 [00:09<00:24, 47.43it/s] 13%|█▎        | 171/1319 [00:09<00:27, 41.20it/s] 13%|█▎        | 175/1319 [00:09<00:30, 37.76it/s] 13%|█▎        | 176/1319 [00:09<00:30, 37.76it/s] 14%|█▎        | 180/1319 [00:09<00:34, 33.14it/s] 14%|█▍        | 184/1319 [00:09<00:38, 29.59it/s] 15%|█▍        | 195/1319 [00:09<00:38, 29.55it/s] 15%|█▍        | 196/1319 [00:09<00:38, 29.55it/s] 15%|█▌        | 199/1319 [00:10<00:43, 25.59it/s] 16%|█▌        | 208/1319 [00:10<00:34, 32.38it/s] 16%|█▌        | 213/1319 [00:10<00:24, 44.79it/s] 16%|█▋        | 215/1319 [00:10<00:24, 44.79it/s] 17%|█▋        | 220/1319 [00:10<00:27, 39.38it/s] 17%|█▋        | 224/1319 [00:10<00:32, 33.80it/s] 18%|█▊        | 238/1319 [00:10<00:22, 47.37it/s] 18%|█▊        | 239/1319 [00:10<00:22, 47.37it/s] 18%|█▊        | 239/1319 [00:10<00:22, 47.37it/s] 18%|█▊        | 239/1319 [00:10<00:22, 47.37it/s] 18%|█▊        | 239/1319 [00:10<00:22, 47.37it/s] 18%|█▊        | 239/1319 [00:10<00:22, 47.37it/s] 18%|█▊        | 239/1319 [00:10<00:22, 47.37it/s] 18%|█▊        | 244/1319 [00:10<00:26, 40.98it/s] 19%|█▉        | 256/1319 [00:11<00:22, 47.93it/s] 20%|█▉        | 262/1319 [00:11<00:17, 60.52it/s] 20%|██        | 267/1319 [00:11<00:17, 60.52it/s] 21%|██        | 274/1319 [00:11<00:19, 52.74it/s] 21%|██▏       | 283/1319 [00:11<00:14, 70.10it/s] 22%|██▏       | 284/1319 [00:11<00:14, 70.10it/s] 22%|██▏       | 284/1319 [00:11<00:14, 70.10it/s] 22%|██▏       | 284/1319 [00:11<00:14, 70.10it/s] 22%|██▏       | 284/1319 [00:11<00:14, 70.10it/s] 22%|██▏       | 284/1319 [00:11<00:14, 70.10it/s] 22%|██▏       | 284/1319 [00:11<00:14, 70.10it/s] 22%|██▏       | 284/1319 [00:11<00:14, 70.10it/s] 22%|██▏       | 284/1319 [00:11<00:14, 70.10it/s] 22%|██▏       | 292/1319 [00:11<00:16, 61.61it/s] 23%|██▎       | 301/1319 [00:11<00:17, 58.04it/s] 23%|██▎       | 308/1319 [00:11<00:17, 56.94it/s] 24%|██▍       | 314/1319 [00:11<00:20, 50.07it/s] 25%|██▍       | 325/1319 [00:12<00:19, 51.35it/s] 25%|██▌       | 334/1319 [00:12<00:15, 64.16it/s] 26%|██▌       | 339/1319 [00:12<00:15, 64.16it/s] 26%|██▌       | 342/1319 [00:12<00:15, 64.16it/s] 26%|██▌       | 342/1319 [00:12<00:15, 64.16it/s] 26%|██▋       | 349/1319 [00:12<00:17, 54.44it/s] 27%|██▋       | 352/1319 [00:12<00:20, 47.09it/s] 27%|██▋       | 352/1319 [00:12<00:20, 47.09it/s] 27%|██▋       | 357/1319 [00:12<00:23, 40.99it/s] 28%|██▊       | 368/1319 [00:12<00:18, 52.07it/s] 28%|██▊       | 372/1319 [00:12<00:09, 100.69it/s] 28%|██▊       | 373/1319 [00:12<00:09, 100.69it/s] 28%|██▊       | 375/1319 [00:12<00:09, 100.69it/s] 28%|██▊       | 375/1319 [00:12<00:09, 100.69it/s] 29%|██▉       | 386/1319 [00:13<00:18, 49.34it/s]  31%|███       | 403/1319 [00:13<00:15, 59.13it/s] 32%|███▏      | 428/1319 [00:13<00:13, 67.93it/s] 33%|███▎      | 438/1319 [00:13<00:11, 79.54it/s] 33%|███▎      | 440/1319 [00:13<00:11, 79.54it/s] 34%|███▍      | 449/1319 [00:13<00:10, 80.11it/s] 34%|███▍      | 451/1319 [00:13<00:10, 86.08it/s] 34%|███▍      | 451/1319 [00:13<00:10, 86.08it/s] 35%|███▍      | 461/1319 [00:14<00:13, 63.27it/s] 35%|███▌      | 466/1319 [00:14<00:17, 48.60it/s] 35%|███▌      | 467/1319 [00:14<00:17, 48.60it/s] 36%|███▌      | 473/1319 [00:14<00:19, 43.56it/s] 37%|███▋      | 482/1319 [00:14<00:13, 62.17it/s] 37%|███▋      | 482/1319 [00:14<00:13, 62.17it/s] 37%|███▋      | 482/1319 [00:14<00:13, 62.17it/s] 37%|███▋      | 482/1319 [00:14<00:13, 62.17it/s] 37%|███▋      | 482/1319 [00:14<00:13, 62.17it/s] 37%|███▋      | 482/1319 [00:14<00:13, 62.17it/s] 37%|███▋      | 482/1319 [00:14<00:13, 62.17it/s] 37%|███▋      | 482/1319 [00:14<00:13, 62.17it/s] 37%|███▋      | 482/1319 [00:14<00:13, 62.17it/s] 37%|███▋      | 489/1319 [00:14<00:15, 54.80it/s] 37%|███▋      | 492/1319 [00:14<00:16, 50.27it/s] 37%|███▋      | 492/1319 [00:14<00:16, 50.27it/s] 37%|███▋      | 492/1319 [00:14<00:16, 50.27it/s] 38%|███▊      | 498/1319 [00:14<00:16, 50.68it/s] 38%|███▊      | 503/1319 [00:14<00:10, 76.35it/s] 38%|███▊      | 503/1319 [00:14<00:10, 76.35it/s] 38%|███▊      | 503/1319 [00:14<00:10, 76.35it/s] 38%|███▊      | 503/1319 [00:14<00:10, 76.35it/s] 38%|███▊      | 503/1319 [00:14<00:10, 76.35it/s] 39%|███▊      | 511/1319 [00:14<00:10, 75.05it/s] 39%|███▉      | 513/1319 [00:14<00:10, 80.27it/s] 39%|███▉      | 513/1319 [00:14<00:10, 80.27it/s] 40%|███▉      | 523/1319 [00:14<00:11, 69.15it/s] 40%|████      | 533/1319 [00:14<00:11, 65.88it/s] 40%|████      | 534/1319 [00:14<00:11, 65.88it/s] 41%|████      | 535/1319 [00:14<00:11, 65.88it/s] 41%|████      | 542/1319 [00:15<00:27, 28.22it/s] 43%|████▎     | 562/1319 [00:15<00:19, 38.90it/s] 43%|████▎     | 566/1319 [00:15<00:15, 48.05it/s] 43%|████▎     | 573/1319 [00:16<00:16, 44.86it/s] 44%|████▎     | 577/1319 [00:16<00:16, 44.37it/s] 44%|████▎     | 577/1319 [00:16<00:16, 44.37it/s] 44%|████▎     | 577/1319 [00:16<00:16, 44.37it/s] 44%|████▍     | 586/1319 [00:16<00:18, 39.41it/s] 45%|████▌     | 597/1319 [00:16<00:17, 41.96it/s] 45%|████▌     | 600/1319 [00:16<00:17, 41.96it/s] 45%|████▌     | 600/1319 [00:16<00:17, 41.96it/s] 45%|████▌     | 600/1319 [00:16<00:17, 41.96it/s] 45%|████▌     | 600/1319 [00:16<00:17, 41.96it/s] 46%|████▌     | 610/1319 [00:16<00:15, 44.51it/s] 47%|████▋     | 618/1319 [00:16<00:15, 43.91it/s] 48%|████▊     | 630/1319 [00:16<00:14, 48.28it/s] 49%|████▊     | 642/1319 [00:17<00:13, 49.12it/s] 50%|█████     | 666/1319 [00:17<00:09, 70.69it/s] 51%|█████▏    | 676/1319 [00:17<00:09, 65.17it/s] 52%|█████▏    | 689/1319 [00:17<00:09, 63.64it/s] 53%|█████▎    | 701/1319 [00:17<00:05, 104.63it/s] 53%|█████▎    | 701/1319 [00:17<00:05, 104.63it/s] 53%|█████▎    | 701/1319 [00:17<00:05, 104.63it/s] 53%|█████▎    | 701/1319 [00:17<00:05, 104.63it/s] 53%|█████▎    | 701/1319 [00:17<00:05, 104.63it/s] 53%|█████▎    | 701/1319 [00:17<00:05, 104.63it/s] 53%|█████▎    | 701/1319 [00:17<00:05, 104.63it/s] 53%|█████▎    | 701/1319 [00:17<00:05, 104.63it/s] 53%|█████▎    | 701/1319 [00:17<00:05, 104.63it/s] 53%|█████▎    | 701/1319 [00:17<00:05, 104.63it/s] 53%|█████▎    | 701/1319 [00:17<00:05, 104.63it/s] 53%|█████▎    | 701/1319 [00:17<00:05, 104.63it/s] 54%|█████▍    | 712/1319 [00:18<00:07, 78.50it/s]  54%|█████▍    | 713/1319 [00:18<00:09, 64.48it/s] 56%|█████▌    | 734/1319 [00:18<00:07, 77.03it/s] 56%|█████▌    | 740/1319 [00:18<00:04, 135.50it/s] 56%|█████▌    | 741/1319 [00:18<00:04, 135.50it/s] 56%|█████▌    | 741/1319 [00:18<00:04, 135.50it/s] 56%|█████▌    | 741/1319 [00:18<00:04, 135.50it/s] 56%|█████▌    | 741/1319 [00:18<00:04, 135.50it/s] 56%|█████▌    | 741/1319 [00:18<00:04, 135.50it/s] 57%|█████▋    | 755/1319 [00:18<00:04, 117.37it/s] 58%|█████▊    | 768/1319 [00:18<00:05, 103.48it/s] 58%|█████▊    | 769/1319 [00:18<00:05, 95.37it/s]  59%|█████▉    | 779/1319 [00:18<00:06, 79.05it/s] 60%|██████    | 792/1319 [00:18<00:05, 96.35it/s] 60%|██████    | 792/1319 [00:18<00:05, 96.35it/s] 60%|██████    | 792/1319 [00:18<00:05, 96.35it/s] 60%|██████    | 792/1319 [00:18<00:05, 96.35it/s] 60%|██████    | 792/1319 [00:18<00:05, 96.35it/s] 60%|██████    | 792/1319 [00:18<00:05, 96.35it/s] 60%|██████    | 792/1319 [00:18<00:05, 96.35it/s] 60%|██████    | 792/1319 [00:18<00:05, 96.35it/s] 60%|██████    | 792/1319 [00:18<00:05, 96.35it/s] 60%|██████    | 792/1319 [00:18<00:05, 96.35it/s] 60%|██████    | 792/1319 [00:18<00:05, 96.35it/s] 60%|██████    | 792/1319 [00:18<00:05, 96.35it/s] 60%|██████    | 792/1319 [00:18<00:05, 96.35it/s] 61%|██████    | 802/1319 [00:19<00:06, 85.46it/s] 63%|██████▎   | 836/1319 [00:19<00:03, 120.86it/s] 64%|██████▍   | 843/1319 [00:19<00:03, 152.00it/s] 65%|██████▌   | 860/1319 [00:19<00:02, 155.54it/s] 66%|██████▌   | 865/1319 [00:19<00:02, 184.48it/s] 66%|██████▌   | 865/1319 [00:19<00:02, 184.48it/s] 66%|██████▌   | 865/1319 [00:19<00:02, 184.48it/s] 66%|██████▌   | 865/1319 [00:19<00:02, 184.48it/s] 67%|██████▋   | 885/1319 [00:19<00:02, 172.64it/s] 69%|██████▉   | 913/1319 [00:19<00:02, 185.09it/s] 70%|██████▉   | 922/1319 [00:19<00:01, 259.32it/s] 70%|██████▉   | 922/1319 [00:19<00:01, 259.32it/s] 70%|██████▉   | 922/1319 [00:19<00:01, 259.32it/s] 70%|██████▉   | 922/1319 [00:19<00:01, 259.32it/s] 70%|██████▉   | 922/1319 [00:19<00:01, 259.32it/s] 70%|██████▉   | 922/1319 [00:19<00:01, 259.32it/s] 70%|██████▉   | 922/1319 [00:19<00:01, 259.32it/s] 70%|██████▉   | 922/1319 [00:19<00:01, 259.32it/s] 70%|██████▉   | 922/1319 [00:19<00:01, 259.32it/s] 72%|███████▏  | 948/1319 [00:19<00:01, 221.05it/s] 74%|███████▎  | 972/1319 [00:19<00:01, 210.30it/s] 76%|███████▌  | 999/1319 [00:19<00:01, 211.22it/s] 77%|███████▋  | 1021/1319 [00:20<00:01, 203.06it/s] 79%|███████▉  | 1042/1319 [00:20<00:01, 177.09it/s] 81%|████████  | 1062/1319 [00:20<00:01, 175.40it/s] 81%|████████  | 1067/1319 [00:20<00:01, 183.28it/s] 81%|████████  | 1067/1319 [00:20<00:01, 183.28it/s] 81%|████████  | 1067/1319 [00:20<00:01, 183.28it/s] 82%|████████▏ | 1086/1319 [00:20<00:01, 173.59it/s] 84%|████████▍ | 1105/1319 [00:20<00:01, 166.71it/s] 85%|████████▌ | 1125/1319 [00:20<00:01, 167.27it/s] 87%|████████▋ | 1146/1319 [00:20<00:00, 173.00it/s] 88%|████████▊ | 1165/1319 [00:20<00:00, 174.38it/s] 90%|████████▉ | 1183/1319 [00:21<00:00, 152.07it/s] 91%|█████████▏| 1205/1319 [00:21<00:00, 164.31it/s] 93%|█████████▎| 1222/1319 [00:21<00:00, 162.28it/s] 94%|█████████▍| 1239/1319 [00:21<00:00, 127.73it/s] 95%|█████████▌| 1254/1319 [00:21<00:00, 100.93it/s] 96%|█████████▌| 1266/1319 [00:21<00:00, 96.86it/s]  97%|█████████▋| 1277/1319 [00:22<00:00, 78.81it/s] 97%|█████████▋| 1278/1319 [00:22<00:00, 69.77it/s] 97%|█████████▋| 1286/1319 [00:22<00:00, 68.01it/s] 98%|█████████▊| 1294/1319 [00:22<00:00, 67.25it/s] 99%|█████████▊| 1302/1319 [00:22<00:00, 48.79it/s] 99%|█████████▉| 1308/1319 [00:24<00:00, 13.66it/s]100%|█████████▉| 1313/1319 [00:25<00:00,  8.64it/s]100%|██████████| 1319/1319 [00:25<00:00, 50.96it/s]
Accuracy: 0.940
Invalid: 0.000
Latency: 26.079 s
Output throughput: 4997.221 token/s
Run 3 completed in 31 seconds
Run 3: Accuracy: 0.940
[progress] [===============-----------------------------------] 3/10 (30%)  | GSM8K: Run 3
Executing GSM8K test Run 4 ...
  0%|          | 0/1319 [00:00<?, ?it/s]  0%|          | 1/1319 [00:04<1:43:33,  4.71s/it]  0%|          | 2/1319 [00:05<55:33,  2.53s/it]    0%|          | 3/1319 [00:05<32:06,  1.46s/it]  0%|          | 4/1319 [00:06<21:01,  1.04it/s]  1%|          | 8/1319 [00:06<07:08,  3.06it/s]  1%|          | 13/1319 [00:06<02:11,  9.95it/s]  1%|          | 13/1319 [00:06<02:11,  9.95it/s]  1%|          | 16/1319 [00:06<01:58, 11.02it/s]  2%|▏         | 25/1319 [00:06<01:09, 18.62it/s]  2%|▏         | 31/1319 [00:06<00:59, 21.65it/s]  3%|▎         | 40/1319 [00:06<00:19, 66.68it/s]  3%|▎         | 40/1319 [00:06<00:19, 66.68it/s]  3%|▎         | 40/1319 [00:06<00:19, 66.68it/s]  3%|▎         | 40/1319 [00:06<00:19, 66.68it/s]  3%|▎         | 40/1319 [00:06<00:19, 66.68it/s]  3%|▎         | 40/1319 [00:06<00:19, 66.68it/s]  3%|▎         | 40/1319 [00:06<00:19, 66.68it/s]  3%|▎         | 40/1319 [00:06<00:19, 66.68it/s]  3%|▎         | 40/1319 [00:06<00:19, 66.68it/s]  4%|▎         | 47/1319 [00:07<00:29, 43.75it/s]  4%|▍         | 53/1319 [00:07<00:33, 38.32it/s]  5%|▍         | 62/1319 [00:07<00:25, 49.59it/s]  5%|▍         | 62/1319 [00:07<00:25, 49.59it/s]  5%|▍         | 62/1319 [00:07<00:25, 49.59it/s]  5%|▍         | 62/1319 [00:07<00:25, 49.59it/s]  5%|▍         | 62/1319 [00:07<00:25, 49.59it/s]  5%|▍         | 62/1319 [00:07<00:25, 49.59it/s]  5%|▍         | 62/1319 [00:07<00:25, 49.59it/s]  5%|▍         | 62/1319 [00:07<00:25, 49.59it/s]  5%|▌         | 67/1319 [00:07<00:28, 44.25it/s]  5%|▌         | 72/1319 [00:07<00:31, 39.56it/s]  6%|▋         | 83/1319 [00:08<00:27, 44.89it/s]  7%|▋         | 96/1319 [00:08<00:42, 28.73it/s]  8%|▊         | 110/1319 [00:08<00:52, 22.96it/s]  8%|▊         | 111/1319 [00:08<00:52, 22.96it/s]  8%|▊         | 112/1319 [00:08<00:52, 22.96it/s]  8%|▊         | 112/1319 [00:08<00:52, 22.96it/s] 11%|█         | 140/1319 [00:08<00:32, 35.91it/s] 11%|█         | 148/1319 [00:09<00:18, 63.86it/s] 11%|█         | 148/1319 [00:09<00:18, 63.86it/s] 12%|█▏        | 158/1319 [00:09<00:22, 52.16it/s] 12%|█▏        | 164/1319 [00:09<00:30, 37.83it/s] 12%|█▏        | 164/1319 [00:09<00:30, 37.83it/s] 13%|█▎        | 165/1319 [00:09<00:30, 37.83it/s] 13%|█▎        | 170/1319 [00:09<00:32, 35.85it/s] 13%|█▎        | 174/1319 [00:09<00:34, 32.85it/s] 14%|█▎        | 181/1319 [00:09<00:26, 42.54it/s] 14%|█▎        | 181/1319 [00:09<00:26, 42.54it/s] 14%|█▎        | 181/1319 [00:09<00:26, 42.54it/s] 14%|█▎        | 181/1319 [00:09<00:26, 42.54it/s] 14%|█▎        | 181/1319 [00:09<00:26, 42.54it/s] 14%|█▎        | 181/1319 [00:09<00:26, 42.54it/s] 14%|█▍        | 186/1319 [00:09<00:29, 37.91it/s] 15%|█▍        | 195/1319 [00:09<00:18, 62.43it/s] 15%|█▍        | 195/1319 [00:09<00:18, 62.43it/s] 15%|█▍        | 195/1319 [00:09<00:18, 62.43it/s] 15%|█▍        | 195/1319 [00:09<00:18, 62.43it/s] 15%|█▍        | 195/1319 [00:09<00:18, 62.43it/s] 15%|█▍        | 195/1319 [00:09<00:18, 62.43it/s] 15%|█▍        | 195/1319 [00:09<00:18, 62.43it/s] 15%|█▍        | 195/1319 [00:09<00:18, 62.43it/s] 15%|█▍        | 195/1319 [00:09<00:18, 62.43it/s] 15%|█▌        | 202/1319 [00:10<00:20, 55.00it/s] 16%|█▌        | 210/1319 [00:10<00:17, 64.66it/s] 16%|█▌        | 210/1319 [00:10<00:17, 64.66it/s] 16%|█▌        | 210/1319 [00:10<00:17, 64.66it/s] 16%|█▌        | 210/1319 [00:10<00:17, 64.66it/s] 16%|█▌        | 210/1319 [00:10<00:17, 64.66it/s] 16%|█▌        | 210/1319 [00:10<00:17, 64.66it/s] 16%|█▌        | 210/1319 [00:10<00:17, 64.66it/s] 16%|█▋        | 217/1319 [00:10<00:19, 56.54it/s] 17%|█▋        | 226/1319 [00:10<00:20, 54.16it/s] 18%|█▊        | 234/1319 [00:10<00:13, 79.83it/s] 18%|█▊        | 234/1319 [00:10<00:13, 79.83it/s] 18%|█▊        | 234/1319 [00:10<00:13, 79.83it/s] 18%|█▊        | 234/1319 [00:10<00:13, 79.83it/s] 18%|█▊        | 234/1319 [00:10<00:13, 79.83it/s] 18%|█▊        | 234/1319 [00:10<00:13, 79.83it/s] 18%|█▊        | 234/1319 [00:10<00:13, 79.83it/s] 18%|█▊        | 234/1319 [00:10<00:13, 79.83it/s] 18%|█▊        | 242/1319 [00:10<00:15, 68.30it/s] 19%|█▉        | 249/1319 [00:10<00:18, 59.10it/s] 20%|█▉        | 262/1319 [00:10<00:13, 78.90it/s] 20%|█▉        | 262/1319 [00:10<00:13, 78.90it/s] 20%|█▉        | 262/1319 [00:10<00:13, 78.90it/s] 20%|█▉        | 262/1319 [00:10<00:13, 78.90it/s] 20%|█▉        | 262/1319 [00:10<00:13, 78.90it/s] 20%|█▉        | 262/1319 [00:10<00:13, 78.90it/s] 20%|█▉        | 262/1319 [00:10<00:13, 78.90it/s] 20%|█▉        | 262/1319 [00:10<00:13, 78.90it/s] 20%|█▉        | 262/1319 [00:10<00:13, 78.90it/s] 20%|█▉        | 262/1319 [00:10<00:13, 78.90it/s] 20%|██        | 270/1319 [00:11<00:15, 68.11it/s] 21%|██        | 277/1319 [00:11<00:17, 58.67it/s] 21%|██▏       | 283/1319 [00:11<00:20, 50.83it/s] 22%|██▏       | 294/1319 [00:11<00:19, 53.02it/s] 23%|██▎       | 309/1319 [00:11<00:16, 60.94it/s] 24%|██▍       | 321/1319 [00:11<00:08, 124.02it/s] 24%|██▍       | 321/1319 [00:11<00:08, 124.02it/s] 24%|██▍       | 321/1319 [00:11<00:08, 124.02it/s] 24%|██▍       | 321/1319 [00:11<00:08, 124.02it/s] 24%|██▍       | 321/1319 [00:11<00:08, 124.02it/s] 24%|██▍       | 321/1319 [00:11<00:08, 124.02it/s] 24%|██▍       | 321/1319 [00:11<00:08, 124.02it/s] 24%|██▍       | 321/1319 [00:11<00:08, 124.02it/s] 24%|██▍       | 321/1319 [00:11<00:08, 124.02it/s] 24%|██▍       | 321/1319 [00:11<00:08, 124.02it/s] 24%|██▍       | 321/1319 [00:11<00:08, 124.02it/s] 25%|██▌       | 334/1319 [00:12<00:09, 109.44it/s] 26%|██▌       | 345/1319 [00:12<00:10, 91.31it/s]  27%|██▋       | 355/1319 [00:12<00:12, 77.69it/s] 29%|██▉       | 386/1319 [00:12<00:08, 104.82it/s] 30%|███       | 397/1319 [00:12<00:13, 68.00it/s]  31%|███       | 406/1319 [00:13<00:16, 55.27it/s] 32%|███▏      | 423/1319 [00:13<00:14, 60.55it/s] 33%|███▎      | 434/1319 [00:13<00:07, 112.82it/s] 33%|███▎      | 434/1319 [00:13<00:07, 112.82it/s] 33%|███▎      | 434/1319 [00:13<00:07, 112.82it/s] 33%|███▎      | 434/1319 [00:13<00:07, 112.82it/s] 33%|███▎      | 434/1319 [00:13<00:07, 112.82it/s] 33%|███▎      | 434/1319 [00:13<00:07, 112.82it/s] 33%|███▎      | 434/1319 [00:13<00:07, 112.82it/s] 33%|███▎      | 434/1319 [00:13<00:07, 112.82it/s] 33%|███▎      | 434/1319 [00:13<00:07, 112.82it/s] 33%|███▎      | 434/1319 [00:13<00:07, 112.82it/s] 33%|███▎      | 434/1319 [00:13<00:07, 112.82it/s] 34%|███▍      | 447/1319 [00:13<00:08, 100.99it/s] 35%|███▌      | 463/1319 [00:13<00:10, 85.09it/s]  36%|███▌      | 472/1319 [00:14<00:11, 73.67it/s] 36%|███▋      | 481/1319 [00:14<00:12, 64.61it/s] 37%|███▋      | 493/1319 [00:14<00:14, 57.51it/s] 37%|███▋      | 494/1319 [00:14<00:14, 57.51it/s] 37%|███▋      | 494/1319 [00:14<00:14, 57.51it/s] 37%|███▋      | 494/1319 [00:14<00:14, 57.51it/s] 38%|███▊      | 506/1319 [00:14<00:15, 51.08it/s] 39%|███▉      | 517/1319 [00:14<00:16, 48.53it/s] 39%|███▉      | 517/1319 [00:14<00:16, 48.53it/s] 39%|███▉      | 518/1319 [00:14<00:16, 48.53it/s] 40%|████      | 529/1319 [00:15<00:17, 44.90it/s] 41%|████      | 539/1319 [00:15<00:12, 62.91it/s] 41%|████      | 540/1319 [00:15<00:12, 62.91it/s] 41%|████      | 540/1319 [00:15<00:12, 62.91it/s] 41%|████      | 540/1319 [00:15<00:12, 62.91it/s] 41%|████      | 540/1319 [00:15<00:12, 62.91it/s] 41%|████      | 540/1319 [00:15<00:12, 62.91it/s] 41%|████      | 540/1319 [00:15<00:12, 62.91it/s] 41%|████      | 540/1319 [00:15<00:12, 62.91it/s] 41%|████      | 540/1319 [00:15<00:12, 62.91it/s] 41%|████      | 540/1319 [00:15<00:12, 62.91it/s] 41%|████▏     | 547/1319 [00:15<00:13, 56.33it/s] 42%|████▏     | 553/1319 [00:15<00:17, 43.82it/s] 42%|████▏     | 560/1319 [00:15<00:24, 31.55it/s] 43%|████▎     | 562/1319 [00:15<00:23, 31.55it/s] 43%|████▎     | 562/1319 [00:15<00:23, 31.55it/s] 43%|████▎     | 562/1319 [00:15<00:23, 31.55it/s] 43%|████▎     | 566/1319 [00:15<00:25, 29.02it/s] 43%|████▎     | 573/1319 [00:15<00:25, 29.01it/s] 44%|████▍     | 578/1319 [00:15<00:23, 32.11it/s] 44%|████▍     | 583/1319 [00:15<00:22, 32.11it/s] 45%|████▍     | 587/1319 [00:16<00:22, 32.74it/s] 46%|████▌     | 604/1319 [00:16<00:14, 48.57it/s] 46%|████▌     | 610/1319 [00:16<00:08, 82.22it/s] 46%|████▋     | 612/1319 [00:16<00:08, 82.22it/s] 46%|████▋     | 612/1319 [00:16<00:08, 82.22it/s] 47%|████▋     | 621/1319 [00:16<00:09, 70.81it/s] 48%|████▊     | 636/1319 [00:16<00:09, 73.92it/s] 49%|████▉     | 644/1319 [00:16<00:09, 71.24it/s] 51%|█████▏    | 676/1319 [00:16<00:05, 108.65it/s] 53%|█████▎    | 704/1319 [00:17<00:04, 123.30it/s] 54%|█████▍    | 709/1319 [00:17<00:04, 144.31it/s] 54%|█████▍    | 709/1319 [00:17<00:04, 144.31it/s] 55%|█████▍    | 724/1319 [00:17<00:04, 142.78it/s] 56%|█████▌    | 739/1319 [00:17<00:04, 120.21it/s] 57%|█████▋    | 752/1319 [00:17<00:06, 86.50it/s]  57%|█████▋    | 755/1319 [00:17<00:07, 70.97it/s] 58%|█████▊    | 764/1319 [00:17<00:07, 72.46it/s] 59%|█████▊    | 774/1319 [00:17<00:04, 118.55it/s] 59%|█████▊    | 774/1319 [00:17<00:04, 118.55it/s] 59%|█████▊    | 774/1319 [00:17<00:04, 118.55it/s] 59%|█████▊    | 774/1319 [00:17<00:04, 118.55it/s] 59%|█████▊    | 774/1319 [00:17<00:04, 118.55it/s] 59%|█████▊    | 774/1319 [00:17<00:04, 118.55it/s] 59%|█████▊    | 774/1319 [00:17<00:04, 118.55it/s] 60%|█████▉    | 787/1319 [00:18<00:06, 80.70it/s]  61%|██████    | 805/1319 [00:18<00:07, 73.26it/s] 62%|██████▏   | 816/1319 [00:18<00:07, 71.17it/s] 62%|██████▏   | 817/1319 [00:18<00:07, 71.17it/s] 62%|██████▏   | 817/1319 [00:18<00:07, 71.17it/s] 63%|██████▎   | 830/1319 [00:18<00:06, 78.73it/s] 63%|██████▎   | 836/1319 [00:18<00:05, 87.84it/s] 64%|██████▍   | 847/1319 [00:18<00:05, 84.21it/s] 66%|██████▌   | 873/1319 [00:18<00:04, 110.33it/s] 67%|██████▋   | 881/1319 [00:18<00:01, 220.08it/s] 67%|██████▋   | 881/1319 [00:18<00:01, 220.08it/s] 67%|██████▋   | 881/1319 [00:18<00:01, 220.08it/s] 67%|██████▋   | 881/1319 [00:18<00:01, 220.08it/s] 67%|██████▋   | 881/1319 [00:18<00:01, 220.08it/s] 67%|██████▋   | 881/1319 [00:18<00:01, 220.08it/s] 67%|██████▋   | 881/1319 [00:18<00:01, 220.08it/s] 67%|██████▋   | 881/1319 [00:18<00:01, 220.08it/s] 69%|██████▊   | 904/1319 [00:18<00:01, 207.54it/s] 69%|██████▊   | 905/1319 [00:18<00:02, 200.47it/s] 70%|███████   | 926/1319 [00:19<00:02, 186.93it/s] 71%|███████   | 931/1319 [00:19<00:02, 178.83it/s] 71%|███████   | 931/1319 [00:19<00:02, 178.83it/s] 71%|███████   | 931/1319 [00:19<00:02, 178.83it/s] 71%|███████   | 931/1319 [00:19<00:02, 178.83it/s] 72%|███████▏  | 949/1319 [00:19<00:02, 167.12it/s] 74%|███████▍  | 974/1319 [00:19<00:01, 175.64it/s] 76%|███████▌  | 996/1319 [00:19<00:01, 176.60it/s] 77%|███████▋  | 1014/1319 [00:19<00:01, 164.87it/s] 78%|███████▊  | 1032/1319 [00:19<00:01, 160.60it/s] 78%|███████▊  | 1033/1319 [00:19<00:01, 159.68it/s] 80%|███████▉  | 1049/1319 [00:19<00:01, 153.91it/s] 81%|████████  | 1071/1319 [00:19<00:01, 169.83it/s] 83%|████████▎ | 1094/1319 [00:20<00:01, 174.63it/s] 84%|████████▍ | 1114/1319 [00:20<00:01, 172.20it/s] 85%|████████▍ | 1121/1319 [00:20<00:00, 206.40it/s] 85%|████████▍ | 1121/1319 [00:20<00:00, 206.40it/s] 85%|████████▍ | 1121/1319 [00:20<00:00, 206.40it/s] 85%|████████▍ | 1121/1319 [00:20<00:00, 206.40it/s] 85%|████████▍ | 1121/1319 [00:20<00:00, 206.40it/s] 85%|████████▍ | 1121/1319 [00:20<00:00, 206.40it/s] 85%|████████▍ | 1121/1319 [00:20<00:00, 206.40it/s] 87%|████████▋ | 1142/1319 [00:20<00:00, 203.42it/s] 89%|████████▉ | 1171/1319 [00:20<00:00, 221.82it/s] 91%|█████████ | 1194/1319 [00:20<00:00, 182.10it/s] 92%|█████████▏| 1214/1319 [00:20<00:00, 183.30it/s] 94%|█████████▎| 1234/1319 [00:20<00:00, 145.83it/s] 94%|█████████▎| 1235/1319 [00:20<00:00, 128.08it/s] 95%|█████████▍| 1250/1319 [00:21<00:00, 127.27it/s] 96%|█████████▌| 1264/1319 [00:21<00:00, 107.18it/s] 97%|█████████▋| 1276/1319 [00:21<00:00, 90.56it/s]  97%|█████████▋| 1286/1319 [00:21<00:00, 70.46it/s] 98%|█████████▊| 1295/1319 [00:21<00:00, 64.73it/s] 99%|█████████▉| 1303/1319 [00:22<00:00, 47.90it/s] 99%|█████████▉| 1309/1319 [00:22<00:00, 28.40it/s]100%|█████████▉| 1314/1319 [00:25<00:00,  8.79it/s]100%|█████████▉| 1317/1319 [00:25<00:00,  4.06it/s]100%|█████████▉| 1317/1319 [00:25<00:00,  4.06it/s]100%|█████████▉| 1317/1319 [00:25<00:00,  4.06it/s]100%|██████████| 1319/1319 [00:25<00:00,  4.06it/s]100%|██████████| 1319/1319 [00:25<00:00, 51.36it/s]
Accuracy: 0.947
Invalid: 0.000
Latency: 25.872 s
Output throughput: 4977.598 token/s
Run 4 completed in 30 seconds
Run 4: Accuracy: 0.947
[progress] [====================------------------------------] 4/10 (40%)  | GSM8K: Run 4
Executing GSM8K test Run 5 ...
  0%|          | 0/1319 [00:00<?, ?it/s]  0%|          | 1/1319 [00:04<1:43:24,  4.71s/it]  0%|          | 2/1319 [00:05<58:33,  2.67s/it]    1%|          | 8/1319 [00:06<10:14,  2.13it/s]  1%|          | 13/1319 [00:06<02:37,  8.29it/s]  1%|          | 14/1319 [00:06<02:37,  8.29it/s]  1%|▏         | 17/1319 [00:06<02:21,  9.18it/s]  2%|▏         | 22/1319 [00:06<01:50, 11.74it/s]  2%|▏         | 24/1319 [00:06<01:05, 19.65it/s]  2%|▏         | 24/1319 [00:06<01:05, 19.65it/s]  2%|▏         | 29/1319 [00:06<01:04, 20.00it/s]  3%|▎         | 35/1319 [00:06<00:40, 31.67it/s]  3%|▎         | 37/1319 [00:06<00:40, 31.67it/s]  3%|▎         | 37/1319 [00:06<00:40, 31.67it/s]  3%|▎         | 37/1319 [00:06<00:40, 31.67it/s]  3%|▎         | 41/1319 [00:06<00:44, 28.85it/s]  3%|▎         | 45/1319 [00:07<00:47, 26.58it/s]  5%|▍         | 62/1319 [00:07<00:27, 45.41it/s]  5%|▌         | 67/1319 [00:07<00:15, 83.39it/s]  5%|▌         | 68/1319 [00:07<00:15, 83.39it/s]  5%|▌         | 68/1319 [00:07<00:15, 83.39it/s]  6%|▌         | 77/1319 [00:07<00:17, 72.48it/s]  6%|▋         | 85/1319 [00:07<00:19, 63.71it/s]  7%|▋         | 88/1319 [00:07<00:20, 59.08it/s]  7%|▋         | 94/1319 [00:08<00:44, 27.63it/s]  8%|▊         | 104/1319 [00:08<01:18, 15.42it/s]  8%|▊         | 105/1319 [00:08<01:18, 15.42it/s]  8%|▊         | 105/1319 [00:08<01:18, 15.42it/s]  8%|▊         | 105/1319 [00:08<01:18, 15.42it/s]  8%|▊         | 105/1319 [00:08<01:18, 15.42it/s]  8%|▊         | 105/1319 [00:08<01:18, 15.42it/s] 10%|▉         | 130/1319 [00:08<00:44, 26.86it/s] 11%|█         | 139/1319 [00:08<00:39, 29.58it/s] 11%|█         | 144/1319 [00:08<00:35, 33.25it/s] 11%|█▏        | 150/1319 [00:09<00:36, 32.03it/s] 12%|█▏        | 153/1319 [00:09<00:35, 33.14it/s] 12%|█▏        | 154/1319 [00:09<00:35, 33.14it/s] 12%|█▏        | 158/1319 [00:09<00:38, 30.23it/s] 13%|█▎        | 165/1319 [00:09<00:35, 32.26it/s] 13%|█▎        | 172/1319 [00:09<00:34, 33.45it/s] 14%|█▍        | 182/1319 [00:09<00:24, 47.05it/s] 14%|█▍        | 183/1319 [00:09<00:24, 47.05it/s] 14%|█▍        | 183/1319 [00:09<00:24, 47.05it/s] 14%|█▍        | 183/1319 [00:09<00:24, 47.05it/s] 14%|█▍        | 188/1319 [00:09<00:27, 41.32it/s] 14%|█▍        | 191/1319 [00:09<00:29, 38.48it/s] 15%|█▍        | 192/1319 [00:09<00:29, 38.48it/s] 15%|█▍        | 196/1319 [00:09<00:33, 33.38it/s] 15%|█▌        | 201/1319 [00:10<00:35, 31.26it/s] 16%|█▋        | 216/1319 [00:10<00:24, 45.54it/s] 18%|█▊        | 234/1319 [00:10<00:07, 148.17it/s] 18%|█▊        | 235/1319 [00:10<00:07, 148.17it/s] 18%|█▊        | 235/1319 [00:10<00:07, 148.17it/s] 18%|█▊        | 235/1319 [00:10<00:07, 148.17it/s] 18%|█▊        | 235/1319 [00:10<00:07, 148.17it/s] 18%|█▊        | 235/1319 [00:10<00:07, 148.17it/s] 18%|█▊        | 235/1319 [00:10<00:07, 148.17it/s] 18%|█▊        | 235/1319 [00:10<00:07, 148.17it/s] 18%|█▊        | 235/1319 [00:10<00:07, 148.17it/s] 18%|█▊        | 235/1319 [00:10<00:07, 148.17it/s] 18%|█▊        | 235/1319 [00:10<00:07, 148.17it/s] 18%|█▊        | 235/1319 [00:10<00:07, 148.17it/s] 18%|█▊        | 235/1319 [00:10<00:07, 148.17it/s] 18%|█▊        | 235/1319 [00:10<00:07, 148.17it/s] 18%|█▊        | 235/1319 [00:10<00:07, 148.17it/s] 18%|█▊        | 235/1319 [00:10<00:07, 148.17it/s] 19%|█▉        | 250/1319 [00:10<00:10, 105.64it/s] 19%|█▉        | 251/1319 [00:10<00:12, 84.61it/s]  20%|█▉        | 261/1319 [00:10<00:13, 76.96it/s] 20%|██        | 264/1319 [00:10<00:14, 72.05it/s] 21%|██        | 272/1319 [00:11<00:16, 64.24it/s] 21%|██        | 277/1319 [00:11<00:17, 59.61it/s] 21%|██        | 277/1319 [00:11<00:17, 59.61it/s] 21%|██        | 277/1319 [00:11<00:17, 59.61it/s] 21%|██        | 277/1319 [00:11<00:17, 59.61it/s] 21%|██▏       | 283/1319 [00:11<00:19, 51.86it/s] 22%|██▏       | 285/1319 [00:11<00:21, 47.85it/s] 22%|██▏       | 290/1319 [00:11<00:24, 41.55it/s] 22%|██▏       | 295/1319 [00:11<00:27, 37.14it/s] 23%|██▎       | 307/1319 [00:11<00:22, 44.77it/s] 25%|██▍       | 326/1319 [00:12<00:19, 52.18it/s] 25%|██▌       | 333/1319 [00:12<00:12, 78.33it/s] 25%|██▌       | 333/1319 [00:12<00:12, 78.33it/s] 25%|██▌       | 333/1319 [00:12<00:12, 78.33it/s] 25%|██▌       | 333/1319 [00:12<00:12, 78.33it/s] 25%|██▌       | 333/1319 [00:12<00:12, 78.33it/s] 25%|██▌       | 333/1319 [00:12<00:12, 78.33it/s] 25%|██▌       | 333/1319 [00:12<00:12, 78.33it/s] 26%|██▌       | 341/1319 [00:12<00:14, 69.23it/s] 27%|██▋       | 350/1319 [00:12<00:15, 62.93it/s] 27%|██▋       | 360/1319 [00:12<00:16, 59.10it/s] 27%|██▋       | 362/1319 [00:12<00:16, 59.10it/s] 27%|██▋       | 362/1319 [00:12<00:16, 59.10it/s] 27%|██▋       | 362/1319 [00:12<00:16, 59.10it/s] 28%|██▊       | 368/1319 [00:12<00:18, 50.65it/s] 28%|██▊       | 373/1319 [00:12<00:21, 43.98it/s] 28%|██▊       | 374/1319 [00:12<00:21, 43.98it/s] 29%|██▉       | 382/1319 [00:12<00:21, 43.52it/s] 30%|██▉       | 392/1319 [00:13<00:36, 25.45it/s] 30%|███       | 402/1319 [00:13<00:28, 32.28it/s] 32%|███▏      | 417/1319 [00:13<00:05, 150.78it/s] 32%|███▏      | 417/1319 [00:13<00:05, 150.78it/s] 32%|███▏      | 417/1319 [00:13<00:05, 150.78it/s] 32%|███▏      | 417/1319 [00:13<00:05, 150.78it/s] 32%|███▏      | 417/1319 [00:13<00:05, 150.78it/s] 32%|███▏      | 417/1319 [00:13<00:05, 150.78it/s] 32%|███▏      | 417/1319 [00:13<00:05, 150.78it/s] 32%|███▏      | 417/1319 [00:13<00:05, 150.78it/s] 32%|███▏      | 417/1319 [00:13<00:05, 150.78it/s] 32%|███▏      | 417/1319 [00:13<00:05, 150.78it/s] 32%|███▏      | 417/1319 [00:13<00:05, 150.78it/s] 32%|███▏      | 417/1319 [00:13<00:05, 150.78it/s] 32%|███▏      | 417/1319 [00:13<00:05, 150.78it/s] 33%|███▎      | 433/1319 [00:14<00:12, 69.27it/s]  33%|███▎      | 434/1319 [00:14<00:17, 49.30it/s] 34%|███▎      | 443/1319 [00:14<00:16, 52.61it/s] 34%|███▍      | 450/1319 [00:14<00:09, 89.72it/s] 34%|███▍      | 450/1319 [00:14<00:09, 89.72it/s] 34%|███▍      | 450/1319 [00:14<00:09, 89.72it/s] 34%|███▍      | 450/1319 [00:14<00:09, 89.72it/s] 34%|███▍      | 450/1319 [00:14<00:09, 89.72it/s] 35%|███▌      | 463/1319 [00:14<00:10, 83.22it/s] 36%|███▌      | 473/1319 [00:14<00:14, 58.87it/s] 36%|███▋      | 480/1319 [00:14<00:17, 47.89it/s] 36%|███▋      | 480/1319 [00:14<00:17, 47.89it/s] 37%|███▋      | 489/1319 [00:14<00:17, 47.89it/s] 37%|███▋      | 490/1319 [00:14<00:17, 47.89it/s] 37%|███▋      | 490/1319 [00:14<00:17, 47.89it/s] 37%|███▋      | 490/1319 [00:14<00:17, 47.89it/s] 37%|███▋      | 490/1319 [00:14<00:17, 47.89it/s] 38%|███▊      | 495/1319 [00:15<00:19, 43.17it/s] 38%|███▊      | 499/1319 [00:15<00:19, 41.23it/s] 38%|███▊      | 500/1319 [00:15<00:19, 41.23it/s] 38%|███▊      | 500/1319 [00:15<00:19, 41.23it/s] 38%|███▊      | 500/1319 [00:15<00:19, 41.23it/s] 38%|███▊      | 505/1319 [00:15<00:22, 35.75it/s] 40%|███▉      | 522/1319 [00:15<00:15, 51.01it/s] 40%|████      | 529/1319 [00:15<00:07, 108.69it/s] 40%|████      | 529/1319 [00:15<00:07, 108.69it/s] 40%|████      | 529/1319 [00:15<00:07, 108.69it/s] 40%|████      | 529/1319 [00:15<00:07, 108.69it/s] 40%|████      | 529/1319 [00:15<00:07, 108.69it/s] 40%|████      | 529/1319 [00:15<00:07, 108.69it/s] 41%|████      | 540/1319 [00:15<00:09, 78.12it/s]  43%|████▎     | 564/1319 [00:16<00:08, 91.81it/s] 44%|████▎     | 575/1319 [00:16<00:04, 162.42it/s] 44%|████▎     | 576/1319 [00:16<00:04, 162.42it/s] 44%|████▎     | 576/1319 [00:16<00:04, 162.42it/s] 44%|████▎     | 576/1319 [00:16<00:04, 162.42it/s] 44%|████▎     | 576/1319 [00:16<00:04, 162.42it/s] 44%|████▎     | 576/1319 [00:16<00:04, 162.42it/s] 44%|████▎     | 576/1319 [00:16<00:04, 162.42it/s] 44%|████▎     | 576/1319 [00:16<00:04, 162.42it/s] 44%|████▎     | 576/1319 [00:16<00:04, 162.42it/s] 45%|████▍     | 593/1319 [00:16<00:06, 119.36it/s] 45%|████▌     | 595/1319 [00:16<00:08, 85.62it/s]  45%|████▌     | 595/1319 [00:16<00:08, 85.62it/s] 46%|████▌     | 605/1319 [00:16<00:10, 69.25it/s] 47%|████▋     | 621/1319 [00:16<00:08, 81.64it/s] 48%|████▊     | 635/1319 [00:16<00:08, 78.11it/s] 49%|████▊     | 643/1319 [00:16<00:08, 77.44it/s] 49%|████▉     | 645/1319 [00:16<00:08, 77.44it/s] 50%|████▉     | 654/1319 [00:17<00:09, 73.31it/s] 50%|████▉     | 656/1319 [00:17<00:09, 71.58it/s] 50%|█████     | 664/1319 [00:18<00:22, 28.66it/s] 51%|█████▏    | 676/1319 [00:18<00:36, 17.76it/s] 51%|█████▏    | 677/1319 [00:18<00:36, 17.76it/s] 51%|█████▏    | 677/1319 [00:18<00:36, 17.76it/s] 51%|█████▏    | 677/1319 [00:18<00:36, 17.76it/s] 51%|█████▏    | 677/1319 [00:18<00:36, 17.76it/s] 51%|█████▏    | 677/1319 [00:18<00:36, 17.76it/s] 51%|█████▏    | 677/1319 [00:18<00:36, 17.76it/s] 51%|█████▏    | 677/1319 [00:18<00:36, 17.76it/s] 51%|█████▏    | 677/1319 [00:18<00:36, 17.76it/s] 51%|█████▏    | 677/1319 [00:18<00:36, 17.76it/s] 51%|█████▏    | 679/1319 [00:18<00:37, 17.00it/s] 52%|█████▏    | 688/1319 [00:18<00:15, 39.64it/s] 52%|█████▏    | 688/1319 [00:18<00:15, 39.64it/s] 52%|█████▏    | 688/1319 [00:18<00:15, 39.64it/s] 52%|█████▏    | 688/1319 [00:18<00:15, 39.64it/s] 52%|█████▏    | 688/1319 [00:18<00:15, 39.64it/s] 52%|█████▏    | 688/1319 [00:18<00:15, 39.64it/s] 52%|█████▏    | 688/1319 [00:18<00:15, 39.64it/s] 52%|█████▏    | 688/1319 [00:18<00:15, 39.64it/s] 52%|█████▏    | 688/1319 [00:18<00:15, 39.64it/s] 53%|█████▎    | 698/1319 [00:18<00:14, 44.16it/s] 54%|█████▍    | 717/1319 [00:18<00:10, 60.18it/s] 55%|█████▌    | 726/1319 [00:18<00:10, 55.29it/s] 57%|█████▋    | 752/1319 [00:18<00:07, 80.83it/s] 58%|█████▊    | 761/1319 [00:19<00:07, 70.75it/s] 58%|█████▊    | 769/1319 [00:19<00:08, 66.72it/s] 58%|█████▊    | 769/1319 [00:19<00:08, 66.72it/s] 58%|█████▊    | 769/1319 [00:19<00:08, 66.72it/s] 58%|█████▊    | 769/1319 [00:19<00:08, 66.72it/s] 58%|█████▊    | 769/1319 [00:19<00:08, 66.72it/s] 59%|█████▉    | 776/1319 [00:19<00:08, 66.08it/s] 60%|█████▉    | 790/1319 [00:19<00:07, 69.30it/s] 62%|██████▏   | 815/1319 [00:19<00:05, 97.96it/s] 64%|██████▍   | 848/1319 [00:19<00:03, 136.18it/s] 66%|██████▋   | 874/1319 [00:19<00:03, 147.94it/s] 69%|██████▊   | 904/1319 [00:20<00:02, 169.89it/s] 71%|███████   | 932/1319 [00:20<00:02, 183.16it/s] 71%|███████   | 935/1319 [00:20<00:01, 195.12it/s] 72%|███████▏  | 956/1319 [00:20<00:01, 186.63it/s] 75%|███████▍  | 983/1319 [00:20<00:01, 192.53it/s] 75%|███████▌  | 991/1319 [00:20<00:01, 212.26it/s] 75%|███████▌  | 991/1319 [00:20<00:01, 212.26it/s] 75%|███████▌  | 991/1319 [00:20<00:01, 212.26it/s] 77%|███████▋  | 1013/1319 [00:20<00:01, 200.71it/s] 78%|███████▊  | 1034/1319 [00:20<00:01, 162.62it/s] 79%|███████▉  | 1039/1319 [00:20<00:02, 128.93it/s] 79%|███████▉  | 1039/1319 [00:20<00:02, 128.93it/s] 79%|███████▉  | 1039/1319 [00:20<00:02, 128.93it/s] 80%|███████▉  | 1053/1319 [00:20<00:02, 127.22it/s] 81%|████████▏ | 1074/1319 [00:20<00:01, 142.12it/s] 82%|████████▏ | 1077/1319 [00:20<00:01, 156.86it/s] 83%|████████▎ | 1095/1319 [00:21<00:01, 152.42it/s] 85%|████████▍ | 1118/1319 [00:21<00:01, 164.12it/s] 86%|████████▌ | 1136/1319 [00:21<00:01, 162.98it/s] 87%|████████▋ | 1153/1319 [00:21<00:01, 159.55it/s] 89%|████████▊ | 1170/1319 [00:21<00:00, 160.43it/s] 90%|████████▉ | 1187/1319 [00:21<00:00, 161.58it/s] 92%|█████████▏| 1211/1319 [00:21<00:00, 180.10it/s] 92%|█████████▏| 1213/1319 [00:21<00:00, 196.00it/s] 93%|█████████▎| 1233/1319 [00:21<00:00, 181.92it/s] 95%|█████████▍| 1252/1319 [00:22<00:00, 122.85it/s] 96%|█████████▌| 1267/1319 [00:22<00:00, 104.69it/s] 97%|█████████▋| 1280/1319 [00:22<00:00, 83.80it/s]  98%|█████████▊| 1291/1319 [00:22<00:00, 64.87it/s] 99%|█████████▊| 1300/1319 [00:23<00:00, 50.51it/s] 99%|█████████▉| 1307/1319 [00:23<00:00, 29.19it/s] 99%|█████████▉| 1312/1319 [00:26<00:00,  9.71it/s]100%|█████████▉| 1317/1319 [00:26<00:00,  6.08it/s]100%|██████████| 1319/1319 [00:26<00:00, 50.09it/s]
Accuracy: 0.946
Invalid: 0.000
Latency: 26.524 s
Output throughput: 4907.168 token/s
Run 5 completed in 31 seconds
Run 5: Accuracy: 0.946
[progress] [=========================-------------------------] 5/10 (50%)  | GSM8K: Run 5
GSM8K test completed in 164 seconds
Average Accuracy over 5 runs: 0.944
Average accuracy meets threshold (0.93).
✅ GSM8K benchmark completed successfully.
GSM8K log saved to /mnt/raid/michael/sglang-ci/online/DeepSeek-R1-MXFP4-Preview/v0.5.4.post2-rocm700-mi35x-20251101_DeepSeek-R1-MXFP4-Preview_FP8_online/sglang_client_log_DeepSeek-R1-MXFP4-Preview_gsm8k.log
Server log saved to /mnt/raid/michael/sglang-ci/online/DeepSeek-R1-MXFP4-Preview/v0.5.4.post2-rocm700-mi35x-20251101_DeepSeek-R1-MXFP4-Preview_FP8_online/sglang_server.log
Starting serving benchmark tests with different concurrency levels...
[online] Structured CSV initialized at /mnt/raid/michael/sglang-ci/online/DeepSeek-R1-MXFP4-Preview/v0.5.4.post2-rocm700-mi35x-20251101_DeepSeek-R1-MXFP4-Preview_FP8_online/v0.5.4.post2-rocm700-mi35x-20251101_DeepSeek-R1-MXFP4-Preview_FP8_serving.csv
Processing concurrency 128 with 1 runs...
Running serving benchmark with concurrency 128 (Run 1) - 500 prompts...
Concurrency 128, Run 1 completed: 500 requests, (tok/s): tok/s output throughput, 33140.25ms E2E latency (141s)
[progress] [==============================--------------------] 6/10 (60%)  | Serving: C128 R1
✅ Best results for concurrency 128: E2E=33140.25ms, TTFT=6533.08ms, ITL=25.99ms, Output=(tok/s): tok/s
[online] Updating CSV for concurrency 128: E2E=33140.25ms, TTFT=6533.08ms, ITL=25.99ms, Output=(tok/s): tok/s
[online] CSV updated with results for concurrency 128
Sleeping 3 seconds before next concurrency level...
Processing concurrency 64 with 1 runs...
Running serving benchmark with concurrency 64 (Run 1) - 500 prompts...
Concurrency 64, Run 1 completed: 500 requests, (tok/s): tok/s output throughput, 18345.03ms E2E latency (153s)
[progress] [===================================---------------] 7/10 (70%)  | Serving: C64 R1
✅ Best results for concurrency 64: E2E=18345.03ms, TTFT=790.93ms, ITL=19.85ms, Output=(tok/s): tok/s
[online] Updating CSV for concurrency 64: E2E=18345.03ms, TTFT=790.93ms, ITL=19.85ms, Output=(tok/s): tok/s
[online] CSV updated with results for concurrency 64
Sleeping 3 seconds before next concurrency level...
Processing concurrency 16 with 1 runs...
Running serving benchmark with concurrency 16 (Run 1) - 128 prompts...
Concurrency 16, Run 1 completed: 128 requests, (tok/s): tok/s output throughput, 11091.14ms E2E latency (100s)
[progress] [========================================----------] 8/10 (80%)  | Serving: C16 R1
✅ Best results for concurrency 16: E2E=11091.14ms, TTFT=235.77ms, ITL=13.48ms, Output=(tok/s): tok/s
[online] Updating CSV for concurrency 16: E2E=11091.14ms, TTFT=235.77ms, ITL=13.48ms, Output=(tok/s): tok/s
[online] CSV updated with results for concurrency 16
Sleeping 3 seconds before next concurrency level...
Processing concurrency 4 with 1 runs...
Running serving benchmark with concurrency 4 (Run 1) - 128 prompts...
Concurrency 4, Run 1 completed: 128 requests, (tok/s): tok/s output throughput, 9162.45ms E2E latency (305s)
[progress] [=============================================-----] 9/10 (90%)  | Serving: C4 R1
✅ Best results for concurrency 4: E2E=9162.45ms, TTFT=212.65ms, ITL=11.20ms, Output=(tok/s): tok/s
[online] Updating CSV for concurrency 4: E2E=9162.45ms, TTFT=212.65ms, ITL=11.20ms, Output=(tok/s): tok/s
[online] CSV updated with results for concurrency 4
Sleeping 3 seconds before next concurrency level...
Processing concurrency 1 with 1 runs...
Running serving benchmark with concurrency 1 (Run 1) - 128 prompts...
Concurrency 1, Run 1 completed: 128 requests, (tok/s): tok/s output throughput, 8376.69ms E2E latency (1083s)
[progress] [==================================================] 10/10 (100%) ✅ Complete!
 | Serving: C1 R1
✅ Best results for concurrency 1: E2E=8376.69ms, TTFT=114.98ms, ITL=10.34ms, Output=(tok/s): tok/s
[online] Updating CSV for concurrency 1: E2E=8376.69ms, TTFT=114.98ms, ITL=10.34ms, Output=(tok/s): tok/s
[online] CSV updated with results for concurrency 1
✅ Serving benchmark completed successfully in 1805 seconds (standard mode).
Structured serving benchmark results written to /mnt/raid/michael/sglang-ci/online/DeepSeek-R1-MXFP4-Preview/v0.5.4.post2-rocm700-mi35x-20251101_DeepSeek-R1-MXFP4-Preview_FP8_online/v0.5.4.post2-rocm700-mi35x-20251101_DeepSeek-R1-MXFP4-Preview_FP8_serving.csv
Individual concurrency logs saved to /mnt/raid/michael/sglang-ci/online/DeepSeek-R1-MXFP4-Preview/v0.5.4.post2-rocm700-mi35x-20251101_DeepSeek-R1-MXFP4-Preview_FP8_online/sglang_serving_benchmark_concurrency_*_run*.log
GSM8K accuracy results written to /mnt/raid/michael/sglang-ci/online/DeepSeek-R1-MXFP4-Preview/v0.5.4.post2-rocm700-mi35x-20251101_DeepSeek-R1-MXFP4-Preview_FP8_online/sglang_client_log_DeepSeek-R1-MXFP4-Preview_gsm8k.log
Shutting down SGLang server...
Server shutdown completed in 0 seconds

==========================================
SCRIPT EXECUTION SUMMARY
==========================================
Script completed at: 2025-11-01 17:44:53 PDT
Total execution time: 2050 seconds (34 minutes)
Output directory: /mnt/raid/michael/sglang-ci/online/DeepSeek-R1-MXFP4-Preview/v0.5.4.post2-rocm700-mi35x-20251101_DeepSeek-R1-MXFP4-Preview_FP8_online
Serving CSV: /mnt/raid/michael/sglang-ci/online/DeepSeek-R1-MXFP4-Preview/v0.5.4.post2-rocm700-mi35x-20251101_DeepSeek-R1-MXFP4-Preview_FP8_online/v0.5.4.post2-rocm700-mi35x-20251101_DeepSeek-R1-MXFP4-Preview_FP8_serving.csv
Timing log: /mnt/raid/michael/sglang-ci/online/DeepSeek-R1-MXFP4-Preview/v0.5.4.post2-rocm700-mi35x-20251101_DeepSeek-R1-MXFP4-Preview_FP8_online/timing_summary_20251101_171043.log
===========================================
Cleaning up...
Killing background SGLang server (PID: 47)...
Server process 47 not found or already terminated.
[nightly] === Online benchmark dispatched for DEEPSEEK; check logs in sgl-dev_v0.5.4.post2-rocm700-mi35x-20251101 ===
[nightly] === Starting post-processing (CSV processing, plot generation, Teams notifications) ===
[nightly] Processing online CSV data and generating plots... Logs will be saved to /mnt/raid/michael/sglang-ci/online/DeepSeek-R1-MXFP4-Preview/v0.5.4.post2-rocm700-mi35x-20251101_DeepSeek-R1-MXFP4-Preview_FP8_online/process_and_generate_online_plots.log
[nightly] Using plot date from image tag: 20251101
[nightly] Teams notifications skipped - --teams-webhook-url not provided
[nightly] === Online post-processing completed for DEEPSEEK ===
[nightly] ==========================================
[nightly] Completed benchmarks for image: rocm/sgl-dev:v0.5.4.post2-rocm700-mi35x-20251101
[nightly] Stopping container sgl-dev_v0.5.4.post2-rocm700-mi35x-20251101 to release resources...
[nightly] ==========================================
[nightly] ==========================================
[nightly] All benchmarks completed for 1 image(s)
[nightly] ==========================================
[nightly] Cleaning up process lock...
