[nightly] ==========================================
[nightly] SGL Nightly Benchmark Started
[nightly] ==========================================
[nightly] Command: scripts/perf_nightly.sh --model=deepseek --model-path=/data/models/deepseek-ai/DeepSeek-V3-0324 --mode=online --hardware=mi30x --teams-webhook-url=
[nightly] Start time: 2025-12-06 15:15:01 PST
[nightly] Machine: dell300x-pla-t12-38
[nightly] Working directory: /mnt/raid/michael/sglang-ci
[nightly] Script location: /mnt/raid/michael/sglang-ci/scripts/perf_nightly.sh
[nightly] Process ID: 206603
[nightly] ==========================================

[nightly] Runtime Environment:
[nightly] User: amd | Groups: amd adm cdrom... | Docker: /usr/bin/docker
[nightly] Testing Docker daemon access...
[nightly] Docker daemon accessible - proceeding...
[nightly] WARN: --teams-webhook-url was provided without a value - notifications disabled
[nightly] Custom model path provided: /data/models/deepseek-ai/DeepSeek-V3-0324
[nightly] Hardware: mi30x, ROCM Version: rocm700
[nightly] Model: deepseek, Mode(s): online
[nightly] Created process lock: /tmp/perf_nightly_deepseek.lock
[nightly] GPU is busy. Attempting to stop running Docker containers...
[nightly] No running containers to stop.
[nightly] Waiting 15s for GPU to become idle...
[nightly] WARN: GPU may still be busy, but proceeding as requested.
[nightly] Searching for non-SRT images for deepseek for the last 1 days...
[nightly] Searching for non-SRT mi30x image (rocm700) in 'rocm/sgl-dev' for date 20251206...
[nightly] Found candidate tag for day -0: v0.5.6-rocm700-mi30x-20251206
[nightly] Found local image: rocm/sgl-dev:v0.5.6-rocm700-mi30x-20251206
[nightly] Successfully obtained image for date 20251206: rocm/sgl-dev:v0.5.6-rocm700-mi30x-20251206
[nightly] Found 1 valid image(s) to run benchmarks on:
[nightly]   - rocm/sgl-dev:v0.5.6-rocm700-mi30x-20251206

[nightly] ==========================================
[nightly] Starting benchmarks for image: rocm/sgl-dev:v0.5.6-rocm700-mi30x-20251206
[nightly] ==========================================
[nightly] Checking GPU status before starting benchmarks for rocm/sgl-dev:v0.5.6-rocm700-mi30x-20251206...
[nightly] GPU is busy. Attempting to stop running Docker containers...
[nightly] No running containers to stop.
[nightly] Waiting 15s for GPU to become idle...
[nightly] WARN: GPU may still be busy, but proceeding as requested.
[nightly] Checking benchmark completion in: /mnt/raid/michael/sglang-ci/online/DeepSeek-V3-0324/v0.5.6-rocm700-mi30x-20251206_DeepSeek-V3-0324_FP8_online
[nightly] Found 0 completed benchmark runs
[nightly] INFO: Found 0/15 completed runs for rocm/sgl-dev:v0.5.6-rocm700-mi30x-20251206 (online). Proceeding with benchmarks.
[nightly] Using Docker image: rocm/sgl-dev:v0.5.6-rocm700-mi30x-20251206
[nightly] Container name: sgl-dev_v0.5.6-rocm700-mi30x-20251206
[nightly] Reusing container sgl-dev_v0.5.6-rocm700-mi30x-20251206
[nightly] === Starting benchmark execution ===
[nightly] === Starting nightly DEEPSEEK online benchmark ===
[nightly] Launching deepseek_perf_online_csv.sh inside sgl-dev_v0.5.6-rocm700-mi30x-20251206
[nightly] Passing --model-name='DeepSeek-V3-0324' to DeepSeek benchmark
✅ Parameter validation passed
[online] Script started at: 2025-12-06 15:15:32 PST
Scanning existing logs to check if all benchmarks are already complete...
Checking GSM8K log status...
Missing: GSM8K log file (/mnt/raid/michael/sglang-ci/online/DeepSeek-V3-0324/v0.5.6-rocm700-mi30x-20251206_DeepSeek-V3-0324_FP8_online/sglang_client_log_DeepSeek-V3-0324_gsm8k.log)
Checking serving benchmark logs...
Missing: Concurrency 128, Run 1
Missing: Concurrency 64, Run 1
Missing: Concurrency 16, Run 1
Missing: Concurrency 4, Run 1
Missing: Concurrency 1, Run 1
Scan complete: 5 total runs needed, 5 missing/incomplete
❌ Missing 5 serving benchmark runs.
❌ GSM8K benchmark is missing, empty, or incomplete.
Server startup required.
Clearing previous logs...
Starting SGLang server for online GSM8K benchmark...
[DEBUG] Using standard settings with environment variable: SGLANG_USE_AITER
Waiting for SGLang server (PID: 47) to start... (Max 15 minutes)
Server logs are being written to: /mnt/raid/michael/sglang-ci/online/DeepSeek-V3-0324/v0.5.6-rocm700-mi30x-20251206_DeepSeek-V3-0324_FP8_online/sglang_server.log
...............................
SGLang server started successfully after 155 seconds.
=== Online GSM8K Benchmark: TP=8, Questions=2000, Parallel=2000, Shots=5 ===
[progress] Total benchmark runs to execute: 10 (GSM8K: 5, Serving: 5) - standard mode
[progress] [--------------------------------------------------] 0/10 (0%) 
Starting GSM8K Online Benchmark...
Running 5 test iterations...
Executing GSM8K test Run 1 ...
  0%|          | 0/1319 [00:00<?, ?it/s]  0%|          | 1/1319 [00:20<7:27:04, 20.35s/it]  0%|          | 2/1319 [00:20<3:05:46,  8.46s/it]  0%|          | 3/1319 [00:21<1:49:11,  4.98s/it]  0%|          | 4/1319 [00:22<1:12:53,  3.33s/it]  0%|          | 5/1319 [00:22<52:20,  2.39s/it]    1%|          | 8/1319 [00:23<21:30,  1.02it/s]  1%|          | 11/1319 [00:23<13:11,  1.65it/s]  1%|          | 15/1319 [00:26<13:50,  1.57it/s]  2%|▏         | 22/1319 [00:26<07:23,  2.92it/s]  2%|▏         | 31/1319 [00:27<04:31,  4.74it/s]  3%|▎         | 37/1319 [00:30<06:08,  3.48it/s]  3%|▎         | 43/1319 [00:30<04:36,  4.61it/s]  4%|▎         | 47/1319 [00:31<04:24,  4.81it/s]  4%|▍         | 56/1319 [00:32<03:09,  6.68it/s]  5%|▌         | 67/1319 [00:32<02:25,  8.62it/s]  5%|▌         | 72/1319 [00:33<02:28,  8.38it/s]  6%|▌         | 79/1319 [00:33<01:59, 10.36it/s]  7%|▋         | 89/1319 [00:36<03:21,  6.12it/s]  8%|▊         | 102/1319 [00:37<02:24,  8.44it/s]  8%|▊         | 109/1319 [00:37<02:01,  9.96it/s]  9%|▊         | 115/1319 [00:38<02:02,  9.82it/s]  9%|▉         | 122/1319 [00:38<01:43, 11.60it/s] 10%|█         | 135/1319 [00:38<01:10, 16.79it/s] 11%|█         | 145/1319 [00:39<01:11, 16.37it/s] 12%|█▏        | 152/1319 [00:39<01:06, 17.44it/s] 12%|█▏        | 159/1319 [00:40<01:16, 15.17it/s] 13%|█▎        | 165/1319 [00:40<01:11, 16.05it/s] 13%|█▎        | 177/1319 [00:43<02:13,  8.53it/s] 14%|█▍        | 188/1319 [00:43<01:49, 10.33it/s] 15%|█▌        | 198/1319 [00:44<01:26, 13.03it/s] 16%|█▌        | 208/1319 [00:44<01:09, 16.00it/s] 17%|█▋        | 219/1319 [00:44<00:56, 19.54it/s] 17%|█▋        | 224/1319 [00:45<01:12, 15.17it/s] 17%|█▋        | 229/1319 [00:45<01:30, 12.04it/s] 17%|█▋        | 229/1319 [00:45<01:30, 12.04it/s] 17%|█▋        | 229/1319 [00:45<01:30, 12.04it/s] 18%|█▊        | 240/1319 [00:47<02:23,  7.51it/s] 19%|█▉        | 252/1319 [00:49<02:45,  6.45it/s] 20%|█▉        | 262/1319 [00:50<02:03,  8.56it/s] 21%|██        | 276/1319 [00:50<01:35, 10.89it/s] 22%|██▏       | 290/1319 [00:51<01:17, 13.26it/s] 23%|██▎       | 301/1319 [00:51<01:02, 16.16it/s] 23%|██▎       | 308/1319 [00:52<00:57, 17.45it/s] 24%|██▍       | 318/1319 [00:52<00:47, 21.25it/s] 25%|██▍       | 327/1319 [00:52<00:40, 24.36it/s] 26%|██▌       | 340/1319 [00:52<00:31, 30.86it/s] 26%|██▋       | 347/1319 [00:53<00:31, 30.87it/s] 27%|██▋       | 354/1319 [00:53<00:31, 30.78it/s] 28%|██▊       | 371/1319 [00:53<00:22, 42.15it/s] 29%|██▉       | 386/1319 [00:53<00:19, 48.58it/s] 30%|███       | 401/1319 [00:54<00:17, 53.86it/s] 31%|███       | 409/1319 [00:54<00:18, 48.64it/s] 32%|███▏      | 422/1319 [00:54<00:17, 51.56it/s] 33%|███▎      | 434/1319 [00:54<00:17, 52.06it/s] 34%|███▍      | 448/1319 [00:54<00:15, 55.21it/s] 35%|███▌      | 463/1319 [00:55<00:14, 58.49it/s] 36%|███▌      | 472/1319 [00:55<00:15, 53.05it/s] 37%|███▋      | 490/1319 [00:55<00:13, 61.45it/s] 38%|███▊      | 499/1319 [00:55<00:15, 54.59it/s] 38%|███▊      | 505/1319 [00:56<00:17, 46.28it/s] 39%|███▉      | 514/1319 [00:56<00:17, 44.82it/s] 39%|███▉      | 521/1319 [00:56<00:19, 40.59it/s] 40%|████      | 529/1319 [00:56<00:20, 39.37it/s] 41%|████      | 536/1319 [00:56<00:21, 37.16it/s] 41%|████      | 542/1319 [00:57<00:22, 33.94it/s] 42%|████▏     | 559/1319 [00:57<00:16, 46.65it/s] 43%|████▎     | 569/1319 [00:57<00:16, 45.81it/s] 44%|████▍     | 579/1319 [00:57<00:17, 43.33it/s] 45%|████▍     | 589/1319 [00:58<00:15, 45.96it/s] 45%|████▌     | 597/1319 [00:58<00:16, 43.30it/s] 46%|████▌     | 603/1319 [00:58<00:18, 38.19it/s] 47%|████▋     | 623/1319 [00:58<00:12, 54.28it/s] 48%|████▊     | 632/1319 [01:00<00:45, 15.02it/s] 49%|████▊     | 642/1319 [01:00<00:36, 18.51it/s] 49%|████▉     | 651/1319 [01:01<00:32, 20.56it/s] 50%|████▉     | 659/1319 [01:01<00:28, 23.07it/s] 51%|█████     | 673/1319 [01:01<00:21, 30.02it/s] 52%|█████▏    | 681/1319 [01:01<00:20, 31.30it/s] 53%|█████▎    | 694/1319 [01:02<00:16, 37.71it/s] 54%|█████▍    | 710/1319 [01:02<00:13, 46.27it/s] 54%|█████▍    | 716/1319 [01:02<00:14, 41.38it/s] 55%|█████▍    | 725/1319 [01:02<00:14, 41.35it/s] 56%|█████▌    | 734/1319 [01:02<00:14, 41.38it/s] 56%|█████▋    | 744/1319 [01:05<00:51, 11.15it/s] 57%|█████▋    | 758/1319 [01:05<00:35, 15.88it/s] 58%|█████▊    | 771/1319 [01:05<00:26, 21.04it/s] 59%|█████▉    | 783/1319 [01:06<00:20, 25.78it/s] 60%|█████▉    | 790/1319 [01:06<00:19, 26.84it/s] 61%|██████    | 799/1319 [01:06<00:17, 29.49it/s] 63%|██████▎   | 826/1319 [01:06<00:09, 52.12it/s] 64%|██████▍   | 844/1319 [01:06<00:07, 64.68it/s] 65%|██████▍   | 854/1319 [01:06<00:07, 65.10it/s] 66%|██████▌   | 870/1319 [01:07<00:06, 74.43it/s] 67%|██████▋   | 888/1319 [01:07<00:04, 86.99it/s] 68%|██████▊   | 902/1319 [01:07<00:04, 90.61it/s] 70%|███████   | 925/1319 [01:07<00:03, 111.44it/s] 71%|███████   | 939/1319 [01:07<00:03, 111.36it/s] 73%|███████▎  | 964/1319 [01:07<00:02, 131.53it/s] 74%|███████▍  | 979/1319 [01:07<00:02, 127.15it/s] 75%|███████▌  | 993/1319 [01:08<00:02, 122.94it/s] 76%|███████▋  | 1006/1319 [01:08<00:02, 117.04it/s] 77%|███████▋  | 1018/1319 [01:08<00:02, 109.57it/s] 79%|███████▊  | 1037/1319 [01:08<00:02, 123.80it/s] 80%|███████▉  | 1050/1319 [01:08<00:02, 108.16it/s] 81%|████████  | 1065/1319 [01:08<00:02, 113.16it/s] 82%|████████▏ | 1079/1319 [01:08<00:02, 116.39it/s] 83%|████████▎ | 1091/1319 [01:08<00:02, 113.07it/s] 84%|████████▎ | 1103/1319 [01:09<00:02, 98.79it/s]  84%|████████▍ | 1114/1319 [01:09<00:02, 98.62it/s] 85%|████████▌ | 1125/1319 [01:09<00:02, 86.73it/s] 86%|████████▋ | 1140/1319 [01:09<00:01, 100.69it/s] 87%|████████▋ | 1151/1319 [01:09<00:01, 101.68it/s] 88%|████████▊ | 1162/1319 [01:09<00:01, 90.65it/s]  89%|████████▉ | 1172/1319 [01:09<00:01, 82.12it/s] 90%|████████▉ | 1181/1319 [01:10<00:02, 68.37it/s] 90%|█████████ | 1191/1319 [01:10<00:01, 68.14it/s] 91%|█████████ | 1203/1319 [01:10<00:01, 72.68it/s] 92%|█████████▏| 1213/1319 [01:10<00:01, 69.13it/s] 93%|█████████▎| 1221/1319 [01:10<00:01, 53.58it/s] 93%|█████████▎| 1230/1319 [01:10<00:01, 52.75it/s] 94%|█████████▎| 1236/1319 [01:11<00:01, 47.01it/s] 94%|█████████▍| 1242/1319 [01:11<00:01, 43.22it/s] 95%|█████████▍| 1253/1319 [01:11<00:01, 53.14it/s] 95%|█████████▌| 1259/1319 [01:11<00:01, 46.97it/s] 96%|█████████▌| 1265/1319 [01:11<00:01, 40.70it/s] 96%|█████████▋| 1270/1319 [01:11<00:01, 40.59it/s] 97%|█████████▋| 1275/1319 [01:12<00:01, 38.13it/s] 97%|█████████▋| 1281/1319 [01:12<00:00, 38.48it/s] 97%|█████████▋| 1285/1319 [01:12<00:00, 35.08it/s] 98%|█████████▊| 1289/1319 [01:12<00:01, 25.56it/s] 98%|█████████▊| 1292/1319 [01:12<00:01, 23.17it/s] 98%|█████████▊| 1295/1319 [01:13<00:01, 18.51it/s] 98%|█████████▊| 1299/1319 [01:13<00:01, 15.43it/s] 99%|█████████▊| 1301/1319 [01:13<00:01, 13.64it/s] 99%|█████████▉| 1303/1319 [01:13<00:01, 13.99it/s] 99%|█████████▉| 1307/1319 [01:13<00:00, 17.72it/s] 99%|█████████▉| 1310/1319 [01:14<00:00, 19.44it/s]100%|█████████▉| 1313/1319 [01:14<00:00, 13.14it/s]100%|█████████▉| 1316/1319 [01:14<00:00, 13.47it/s]100%|█████████▉| 1318/1319 [01:15<00:00, 10.29it/s]100%|██████████| 1319/1319 [01:18<00:00, 16.89it/s]
Accuracy: 0.929
Invalid: 0.000
Latency: 120.011 s
Output throughput: 1121.598 token/s
Run 1 completed in 126 seconds
Run 1: Accuracy: 0.929
  ✓ Run 1 included in average (accuracy: 0.929)
[progress] [=====---------------------------------------------] 1/10 (10%)  | GSM8K: Run 1

Checking server health before Run 2...
✅ Server is healthy
Executing GSM8K test Run 2 ...
  0%|          | 0/1319 [00:00<?, ?it/s]  0%|          | 1/1319 [00:07<2:44:51,  7.50s/it]  0%|          | 2/1319 [00:08<1:17:18,  3.52s/it]  0%|          | 3/1319 [00:08<43:25,  1.98s/it]    0%|          | 4/1319 [00:08<27:44,  1.27s/it]  0%|          | 5/1319 [00:09<27:59,  1.28s/it]  1%|          | 9/1319 [00:09<09:38,  2.26it/s]  1%|          | 12/1319 [00:10<06:06,  3.56it/s]  1%|▏         | 17/1319 [00:11<06:27,  3.36it/s]  2%|▏         | 21/1319 [00:11<04:31,  4.78it/s]  2%|▏         | 21/1319 [00:11<04:31,  4.78it/s]  2%|▏         | 21/1319 [00:11<04:31,  4.78it/s]  2%|▏         | 21/1319 [00:11<04:31,  4.78it/s]  2%|▏         | 22/1319 [00:12<04:40,  4.63it/s]  2%|▏         | 31/1319 [00:12<03:19,  6.46it/s]  3%|▎         | 37/1319 [00:13<02:44,  7.81it/s]  3%|▎         | 42/1319 [00:13<02:20,  9.07it/s]  3%|▎         | 45/1319 [00:14<02:44,  7.72it/s]  4%|▍         | 56/1319 [00:14<02:00, 10.50it/s]  5%|▌         | 67/1319 [00:15<01:27, 14.27it/s]  5%|▌         | 71/1319 [00:15<01:43, 12.03it/s]  6%|▌         | 76/1319 [00:15<01:37, 12.81it/s]  6%|▋         | 85/1319 [00:16<01:15, 16.34it/s]  7%|▋         | 96/1319 [00:16<01:13, 16.64it/s]  8%|▊         | 104/1319 [00:17<01:20, 15.11it/s]  8%|▊         | 110/1319 [00:17<01:15, 16.02it/s]  9%|▊         | 115/1319 [00:18<01:14, 16.09it/s] 10%|▉         | 129/1319 [00:18<01:05, 18.29it/s] 10%|█         | 138/1319 [00:19<00:57, 20.43it/s] 11%|█         | 146/1319 [00:19<00:53, 22.05it/s] 12%|█▏        | 154/1319 [00:19<00:50, 23.14it/s] 12%|█▏        | 160/1319 [00:20<00:52, 22.25it/s] 13%|█▎        | 172/1319 [00:20<00:55, 20.62it/s] 14%|█▎        | 180/1319 [00:20<00:52, 21.84it/s] 14%|█▍        | 189/1319 [00:21<00:47, 23.71it/s] 15%|█▌        | 203/1319 [00:21<00:37, 29.49it/s] 16%|█▋        | 217/1319 [00:22<00:42, 26.11it/s] 17%|█▋        | 224/1319 [00:22<00:43, 25.37it/s] 18%|█▊        | 236/1319 [00:22<00:37, 28.73it/s] 19%|█▉        | 253/1319 [00:23<00:40, 26.37it/s] 20%|██        | 266/1319 [00:23<00:35, 29.72it/s] 21%|██        | 280/1319 [00:24<00:30, 33.53it/s] 22%|██▏       | 293/1319 [00:24<00:36, 27.96it/s] 23%|██▎       | 307/1319 [00:25<00:31, 31.98it/s] 24%|██▍       | 315/1319 [00:25<00:34, 29.35it/s] 25%|██▍       | 326/1319 [00:25<00:29, 33.14it/s] 26%|██▌       | 337/1319 [00:25<00:26, 36.48it/s] 26%|██▌       | 346/1319 [00:26<00:26, 36.96it/s] 27%|██▋       | 355/1319 [00:26<00:25, 37.74it/s] 27%|██▋       | 361/1319 [00:26<00:27, 34.66it/s] 29%|██▊       | 378/1319 [00:26<00:20, 45.77it/s] 29%|██▉       | 386/1319 [00:27<00:19, 46.98it/s] 30%|███       | 397/1319 [00:27<00:19, 47.57it/s] 31%|███       | 409/1319 [00:27<00:16, 55.40it/s] 32%|███▏      | 419/1319 [00:27<00:17, 51.67it/s] 32%|███▏      | 428/1319 [00:27<00:18, 47.62it/s] 34%|███▍      | 450/1319 [00:28<00:13, 63.37it/s] 35%|███▍      | 461/1319 [00:28<00:14, 58.61it/s] 35%|███▌      | 467/1319 [00:28<00:17, 48.30it/s] 37%|███▋      | 486/1319 [00:28<00:14, 59.38it/s] 38%|███▊      | 498/1319 [00:29<00:14, 55.63it/s] 38%|███▊      | 505/1319 [00:29<00:19, 42.67it/s] 39%|███▉      | 519/1319 [00:29<00:16, 48.10it/s] 40%|████      | 530/1319 [00:29<00:16, 48.51it/s] 41%|████      | 541/1319 [00:30<00:15, 48.95it/s] 41%|████▏     | 547/1319 [00:30<00:18, 42.47it/s] 42%|████▏     | 552/1319 [00:30<00:21, 36.50it/s] 43%|████▎     | 562/1319 [00:30<00:19, 38.80it/s] 43%|████▎     | 572/1319 [00:30<00:18, 40.72it/s] 44%|████▍     | 578/1319 [00:31<00:21, 34.71it/s] 44%|████▍     | 585/1319 [00:31<00:20, 35.20it/s] 45%|████▍     | 592/1319 [00:31<00:21, 33.87it/s] 46%|████▌     | 601/1319 [00:31<00:20, 35.71it/s] 47%|████▋     | 620/1319 [00:32<00:13, 50.73it/s] 48%|████▊     | 631/1319 [00:32<00:13, 50.27it/s] 49%|████▉     | 645/1319 [00:32<00:12, 54.17it/s] 50%|████▉     | 658/1319 [00:32<00:11, 55.17it/s] 51%|█████     | 671/1319 [00:32<00:11, 56.09it/s] 52%|█████▏    | 682/1319 [00:33<00:11, 54.17it/s] 52%|█████▏    | 691/1319 [00:33<00:12, 50.20it/s] 53%|█████▎    | 703/1319 [00:33<00:11, 51.56it/s] 54%|█████▍    | 710/1319 [00:33<00:11, 51.21it/s] 54%|█████▍    | 717/1319 [00:33<00:13, 44.36it/s] 55%|█████▌    | 728/1319 [00:34<00:12, 46.04it/s] 56%|█████▌    | 740/1319 [00:34<00:11, 48.92it/s] 57%|█████▋    | 747/1319 [00:34<00:13, 43.30it/s] 58%|█████▊    | 759/1319 [00:34<00:11, 46.79it/s] 59%|█████▉    | 775/1319 [00:35<00:09, 54.64it/s] 60%|█████▉    | 787/1319 [00:35<00:09, 54.72it/s] 61%|██████    | 798/1319 [00:35<00:09, 53.67it/s] 61%|██████    | 804/1319 [00:35<00:11, 45.87it/s] 63%|██████▎   | 834/1319 [00:35<00:06, 78.18it/s] 65%|██████▍   | 851/1319 [00:36<00:05, 86.73it/s] 65%|██████▌   | 863/1319 [00:36<00:05, 85.04it/s] 66%|██████▋   | 877/1319 [00:36<00:05, 87.04it/s] 68%|██████▊   | 892/1319 [00:36<00:04, 93.66it/s] 69%|██████▉   | 908/1319 [00:36<00:04, 100.68it/s] 70%|███████   | 924/1319 [00:36<00:03, 105.48it/s] 71%|███████   | 935/1319 [00:36<00:03, 100.10it/s] 72%|███████▏  | 952/1319 [00:36<00:03, 107.71it/s] 74%|███████▍  | 974/1319 [00:37<00:02, 123.67it/s] 75%|███████▌  | 990/1319 [00:37<00:02, 125.72it/s] 76%|███████▌  | 1003/1319 [00:37<00:02, 119.54it/s] 77%|███████▋  | 1015/1319 [00:37<00:02, 111.15it/s] 78%|███████▊  | 1028/1319 [00:37<00:02, 107.68it/s] 79%|███████▉  | 1039/1319 [00:37<00:03, 93.28it/s]  80%|████████  | 1060/1319 [00:37<00:02, 117.71it/s] 81%|████████▏ | 1073/1319 [00:38<00:02, 115.75it/s] 82%|████████▏ | 1086/1319 [00:38<00:02, 114.36it/s] 83%|████████▎ | 1098/1319 [00:38<00:02, 87.78it/s]  84%|████████▍ | 1108/1319 [00:38<00:02, 88.81it/s] 85%|████████▍ | 1118/1319 [00:38<00:02, 89.32it/s] 86%|████████▌ | 1129/1319 [00:38<00:02, 92.57it/s] 86%|████████▋ | 1139/1319 [00:38<00:01, 93.00it/s] 87%|████████▋ | 1149/1319 [00:38<00:01, 92.06it/s] 88%|████████▊ | 1159/1319 [00:39<00:01, 82.20it/s] 89%|████████▊ | 1168/1319 [00:39<00:02, 73.45it/s] 89%|████████▉ | 1176/1319 [00:39<00:01, 74.59it/s] 90%|████████▉ | 1184/1319 [00:39<00:02, 61.29it/s] 90%|█████████ | 1192/1319 [00:39<00:01, 65.29it/s] 91%|█████████ | 1203/1319 [00:39<00:01, 69.13it/s] 92%|█████████▏| 1212/1319 [00:39<00:01, 67.68it/s] 92%|█████████▏| 1219/1319 [00:40<00:01, 62.45it/s] 93%|█████████▎| 1228/1319 [00:40<00:01, 62.70it/s] 94%|█████████▎| 1236/1319 [00:40<00:01, 62.10it/s] 94%|█████████▍| 1243/1319 [00:40<00:01, 59.41it/s] 95%|█████████▍| 1252/1319 [00:40<00:01, 62.40it/s] 95%|█████████▌| 1259/1319 [00:40<00:01, 54.63it/s] 96%|█████████▌| 1265/1319 [00:40<00:01, 53.35it/s] 96%|█████████▋| 1271/1319 [00:41<00:00, 51.96it/s] 97%|█████████▋| 1277/1319 [00:41<00:00, 51.59it/s] 97%|█████████▋| 1283/1319 [00:41<00:00, 47.10it/s] 98%|█████████▊| 1288/1319 [00:41<00:01, 27.34it/s] 98%|█████████▊| 1292/1319 [00:41<00:01, 23.80it/s] 98%|█████████▊| 1296/1319 [00:42<00:00, 24.79it/s] 99%|█████████▊| 1300/1319 [00:42<00:00, 24.67it/s] 99%|█████████▉| 1303/1319 [00:42<00:00, 20.77it/s] 99%|█████████▉| 1306/1319 [00:42<00:00, 15.26it/s] 99%|█████████▉| 1308/1319 [00:43<00:00, 13.40it/s] 99%|█████████▉| 1311/1319 [00:43<00:00, 12.46it/s]100%|█████████▉| 1313/1319 [00:43<00:00, 10.57it/s]100%|█████████▉| 1316/1319 [00:44<00:00,  8.61it/s]100%|█████████▉| 1318/1319 [00:44<00:00,  8.43it/s]100%|██████████| 1319/1319 [00:44<00:00,  6.54it/s]100%|██████████| 1319/1319 [00:44<00:00, 29.45it/s]
Accuracy: 0.936
Invalid: 0.000
Latency: 88.050 s
Output throughput: 1528.521 token/s
Run 2 completed in 94 seconds
Run 2: Accuracy: 0.936
  ✓ Run 2 included in average (accuracy: 0.936)
[progress] [==========----------------------------------------] 2/10 (20%)  | GSM8K: Run 2

Checking server health before Run 3...
✅ Server is healthy
Executing GSM8K test Run 3 ...
  0%|          | 0/1319 [00:00<?, ?it/s]  0%|          | 1/1319 [00:06<2:18:23,  6.30s/it]  0%|          | 2/1319 [00:08<1:21:28,  3.71s/it]  0%|          | 3/1319 [00:08<45:42,  2.08s/it]    0%|          | 4/1319 [00:09<35:22,  1.61s/it]  0%|          | 5/1319 [00:09<28:26,  1.30s/it]  1%|          | 8/1319 [00:10<11:47,  1.85it/s]  1%|          | 12/1319 [00:10<05:57,  3.66it/s]  1%|          | 16/1319 [00:10<04:05,  5.31it/s]  2%|▏         | 21/1319 [00:10<02:52,  7.52it/s]  2%|▏         | 31/1319 [00:11<01:38, 13.14it/s]  3%|▎         | 37/1319 [00:11<01:27, 14.71it/s]  3%|▎         | 42/1319 [00:11<01:24, 15.12it/s]  3%|▎         | 46/1319 [00:12<01:27, 14.54it/s]  4%|▍         | 58/1319 [00:12<00:58, 21.39it/s]  5%|▌         | 66/1319 [00:12<00:58, 21.24it/s]  5%|▌         | 72/1319 [00:13<00:56, 22.12it/s]  6%|▌         | 77/1319 [00:13<01:00, 20.43it/s]  7%|▋         | 88/1319 [00:14<01:05, 18.83it/s]  8%|▊         | 100/1319 [00:14<01:05, 18.72it/s]  8%|▊         | 107/1319 [00:14<01:01, 19.56it/s]  9%|▊         | 115/1319 [00:15<00:57, 21.11it/s]  9%|▉         | 120/1319 [00:15<01:00, 19.89it/s] 10%|▉         | 131/1319 [00:15<00:49, 24.14it/s] 11%|█         | 139/1319 [00:16<00:47, 24.71it/s] 11%|█         | 146/1319 [00:16<00:48, 24.18it/s] 12%|█▏        | 156/1319 [00:16<00:43, 26.68it/s] 12%|█▏        | 163/1319 [00:17<00:45, 25.50it/s] 13%|█▎        | 175/1319 [00:17<00:38, 29.59it/s] 14%|█▎        | 181/1319 [00:17<00:42, 26.56it/s] 15%|█▍        | 193/1319 [00:18<00:49, 22.83it/s] 15%|█▌        | 201/1319 [00:18<00:47, 23.57it/s] 16%|█▋        | 216/1319 [00:19<00:49, 22.34it/s] 17%|█▋        | 224/1319 [00:19<00:47, 23.14it/s] 18%|█▊        | 233/1319 [00:20<00:44, 24.54it/s] 19%|█▉        | 252/1319 [00:20<00:40, 26.54it/s] 20%|██        | 266/1319 [00:20<00:34, 30.78it/s] 21%|██        | 275/1319 [00:21<00:34, 30.43it/s] 22%|██▏       | 288/1319 [00:21<00:30, 33.56it/s] 23%|██▎       | 300/1319 [00:21<00:28, 35.17it/s] 23%|██▎       | 309/1319 [00:22<00:29, 34.41it/s] 24%|██▍       | 319/1319 [00:22<00:27, 36.44it/s] 25%|██▍       | 328/1319 [00:22<00:26, 37.11it/s] 26%|██▌       | 341/1319 [00:22<00:23, 42.08it/s] 27%|██▋       | 354/1319 [00:23<00:18, 51.25it/s] 27%|██▋       | 361/1319 [00:23<00:19, 50.17it/s] 28%|██▊       | 375/1319 [00:23<00:17, 53.71it/s] 30%|██▉       | 392/1319 [00:23<00:15, 60.10it/s] 30%|███       | 399/1319 [00:23<00:18, 50.91it/s] 31%|███       | 407/1319 [00:24<00:19, 46.13it/s] 32%|███▏      | 420/1319 [00:24<00:18, 49.43it/s] 32%|███▏      | 427/1319 [00:24<00:20, 43.73it/s] 33%|███▎      | 441/1319 [00:24<00:17, 49.06it/s] 34%|███▍      | 453/1319 [00:24<00:17, 50.48it/s] 35%|███▌      | 463/1319 [00:25<00:15, 54.17it/s] 36%|███▋      | 480/1319 [00:25<00:13, 61.29it/s] 37%|███▋      | 491/1319 [00:25<00:14, 57.10it/s] 38%|███▊      | 501/1319 [00:25<00:15, 53.03it/s] 39%|███▉      | 512/1319 [00:26<00:15, 51.69it/s] 40%|███▉      | 526/1319 [00:26<00:15, 49.60it/s] 40%|████      | 532/1319 [00:26<00:18, 43.32it/s] 41%|████      | 539/1319 [00:26<00:19, 39.89it/s] 41%|████▏     | 547/1319 [00:27<00:20, 38.26it/s] 43%|████▎     | 565/1319 [00:27<00:14, 50.74it/s] 44%|████▎     | 575/1319 [00:27<00:15, 49.18it/s] 44%|████▍     | 582/1319 [00:27<00:17, 41.54it/s] 45%|████▍     | 588/1319 [00:27<00:18, 39.31it/s] 45%|████▌     | 598/1319 [00:28<00:17, 41.12it/s] 46%|████▌     | 607/1319 [00:28<00:17, 40.87it/s] 47%|████▋     | 625/1319 [00:28<00:13, 52.73it/s] 48%|████▊     | 635/1319 [00:28<00:13, 50.46it/s] 49%|████▉     | 647/1319 [00:29<00:13, 50.89it/s] 50%|█████     | 664/1319 [00:29<00:11, 58.93it/s] 51%|█████     | 674/1319 [00:29<00:11, 54.55it/s] 52%|█████▏    | 683/1319 [00:29<00:12, 50.67it/s] 52%|█████▏    | 690/1319 [00:29<00:13, 45.08it/s] 53%|█████▎    | 700/1319 [00:30<00:13, 45.11it/s] 54%|█████▍    | 716/1319 [00:30<00:11, 53.53it/s] 55%|█████▍    | 724/1319 [00:30<00:12, 48.13it/s] 56%|█████▌    | 740/1319 [00:30<00:09, 62.32it/s] 57%|█████▋    | 752/1319 [00:30<00:09, 59.85it/s] 58%|█████▊    | 760/1319 [00:31<00:10, 52.49it/s] 58%|█████▊    | 771/1319 [00:31<00:09, 57.82it/s] 60%|█████▉    | 786/1319 [00:31<00:08, 61.75it/s] 60%|██████    | 793/1319 [00:31<00:10, 51.85it/s] 61%|██████    | 800/1319 [00:31<00:11, 45.61it/s] 61%|██████▏   | 810/1319 [00:31<00:08, 63.23it/s] 61%|██████▏   | 811/1319 [00:31<00:08, 63.23it/s] 61%|██████▏   | 811/1319 [00:31<00:08, 63.23it/s] 61%|██████▏   | 811/1319 [00:31<00:08, 63.23it/s] 61%|██████▏   | 811/1319 [00:31<00:08, 63.23it/s] 61%|██████▏   | 811/1319 [00:31<00:08, 63.23it/s] 61%|██████▏   | 811/1319 [00:31<00:08, 63.23it/s] 61%|██████▏   | 811/1319 [00:31<00:08, 63.23it/s] 61%|██████▏   | 811/1319 [00:31<00:08, 63.23it/s] 63%|██████▎   | 833/1319 [00:32<00:06, 80.03it/s] 64%|██████▍   | 849/1319 [00:32<00:05, 86.38it/s] 66%|██████▌   | 866/1319 [00:32<00:04, 93.67it/s] 67%|██████▋   | 880/1319 [00:32<00:04, 92.67it/s] 68%|██████▊   | 892/1319 [00:32<00:04, 92.86it/s] 69%|██████▉   | 908/1319 [00:32<00:04, 99.80it/s] 70%|██████▉   | 919/1319 [00:32<00:04, 93.78it/s] 71%|███████   | 934/1319 [00:33<00:03, 100.01it/s] 72%|███████▏  | 947/1319 [00:33<00:03, 98.40it/s]  73%|███████▎  | 966/1319 [00:33<00:03, 109.93it/s] 75%|███████▍  | 985/1319 [00:33<00:02, 121.23it/s] 76%|███████▌  | 999/1319 [00:33<00:02, 118.51it/s] 77%|███████▋  | 1012/1319 [00:33<00:02, 113.58it/s] 78%|███████▊  | 1033/1319 [00:33<00:02, 130.45it/s] 79%|███████▉  | 1047/1319 [00:33<00:02, 128.78it/s] 80%|████████  | 1060/1319 [00:34<00:02, 122.97it/s] 81%|████████▏ | 1073/1319 [00:34<00:02, 119.69it/s] 82%|████████▏ | 1085/1319 [00:34<00:02, 116.34it/s] 83%|████████▎ | 1097/1319 [00:34<00:02, 98.77it/s]  84%|████████▍ | 1108/1319 [00:34<00:02, 88.02it/s] 85%|████████▍ | 1118/1319 [00:34<00:02, 88.36it/s] 86%|████████▌ | 1128/1319 [00:34<00:02, 89.18it/s] 86%|████████▋ | 1138/1319 [00:34<00:01, 91.07it/s] 87%|████████▋ | 1148/1319 [00:35<00:02, 79.88it/s] 88%|████████▊ | 1159/1319 [00:35<00:01, 86.13it/s] 89%|████████▉ | 1173/1319 [00:35<00:01, 99.22it/s] 90%|████████▉ | 1184/1319 [00:35<00:01, 81.35it/s] 90%|█████████ | 1193/1319 [00:35<00:01, 74.60it/s] 91%|█████████ | 1202/1319 [00:35<00:01, 64.26it/s] 92%|█████████▏| 1210/1319 [00:36<00:01, 61.93it/s] 92%|█████████▏| 1218/1319 [00:36<00:01, 60.64it/s] 93%|█████████▎| 1226/1319 [00:36<00:01, 59.81it/s] 93%|█████████▎| 1233/1319 [00:36<00:01, 52.46it/s] 94%|█████████▍| 1240/1319 [00:36<00:01, 48.65it/s] 95%|█████████▍| 1248/1319 [00:36<00:01, 51.51it/s] 95%|█████████▌| 1254/1319 [00:36<00:01, 46.49it/s] 96%|█████████▌| 1265/1319 [00:37<00:00, 56.99it/s] 96%|█████████▋| 1271/1319 [00:37<00:00, 50.13it/s] 97%|█████████▋| 1277/1319 [00:37<00:01, 40.28it/s] 97%|█████████▋| 1282/1319 [00:37<00:00, 38.19it/s] 98%|█████████▊| 1287/1319 [00:37<00:00, 36.87it/s] 98%|█████████▊| 1291/1319 [00:38<00:01, 22.40it/s] 98%|█████████▊| 1295/1319 [00:38<00:01, 23.69it/s] 99%|█████████▊| 1301/1319 [00:38<00:00, 22.52it/s] 99%|█████████▉| 1304/1319 [00:38<00:00, 20.66it/s] 99%|█████████▉| 1307/1319 [00:39<00:00, 17.97it/s] 99%|█████████▉| 1310/1319 [00:39<00:00, 12.33it/s] 99%|█████████▉| 1312/1319 [00:39<00:00, 10.62it/s]100%|█████████▉| 1314/1319 [00:40<00:00,  7.65it/s]100%|█████████▉| 1316/1319 [00:40<00:00,  8.02it/s]100%|█████████▉| 1318/1319 [00:41<00:00,  3.94it/s]100%|██████████| 1319/1319 [00:42<00:00,  2.92it/s]100%|██████████| 1319/1319 [00:42<00:00, 30.80it/s]
Accuracy: 0.936
Invalid: 0.000
Latency: 43.008 s
Output throughput: 3119.746 token/s
Run 3 completed in 49 seconds
Run 3: Accuracy: 0.936
  ✓ Run 3 included in average (accuracy: 0.936)
[progress] [===============-----------------------------------] 3/10 (30%)  | GSM8K: Run 3

Checking server health before Run 4...
✅ Server is healthy
Executing GSM8K test Run 4 ...
  0%|          | 0/1319 [00:00<?, ?it/s]  0%|          | 1/1319 [00:07<2:52:41,  7.86s/it]  0%|          | 3/1319 [00:08<45:51,  2.09s/it]    0%|          | 4/1319 [00:08<31:15,  1.43s/it]  0%|          | 5/1319 [00:09<30:17,  1.38s/it]  1%|          | 8/1319 [00:09<13:07,  1.66it/s]  1%|          | 12/1319 [00:09<06:40,  3.27it/s]  1%|          | 16/1319 [00:10<04:30,  4.82it/s]  2%|▏         | 22/1319 [00:10<02:51,  7.55it/s]  2%|▏         | 31/1319 [00:10<01:46, 12.13it/s]  3%|▎         | 38/1319 [00:11<01:27, 14.62it/s]  3%|▎         | 44/1319 [00:11<01:20, 15.89it/s]  4%|▎         | 48/1319 [00:11<01:23, 15.13it/s]  4%|▍         | 59/1319 [00:11<01:00, 20.83it/s]  5%|▌         | 67/1319 [00:12<00:59, 20.93it/s]  6%|▌         | 75/1319 [00:12<00:52, 23.67it/s]  6%|▌         | 81/1319 [00:12<00:55, 22.49it/s]  7%|▋         | 88/1319 [00:13<00:54, 22.56it/s]  8%|▊         | 100/1319 [00:13<00:44, 27.56it/s]  8%|▊         | 104/1319 [00:13<00:52, 23.18it/s]  8%|▊         | 110/1319 [00:14<00:54, 22.10it/s]  9%|▉         | 119/1319 [00:14<00:49, 24.23it/s] 10%|█         | 133/1319 [00:14<00:38, 30.69it/s] 11%|█         | 140/1319 [00:14<00:41, 28.26it/s] 11%|█▏        | 151/1319 [00:15<00:38, 30.50it/s] 12%|█▏        | 162/1319 [00:15<00:35, 32.15it/s] 13%|█▎        | 169/1319 [00:15<00:39, 29.29it/s] 14%|█▎        | 181/1319 [00:16<00:35, 32.30it/s] 14%|█▍        | 188/1319 [00:16<00:38, 29.42it/s] 15%|█▍        | 195/1319 [00:16<00:40, 27.42it/s] 16%|█▌        | 205/1319 [00:17<00:38, 28.97it/s] 16%|█▋        | 217/1319 [00:17<00:34, 32.06it/s] 17%|█▋        | 223/1319 [00:17<00:38, 28.25it/s] 18%|█▊        | 233/1319 [00:18<00:36, 29.40it/s] 19%|█▉        | 255/1319 [00:19<00:45, 23.31it/s] 20%|██        | 265/1319 [00:19<00:42, 25.06it/s] 21%|██        | 278/1319 [00:19<00:36, 28.78it/s] 22%|██▏       | 292/1319 [00:20<00:31, 32.76it/s] 23%|██▎       | 301/1319 [00:20<00:31, 31.98it/s] 23%|██▎       | 308/1319 [00:20<00:33, 30.23it/s] 24%|██▍       | 318/1319 [00:20<00:27, 36.08it/s] 25%|██▌       | 330/1319 [00:21<00:24, 40.14it/s] 26%|██▌       | 344/1319 [00:21<00:21, 45.70it/s] 27%|██▋       | 354/1319 [00:21<00:19, 50.32it/s] 27%|██▋       | 360/1319 [00:21<00:22, 42.71it/s] 28%|██▊       | 371/1319 [00:21<00:19, 48.78it/s] 30%|██▉       | 390/1319 [00:22<00:15, 60.30it/s] 30%|███       | 397/1319 [00:22<00:16, 57.24it/s] 31%|███       | 407/1319 [00:22<00:15, 59.89it/s] 32%|███▏      | 420/1319 [00:22<00:13, 67.36it/s] 33%|███▎      | 430/1319 [00:22<00:15, 58.17it/s] 34%|███▍      | 451/1319 [00:22<00:12, 69.82it/s] 35%|███▌      | 462/1319 [00:23<00:21, 39.40it/s] 36%|███▌      | 470/1319 [00:23<00:24, 35.01it/s] 37%|███▋      | 488/1319 [00:24<00:18, 45.04it/s] 38%|███▊      | 498/1319 [00:24<00:16, 48.72it/s] 39%|███▊      | 508/1319 [00:24<00:17, 46.79it/s] 39%|███▉      | 520/1319 [00:24<00:16, 48.57it/s] 40%|████      | 532/1319 [00:24<00:14, 55.49it/s] 41%|████      | 539/1319 [00:25<00:14, 54.05it/s] 41%|████▏     | 545/1319 [00:25<00:17, 45.02it/s] 42%|████▏     | 550/1319 [00:25<00:20, 37.38it/s] 43%|████▎     | 562/1319 [00:25<00:15, 48.00it/s] 43%|████▎     | 571/1319 [00:25<00:18, 40.56it/s] 44%|████▍     | 581/1319 [00:26<00:28, 25.94it/s] 45%|████▌     | 598/1319 [00:26<00:20, 34.80it/s] 45%|████▌     | 598/1319 [00:26<00:20, 34.80it/s] 45%|████▌     | 598/1319 [00:26<00:20, 34.80it/s] 45%|████▌     | 598/1319 [00:26<00:20, 34.80it/s] 45%|████▌     | 598/1319 [00:26<00:20, 34.80it/s] 45%|████▌     | 598/1319 [00:26<00:20, 34.80it/s] 45%|████▌     | 598/1319 [00:26<00:20, 34.80it/s] 45%|████▌     | 598/1319 [00:26<00:20, 34.80it/s] 45%|████▌     | 598/1319 [00:26<00:20, 34.80it/s] 45%|████▌     | 598/1319 [00:26<00:20, 34.80it/s] 45%|████▌     | 598/1319 [00:26<00:20, 34.80it/s] 45%|████▌     | 598/1319 [00:26<00:20, 34.80it/s] 45%|████▌     | 598/1319 [00:26<00:20, 34.80it/s] 45%|████▌     | 598/1319 [00:26<00:20, 34.80it/s] 45%|████▌     | 598/1319 [00:26<00:20, 34.80it/s] 45%|████▌     | 598/1319 [00:26<00:20, 34.80it/s] 46%|████▌     | 608/1319 [00:26<00:18, 37.47it/s] 48%|████▊     | 630/1319 [00:27<00:14, 47.02it/s] 49%|████▉     | 644/1319 [00:27<00:13, 49.74it/s] 50%|████▉     | 653/1319 [00:27<00:13, 47.85it/s] 50%|█████     | 665/1319 [00:27<00:13, 49.03it/s] 51%|█████▏    | 676/1319 [00:27<00:13, 49.25it/s] 52%|█████▏    | 688/1319 [00:28<00:12, 50.35it/s] 53%|█████▎    | 694/1319 [00:28<00:14, 44.06it/s] 53%|█████▎    | 703/1319 [00:28<00:12, 47.65it/s] 54%|█████▍    | 717/1319 [00:28<00:10, 59.00it/s] 55%|█████▌    | 727/1319 [00:28<00:10, 54.21it/s] 56%|█████▌    | 739/1319 [00:29<00:10, 54.47it/s] 57%|█████▋    | 747/1319 [00:29<00:10, 54.71it/s] 57%|█████▋    | 754/1319 [00:29<00:12, 46.87it/s] 58%|█████▊    | 769/1319 [00:29<00:10, 53.87it/s] 59%|█████▉    | 781/1319 [00:29<00:09, 53.84it/s] 60%|█████▉    | 789/1319 [00:30<00:10, 48.28it/s] 61%|██████    | 802/1319 [00:30<00:10, 51.46it/s] 63%|██████▎   | 826/1319 [00:30<00:06, 73.31it/s] 64%|██████▍   | 844/1319 [00:30<00:05, 84.56it/s] 65%|██████▌   | 860/1319 [00:30<00:05, 90.54it/s] 66%|██████▌   | 871/1319 [00:30<00:05, 84.87it/s] 67%|██████▋   | 887/1319 [00:31<00:04, 92.03it/s] 69%|██████▊   | 904/1319 [00:31<00:04, 101.52it/s] 70%|██████▉   | 922/1319 [00:31<00:03, 109.66it/s] 71%|███████   | 936/1319 [00:31<00:03, 109.77it/s] 72%|███████▏  | 950/1319 [00:31<00:03, 106.05it/s] 73%|███████▎  | 965/1319 [00:31<00:03, 106.29it/s] 74%|███████▍  | 981/1319 [00:31<00:03, 111.12it/s] 75%|███████▌  | 995/1319 [00:32<00:02, 111.58it/s] 76%|███████▋  | 1007/1319 [00:32<00:02, 106.41it/s] 77%|███████▋  | 1020/1319 [00:32<00:02, 104.83it/s] 78%|███████▊  | 1031/1319 [00:32<00:02, 102.14it/s] 79%|███████▉  | 1043/1319 [00:32<00:02, 102.84it/s] 80%|████████  | 1061/1319 [00:32<00:02, 118.27it/s] 81%|████████▏ | 1073/1319 [00:32<00:02, 99.07it/s]  82%|████████▏ | 1084/1319 [00:32<00:02, 97.83it/s] 83%|████████▎ | 1095/1319 [00:33<00:02, 85.78it/s] 84%|████████▍ | 1105/1319 [00:33<00:02, 87.23it/s] 85%|████████▍ | 1115/1319 [00:33<00:02, 87.77it/s] 85%|████████▌ | 1125/1319 [00:33<00:02, 89.85it/s] 86%|████████▌ | 1135/1319 [00:33<00:02, 91.24it/s] 87%|████████▋ | 1145/1319 [00:33<00:02, 70.91it/s] 88%|████████▊ | 1157/1319 [00:33<00:02, 80.85it/s] 89%|████████▊ | 1168/1319 [00:33<00:01, 87.46it/s] 89%|████████▉ | 1178/1319 [00:34<00:01, 79.95it/s] 90%|████████▉ | 1187/1319 [00:34<00:01, 74.20it/s] 91%|█████████ | 1195/1319 [00:34<00:02, 61.22it/s] 91%|█████████▏| 1206/1319 [00:34<00:01, 65.94it/s] 92%|█████████▏| 1215/1319 [00:34<00:01, 65.15it/s] 93%|█████████▎| 1226/1319 [00:34<00:01, 69.36it/s] 94%|█████████▎| 1234/1319 [00:35<00:01, 60.82it/s] 94%|█████████▍| 1241/1319 [00:35<00:01, 49.67it/s] 95%|█████████▍| 1247/1319 [00:35<00:01, 48.31it/s] 95%|█████████▌| 1255/1319 [00:35<00:01, 47.97it/s] 96%|█████████▌| 1266/1319 [00:35<00:00, 57.83it/s] 97%|█████████▋| 1273/1319 [00:35<00:00, 52.91it/s] 97%|█████████▋| 1279/1319 [00:36<00:00, 48.54it/s] 97%|█████████▋| 1285/1319 [00:36<00:00, 35.57it/s] 98%|█████████▊| 1290/1319 [00:36<00:01, 27.53it/s] 98%|█████████▊| 1294/1319 [00:36<00:00, 29.44it/s] 98%|█████████▊| 1298/1319 [00:36<00:00, 31.28it/s] 99%|█████████▊| 1302/1319 [00:37<00:00, 29.36it/s] 99%|█████████▉| 1306/1319 [00:37<00:00, 21.23it/s] 99%|█████████▉| 1309/1319 [00:37<00:00, 17.88it/s] 99%|█████████▉| 1312/1319 [00:37<00:00, 17.90it/s]100%|█████████▉| 1315/1319 [00:38<00:00, 14.07it/s]100%|█████████▉| 1317/1319 [00:38<00:00, 13.37it/s]100%|██████████| 1319/1319 [00:38<00:00, 10.96it/s]100%|██████████| 1319/1319 [00:38<00:00, 34.11it/s]
Accuracy: 0.936
Invalid: 0.000
Latency: 38.846 s
Output throughput: 3461.454 token/s
Run 4 completed in 45 seconds
Run 4: Accuracy: 0.936
  ✓ Run 4 included in average (accuracy: 0.936)
[progress] [====================------------------------------] 4/10 (40%)  | GSM8K: Run 4

Checking server health before Run 5...
✅ Server is healthy
Executing GSM8K test Run 5 ...
  0%|          | 0/1319 [00:00<?, ?it/s]  0%|          | 1/1319 [00:08<2:58:07,  8.11s/it]  0%|          | 2/1319 [00:08<1:15:10,  3.42s/it]  0%|          | 3/1319 [00:08<42:31,  1.94s/it]    0%|          | 4/1319 [00:09<31:58,  1.46s/it]  0%|          | 5/1319 [00:09<25:05,  1.15s/it]  0%|          | 6/1319 [00:09<17:39,  1.24it/s]  1%|          | 9/1319 [00:10<07:54,  2.76it/s]  1%|          | 13/1319 [00:10<04:34,  4.76it/s]  1%|▏         | 18/1319 [00:10<02:58,  7.27it/s]  2%|▏         | 22/1319 [00:10<02:30,  8.65it/s]  2%|▏         | 31/1319 [00:11<01:32, 13.92it/s]  3%|▎         | 36/1319 [00:11<01:28, 14.54it/s]  3%|▎         | 42/1319 [00:11<01:19, 15.97it/s]  3%|▎         | 44/1319 [00:12<01:36, 13.27it/s]  4%|▍         | 55/1319 [00:12<01:24, 14.98it/s]  5%|▍         | 64/1319 [00:12<00:45, 27.51it/s]  5%|▍         | 64/1319 [00:12<00:45, 27.51it/s]  5%|▍         | 64/1319 [00:12<00:45, 27.51it/s]  5%|▍         | 64/1319 [00:12<00:45, 27.51it/s]  5%|▍         | 64/1319 [00:12<00:45, 27.51it/s]  5%|▍         | 64/1319 [00:12<00:45, 27.51it/s]  5%|▍         | 64/1319 [00:12<00:45, 27.51it/s]  5%|▍         | 64/1319 [00:12<00:45, 27.51it/s]  5%|▍         | 64/1319 [00:12<00:45, 27.51it/s]  5%|▌         | 67/1319 [00:13<01:06, 18.83it/s]  6%|▌         | 82/1319 [00:14<00:55, 22.14it/s]  7%|▋         | 88/1319 [00:14<00:56, 21.70it/s]  8%|▊         | 99/1319 [00:14<00:49, 24.49it/s]  8%|▊         | 108/1319 [00:15<00:47, 25.61it/s]  8%|▊         | 112/1319 [00:15<00:53, 22.55it/s]  9%|▉         | 117/1319 [00:15<00:53, 22.49it/s]  9%|▉         | 117/1319 [00:15<00:53, 22.49it/s]  9%|▉         | 117/1319 [00:15<00:53, 22.49it/s]  9%|▉         | 117/1319 [00:15<00:53, 22.49it/s]  9%|▉         | 120/1319 [00:15<01:23, 14.31it/s] 10%|▉         | 128/1319 [00:16<01:09, 17.08it/s] 10%|█         | 136/1319 [00:16<01:00, 19.41it/s] 11%|█         | 141/1319 [00:16<01:03, 18.58it/s] 11%|█▏        | 149/1319 [00:16<00:48, 23.89it/s] 11%|█▏        | 150/1319 [00:16<00:48, 23.89it/s] 11%|█▏        | 150/1319 [00:16<00:48, 23.89it/s] 11%|█▏        | 150/1319 [00:16<00:48, 23.89it/s] 12%|█▏        | 153/1319 [00:17<00:58, 19.77it/s] 12%|█▏        | 160/1319 [00:17<00:56, 20.67it/s] 13%|█▎        | 170/1319 [00:17<00:29, 38.42it/s] 13%|█▎        | 170/1319 [00:17<00:29, 38.42it/s] 13%|█▎        | 170/1319 [00:17<00:29, 38.42it/s] 13%|█▎        | 170/1319 [00:17<00:29, 38.42it/s] 13%|█▎        | 170/1319 [00:17<00:29, 38.42it/s] 13%|█▎        | 170/1319 [00:17<00:29, 38.42it/s] 13%|█▎        | 170/1319 [00:17<00:29, 38.42it/s] 13%|█▎        | 174/1319 [00:18<00:49, 23.22it/s] 14%|█▎        | 179/1319 [00:18<00:53, 21.39it/s] 14%|█▍        | 190/1319 [00:18<00:45, 25.06it/s] 15%|█▌        | 204/1319 [00:19<00:36, 30.56it/s] 16%|█▋        | 217/1319 [00:19<00:32, 33.84it/s] 17%|█▋        | 224/1319 [00:19<00:35, 30.59it/s] 18%|█▊        | 237/1319 [00:20<00:42, 25.70it/s] 19%|█▉        | 256/1319 [00:21<00:39, 27.20it/s] 20%|██        | 264/1319 [00:21<00:39, 26.83it/s] 21%|██        | 276/1319 [00:21<00:35, 29.58it/s] 22%|██▏       | 288/1319 [00:21<00:20, 49.46it/s] 22%|██▏       | 290/1319 [00:21<00:20, 49.46it/s] 22%|██▏       | 290/1319 [00:21<00:20, 49.46it/s] 22%|██▏       | 290/1319 [00:21<00:20, 49.46it/s] 22%|██▏       | 290/1319 [00:21<00:20, 49.46it/s] 22%|██▏       | 290/1319 [00:21<00:20, 49.46it/s] 22%|██▏       | 296/1319 [00:22<00:33, 30.79it/s] 23%|██▎       | 304/1319 [00:22<00:34, 29.29it/s] 24%|██▍       | 315/1319 [00:22<00:31, 31.68it/s] 25%|██▍       | 324/1319 [00:23<00:30, 33.08it/s] 25%|██▌       | 333/1319 [00:23<00:21, 45.11it/s] 25%|██▌       | 334/1319 [00:23<00:21, 45.11it/s] 25%|██▌       | 335/1319 [00:23<00:21, 45.11it/s] 25%|██▌       | 335/1319 [00:23<00:21, 45.11it/s] 26%|██▌       | 340/1319 [00:23<00:25, 38.86it/s] 26%|██▌       | 344/1319 [00:23<00:29, 32.74it/s] 27%|██▋       | 355/1319 [00:23<00:23, 41.52it/s] 27%|██▋       | 361/1319 [00:23<00:23, 40.93it/s] 28%|██▊       | 375/1319 [00:24<00:17, 53.98it/s] 30%|██▉       | 392/1319 [00:24<00:13, 70.22it/s] 30%|███       | 402/1319 [00:24<00:15, 60.81it/s] 31%|███       | 410/1319 [00:24<00:17, 51.87it/s] 32%|███▏      | 419/1319 [00:24<00:16, 54.17it/s] 33%|███▎      | 430/1319 [00:24<00:15, 59.01it/s] 34%|███▎      | 445/1319 [00:25<00:14, 61.76it/s] 35%|███▍      | 456/1319 [00:25<00:15, 57.45it/s] 35%|███▌      | 464/1319 [00:25<00:17, 49.54it/s] 37%|███▋      | 482/1319 [00:25<00:14, 59.66it/s] 37%|███▋      | 489/1319 [00:25<00:14, 56.62it/s] 38%|███▊      | 501/1319 [00:26<00:12, 62.94it/s] 39%|███▉      | 514/1319 [00:26<00:11, 69.49it/s] 40%|███▉      | 524/1319 [00:26<00:13, 60.67it/s] 40%|████      | 531/1319 [00:26<00:13, 57.58it/s] 41%|████      | 537/1319 [00:26<00:16, 46.52it/s] 41%|████      | 544/1319 [00:27<00:16, 46.66it/s] 42%|████▏     | 558/1319 [00:27<00:14, 52.20it/s] 43%|████▎     | 569/1319 [00:27<00:07, 96.36it/s] 43%|████▎     | 570/1319 [00:27<00:07, 96.36it/s] 43%|████▎     | 570/1319 [00:27<00:07, 96.36it/s] 43%|████▎     | 570/1319 [00:27<00:07, 96.36it/s] 43%|████▎     | 570/1319 [00:27<00:07, 96.36it/s] 43%|████▎     | 570/1319 [00:27<00:07, 96.36it/s] 43%|████▎     | 570/1319 [00:27<00:07, 96.36it/s] 43%|████▎     | 570/1319 [00:27<00:07, 96.36it/s] 43%|████▎     | 570/1319 [00:27<00:07, 96.36it/s] 43%|████▎     | 570/1319 [00:27<00:07, 96.36it/s] 44%|████▍     | 580/1319 [00:27<00:08, 90.41it/s] 45%|████▍     | 589/1319 [00:27<00:10, 70.37it/s] 45%|████▌     | 597/1319 [00:27<00:11, 62.67it/s] 46%|████▌     | 604/1319 [00:27<00:11, 59.76it/s] 46%|████▌     | 610/1319 [00:28<00:14, 48.36it/s] 47%|████▋     | 626/1319 [00:28<00:12, 56.14it/s] 48%|████▊     | 636/1319 [00:28<00:12, 52.57it/s] 49%|████▉     | 648/1319 [00:28<00:12, 52.90it/s] 50%|█████     | 660/1319 [00:29<00:12, 53.43it/s] 51%|█████     | 673/1319 [00:29<00:10, 61.41it/s] 52%|█████▏    | 685/1319 [00:29<00:10, 59.03it/s] 52%|█████▏    | 691/1319 [00:29<00:09, 68.81it/s] 52%|█████▏    | 691/1319 [00:29<00:09, 68.81it/s] 52%|█████▏    | 691/1319 [00:29<00:09, 68.81it/s] 52%|█████▏    | 691/1319 [00:29<00:09, 68.81it/s] 52%|█████▏    | 691/1319 [00:29<00:09, 68.81it/s] 53%|█████▎    | 698/1319 [00:29<00:10, 57.38it/s] 54%|█████▎    | 706/1319 [00:29<00:12, 50.62it/s] 54%|█████▍    | 714/1319 [00:30<00:13, 46.23it/s] 55%|█████▌    | 726/1319 [00:30<00:12, 48.62it/s] 56%|█████▌    | 737/1319 [00:30<00:11, 49.20it/s] 56%|█████▋    | 743/1319 [00:30<00:13, 42.68it/s] 57%|█████▋    | 751/1319 [00:31<00:14, 40.52it/s] 58%|█████▊    | 764/1319 [00:31<00:12, 46.08it/s] 59%|█████▉    | 777/1319 [00:31<00:10, 50.06it/s] 60%|█████▉    | 788/1319 [00:31<00:10, 50.27it/s] 60%|██████    | 796/1319 [00:31<00:11, 46.18it/s] 61%|██████    | 805/1319 [00:32<00:11, 44.42it/s] 62%|██████▏   | 818/1319 [00:32<00:06, 74.87it/s] 62%|██████▏   | 818/1319 [00:32<00:06, 74.87it/s] 62%|██████▏   | 818/1319 [00:32<00:06, 74.87it/s] 62%|██████▏   | 818/1319 [00:32<00:06, 74.87it/s] 62%|██████▏   | 818/1319 [00:32<00:06, 74.87it/s] 62%|██████▏   | 818/1319 [00:32<00:06, 74.87it/s] 62%|██████▏   | 818/1319 [00:32<00:06, 74.87it/s] 62%|██████▏   | 818/1319 [00:32<00:06, 74.87it/s] 62%|██████▏   | 818/1319 [00:32<00:06, 74.87it/s] 62%|██████▏   | 818/1319 [00:32<00:06, 74.87it/s] 64%|██████▎   | 840/1319 [00:32<00:05, 88.87it/s] 65%|██████▍   | 856/1319 [00:32<00:04, 93.28it/s] 66%|██████▌   | 866/1319 [00:32<00:05, 85.72it/s] 67%|██████▋   | 884/1319 [00:32<00:04, 96.05it/s] 68%|██████▊   | 900/1319 [00:32<00:04, 101.74it/s] 69%|██████▉   | 916/1319 [00:32<00:03, 106.68it/s] 71%|███████   | 934/1319 [00:33<00:03, 114.74it/s] 72%|███████▏  | 946/1319 [00:33<00:03, 107.05it/s] 73%|███████▎  | 963/1319 [00:33<00:03, 111.66it/s] 74%|███████▍  | 979/1319 [00:33<00:02, 114.60it/s] 75%|███████▌  | 992/1319 [00:33<00:02, 110.51it/s] 77%|███████▋  | 1010/1319 [00:33<00:02, 120.27it/s] 78%|███████▊  | 1023/1319 [00:33<00:02, 115.60it/s] 79%|███████▉  | 1040/1319 [00:34<00:02, 122.89it/s] 80%|███████▉  | 1053/1319 [00:34<00:02, 106.52it/s] 81%|████████▏ | 1072/1319 [00:34<00:02, 122.71it/s] 82%|████████▏ | 1085/1319 [00:34<00:02, 105.33it/s] 83%|████████▎ | 1097/1319 [00:34<00:02, 84.35it/s]  84%|████████▍ | 1107/1319 [00:34<00:02, 76.76it/s] 85%|████████▌ | 1124/1319 [00:34<00:02, 94.00it/s] 86%|████████▋ | 1139/1319 [00:35<00:01, 105.03it/s] 87%|████████▋ | 1151/1319 [00:35<00:01, 106.94it/s] 88%|████████▊ | 1163/1319 [00:35<00:01, 96.02it/s]  89%|████████▉ | 1174/1319 [00:35<00:01, 88.29it/s] 90%|████████▉ | 1184/1319 [00:35<00:01, 81.84it/s] 90%|█████████ | 1193/1319 [00:35<00:01, 68.28it/s] 91%|█████████ | 1201/1319 [00:36<00:01, 64.64it/s] 92%|█████████▏| 1208/1319 [00:36<00:01, 60.19it/s] 92%|█████████▏| 1215/1319 [00:36<00:02, 51.97it/s] 93%|█████████▎| 1227/1319 [00:36<00:01, 61.43it/s] 94%|█████████▎| 1234/1319 [00:36<00:01, 53.91it/s] 94%|█████████▍| 1240/1319 [00:36<00:01, 47.30it/s] 94%|█████████▍| 1246/1319 [00:36<00:01, 46.76it/s] 95%|█████████▍| 1251/1319 [00:37<00:01, 40.87it/s] 95%|█████████▌| 1259/1319 [00:37<00:01, 46.11it/s] 96%|█████████▌| 1268/1319 [00:37<00:00, 53.23it/s] 97%|█████████▋| 1274/1319 [00:37<00:00, 51.64it/s] 97%|█████████▋| 1280/1319 [00:37<00:00, 47.26it/s] 97%|█████████▋| 1285/1319 [00:37<00:00, 42.82it/s] 98%|█████████▊| 1290/1319 [00:38<00:01, 27.71it/s] 98%|█████████▊| 1294/1319 [00:38<00:01, 23.95it/s] 98%|█████████▊| 1297/1319 [00:38<00:01, 21.46it/s] 99%|█████████▊| 1301/1319 [00:38<00:00, 22.25it/s] 99%|█████████▉| 1304/1319 [00:39<00:00, 18.54it/s] 99%|█████████▉| 1307/1319 [00:39<00:00, 17.21it/s] 99%|█████████▉| 1309/1319 [00:39<00:00, 15.12it/s] 99%|█████████▉| 1311/1319 [00:39<00:00, 15.57it/s]100%|█████████▉| 1313/1319 [00:39<00:00, 13.43it/s]100%|█████████▉| 1315/1319 [00:40<00:00, 10.44it/s]100%|█████████▉| 1317/1319 [00:40<00:00,  6.90it/s]100%|██████████| 1319/1319 [00:40<00:00,  7.75it/s]100%|██████████| 1319/1319 [00:40<00:00, 32.26it/s]
Accuracy: 0.936
Invalid: 0.000
Latency: 41.084 s
Output throughput: 3263.365 token/s
Run 5 completed in 47 seconds
Run 5: Accuracy: 0.936
  ✓ Run 5 included in average (accuracy: 0.936)
[progress] [=========================-------------------------] 5/10 (50%)  | GSM8K: Run 5
GSM8K test completed in 361 seconds
Total runs: 5, Valid runs: 5, Excluded runs: 0
Average Accuracy over 5 valid runs: 0.935
Average accuracy meets threshold (0.93).
✅ GSM8K benchmark completed successfully.
GSM8K log saved to /mnt/raid/michael/sglang-ci/online/DeepSeek-V3-0324/v0.5.6-rocm700-mi30x-20251206_DeepSeek-V3-0324_FP8_online/sglang_client_log_DeepSeek-V3-0324_gsm8k.log
Server log saved to /mnt/raid/michael/sglang-ci/online/DeepSeek-V3-0324/v0.5.6-rocm700-mi30x-20251206_DeepSeek-V3-0324_FP8_online/sglang_server.log
Starting serving benchmark tests with different concurrency levels...
[online] Structured CSV initialized at /mnt/raid/michael/sglang-ci/online/DeepSeek-V3-0324/v0.5.6-rocm700-mi30x-20251206_DeepSeek-V3-0324_FP8_online/v0.5.6-rocm700-mi30x-20251206_DeepSeek-V3-0324_FP8_serving.csv
Processing concurrency 128 with 1 runs...
Running serving benchmark with concurrency 128 (Run 1) - 500 prompts...
Concurrency 128, Run 1 completed: 500 requests, (tok/s): tok/s output throughput, 135688.18ms E2E latency (539s)
[progress] [==============================--------------------] 6/10 (60%)  | Serving: C128 R1
✅ Best results for concurrency 128: E2E=135688.18ms, TTFT=19183.04ms, ITL=120.63ms, Output=(tok/s): tok/s
[online] Updating CSV for concurrency 128: E2E=135688.18ms, TTFT=19183.04ms, ITL=120.63ms, Output=(tok/s): tok/s
[online] CSV updated with results for concurrency 128
Sleeping 3 seconds before next concurrency level...
Processing concurrency 64 with 1 runs...
Running serving benchmark with concurrency 64 (Run 1) - 500 prompts...
Concurrency 64, Run 1 completed: 500 requests, (tok/s): tok/s output throughput, 106445.37ms E2E latency (831s)
[progress] [===================================---------------] 7/10 (70%)  | Serving: C64 R1
✅ Best results for concurrency 64: E2E=106445.37ms, TTFT=9883.36ms, ITL=108.89ms, Output=(tok/s): tok/s
[online] Updating CSV for concurrency 64: E2E=106445.37ms, TTFT=9883.36ms, ITL=108.89ms, Output=(tok/s): tok/s
[online] CSV updated with results for concurrency 64
Sleeping 3 seconds before next concurrency level...
Processing concurrency 16 with 1 runs...
Running serving benchmark with concurrency 16 (Run 1) - 128 prompts...
Concurrency 16, Run 1 completed: 128 requests, (tok/s): tok/s output throughput, 80505.47ms E2E latency (527s)
[progress] [========================================----------] 8/10 (80%)  | Serving: C16 R1
✅ Best results for concurrency 16: E2E=80505.47ms, TTFT=2812.75ms, ITL=94.75ms, Output=(tok/s): tok/s
[online] Updating CSV for concurrency 16: E2E=80505.47ms, TTFT=2812.75ms, ITL=94.75ms, Output=(tok/s): tok/s
[online] CSV updated with results for concurrency 16
Sleeping 3 seconds before next concurrency level...
Processing concurrency 4 with 1 runs...
Running serving benchmark with concurrency 4 (Run 1) - 128 prompts...
Concurrency 4, Run 1 completed: 128 requests, (tok/s): tok/s output throughput, 21149.42ms E2E latency (690s)
[progress] [=============================================-----] 9/10 (90%)  | Serving: C4 R1
✅ Best results for concurrency 4: E2E=21149.42ms, TTFT=334.30ms, ITL=26.05ms, Output=(tok/s): tok/s
[online] Updating CSV for concurrency 4: E2E=21149.42ms, TTFT=334.30ms, ITL=26.05ms, Output=(tok/s): tok/s
[online] CSV updated with results for concurrency 4
Sleeping 3 seconds before next concurrency level...
Processing concurrency 1 with 1 runs...
Running serving benchmark with concurrency 1 (Run 1) - 128 prompts...
Concurrency 1, Run 1 completed: 128 requests, (tok/s): tok/s output throughput, 19676.02ms E2E latency (2533s)
[progress] [==================================================] 10/10 (100%) ✅ Complete!
 | Serving: C1 R1
✅ Best results for concurrency 1: E2E=19676.02ms, TTFT=180.66ms, ITL=24.40ms, Output=(tok/s): tok/s
[online] Updating CSV for concurrency 1: E2E=19676.02ms, TTFT=180.66ms, ITL=24.40ms, Output=(tok/s): tok/s
[online] CSV updated with results for concurrency 1
✅ Serving benchmark completed successfully in 5143 seconds (standard mode).
Structured serving benchmark results written to /mnt/raid/michael/sglang-ci/online/DeepSeek-V3-0324/v0.5.6-rocm700-mi30x-20251206_DeepSeek-V3-0324_FP8_online/v0.5.6-rocm700-mi30x-20251206_DeepSeek-V3-0324_FP8_serving.csv
Individual concurrency logs saved to /mnt/raid/michael/sglang-ci/online/DeepSeek-V3-0324/v0.5.6-rocm700-mi30x-20251206_DeepSeek-V3-0324_FP8_online/sglang_serving_benchmark_concurrency_*_run*.log
GSM8K accuracy results written to /mnt/raid/michael/sglang-ci/online/DeepSeek-V3-0324/v0.5.6-rocm700-mi30x-20251206_DeepSeek-V3-0324_FP8_online/sglang_client_log_DeepSeek-V3-0324_gsm8k.log
Shutting down SGLang server...
Server shutdown completed in 0 seconds

==========================================
SCRIPT EXECUTION SUMMARY
==========================================
Script completed at: 2025-12-06 16:49:51 PST
Total execution time: 5659 seconds (94 minutes)
Output directory: /mnt/raid/michael/sglang-ci/online/DeepSeek-V3-0324/v0.5.6-rocm700-mi30x-20251206_DeepSeek-V3-0324_FP8_online
Serving CSV: /mnt/raid/michael/sglang-ci/online/DeepSeek-V3-0324/v0.5.6-rocm700-mi30x-20251206_DeepSeek-V3-0324_FP8_online/v0.5.6-rocm700-mi30x-20251206_DeepSeek-V3-0324_FP8_serving.csv
Timing log: /mnt/raid/michael/sglang-ci/online/DeepSeek-V3-0324/v0.5.6-rocm700-mi30x-20251206_DeepSeek-V3-0324_FP8_online/timing_summary_20251206_151532.log
===========================================
Cleaning up...
Killing background SGLang server (PID: 47)...
Server process 47 not found or already terminated.
[nightly] === Online benchmark dispatched for DEEPSEEK; check logs in sgl-dev_v0.5.6-rocm700-mi30x-20251206 ===
[nightly] === Starting post-processing (CSV processing, plot generation, Teams notifications) ===
[nightly] Processing online CSV data and generating plots... Logs will be saved to /mnt/raid/michael/sglang-ci/online/DeepSeek-V3-0324/v0.5.6-rocm700-mi30x-20251206_DeepSeek-V3-0324_FP8_online/process_and_generate_online_plots.log
[nightly] Using plot date from image tag: 20251206
[nightly] Teams notifications skipped - --teams-webhook-url not provided
[nightly] === Online post-processing completed for DEEPSEEK ===
[nightly] ==========================================
[nightly] Completed benchmarks for image: rocm/sgl-dev:v0.5.6-rocm700-mi30x-20251206
[nightly] Stopping container sgl-dev_v0.5.6-rocm700-mi30x-20251206 to release resources...
[nightly] ==========================================
[nightly] ==========================================
[nightly] All benchmarks completed for 1 image(s)
[nightly] ==========================================
[nightly] Cleaning up process lock...
