[nightly] ==========================================
[nightly] SGL Nightly Benchmark Started
[nightly] ==========================================
[nightly] Command: scripts/perf_nightly.sh --model=deepseek --model-path=/mnt/raid/models/huggingface/deepseek-ai/DeepSeek-V3-0324 --mode=online --hardware=mi30x --teams-webhook-url=https://default3dd8961fe4884e608e11a82d994e18.3d.environment.api.powerplatform.com:443/powerautomate/automations/direct/workflows/5b63cac7474049f7a780db5486e3a5c6/triggers/manual/paths/invoke?api-version=1&sp=%2Ftriggers%2Fmanual%2Frun&sv=1.0&sig=5npWudEjINETmq67Bx35skofwckhvg92Io38Ayll5Ns
[nightly] Start time: 2025-11-08 14:15:01 PST
[nightly] Machine: dell300x-pla-t10-23
[nightly] Working directory: /mnt/raid/michael/sglang-ci
[nightly] Script location: /mnt/raid/michael/sglang-ci/scripts/perf_nightly.sh
[nightly] Process ID: 4070449
[nightly] ==========================================

[nightly] Runtime Environment:
[nightly] User: amd | Groups: amd video users... | Docker: /usr/bin/docker
[nightly] Testing Docker daemon access...
[nightly] Docker daemon accessible - proceeding...
[nightly] Teams webhook URL provided via command line - notifications enabled
[nightly] Custom model path provided: /mnt/raid/models/huggingface/deepseek-ai/DeepSeek-V3-0324
[nightly] Hardware: mi30x, ROCM Version: rocm630
[nightly] Model: deepseek, Mode(s): online
[nightly] Created process lock: /tmp/perf_nightly_deepseek.lock
[nightly] GPU is busy. Attempting to stop running Docker containers...
[nightly] Stopping running containers: 492cd001a009
[nightly] Waiting 15s for GPU to become idle...
[nightly] WARN: GPU may still be busy, but proceeding as requested.
[nightly] Searching for non-SRT images for deepseek for the last 1 days...
[nightly] Searching for non-SRT mi30x image in 'rocm/sgl-dev' for date 20251108...
[nightly] Found candidate tag for day -0: v0.5.5-rocm630-mi30x-20251108
[nightly] Found local image: rocm/sgl-dev:v0.5.5-rocm630-mi30x-20251108
[nightly] Successfully obtained image for date 20251108: rocm/sgl-dev:v0.5.5-rocm630-mi30x-20251108
[nightly] Found 1 valid image(s) to run benchmarks on:
[nightly]   - rocm/sgl-dev:v0.5.5-rocm630-mi30x-20251108

[nightly] ==========================================
[nightly] Starting benchmarks for image: rocm/sgl-dev:v0.5.5-rocm630-mi30x-20251108
[nightly] ==========================================
[nightly] Checking GPU status before starting benchmarks for rocm/sgl-dev:v0.5.5-rocm630-mi30x-20251108...
[nightly] GPU is busy. Attempting to stop running Docker containers...
[nightly] Stopping running containers: ba06f96cb79d
[nightly] Waiting 15s for GPU to become idle...
[nightly] WARN: GPU may still be busy, but proceeding as requested.
[nightly] Checking benchmark completion in: /mnt/raid/michael/sglang-ci/online/DeepSeek-V3-0324/v0.5.5-rocm630-mi30x-20251108_DeepSeek-V3-0324_FP8_online
[nightly] Found 0 completed benchmark runs
[nightly] INFO: Found 0/15 completed runs for rocm/sgl-dev:v0.5.5-rocm630-mi30x-20251108 (online). Proceeding with benchmarks.
[nightly] Using Docker image: rocm/sgl-dev:v0.5.5-rocm630-mi30x-20251108
[nightly] Container name: sgl-dev_v0.5.5-rocm630-mi30x-20251108
[nightly] Reusing container sgl-dev_v0.5.5-rocm630-mi30x-20251108
[nightly] === Starting benchmark execution ===
[nightly] === Starting nightly DEEPSEEK online benchmark ===
[nightly] Launching deepseek_perf_online_csv.sh inside sgl-dev_v0.5.5-rocm630-mi30x-20251108
[nightly] Passing --model-name='DeepSeek-V3-0324' to DeepSeek benchmark
✅ Parameter validation passed
[online] Script started at: 2025-11-08 14:15:33 PST
Scanning existing logs to check if all benchmarks are already complete...
Checking GSM8K log status...
Missing: GSM8K log file (/mnt/raid/michael/sglang-ci/online/DeepSeek-V3-0324/v0.5.5-rocm630-mi30x-20251108_DeepSeek-V3-0324_FP8_online/sglang_client_log_DeepSeek-V3-0324_gsm8k.log)
Checking serving benchmark logs...
Missing: Concurrency 128, Run 1
Missing: Concurrency 64, Run 1
Missing: Concurrency 16, Run 1
Missing: Concurrency 4, Run 1
Missing: Concurrency 1, Run 1
Scan complete: 5 total runs needed, 5 missing/incomplete
❌ Missing 5 serving benchmark runs.
❌ GSM8K benchmark is missing, empty, or incomplete.
Server startup required.
Clearing previous logs...
Starting SGLang server for online GSM8K benchmark...
[DEBUG] Using standard settings with environment variable: SGLANG_USE_AITER
Waiting for SGLang server (PID: 47) to start... (Max 15 minutes)
Server logs are being written to: /mnt/raid/michael/sglang-ci/online/DeepSeek-V3-0324/v0.5.5-rocm630-mi30x-20251108_DeepSeek-V3-0324_FP8_online/sglang_server.log
.....................
SGLang server started successfully after 105 seconds.
=== Online GSM8K Benchmark: TP=8, Questions=2000, Parallel=2000, Shots=5 ===
[progress] Total benchmark runs to execute: 10 (GSM8K: 5, Serving: 5) - standard mode
[progress] [--------------------------------------------------] 0/10 (0%) 
Starting GSM8K Online Benchmark...
Running 5 test iterations...
Executing GSM8K test Run 1 ...
  0%|          | 0/1319 [00:00<?, ?it/s]  0%|          | 1/1319 [00:07<2:53:48,  7.91s/it]  0%|          | 2/1319 [00:08<1:19:18,  3.61s/it]  0%|          | 3/1319 [00:08<46:55,  2.14s/it]    0%|          | 4/1319 [00:09<33:29,  1.53s/it]  1%|          | 8/1319 [00:09<10:42,  2.04it/s]  1%|          | 16/1319 [00:09<04:06,  5.30it/s]  1%|▏         | 17/1319 [00:09<02:20,  9.24it/s]  2%|▏         | 20/1319 [00:10<02:09, 10.00it/s]  2%|▏         | 29/1319 [00:10<01:22, 15.60it/s]  3%|▎         | 34/1319 [00:10<01:13, 17.40it/s]  3%|▎         | 38/1319 [00:10<01:11, 17.90it/s]  3%|▎         | 41/1319 [00:10<01:14, 17.20it/s]  4%|▍         | 50/1319 [00:11<00:52, 24.13it/s]  5%|▍         | 61/1319 [00:11<00:54, 22.89it/s]  6%|▌         | 81/1319 [00:11<00:34, 35.44it/s]  7%|▋         | 92/1319 [00:12<00:30, 39.66it/s]  8%|▊         | 100/1319 [00:12<00:30, 39.93it/s]  8%|▊         | 105/1319 [00:12<00:33, 36.10it/s]  9%|▊         | 113/1319 [00:12<00:32, 37.19it/s]  9%|▉         | 124/1319 [00:12<00:28, 42.18it/s] 10%|█         | 133/1319 [00:13<00:27, 42.79it/s] 11%|█         | 141/1319 [00:13<00:27, 42.14it/s] 11%|█         | 147/1319 [00:13<00:30, 38.71it/s] 12%|█▏        | 152/1319 [00:13<00:33, 34.50it/s] 13%|█▎        | 167/1319 [00:13<00:24, 46.71it/s] 13%|█▎        | 173/1319 [00:14<00:27, 41.47it/s] 14%|█▍        | 182/1319 [00:14<00:26, 42.51it/s] 15%|█▍        | 192/1319 [00:14<00:25, 44.75it/s] 16%|█▌        | 206/1319 [00:14<00:21, 52.55it/s] 16%|█▋        | 216/1319 [00:14<00:21, 51.05it/s] 17%|█▋        | 228/1319 [00:15<00:20, 53.62it/s] 19%|█▊        | 247/1319 [00:15<00:17, 62.96it/s] 19%|█▉        | 257/1319 [00:15<00:17, 59.13it/s] 20%|██        | 267/1319 [00:15<00:18, 56.37it/s] 21%|██▏       | 281/1319 [00:15<00:17, 60.40it/s] 22%|██▏       | 295/1319 [00:16<00:16, 63.32it/s] 23%|██▎       | 304/1319 [00:16<00:17, 57.80it/s] 24%|██▍       | 315/1319 [00:16<00:17, 57.53it/s] 25%|██▍       | 325/1319 [00:16<00:15, 63.77it/s] 26%|██▌       | 338/1319 [00:16<00:12, 76.60it/s] 27%|██▋       | 360/1319 [00:16<00:10, 88.79it/s] 28%|██▊       | 372/1319 [00:17<00:10, 93.38it/s] 30%|██▉       | 392/1319 [00:17<00:09, 96.36it/s] 31%|███       | 412/1319 [00:17<00:11, 77.50it/s] 32%|███▏      | 425/1319 [00:17<00:10, 83.23it/s] 33%|███▎      | 437/1319 [00:17<00:09, 89.06it/s] 35%|███▍      | 457/1319 [00:18<00:09, 93.10it/s] 37%|███▋      | 483/1319 [00:18<00:07, 106.35it/s] 38%|███▊      | 499/1319 [00:18<00:08, 98.33it/s]  40%|███▉      | 523/1319 [00:18<00:07, 106.54it/s] 41%|████      | 538/1319 [00:18<00:08, 97.27it/s]  42%|████▏     | 553/1319 [00:19<00:08, 90.84it/s] 43%|████▎     | 565/1319 [00:19<00:08, 88.29it/s] 44%|████▍     | 586/1319 [00:19<00:07, 101.22it/s] 45%|████▍     | 591/1319 [00:19<00:04, 149.14it/s] 45%|████▍     | 591/1319 [00:19<00:04, 149.14it/s] 45%|████▍     | 591/1319 [00:19<00:04, 149.14it/s] 45%|████▍     | 591/1319 [00:19<00:04, 149.14it/s] 45%|████▍     | 591/1319 [00:19<00:04, 149.14it/s] 46%|████▌     | 607/1319 [00:19<00:05, 123.83it/s] 48%|████▊     | 629/1319 [00:19<00:05, 120.85it/s] 50%|████▉     | 654/1319 [00:19<00:05, 123.91it/s] 50%|█████     | 665/1319 [00:19<00:03, 165.22it/s] 50%|█████     | 665/1319 [00:19<00:03, 165.22it/s] 50%|█████     | 665/1319 [00:19<00:03, 165.22it/s] 50%|█████     | 665/1319 [00:19<00:03, 165.22it/s] 50%|█████     | 665/1319 [00:19<00:03, 165.22it/s] 50%|█████     | 665/1319 [00:19<00:03, 165.22it/s] 50%|█████     | 665/1319 [00:19<00:03, 165.22it/s] 50%|█████     | 665/1319 [00:19<00:03, 165.22it/s] 50%|█████     | 665/1319 [00:19<00:03, 165.22it/s] 52%|█████▏    | 682/1319 [00:20<00:04, 142.54it/s] 53%|█████▎    | 697/1319 [00:20<00:05, 123.69it/s] 54%|█████▍    | 711/1319 [00:20<00:05, 108.34it/s] 55%|█████▌    | 730/1319 [00:20<00:05, 103.60it/s] 58%|█████▊    | 762/1319 [00:20<00:04, 123.16it/s] 59%|█████▉    | 783/1319 [00:21<00:04, 116.99it/s] 60%|██████    | 797/1319 [00:21<00:03, 141.30it/s] 60%|██████    | 797/1319 [00:21<00:03, 141.30it/s] 60%|██████    | 797/1319 [00:21<00:03, 141.30it/s] 60%|██████    | 797/1319 [00:21<00:03, 141.30it/s] 60%|██████    | 797/1319 [00:21<00:03, 141.30it/s] 60%|██████    | 797/1319 [00:21<00:03, 141.30it/s] 60%|██████    | 797/1319 [00:21<00:03, 141.30it/s] 60%|██████    | 797/1319 [00:21<00:03, 141.30it/s] 60%|██████    | 797/1319 [00:21<00:03, 141.30it/s] 60%|██████    | 797/1319 [00:21<00:03, 141.30it/s] 62%|██████▏   | 812/1319 [00:21<00:03, 141.90it/s] 63%|██████▎   | 827/1319 [00:21<00:03, 129.46it/s] 64%|██████▎   | 840/1319 [00:21<00:04, 118.14it/s] 65%|██████▍   | 852/1319 [00:21<00:04, 107.72it/s] 66%|██████▋   | 874/1319 [00:21<00:03, 120.11it/s] 67%|██████▋   | 886/1319 [00:21<00:03, 113.70it/s] 68%|██████▊   | 903/1319 [00:22<00:03, 118.69it/s] 70%|██████▉   | 918/1319 [00:22<00:03, 117.56it/s] 71%|███████   | 932/1319 [00:22<00:03, 115.60it/s] 72%|███████▏  | 948/1319 [00:22<00:03, 117.92it/s] 73%|███████▎  | 962/1319 [00:22<00:03, 113.09it/s] 74%|███████▍  | 981/1319 [00:22<00:02, 123.99it/s] 76%|███████▌  | 997/1319 [00:22<00:02, 126.22it/s] 77%|███████▋  | 1015/1319 [00:22<00:02, 132.15it/s] 78%|███████▊  | 1031/1319 [00:23<00:02, 129.83it/s] 79%|███████▉  | 1045/1319 [00:23<00:02, 131.86it/s] 80%|████████  | 1059/1319 [00:23<00:01, 131.69it/s] 81%|████████▏ | 1073/1319 [00:23<00:02, 114.82it/s] 82%|████████▏ | 1085/1319 [00:23<00:02, 101.98it/s] 83%|████████▎ | 1096/1319 [00:23<00:02, 102.63it/s] 84%|████████▍ | 1107/1319 [00:23<00:02, 92.89it/s]  85%|████████▍ | 1117/1319 [00:23<00:02, 84.40it/s] 86%|████████▌ | 1129/1319 [00:24<00:02, 84.00it/s] 87%|████████▋ | 1144/1319 [00:24<00:01, 89.98it/s] 88%|████████▊ | 1161/1319 [00:24<00:01, 99.11it/s] 89%|████████▉ | 1173/1319 [00:24<00:01, 94.73it/s] 90%|████████▉ | 1183/1319 [00:24<00:01, 81.11it/s] 91%|█████████ | 1197/1319 [00:24<00:01, 88.52it/s] 92%|█████████▏| 1207/1319 [00:25<00:01, 79.75it/s] 92%|█████████▏| 1216/1319 [00:25<00:01, 77.85it/s] 93%|█████████▎| 1224/1319 [00:25<00:01, 74.44it/s] 93%|█████████▎| 1233/1319 [00:25<00:01, 74.57it/s] 94%|█████████▍| 1242/1319 [00:25<00:01, 75.78it/s] 95%|█████████▍| 1250/1319 [00:25<00:01, 62.35it/s] 96%|█████████▌| 1260/1319 [00:25<00:00, 64.41it/s] 96%|█████████▌| 1269/1319 [00:25<00:00, 69.44it/s] 97%|█████████▋| 1277/1319 [00:26<00:00, 48.87it/s] 97%|█████████▋| 1284/1319 [00:26<00:00, 47.53it/s] 98%|█████████▊| 1290/1319 [00:26<00:00, 45.47it/s] 98%|█████████▊| 1296/1319 [00:26<00:00, 38.26it/s] 99%|█████████▊| 1301/1319 [00:26<00:00, 36.11it/s] 99%|█████████▉| 1305/1319 [00:27<00:00, 34.78it/s] 99%|█████████▉| 1309/1319 [00:27<00:00, 31.31it/s]100%|█████████▉| 1313/1319 [00:27<00:00, 20.90it/s]100%|█████████▉| 1316/1319 [00:27<00:00, 21.91it/s]100%|██████████| 1319/1319 [00:28<00:00, 10.64it/s]100%|██████████| 1319/1319 [00:28<00:00, 46.22it/s]
Accuracy: 0.930
Invalid: 0.000
Latency: 28.651 s
Output throughput: 4708.590 token/s
Run 1 completed in 42 seconds
Run 1: Accuracy: 0.930
[progress] [=====---------------------------------------------] 1/10 (10%)  | GSM8K: Run 1
Executing GSM8K test Run 2 ...
  0%|          | 0/1319 [00:00<?, ?it/s]  0%|          | 1/1319 [00:04<1:49:40,  4.99s/it]  0%|          | 2/1319 [00:05<52:45,  2.40s/it]    0%|          | 3/1319 [00:05<32:29,  1.48s/it]  0%|          | 4/1319 [00:06<24:45,  1.13s/it]  0%|          | 6/1319 [00:06<12:18,  1.78it/s]  1%|          | 16/1319 [00:06<03:03,  7.11it/s]  1%|▏         | 18/1319 [00:07<02:53,  7.51it/s]  2%|▏         | 25/1319 [00:07<01:47, 12.09it/s]  2%|▏         | 29/1319 [00:07<01:35, 13.49it/s]  3%|▎         | 33/1319 [00:07<01:26, 14.94it/s]  3%|▎         | 37/1319 [00:07<01:19, 16.14it/s]  4%|▎         | 47/1319 [00:08<00:51, 24.76it/s]  4%|▍         | 55/1319 [00:08<00:47, 26.87it/s]  5%|▍         | 62/1319 [00:08<00:25, 50.24it/s]  5%|▍         | 62/1319 [00:08<00:25, 50.24it/s]  5%|▍         | 62/1319 [00:08<00:25, 50.24it/s]  5%|▍         | 62/1319 [00:08<00:25, 50.24it/s]  5%|▍         | 62/1319 [00:08<00:25, 50.24it/s]  5%|▍         | 62/1319 [00:08<00:25, 50.24it/s]  5%|▍         | 62/1319 [00:08<00:25, 50.24it/s]  5%|▌         | 68/1319 [00:08<00:25, 48.39it/s]  6%|▌         | 73/1319 [00:08<00:29, 42.13it/s]  6%|▌         | 80/1319 [00:08<00:30, 40.22it/s]  7%|▋         | 89/1319 [00:09<00:29, 41.71it/s]  7%|▋         | 98/1319 [00:09<00:28, 43.02it/s]  8%|▊         | 104/1319 [00:09<00:30, 39.22it/s]  9%|▊         | 114/1319 [00:09<00:28, 42.64it/s]  9%|▉         | 121/1319 [00:09<00:29, 40.41it/s] 10%|▉         | 130/1319 [00:09<00:18, 64.55it/s] 10%|▉         | 130/1319 [00:09<00:18, 64.55it/s] 10%|▉         | 130/1319 [00:09<00:18, 64.55it/s] 10%|▉         | 130/1319 [00:09<00:18, 64.55it/s] 10%|▉         | 130/1319 [00:09<00:18, 64.55it/s] 10%|▉         | 130/1319 [00:09<00:18, 64.55it/s] 10%|▉         | 130/1319 [00:09<00:18, 64.55it/s] 10%|▉         | 130/1319 [00:09<00:18, 64.55it/s] 10%|█         | 137/1319 [00:10<00:21, 55.96it/s] 11%|█         | 143/1319 [00:10<00:24, 48.42it/s] 11%|█         | 148/1319 [00:10<00:28, 41.55it/s] 12%|█▏        | 154/1319 [00:10<00:30, 38.06it/s] 13%|█▎        | 167/1319 [00:10<00:24, 46.41it/s] 13%|█▎        | 174/1319 [00:11<00:26, 43.17it/s] 14%|█▍        | 186/1319 [00:11<00:23, 48.61it/s] 15%|█▍        | 195/1319 [00:11<00:23, 47.56it/s] 16%|█▌        | 211/1319 [00:11<00:19, 57.83it/s] 17%|█▋        | 219/1319 [00:11<00:21, 52.31it/s] 18%|█▊        | 237/1319 [00:12<00:16, 63.93it/s] 19%|█▉        | 249/1319 [00:12<00:16, 63.10it/s] 20%|█▉        | 259/1319 [00:12<00:17, 59.24it/s] 21%|██        | 272/1319 [00:12<00:17, 60.55it/s] 22%|██▏       | 287/1319 [00:12<00:15, 65.10it/s] 23%|██▎       | 303/1319 [00:13<00:14, 70.28it/s] 24%|██▎       | 311/1319 [00:13<00:16, 61.20it/s] 24%|██▍       | 318/1319 [00:13<00:16, 62.25it/s] 25%|██▌       | 330/1319 [00:13<00:13, 73.69it/s] 26%|██▌       | 341/1319 [00:13<00:12, 81.19it/s] 27%|██▋       | 362/1319 [00:13<00:10, 89.32it/s] 29%|██▉       | 388/1319 [00:14<00:08, 103.97it/s] 30%|███       | 399/1319 [00:14<00:08, 104.99it/s] 31%|███       | 410/1319 [00:14<00:08, 105.92it/s] 32%|███▏      | 426/1319 [00:14<00:09, 95.56it/s]  34%|███▍      | 450/1319 [00:14<00:08, 104.74it/s] 35%|███▌      | 466/1319 [00:14<00:07, 116.00it/s] 36%|███▋      | 480/1319 [00:14<00:08, 100.02it/s] 37%|███▋      | 491/1319 [00:15<00:08, 101.20it/s] 38%|███▊      | 502/1319 [00:15<00:08, 100.72it/s] 39%|███▉      | 513/1319 [00:15<00:07, 102.85it/s] 40%|████      | 531/1319 [00:15<00:07, 98.68it/s]  42%|████▏     | 551/1319 [00:15<00:07, 100.17it/s] 43%|████▎     | 569/1319 [00:15<00:08, 90.29it/s]  44%|████▍     | 581/1319 [00:15<00:06, 115.42it/s] 44%|████▍     | 581/1319 [00:15<00:06, 115.42it/s] 44%|████▍     | 581/1319 [00:15<00:06, 115.42it/s] 44%|████▍     | 581/1319 [00:15<00:06, 115.42it/s] 44%|████▍     | 581/1319 [00:15<00:06, 115.42it/s] 44%|████▍     | 581/1319 [00:15<00:06, 115.42it/s] 44%|████▍     | 581/1319 [00:15<00:06, 115.42it/s] 44%|████▍     | 581/1319 [00:15<00:06, 115.42it/s] 44%|████▍     | 581/1319 [00:15<00:06, 115.42it/s] 44%|████▍     | 581/1319 [00:15<00:06, 115.42it/s] 44%|████▍     | 581/1319 [00:15<00:06, 115.42it/s] 44%|████▍     | 581/1319 [00:15<00:06, 115.42it/s] 45%|████▍     | 593/1319 [00:16<00:06, 105.16it/s] 46%|████▌     | 610/1319 [00:16<00:06, 115.79it/s] 47%|████▋     | 623/1319 [00:16<00:06, 100.43it/s] 49%|████▉     | 649/1319 [00:16<00:06, 111.49it/s] 51%|█████     | 673/1319 [00:16<00:05, 115.63it/s] 52%|█████▏    | 689/1319 [00:16<00:05, 105.42it/s] 54%|█████▎    | 708/1319 [00:17<00:05, 103.69it/s] 55%|█████▌    | 727/1319 [00:17<00:05, 101.93it/s] 56%|█████▋    | 745/1319 [00:17<00:05, 99.20it/s]  59%|█████▊    | 773/1319 [00:17<00:04, 113.40it/s] 60%|██████    | 797/1319 [00:17<00:04, 117.23it/s] 63%|██████▎   | 826/1319 [00:18<00:03, 131.88it/s] 64%|██████▍   | 841/1319 [00:18<00:03, 124.04it/s] 65%|██████▍   | 855/1319 [00:18<00:03, 116.51it/s] 66%|██████▌   | 872/1319 [00:18<00:03, 116.07it/s] 67%|██████▋   | 887/1319 [00:18<00:03, 116.95it/s] 68%|██████▊   | 899/1319 [00:18<00:03, 109.05it/s] 69%|██████▉   | 910/1319 [00:18<00:03, 103.32it/s] 70%|██████▉   | 923/1319 [00:18<00:03, 101.43it/s] 71%|███████▏  | 941/1319 [00:19<00:03, 114.56it/s] 72%|███████▏  | 956/1319 [00:19<00:03, 112.40it/s] 74%|███████▍  | 974/1319 [00:19<00:02, 119.31it/s] 75%|███████▌  | 991/1319 [00:19<00:02, 125.58it/s] 76%|███████▌  | 1004/1319 [00:19<00:02, 119.12it/s] 77%|███████▋  | 1022/1319 [00:19<00:02, 124.24it/s] 78%|███████▊  | 1035/1319 [00:19<00:02, 108.91it/s] 79%|███████▉  | 1047/1319 [00:20<00:02, 108.79it/s] 80%|████████  | 1059/1319 [00:20<00:02, 109.60it/s] 81%|████████  | 1071/1319 [00:20<00:02, 109.98it/s] 82%|████████▏ | 1083/1319 [00:20<00:02, 97.47it/s]  83%|████████▎ | 1094/1319 [00:20<00:02, 99.69it/s] 84%|████████▍ | 1105/1319 [00:20<00:02, 102.31it/s] 85%|████████▍ | 1119/1319 [00:20<00:02, 99.07it/s]  86%|████████▌ | 1133/1319 [00:20<00:01, 98.36it/s] 87%|████████▋ | 1143/1319 [00:21<00:01, 88.42it/s] 88%|████████▊ | 1155/1319 [00:21<00:01, 87.42it/s] 88%|████████▊ | 1166/1319 [00:21<00:01, 83.69it/s] 89%|████████▉ | 1177/1319 [00:21<00:01, 81.99it/s] 90%|█████████ | 1192/1319 [00:21<00:01, 91.59it/s] 91%|█████████ | 1202/1319 [00:21<00:01, 88.96it/s] 92%|█████████▏| 1211/1319 [00:21<00:01, 84.19it/s] 93%|█████████▎| 1221/1319 [00:21<00:01, 83.56it/s] 93%|█████████▎| 1232/1319 [00:22<00:01, 86.38it/s] 94%|█████████▍| 1241/1319 [00:22<00:00, 83.73it/s] 95%|█████████▍| 1250/1319 [00:22<00:00, 69.01it/s] 95%|█████████▌| 1258/1319 [00:22<00:00, 68.38it/s] 96%|█████████▌| 1269/1319 [00:22<00:00, 76.48it/s] 97%|█████████▋| 1277/1319 [00:22<00:00, 58.54it/s] 97%|█████████▋| 1278/1319 [00:22<00:00, 51.21it/s] 97%|█████████▋| 1284/1319 [00:23<00:00, 47.02it/s] 98%|█████████▊| 1290/1319 [00:23<00:00, 42.79it/s] 98%|█████████▊| 1295/1319 [00:23<00:00, 36.96it/s] 98%|█████████▊| 1299/1319 [00:23<00:00, 33.22it/s] 99%|█████████▉| 1303/1319 [00:23<00:00, 27.02it/s] 99%|█████████▉| 1307/1319 [00:23<00:00, 28.05it/s] 99%|█████████▉| 1311/1319 [00:24<00:00, 23.20it/s]100%|█████████▉| 1314/1319 [00:24<00:00, 17.89it/s]100%|█████████▉| 1317/1319 [00:24<00:00, 18.38it/s]100%|██████████| 1319/1319 [00:25<00:00, 51.94it/s]
Accuracy: 0.938
Invalid: 0.000
Latency: 25.888 s
Output throughput: 5219.319 token/s
Run 2 completed in 39 seconds
Run 2: Accuracy: 0.938
[progress] [==========----------------------------------------] 2/10 (20%)  | GSM8K: Run 2
Executing GSM8K test Run 3 ...
  0%|          | 0/1319 [00:00<?, ?it/s]  0%|          | 1/1319 [00:05<1:52:01,  5.10s/it]  0%|          | 2/1319 [00:05<57:28,  2.62s/it]    0%|          | 3/1319 [00:06<37:01,  1.69s/it]  0%|          | 6/1319 [00:06<13:03,  1.68it/s]  1%|          | 13/1319 [00:06<04:40,  4.65it/s]  1%|▏         | 18/1319 [00:07<03:05,  7.02it/s]  2%|▏         | 24/1319 [00:07<02:05, 10.29it/s]  2%|▏         | 32/1319 [00:07<01:23, 15.37it/s]  3%|▎         | 37/1319 [00:07<01:13, 17.34it/s]  3%|▎         | 40/1319 [00:07<01:16, 16.62it/s]  4%|▎         | 48/1319 [00:08<00:57, 22.16it/s]  4%|▍         | 59/1319 [00:08<00:44, 28.04it/s]  5%|▍         | 62/1319 [00:08<00:29, 42.21it/s]  5%|▍         | 62/1319 [00:08<00:29, 42.21it/s]  5%|▍         | 62/1319 [00:08<00:29, 42.21it/s]  5%|▌         | 67/1319 [00:08<00:30, 40.47it/s]  5%|▌         | 72/1319 [00:08<00:34, 36.47it/s]  6%|▌         | 78/1319 [00:08<00:35, 34.71it/s]  7%|▋         | 90/1319 [00:09<00:29, 42.22it/s]  8%|▊         | 99/1319 [00:09<00:28, 43.33it/s]  8%|▊         | 106/1319 [00:09<00:29, 41.08it/s]  9%|▊         | 113/1319 [00:09<00:19, 60.67it/s]  9%|▊         | 113/1319 [00:09<00:19, 60.67it/s]  9%|▊         | 113/1319 [00:09<00:19, 60.67it/s]  9%|▊         | 113/1319 [00:09<00:19, 60.67it/s]  9%|▊         | 113/1319 [00:09<00:19, 60.67it/s]  9%|▊         | 113/1319 [00:09<00:19, 60.67it/s]  9%|▊         | 113/1319 [00:09<00:19, 60.67it/s]  9%|▉         | 120/1319 [00:09<00:22, 52.90it/s] 10%|▉         | 126/1319 [00:09<00:26, 45.67it/s] 10%|▉         | 131/1319 [00:10<00:30, 39.55it/s] 11%|█         | 139/1319 [00:10<00:30, 39.18it/s] 11%|█▏        | 149/1319 [00:10<00:27, 42.65it/s] 12%|█▏        | 157/1319 [00:10<00:27, 41.96it/s] 13%|█▎        | 168/1319 [00:10<00:24, 46.17it/s] 13%|█▎        | 174/1319 [00:11<00:27, 41.11it/s] 14%|█▍        | 188/1319 [00:11<00:22, 50.13it/s] 15%|█▌        | 198/1319 [00:11<00:22, 49.94it/s] 17%|█▋        | 218/1319 [00:11<00:16, 65.66it/s] 17%|█▋        | 225/1319 [00:11<00:19, 56.24it/s] 18%|█▊        | 239/1319 [00:12<00:17, 60.28it/s] 19%|█▉        | 253/1319 [00:12<00:16, 63.46it/s] 20%|██        | 266/1319 [00:12<00:16, 62.96it/s] 21%|██        | 278/1319 [00:12<00:16, 62.40it/s] 22%|██▏       | 288/1319 [00:12<00:17, 58.77it/s] 23%|██▎       | 303/1319 [00:13<00:15, 64.19it/s] 24%|██▎       | 310/1319 [00:13<00:09, 101.00it/s] 24%|██▎       | 310/1319 [00:13<00:09, 101.00it/s] 24%|██▎       | 310/1319 [00:13<00:09, 101.00it/s] 24%|██▎       | 310/1319 [00:13<00:09, 101.00it/s] 24%|██▎       | 310/1319 [00:13<00:09, 101.00it/s] 24%|██▎       | 310/1319 [00:13<00:09, 101.00it/s] 24%|██▎       | 310/1319 [00:13<00:09, 101.00it/s] 24%|██▍       | 321/1319 [00:13<00:13, 74.96it/s]  25%|██▌       | 330/1319 [00:13<00:12, 77.10it/s] 26%|██▌       | 340/1319 [00:13<00:12, 81.21it/s] 27%|██▋       | 358/1319 [00:13<00:11, 83.56it/s] 29%|██▉       | 384/1319 [00:14<00:09, 98.93it/s] 30%|██▉       | 395/1319 [00:14<00:09, 100.65it/s] 31%|███       | 406/1319 [00:14<00:09, 100.55it/s] 32%|███▏      | 417/1319 [00:14<00:08, 101.88it/s] 33%|███▎      | 439/1319 [00:14<00:08, 105.35it/s] 35%|███▍      | 458/1319 [00:14<00:08, 101.25it/s] 37%|███▋      | 485/1319 [00:14<00:07, 113.73it/s] 38%|███▊      | 503/1319 [00:15<00:07, 104.43it/s] 40%|███▉      | 522/1319 [00:15<00:07, 101.94it/s] 41%|████      | 539/1319 [00:15<00:08, 97.33it/s]  42%|████▏     | 558/1319 [00:15<00:07, 97.18it/s] 43%|████▎     | 568/1319 [00:15<00:08, 91.11it/s] 44%|████▍     | 584/1319 [00:16<00:07, 93.83it/s] 46%|████▌     | 603/1319 [00:16<00:07, 94.80it/s] 47%|████▋     | 620/1319 [00:16<00:06, 109.34it/s] 48%|████▊     | 637/1319 [00:16<00:06, 101.52it/s] 50%|█████     | 662/1319 [00:16<00:05, 110.91it/s] 52%|█████▏    | 680/1319 [00:16<00:06, 104.33it/s] 52%|█████▏    | 686/1319 [00:16<00:05, 112.24it/s] 52%|█████▏    | 686/1319 [00:16<00:05, 112.24it/s] 52%|█████▏    | 686/1319 [00:16<00:05, 112.24it/s] 52%|█████▏    | 686/1319 [00:16<00:05, 112.24it/s] 52%|█████▏    | 686/1319 [00:16<00:05, 112.24it/s] 52%|█████▏    | 686/1319 [00:16<00:05, 112.24it/s] 53%|█████▎    | 698/1319 [00:17<00:06, 97.51it/s]  54%|█████▎    | 708/1319 [00:17<00:06, 96.74it/s] 54%|█████▍    | 718/1319 [00:17<00:06, 96.96it/s] 56%|█████▌    | 734/1319 [00:17<00:06, 92.22it/s] 58%|█████▊    | 763/1319 [00:17<00:04, 112.55it/s] 60%|█████▉    | 789/1319 [00:17<00:04, 120.22it/s] 61%|██████    | 801/1319 [00:18<00:04, 119.87it/s] 62%|██████▏   | 820/1319 [00:18<00:03, 133.31it/s] 63%|██████▎   | 836/1319 [00:18<00:03, 124.25it/s] 65%|██████▍   | 856/1319 [00:18<00:03, 128.44it/s] 66%|██████▌   | 870/1319 [00:18<00:03, 116.95it/s] 67%|██████▋   | 883/1319 [00:18<00:03, 110.06it/s] 68%|██████▊   | 897/1319 [00:18<00:03, 109.68it/s] 69%|██████▉   | 912/1319 [00:18<00:03, 110.58it/s] 71%|███████   | 930/1319 [00:19<00:03, 119.06it/s] 72%|███████▏  | 947/1319 [00:19<00:03, 123.21it/s] 73%|███████▎  | 963/1319 [00:19<00:02, 120.37it/s] 75%|███████▍  | 983/1319 [00:19<00:02, 131.53it/s] 76%|███████▌  | 999/1319 [00:19<00:02, 132.18it/s] 77%|███████▋  | 1013/1319 [00:19<00:02, 126.39it/s] 78%|███████▊  | 1026/1319 [00:19<00:02, 118.87it/s] 79%|███████▊  | 1038/1319 [00:19<00:02, 117.26it/s] 80%|███████▉  | 1053/1319 [00:20<00:02, 123.93it/s] 81%|████████  | 1066/1319 [00:20<00:02, 123.04it/s] 82%|████████▏ | 1079/1319 [00:20<00:01, 121.82it/s] 83%|████████▎ | 1092/1319 [00:20<00:02, 95.92it/s]  84%|████████▎ | 1103/1319 [00:20<00:02, 98.73it/s] 85%|████████▍ | 1116/1319 [00:20<00:02, 95.13it/s] 86%|████████▌ | 1134/1319 [00:20<00:01, 104.31it/s] 87%|████████▋ | 1145/1319 [00:21<00:01, 95.00it/s]  88%|████████▊ | 1155/1319 [00:21<00:01, 86.67it/s] 89%|████████▊ | 1168/1319 [00:21<00:01, 88.26it/s] 89%|████████▉ | 1177/1319 [00:21<00:01, 73.95it/s] 90%|████████▉ | 1185/1319 [00:21<00:01, 70.48it/s] 91%|█████████ | 1195/1319 [00:21<00:01, 72.79it/s] 91%|█████████▏| 1204/1319 [00:21<00:01, 72.36it/s] 92%|█████████▏| 1214/1319 [00:22<00:01, 74.94it/s] 93%|█████████▎| 1223/1319 [00:22<00:01, 74.28it/s] 93%|█████████▎| 1233/1319 [00:22<00:01, 76.85it/s] 94%|█████████▍| 1243/1319 [00:22<00:01, 73.42it/s] 95%|█████████▍| 1251/1319 [00:22<00:01, 66.35it/s] 95%|█████████▌| 1258/1319 [00:22<00:00, 65.12it/s] 96%|█████████▌| 1265/1319 [00:22<00:00, 59.99it/s] 96%|█████████▋| 1272/1319 [00:23<00:00, 49.22it/s] 97%|█████████▋| 1278/1319 [00:23<00:00, 48.34it/s] 97%|█████████▋| 1284/1319 [00:23<00:00, 40.02it/s] 98%|█████████▊| 1289/1319 [00:23<00:01, 29.78it/s] 98%|█████████▊| 1293/1319 [00:23<00:00, 30.58it/s] 98%|█████████▊| 1298/1319 [00:24<00:00, 27.76it/s] 99%|█████████▊| 1302/1319 [00:24<00:00, 29.36it/s] 99%|█████████▉| 1306/1319 [00:24<00:00, 24.92it/s] 99%|█████████▉| 1309/1319 [00:24<00:00, 20.51it/s]100%|█████████▉| 1313/1319 [00:24<00:00, 21.78it/s]100%|█████████▉| 1317/1319 [00:25<00:00, 11.74it/s]100%|██████████| 1319/1319 [00:26<00:00,  6.79it/s]100%|██████████| 1319/1319 [00:26<00:00, 49.87it/s]
Accuracy: 0.935
Invalid: 0.000
Latency: 26.576 s
Output throughput: 5103.745 token/s
Run 3 completed in 39 seconds
Run 3: Accuracy: 0.935
[progress] [===============-----------------------------------] 3/10 (30%)  | GSM8K: Run 3
Executing GSM8K test Run 4 ...
  0%|          | 0/1319 [00:00<?, ?it/s]  0%|          | 1/1319 [00:05<1:53:40,  5.17s/it]  0%|          | 2/1319 [00:05<54:16,  2.47s/it]    0%|          | 3/1319 [00:06<33:23,  1.52s/it]  0%|          | 4/1319 [00:06<25:20,  1.16s/it]  0%|          | 6/1319 [00:06<09:29,  2.31it/s]  0%|          | 6/1319 [00:06<09:29,  2.31it/s]  1%|          | 7/1319 [00:06<08:03,  2.71it/s]  1%|          | 10/1319 [00:06<04:40,  4.67it/s]  1%|          | 14/1319 [00:07<02:58,  7.31it/s]  1%|▏         | 18/1319 [00:07<02:12,  9.82it/s]  2%|▏         | 27/1319 [00:07<01:13, 17.62it/s]  3%|▎         | 34/1319 [00:07<00:58, 21.91it/s]  3%|▎         | 38/1319 [00:07<00:59, 21.55it/s]  3%|▎         | 41/1319 [00:08<01:04, 19.73it/s]  4%|▎         | 48/1319 [00:08<00:53, 23.96it/s]  5%|▍         | 61/1319 [00:08<00:37, 33.25it/s]  5%|▍         | 65/1319 [00:08<00:39, 31.72it/s]  6%|▌         | 73/1319 [00:08<00:36, 34.33it/s]  6%|▌         | 80/1319 [00:09<00:35, 34.66it/s]  7%|▋         | 88/1319 [00:09<00:33, 36.38it/s]  7%|▋         | 97/1319 [00:09<00:31, 38.53it/s]  8%|▊         | 103/1319 [00:09<00:33, 36.06it/s]  8%|▊         | 112/1319 [00:09<00:31, 38.92it/s]  9%|▉         | 118/1319 [00:10<00:33, 36.31it/s] 10%|▉         | 126/1319 [00:10<00:19, 59.66it/s] 10%|▉         | 126/1319 [00:10<00:19, 59.66it/s] 10%|▉         | 126/1319 [00:10<00:19, 59.66it/s] 10%|▉         | 126/1319 [00:10<00:19, 59.66it/s] 10%|▉         | 126/1319 [00:10<00:19, 59.66it/s] 10%|▉         | 126/1319 [00:10<00:19, 59.66it/s] 10%|▉         | 126/1319 [00:10<00:19, 59.66it/s] 10%|▉         | 126/1319 [00:10<00:19, 59.66it/s] 10%|█         | 132/1319 [00:10<00:23, 50.49it/s] 11%|█         | 139/1319 [00:10<00:25, 45.99it/s] 11%|█         | 145/1319 [00:10<00:20, 56.46it/s] 11%|█         | 145/1319 [00:10<00:20, 56.46it/s] 11%|█         | 145/1319 [00:10<00:20, 56.46it/s] 11%|█         | 145/1319 [00:10<00:20, 56.46it/s] 11%|█         | 145/1319 [00:10<00:20, 56.46it/s] 11%|█         | 145/1319 [00:10<00:20, 56.46it/s] 11%|█▏        | 151/1319 [00:10<00:24, 48.47it/s] 12%|█▏        | 156/1319 [00:10<00:28, 41.27it/s] 13%|█▎        | 174/1319 [00:11<00:20, 56.48it/s] 14%|█▎        | 180/1319 [00:11<00:23, 48.42it/s] 14%|█▍        | 190/1319 [00:11<00:23, 48.25it/s] 15%|█▌        | 200/1319 [00:11<00:22, 48.73it/s] 16%|█▋        | 216/1319 [00:11<00:18, 58.46it/s] 17%|█▋        | 224/1319 [00:12<00:20, 52.66it/s] 18%|█▊        | 240/1319 [00:12<00:17, 60.86it/s] 19%|█▉        | 257/1319 [00:12<00:15, 68.24it/s] 20%|██        | 268/1319 [00:12<00:08, 128.95it/s] 20%|██        | 268/1319 [00:12<00:08, 128.95it/s] 20%|██        | 268/1319 [00:12<00:08, 128.95it/s] 20%|██        | 268/1319 [00:12<00:08, 128.95it/s] 20%|██        | 268/1319 [00:12<00:08, 128.95it/s] 20%|██        | 268/1319 [00:12<00:08, 128.95it/s] 20%|██        | 268/1319 [00:12<00:08, 128.95it/s] 20%|██        | 268/1319 [00:12<00:08, 128.95it/s] 20%|██        | 268/1319 [00:12<00:08, 128.95it/s] 20%|██        | 268/1319 [00:12<00:08, 128.95it/s] 20%|██        | 268/1319 [00:12<00:08, 128.95it/s] 21%|██▏       | 281/1319 [00:12<00:09, 109.80it/s] 22%|██▏       | 292/1319 [00:12<00:10, 93.40it/s]  23%|██▎       | 302/1319 [00:13<00:12, 80.43it/s] 24%|██▎       | 311/1319 [00:13<00:14, 70.12it/s] 24%|██▍       | 319/1319 [00:13<00:16, 62.09it/s] 25%|██▍       | 326/1319 [00:13<00:16, 61.89it/s] 25%|██▌       | 335/1319 [00:13<00:14, 66.91it/s] 26%|██▌       | 346/1319 [00:13<00:12, 75.92it/s] 27%|██▋       | 359/1319 [00:13<00:10, 88.19it/s] 28%|██▊       | 371/1319 [00:14<00:09, 95.51it/s] 29%|██▉       | 385/1319 [00:14<00:08, 104.29it/s] 30%|███       | 396/1319 [00:14<00:08, 105.41it/s] 31%|███       | 407/1319 [00:14<00:08, 106.27it/s] 32%|███▏      | 418/1319 [00:14<00:08, 106.49it/s] 33%|███▎      | 429/1319 [00:14<00:08, 106.95it/s] 33%|███▎      | 440/1319 [00:14<00:08, 106.92it/s] 34%|███▍      | 451/1319 [00:14<00:08, 107.80it/s] 36%|███▌      | 469/1319 [00:14<00:08, 96.88it/s]  37%|███▋      | 492/1319 [00:15<00:07, 104.84it/s] 38%|███▊      | 507/1319 [00:15<00:08, 94.26it/s]  39%|███▉      | 517/1319 [00:15<00:08, 95.29it/s] 40%|████      | 534/1319 [00:15<00:08, 91.74it/s] 42%|████▏     | 552/1319 [00:15<00:08, 90.98it/s] 44%|████▎     | 574/1319 [00:16<00:08, 91.34it/s] 45%|████▌     | 596/1319 [00:16<00:06, 103.52it/s] 46%|████▌     | 607/1319 [00:16<00:06, 103.76it/s] 47%|████▋     | 618/1319 [00:16<00:06, 103.37it/s] 48%|████▊     | 635/1319 [00:16<00:07, 96.78it/s]  50%|████▉     | 657/1319 [00:16<00:06, 100.77it/s] 52%|█████▏    | 684/1319 [00:17<00:05, 113.62it/s] 54%|█████▎    | 707/1319 [00:17<00:05, 115.42it/s] 55%|█████▍    | 723/1319 [00:17<00:05, 105.49it/s] 56%|█████▌    | 734/1319 [00:17<00:05, 106.05it/s] 57%|█████▋    | 750/1319 [00:17<00:05, 98.05it/s]  59%|█████▉    | 782/1319 [00:17<00:04, 120.66it/s] 61%|██████    | 802/1319 [00:18<00:04, 114.94it/s] 63%|██████▎   | 835/1319 [00:18<00:03, 139.57it/s] 64%|██████▎   | 838/1319 [00:18<00:03, 159.53it/s] 65%|██████▍   | 855/1319 [00:18<00:03, 147.78it/s] 66%|██████▌   | 870/1319 [00:18<00:03, 133.72it/s] 67%|██████▋   | 884/1319 [00:18<00:03, 125.30it/s] 68%|██████▊   | 897/1319 [00:18<00:03, 119.03it/s] 69%|██████▉   | 911/1319 [00:19<00:03, 115.02it/s] 70%|███████   | 925/1319 [00:19<00:03, 113.25it/s] 71%|███████   | 937/1319 [00:19<00:03, 108.12it/s] 73%|███████▎  | 957/1319 [00:19<00:03, 120.57it/s] 74%|███████▎  | 971/1319 [00:19<00:03, 115.18it/s] 75%|███████▍  | 984/1319 [00:19<00:02, 112.71it/s] 76%|███████▌  | 998/1319 [00:19<00:02, 113.51it/s] 77%|███████▋  | 1010/1319 [00:19<00:02, 108.85it/s] 77%|███████▋  | 1021/1319 [00:20<00:02, 99.52it/s]  78%|███████▊  | 1031/1319 [00:20<00:02, 98.86it/s] 79%|███████▉  | 1047/1319 [00:20<00:02, 111.28it/s] 80%|████████  | 1059/1319 [00:20<00:02, 112.19it/s] 81%|████████  | 1071/1319 [00:20<00:02, 110.50it/s] 82%|████████▏ | 1083/1319 [00:20<00:02, 111.33it/s] 83%|████████▎ | 1095/1319 [00:20<00:02, 99.65it/s]  84%|████████▍ | 1106/1319 [00:20<00:02, 90.25it/s] 85%|████████▍ | 1118/1319 [00:20<00:02, 96.89it/s] 86%|████████▌ | 1136/1319 [00:21<00:01, 106.43it/s] 87%|████████▋ | 1147/1319 [00:21<00:01, 96.47it/s]  88%|████████▊ | 1157/1319 [00:21<00:01, 87.82it/s] 89%|████████▊ | 1169/1319 [00:21<00:01, 86.84it/s] 89%|████████▉ | 1178/1319 [00:21<00:01, 79.63it/s] 90%|█████████ | 1188/1319 [00:21<00:01, 78.69it/s] 91%|█████████ | 1196/1319 [00:21<00:01, 74.25it/s] 91%|█████████▏| 1204/1319 [00:22<00:01, 71.19it/s] 92%|█████████▏| 1217/1319 [00:22<00:01, 81.25it/s] 93%|█████████▎| 1227/1319 [00:22<00:01, 81.80it/s] 94%|█████████▎| 1236/1319 [00:22<00:01, 80.53it/s] 94%|█████████▍| 1245/1319 [00:22<00:01, 66.39it/s] 95%|█████████▍| 1253/1319 [00:22<00:00, 67.55it/s] 96%|█████████▌| 1261/1319 [00:22<00:00, 58.85it/s] 96%|█████████▋| 1271/1319 [00:23<00:00, 62.88it/s] 97%|█████████▋| 1278/1319 [00:23<00:00, 52.59it/s] 97%|█████████▋| 1284/1319 [00:23<00:00, 40.69it/s] 98%|█████████▊| 1289/1319 [00:23<00:00, 32.46it/s] 98%|█████████▊| 1294/1319 [00:23<00:00, 34.56it/s] 99%|█████████▊| 1301/1319 [00:24<00:00, 40.32it/s] 99%|█████████▉| 1306/1319 [00:24<00:00, 34.19it/s] 99%|█████████▉| 1311/1319 [00:24<00:00, 28.51it/s]100%|█████████▉| 1315/1319 [00:24<00:00, 26.92it/s]100%|██████████| 1319/1319 [00:29<00:00,  3.11it/s]100%|██████████| 1319/1319 [00:29<00:00, 44.75it/s]
Accuracy: 0.933
Invalid: 0.000
Latency: 29.608 s
Output throughput: 4552.356 token/s
Run 4 completed in 42 seconds
Run 4: Accuracy: 0.933
[progress] [====================------------------------------] 4/10 (40%)  | GSM8K: Run 4
Executing GSM8K test Run 5 ...
  0%|          | 0/1319 [00:00<?, ?it/s]  0%|          | 1/1319 [00:05<1:53:40,  5.17s/it]  0%|          | 2/1319 [00:05<54:29,  2.48s/it]    0%|          | 3/1319 [00:06<33:28,  1.53s/it]  0%|          | 4/1319 [00:06<25:27,  1.16s/it]  0%|          | 6/1319 [00:06<12:37,  1.73it/s]  1%|          | 14/1319 [00:07<03:42,  5.86it/s]  1%|          | 16/1319 [00:07<01:24, 15.50it/s]  1%|          | 16/1319 [00:07<01:24, 15.50it/s]  1%|▏         | 19/1319 [00:07<01:24, 15.41it/s]  2%|▏         | 26/1319 [00:07<01:06, 19.38it/s]  2%|▏         | 29/1319 [00:07<00:36, 34.97it/s]  2%|▏         | 29/1319 [00:07<00:36, 34.97it/s]  2%|▏         | 29/1319 [00:07<00:36, 34.97it/s]  3%|▎         | 34/1319 [00:07<00:40, 31.86it/s]  3%|▎         | 38/1319 [00:08<00:56, 22.51it/s]  3%|▎         | 46/1319 [00:08<00:47, 26.65it/s]  4%|▍         | 58/1319 [00:08<00:38, 32.88it/s]  5%|▍         | 65/1319 [00:08<00:34, 35.93it/s]  5%|▌         | 70/1319 [00:08<00:37, 33.02it/s]  6%|▌         | 76/1319 [00:09<00:38, 32.13it/s]  7%|▋         | 89/1319 [00:09<00:29, 42.00it/s]  7%|▋         | 95/1319 [00:09<00:14, 83.76it/s]  7%|▋         | 95/1319 [00:09<00:14, 83.76it/s]  7%|▋         | 95/1319 [00:09<00:14, 83.76it/s]  7%|▋         | 95/1319 [00:09<00:14, 83.76it/s]  7%|▋         | 95/1319 [00:09<00:14, 83.76it/s]  7%|▋         | 95/1319 [00:09<00:14, 83.76it/s]  8%|▊         | 104/1319 [00:09<00:22, 54.73it/s]  9%|▊         | 113/1319 [00:09<00:23, 52.41it/s] 10%|▉         | 126/1319 [00:10<00:21, 55.96it/s] 10%|█         | 136/1319 [00:10<00:21, 54.73it/s] 11%|█         | 142/1319 [00:10<00:24, 47.88it/s] 11%|█▏        | 150/1319 [00:10<00:25, 45.80it/s] 12%|█▏        | 159/1319 [00:10<00:25, 45.62it/s] 13%|█▎        | 172/1319 [00:11<00:22, 51.07it/s] 13%|█▎        | 178/1319 [00:11<00:25, 44.07it/s] 14%|█▍        | 191/1319 [00:11<00:22, 50.42it/s] 15%|█▌        | 204/1319 [00:11<00:20, 54.72it/s] 17%|█▋        | 222/1319 [00:11<00:16, 65.81it/s] 17%|█▋        | 229/1319 [00:12<00:19, 56.47it/s] 18%|█▊        | 244/1319 [00:12<00:17, 62.23it/s] 20%|█▉        | 258/1319 [00:12<00:16, 64.69it/s] 21%|██        | 272/1319 [00:12<00:15, 66.55it/s] 22%|██▏       | 284/1319 [00:12<00:16, 63.64it/s] 23%|██▎       | 298/1319 [00:13<00:15, 65.98it/s] 24%|██▎       | 310/1319 [00:13<00:15, 65.17it/s] 24%|██▍       | 317/1319 [00:13<00:15, 64.70it/s] 25%|██▍       | 325/1319 [00:13<00:08, 113.08it/s] 25%|██▍       | 325/1319 [00:13<00:08, 113.08it/s] 25%|██▍       | 325/1319 [00:13<00:08, 113.08it/s] 25%|██▍       | 325/1319 [00:13<00:08, 113.08it/s] 25%|██▍       | 325/1319 [00:13<00:08, 113.08it/s] 25%|██▍       | 325/1319 [00:13<00:08, 113.08it/s] 25%|██▍       | 325/1319 [00:13<00:08, 113.08it/s] 25%|██▍       | 325/1319 [00:13<00:08, 113.08it/s] 26%|██▌       | 337/1319 [00:13<00:08, 110.23it/s] 26%|██▋       | 349/1319 [00:13<00:08, 112.88it/s] 27%|██▋       | 361/1319 [00:13<00:10, 89.63it/s]  28%|██▊       | 366/1319 [00:13<00:12, 79.35it/s] 28%|██▊       | 366/1319 [00:13<00:12, 79.35it/s] 28%|██▊       | 366/1319 [00:13<00:12, 79.35it/s] 28%|██▊       | 366/1319 [00:13<00:12, 79.35it/s] 28%|██▊       | 366/1319 [00:13<00:12, 79.35it/s] 28%|██▊       | 375/1319 [00:13<00:11, 80.52it/s] 29%|██▉       | 384/1319 [00:14<00:11, 82.40it/s] 30%|██▉       | 393/1319 [00:14<00:11, 84.11it/s] 31%|███       | 404/1319 [00:14<00:10, 90.38it/s] 32%|███▏      | 424/1319 [00:14<00:09, 94.45it/s] 33%|███▎      | 435/1319 [00:14<00:09, 97.69it/s] 35%|███▍      | 461/1319 [00:14<00:07, 111.10it/s] 36%|███▌      | 472/1319 [00:14<00:07, 109.86it/s] 37%|███▋      | 491/1319 [00:15<00:07, 104.72it/s] 38%|███▊      | 502/1319 [00:15<00:07, 103.97it/s] 39%|███▊      | 508/1319 [00:15<00:05, 136.65it/s] 39%|███▊      | 508/1319 [00:15<00:05, 136.65it/s] 39%|███▊      | 508/1319 [00:15<00:05, 136.65it/s] 39%|███▊      | 508/1319 [00:15<00:05, 136.65it/s] 39%|███▊      | 508/1319 [00:15<00:05, 136.65it/s] 39%|███▊      | 508/1319 [00:15<00:05, 136.65it/s] 40%|███▉      | 522/1319 [00:15<00:07, 108.52it/s] 40%|████      | 534/1319 [00:15<00:08, 90.77it/s]  41%|████▏     | 546/1319 [00:15<00:09, 80.06it/s] 42%|████▏     | 557/1319 [00:15<00:09, 84.56it/s] 43%|████▎     | 567/1319 [00:16<00:09, 81.19it/s] 44%|████▍     | 579/1319 [00:16<00:09, 78.92it/s] 45%|████▍     | 589/1319 [00:16<00:08, 82.98it/s] 47%|████▋     | 616/1319 [00:16<00:06, 104.21it/s] 48%|████▊     | 638/1319 [00:16<00:06, 107.62it/s] 49%|████▉     | 648/1319 [00:16<00:04, 148.64it/s] 49%|████▉     | 648/1319 [00:16<00:04, 148.64it/s] 49%|████▉     | 648/1319 [00:16<00:04, 148.64it/s] 49%|████▉     | 648/1319 [00:16<00:04, 148.64it/s] 49%|████▉     | 648/1319 [00:16<00:04, 148.64it/s] 49%|████▉     | 648/1319 [00:16<00:04, 148.64it/s] 49%|████▉     | 648/1319 [00:16<00:04, 148.64it/s] 49%|████▉     | 648/1319 [00:16<00:04, 148.64it/s] 49%|████▉     | 648/1319 [00:16<00:04, 148.64it/s] 50%|█████     | 663/1319 [00:16<00:04, 148.63it/s] 51%|█████▏    | 678/1319 [00:16<00:05, 125.77it/s] 53%|█████▎    | 699/1319 [00:17<00:05, 119.64it/s] 55%|█████▍    | 719/1319 [00:17<00:05, 115.25it/s] 56%|█████▌    | 741/1319 [00:17<00:05, 115.19it/s] 57%|█████▋    | 753/1319 [00:17<00:04, 115.97it/s] 59%|█████▉    | 778/1319 [00:17<00:04, 121.09it/s] 60%|█████▉    | 791/1319 [00:17<00:04, 122.17it/s] 61%|██████    | 807/1319 [00:18<00:04, 108.47it/s] 63%|██████▎   | 833/1319 [00:18<00:03, 123.27it/s] 64%|██████▍   | 850/1319 [00:18<00:03, 121.75it/s] 66%|██████▌   | 870/1319 [00:18<00:03, 124.98it/s] 67%|██████▋   | 883/1319 [00:18<00:03, 115.78it/s] 69%|██████▊   | 904/1319 [00:18<00:03, 127.92it/s] 70%|██████▉   | 917/1319 [00:18<00:03, 120.46it/s] 70%|███████   | 924/1319 [00:18<00:02, 139.81it/s] 70%|███████   | 924/1319 [00:18<00:02, 139.81it/s] 70%|███████   | 924/1319 [00:18<00:02, 139.81it/s] 70%|███████   | 924/1319 [00:18<00:02, 139.81it/s] 70%|███████   | 924/1319 [00:18<00:02, 139.81it/s] 70%|███████   | 924/1319 [00:18<00:02, 139.81it/s] 70%|███████   | 924/1319 [00:18<00:02, 139.81it/s] 71%|███████   | 938/1319 [00:19<00:03, 114.56it/s] 72%|███████▏  | 951/1319 [00:19<00:03, 110.97it/s] 73%|███████▎  | 966/1319 [00:19<00:03, 110.73it/s] 75%|███████▍  | 984/1319 [00:19<00:02, 119.34it/s] 75%|███████▌  | 990/1319 [00:19<00:01, 169.13it/s] 75%|███████▌  | 990/1319 [00:19<00:01, 169.13it/s] 75%|███████▌  | 990/1319 [00:19<00:01, 169.13it/s] 75%|███████▌  | 990/1319 [00:19<00:01, 169.13it/s] 75%|███████▌  | 990/1319 [00:19<00:01, 169.13it/s] 75%|███████▌  | 990/1319 [00:19<00:01, 169.13it/s] 76%|███████▋  | 1007/1319 [00:19<00:02, 140.31it/s] 77%|███████▋  | 1022/1319 [00:19<00:02, 133.63it/s] 79%|███████▊  | 1036/1319 [00:20<00:02, 132.08it/s] 80%|███████▉  | 1050/1319 [00:20<00:02, 131.91it/s] 81%|████████  | 1064/1319 [00:20<00:02, 115.52it/s] 82%|████████▏ | 1076/1319 [00:20<00:02, 114.15it/s] 82%|████████▏ | 1088/1319 [00:20<00:02, 114.09it/s] 83%|████████▎ | 1100/1319 [00:20<00:02, 99.97it/s]  84%|████████▍ | 1111/1319 [00:20<00:02, 90.81it/s] 85%|████████▌ | 1125/1319 [00:20<00:02, 92.35it/s] 86%|████████▋ | 1139/1319 [00:21<00:01, 93.58it/s] 87%|████████▋ | 1153/1319 [00:21<00:01, 94.74it/s] 88%|████████▊ | 1163/1319 [00:21<00:01, 87.19it/s] 89%|████████▉ | 1173/1319 [00:21<00:01, 82.32it/s] 90%|████████▉ | 1182/1319 [00:21<00:01, 78.05it/s] 91%|█████████ | 1194/1319 [00:21<00:01, 82.16it/s] 91%|█████████ | 1203/1319 [00:21<00:01, 79.21it/s] 92%|█████████▏| 1211/1319 [00:22<00:01, 68.09it/s] 93%|█████████▎| 1222/1319 [00:22<00:01, 74.21it/s] 93%|█████████▎| 1232/1319 [00:22<00:01, 76.53it/s] 94%|█████████▍| 1240/1319 [00:22<00:01, 74.85it/s] 95%|█████████▍| 1248/1319 [00:22<00:00, 71.99it/s] 95%|█████████▌| 1256/1319 [00:22<00:00, 72.64it/s] 96%|█████████▌| 1264/1319 [00:22<00:00, 61.60it/s] 96%|█████████▋| 1271/1319 [00:23<00:00, 50.37it/s] 97%|█████████▋| 1277/1319 [00:23<00:00, 49.08it/s] 97%|█████████▋| 1284/1319 [00:23<00:00, 50.44it/s] 98%|█████████▊| 1290/1319 [00:23<00:00, 33.97it/s] 98%|█████████▊| 1295/1319 [00:23<00:00, 32.65it/s] 98%|█████████▊| 1299/1319 [00:24<00:00, 25.79it/s] 99%|█████████▉| 1307/1319 [00:24<00:00, 26.29it/s] 99%|█████████▉| 1310/1319 [00:24<00:00, 24.38it/s]100%|█████████▉| 1313/1319 [00:24<00:00, 21.62it/s]100%|█████████▉| 1316/1319 [00:25<00:00, 15.05it/s]100%|█████████▉| 1318/1319 [00:25<00:00, 12.04it/s]100%|██████████| 1319/1319 [00:25<00:00, 51.47it/s]
Accuracy: 0.933
Invalid: 0.000
Latency: 25.750 s
Output throughput: 5237.924 token/s
Run 5 completed in 39 seconds
Run 5: Accuracy: 0.933
[progress] [=========================-------------------------] 5/10 (50%)  | GSM8K: Run 5
GSM8K test completed in 201 seconds
Average Accuracy over 5 runs: 0.934
Average accuracy meets threshold (0.93).
✅ GSM8K benchmark completed successfully.
GSM8K log saved to /mnt/raid/michael/sglang-ci/online/DeepSeek-V3-0324/v0.5.5-rocm630-mi30x-20251108_DeepSeek-V3-0324_FP8_online/sglang_client_log_DeepSeek-V3-0324_gsm8k.log
Server log saved to /mnt/raid/michael/sglang-ci/online/DeepSeek-V3-0324/v0.5.5-rocm630-mi30x-20251108_DeepSeek-V3-0324_FP8_online/sglang_server.log
Starting serving benchmark tests with different concurrency levels...
[online] Structured CSV initialized at /mnt/raid/michael/sglang-ci/online/DeepSeek-V3-0324/v0.5.5-rocm630-mi30x-20251108_DeepSeek-V3-0324_FP8_online/v0.5.5-rocm630-mi30x-20251108_DeepSeek-V3-0324_FP8_serving.csv
Processing concurrency 128 with 1 runs...
Running serving benchmark with concurrency 128 (Run 1) - 500 prompts...
Concurrency 128, Run 1 completed: 500 requests, (tok/s): tok/s output throughput, 62458.01ms E2E latency (268s)
[progress] [==============================--------------------] 6/10 (60%)  | Serving: C128 R1
✅ Best results for concurrency 128: E2E=62458.01ms, TTFT=11023.50ms, ITL=51.95ms, Output=(tok/s): tok/s
[online] Updating CSV for concurrency 128: E2E=62458.01ms, TTFT=11023.50ms, ITL=51.95ms, Output=(tok/s): tok/s
[online] CSV updated with results for concurrency 128
Sleeping 3 seconds before next concurrency level...
Processing concurrency 64 with 1 runs...
Running serving benchmark with concurrency 64 (Run 1) - 500 prompts...
Concurrency 64, Run 1 completed: 500 requests, (tok/s): tok/s output throughput, 44621.63ms E2E latency (375s)
[progress] [===================================---------------] 7/10 (70%)  | Serving: C64 R1
✅ Best results for concurrency 64: E2E=44621.63ms, TTFT=6045.30ms, ITL=42.85ms, Output=(tok/s): tok/s
[online] Updating CSV for concurrency 64: E2E=44621.63ms, TTFT=6045.30ms, ITL=42.85ms, Output=(tok/s): tok/s
[online] CSV updated with results for concurrency 64
Sleeping 3 seconds before next concurrency level...
Processing concurrency 16 with 1 runs...
Running serving benchmark with concurrency 16 (Run 1) - 128 prompts...
Concurrency 16, Run 1 completed: 128 requests, (tok/s): tok/s output throughput, 23618.45ms E2E latency (208s)
[progress] [========================================----------] 8/10 (80%)  | Serving: C16 R1
✅ Best results for concurrency 16: E2E=23618.45ms, TTFT=1960.71ms, ITL=26.24ms, Output=(tok/s): tok/s
[online] Updating CSV for concurrency 16: E2E=23618.45ms, TTFT=1960.71ms, ITL=26.24ms, Output=(tok/s): tok/s
[online] CSV updated with results for concurrency 16
Sleeping 3 seconds before next concurrency level...
Processing concurrency 4 with 1 runs...
Running serving benchmark with concurrency 4 (Run 1) - 128 prompts...
Concurrency 4, Run 1 completed: 128 requests, (tok/s): tok/s output throughput, 16710.52ms E2E latency (555s)
[progress] [=============================================-----] 9/10 (90%)  | Serving: C4 R1
✅ Best results for concurrency 4: E2E=16710.52ms, TTFT=188.61ms, ITL=20.67ms, Output=(tok/s): tok/s
[online] Updating CSV for concurrency 4: E2E=16710.52ms, TTFT=188.61ms, ITL=20.67ms, Output=(tok/s): tok/s
[online] CSV updated with results for concurrency 4
Sleeping 3 seconds before next concurrency level...
Processing concurrency 1 with 1 runs...
Running serving benchmark with concurrency 1 (Run 1) - 128 prompts...
Concurrency 1, Run 1 completed: 128 requests, (tok/s): tok/s output throughput, 16482.79ms E2E latency (2129s)
[progress] [==================================================] 10/10 (100%) ✅ Complete!
 | Serving: C1 R1
✅ Best results for concurrency 1: E2E=16482.79ms, TTFT=104.57ms, ITL=20.50ms, Output=(tok/s): tok/s
[online] Updating CSV for concurrency 1: E2E=16482.79ms, TTFT=104.57ms, ITL=20.50ms, Output=(tok/s): tok/s
[online] CSV updated with results for concurrency 1
✅ Serving benchmark completed successfully in 3557 seconds (standard mode).
Structured serving benchmark results written to /mnt/raid/michael/sglang-ci/online/DeepSeek-V3-0324/v0.5.5-rocm630-mi30x-20251108_DeepSeek-V3-0324_FP8_online/v0.5.5-rocm630-mi30x-20251108_DeepSeek-V3-0324_FP8_serving.csv
Individual concurrency logs saved to /mnt/raid/michael/sglang-ci/online/DeepSeek-V3-0324/v0.5.5-rocm630-mi30x-20251108_DeepSeek-V3-0324_FP8_online/sglang_serving_benchmark_concurrency_*_run*.log
GSM8K accuracy results written to /mnt/raid/michael/sglang-ci/online/DeepSeek-V3-0324/v0.5.5-rocm630-mi30x-20251108_DeepSeek-V3-0324_FP8_online/sglang_client_log_DeepSeek-V3-0324_gsm8k.log
Shutting down SGLang server...
Server shutdown completed in 0 seconds

==========================================
SCRIPT EXECUTION SUMMARY
==========================================
Script completed at: 2025-11-08 15:19:56 PST
Total execution time: 3863 seconds (64 minutes)
Output directory: /mnt/raid/michael/sglang-ci/online/DeepSeek-V3-0324/v0.5.5-rocm630-mi30x-20251108_DeepSeek-V3-0324_FP8_online
Serving CSV: /mnt/raid/michael/sglang-ci/online/DeepSeek-V3-0324/v0.5.5-rocm630-mi30x-20251108_DeepSeek-V3-0324_FP8_online/v0.5.5-rocm630-mi30x-20251108_DeepSeek-V3-0324_FP8_serving.csv
Timing log: /mnt/raid/michael/sglang-ci/online/DeepSeek-V3-0324/v0.5.5-rocm630-mi30x-20251108_DeepSeek-V3-0324_FP8_online/timing_summary_20251108_141533.log
===========================================
Cleaning up...
Killing background SGLang server (PID: 47)...
Server process 47 not found or already terminated.
[nightly] === Online benchmark dispatched for DEEPSEEK; check logs in sgl-dev_v0.5.5-rocm630-mi30x-20251108 ===
[nightly] === Starting post-processing (CSV processing, plot generation, Teams notifications) ===
[nightly] Processing online CSV data and generating plots... Logs will be saved to /mnt/raid/michael/sglang-ci/online/DeepSeek-V3-0324/v0.5.5-rocm630-mi30x-20251108_DeepSeek-V3-0324_FP8_online/process_and_generate_online_plots.log
[nightly] Using plot date from image tag: 20251108
[nightly] Sending Teams notification for deepseek online plots...
[nightly] Adding benchmark date to Teams notification: 20251108
[nightly] Teams notification using plot directory: /mnt/raid/michael/sglang-ci/plots_server
[nightly] Using GitHub upload for plot images (repo: ROCm/sglang-ci)
[nightly] Images will be stored in main branch with structure: plot/mi30x/model/mode/filename.png
[nightly] Including intelligent analysis (7 days lookback)
🐙 GitHub upload mode: Images will be uploaded to ROCm/sglang-ci
🐙 GitHub upload mode: Images will be uploaded to GitHub and embedded in Teams
📁 Plot directory: /mnt/raid/michael/sglang-ci/plots_server
🗂️  Benchmark directory: /mnt/raid/michael/sglang-ci
   🔍 Uploading 20251108_DeepSeek-V3-0324_online_standard.png to GitHub...
   📋 Log branch already exists
   📝 Updating existing file: plot/mi30x/DeepSeek-V3-0324/online/20251108_DeepSeek-V3-0324_online_standard.png
   ✅ Uploaded to GitHub (log branch): 20251108_DeepSeek-V3-0324_online_standard.png
   🔗 GitHub URL: https://github.com/ROCm/sglang-ci/blob/log/plot/mi30x/DeepSeek-V3-0324/online/20251108_DeepSeek-V3-0324_online_standard.png
🔍 Discovered 1 plot file(s) for deepseek online
   - 20251108_DeepSeek-V3-0324_online_standard.png -> ✅ uploaded to GitHub
🔍 Analyzing benchmark results for accuracy and performance...
   Found timing_summary log for deepseek online on 20251108: timing_summary_20251108_141533.log
   Found timing_summary log for deepseek online on 20251108: timing_summary_20251108_141533.log
   Found timing_summary log for deepseek online on 20251108: timing_summary_20251108_141533.log
🔍 Sending adaptive card with 1 image(s) hosted on GitHub
📊 Total payload size: 0.00MB
   📷 Image URL: https://github.com/ROCm/sglang-ci/blob/log/plot/mi30x/DeepSeek-V3-0324/online/20251108_DeepSeek-V3-0324_online_standard.png
   💾 Debug: Card JSON saved to /tmp/teams_card_debug.json
✅ Successfully sent Teams notification for deepseek online plots
   (Power Automate flow accepted - message processing asynchronously)
🎉 Teams notification sent successfully! (with intelligent analysis)
[nightly] Teams notification sent successfully for deepseek online
[nightly] === Online post-processing completed for DEEPSEEK ===
[nightly] ==========================================
[nightly] Completed benchmarks for image: rocm/sgl-dev:v0.5.5-rocm630-mi30x-20251108
[nightly] Stopping container sgl-dev_v0.5.5-rocm630-mi30x-20251108 to release resources...
[nightly] ==========================================
[nightly] ==========================================
[nightly] All benchmarks completed for 1 image(s)
[nightly] ==========================================
[nightly] Cleaning up process lock...
